id,title,status,importance
484658,cycle view longer remember last visit view,CLOSED DUPLICATE of bug 459467,P3 normal
484659,vertical ruler update correctly maximize correspond view,NEW,P3 normal
484660,label overflow button,CLOSED FIXED,P3 normal
484661,problem work phar location contain white space,CLOSED FIXED,P3 normal
484662,add option zip directory,RESOLVED FIXED,P3 normal
484663,,RESOLVED NOT_ECLIPSE,P3 normal
484664,rename,CLOSED FIXED,P3 normal
484665,split resource editor,CLOSED FIXED,P3 normal
484666,map,CLOSED FIXED,P3 normal
484667,fix plugin feature name,RESOLVED FIXED,P3 normal
484668,green diamond map fbs,CLOSED FIXED,P3 normal
484669,incompatible database drivers market place,CLOSED FIXED,P3 normal
484670,rename resource,CLOSED FIXED,P3 normal
484671,difference application resource editor,CLOSED FIXED,P3 normal
484672,add factory method create url without force catch malformedurlexception,NEW,P3 normal
484673,drag drop editors,CLOSED FIXED,P3 normal
484674,publish neon installers,RESOLVED FIXED,P3 normal
484675,return null handle,NEW,P3 normal
484676,map without selection,CLOSED FIXED,P3 normal
484677,refresh application palette,CLOSED FIXED,P3 normal
484678,drop fbs within system configuration,CLOSED FIXED,P3 normal
484679,close open editors,CLOSED FIXED,P3 normal
484680,pagesprovider class field extend abstractactivityexplorerpage,CLOSED FIXED,P3 normal
484681,backup process check incorrect file permissions,CLOSED WONTFIX,P3 normal
484682,stackoverflowerror,RESOLVED WORKSFORME,P3 major
484683,fastcgi request idle timeout handle incorrectly,CLOSED MOVED,P3 normal
484684,ignore general error report preference page,CLOSED WONTFIX,P3 minor
484685,delay computation zoom factor,RESOLVED FIXED,P3 normal
484686,arrayindexoutofboundsexception,VERIFIED FIXED,P3 normal
484687,add filter current year period activity company page,CLOSED FIXED,P3 normal
484688,make tablecontrolswtrenderer comparator extensible,CLOSED FIXED,P4 normal
484689,feature name comply android trademark,RESOLVED FIXED,P3 enhancement
484690,introduce abstractfxtool provide utility methods prioritize target,RESOLVED FIXED,P3 normal
484691,optimize chemclipse core code,NEW,P3 normal
484692,socket leak repeatedly call connect,CLOSED FIXED,P3 major
484693,call generally fail,RESOLVED FIXED,P3 normal
484694,name convention refer subproject,RESOLVED FIXED,P3 normal
484695,open papyrus perspective,CLOSED FIXED,P3 normal
484696,empty repositories view link white background,RESOLVED FIXED,P3 normal
484697,npe getinitialwordwrapstatus,RESOLVED FIXED,P3 normal
484698,websocket hang blockingwrite,RESOLVED MOVED,P3 normal
484699,use vararg reflection methods,RESOLVED FIXED,P3 normal
484700,hang,RESOLVED WORKSFORME,P3 normal
484701,refactoring code architecture exploration component base design organise common directory,CLOSED FIXED,P3 enhancement
484702,add,RESOLVED FIXED,P3 normal
484703,tcf agent notify unload symbol file,NEW,P3 normal
484704,opaque behavior editor dialog show scroll bar large code block,ASSIGNED,P4 normal
484705,produce wrong indentation,NEW,P3 normal
484706,limit comparator violation message,RESOLVED FIXED,P3 minor
484707,wrong userdata,CLOSED INVALID,P3 normal
484708,wrong port behavior move arrow key,CLOSED FIXED,P3 normal
484709,neon java return type incompatible,RESOLVED FIXED,P3 normal
484710,dead link website,UNCONFIRMED,P3 normal
484711,epp hipp slow,RESOLVED WORKSFORME,P3 normal
484712,refactoring nosql datasources,RESOLVED FIXED,P3 enhancement
484713,might swallow mandatory error case invocationtypeinferencefailure,VERIFIED FIXED,P3 normal
484714,,RESOLVED FIXED,P3 normal
484715,check state algorithm name,CLOSED FIXED,P3 normal
484716,ability filter natcombo dropdown,CLOSED FIXED,P3 enhancement
484717,insert space miss configuration,CLOSED DUPLICATE of bug 471203,P3 normal
484718,review idle timeout handle,RESOLVED FIXED,P3 enhancement
484719,eclipse model apply stereotype model element work,REOPENED,P3 enhancement
484720,filenotfoundexception,RESOLVED FIXED,P3 normal
484721,resources may reference uninstalled model nsuri,RESOLVED FIXED,P3 normal
484722,basicindexoutofboundsexception,RESOLVED FIXED,P3 normal
484723,transient,NEW,P3 normal
484724,nullpointerexception,RESOLVED FIXED,P3 normal
484725,nullpointerexception,RESOLVED FIXED,P3 normal
484726,import maven project attach git repository inside parent maven project,CLOSED WONTFIX,P3 normal
484727,import static work static method reference subtype,ASSIGNED,P3 normal
484728,bug java project android access,CLOSED FIXED,P3 blocker
484729,eclipse ide consume cpu idle,RESOLVED FIXED,P3 normal
484730,nullpointerexception,RESOLVED FIXED,P3 normal
484731,exceptions run,RESOLVED WORKSFORME,P3 normal
484732,syntax error member definition class,RESOLVED INVALID,P3 normal
484733,call,UNCONFIRMED,P3 major
484734,nullability annotation array result unavoidable,CLOSED DUPLICATE of bug 467094,P3 normal
484735,incorrect analysis nullability concern type variable,CLOSED DUPLICATE of bug 467482,P3 normal
484736,forums newsgroups sync break,CLOSED WONTFIX,P3 normal
484737,bug appear search,RESOLVED FIXED,P3 normal
484738,defaultdndprovider extensible,CLOSED FIXED,P4 normal
484739,update jdt compiler version produce,RESOLVED FIXED,P3 normal
484740,sodaq board derive,CLOSED DUPLICATE of bug 480392,P3 normal
484741,wrong warn interdependent type variables,VERIFIED FIXED,P3 normal
484742,wrong tooltip color kde,CLOSED DUPLICATE of bug 500196,P3 normal with 1 vote
484743,delete item lose focus uml table editor,UNCONFIRMED,P3 minor
484744,refactoring event handler cause gui internal error,NEW,P3 normal
484745,website render properly internet explorer,RESOLVED FIXED,P3 critical
484746,fork github banner overlay menu mobile browsers,RESOLVED FIXED,P3 major
484747,update share hipp,CLOSED FIXED,P3 normal
484748,move link community section,RESOLVED FIXED,P3 normal
484749,add section homepage,RESOLVED MOVED,P3 normal
484750,set tree top item creation time work,RESOLVED FIXED,P3 normal
484751,illegalstateexception,CLOSED DUPLICATE of bug 479385,P3 normal
484752,basicindexoutofboundsexception,CLOSED DUPLICATE of bug 482806,P3 normal
484753,tooltip miss menu field,CLOSED FIXED,P3 normal with 1 vote
484754,eclipselink nosql support collection name dot gridfs generate name,NEW,P3 normal with 1 vote
484755,client operation set fail c null,RESOLVED FIXED,P3 normal
484756,eclipselink nosql mongodb gridfs support,NEW,P3 enhancement with 2 votes
484757,project info eclipse collections project page,RESOLVED FIXED,P3 normal
484758,garbage folder create new file wizard,RESOLVED FIXED,P3 major
484759,history annotations work php file,CLOSED DUPLICATE of bug 471782,P3 normal
484760,register view fully support float point,NEW,P3 enhancement
484761,connack message send unauthorized connect request websocket,CLOSED INVALID,P3 critical
484762,add json editor contribution maven build include feature,RESOLVED FIXED,P3 normal
484763,debugger hit breakpoints put file external libraries source folders,CLOSED FIXED,P3 normal
484764,initial failure qvtd,RESOLVED FIXED,P3 normal
484765,splash screen show release,RESOLVED FIXED,P3 enhancement
484766,eclipse window shift wayland,RESOLVED WORKSFORME,P3 normal
484767,eclipse window shift wayland,CLOSED DUPLICATE of bug 484766,P3 normal
484768,thym hipp seem miss,RESOLVED FIXED,P3 blocker
484769,cla sign push reject,RESOLVED FIXED,P3 normal
484770,editor part create php file correspond project,CLOSED FIXED,P3 critical
484771,add profile get ui test work osx,RESOLVED FIXED,P3 blocker
484772,nightly build onward fail due unsatisfied link errors,RESOLVED FIXED,P3 normal
484773,secure storage password prompt activate even necessary,NEW,P3 normal
484774,adopt javafx properties components,RESOLVED FIXED,P3 normal
484775,copy thread close case error,RESOLVED FIXED,P3 normal
484776,incorrect end time historytree,RESOLVED FIXED,P3 normal
484777,ssh command fail one vm do sequentially,CLOSED FIXED,P3 normal
484778,jetty throw exception size line call,CLOSED INVALID,P3 normal
484779,build fail problems relate download,CLOSED INVALID,P3 critical
484780,virtual method warn quick fix,NEW,P3 normal
484781,import java project nest exclusions work,CLOSED FIXED,P3 major
484782,prune eclipse git mirror,RESOLVED WORKSFORME,P3 normal
484783,click item select,RESOLVED FIXED,P3 normal
484784,tutorial return,RESOLVED FIXED,P3 normal
484785,excelrenderoption export xls file cannot open ms excel,NEW,P3 normal
484786,name resolution problem variadic alias template,RESOLVED FIXED,P3 normal
484788,better log output unable resolve import element,RESOLVED FIXED,P3 normal
484789,java lang assertionerror,NEW,P3 normal
484790,slow step include function,CLOSED FIXED,P3 normal
484791,self package dependency cause problem oomph setup,RESOLVED FIXED,P3 normal
484792,possible create artifact inside device,UNCONFIRMED,P3 normal
484793,add property runtime result error,RESOLVED FIXED,P3 normal
484794,wrong initial size render issue,VERIFIED FIXED,P3 normal
484795,slow performance map network drive,VERIFIED FIXED,P3 major
484796,change dialog,NEW,P3 enhancement with 1 vote
484797,external plugin dependencies lose eclipse restart,VERIFIED FIXED,P3 normal
484798,illegalargumentexception,CLOSED WONTFIX,P5 normal
484799,illegalargumentexception,CLOSED WORKSFORME,P5 normal
484800,target platform neon,RESOLVED FIXED,P3 enhancement
484801,performance problem static file serve link directory,RESOLVED FIXED,P3 normal
484802,eclipse crash fail even run,CLOSED WORKSFORME,P3 critical
484803,conflict detection deletion,CLOSED FIXED,P3 enhancement
484804,delete corrupt smarthome release repo,CLOSED FIXED,P3 normal
484805,popups tile window manager cause cpu content refresh workspace switch,CLOSED DUPLICATE of bug 478962,P3 critical
484806,port xtext,CLOSED FIXED,P3 normal
484807,use xtext see occasionally,CLOSED FIXED,P3 normal with 1 vote
484808,please install jdk swtbot hipp,CLOSED FIXED,P3 normal
484809,upgrade jgit hipp hudson fail,CLOSED FIXED,P3 critical
484810,need provide,RESOLVED FIXED,P3 normal
484811,npe dndaddon,UNCONFIRMED,P3 normal
484812,contain empty package,CLOSED FIXED,P2 normal
484813,text progress bar properly handle eclipse console,NEW,P3 normal
484814,login orion logo image need alt text,RESOLVED FIXED,P3 normal
484815,show web browser work unix socket connections,CLOSED FIXED,P3 normal
484816,debugger locate workflow file,NEW,P3 normal
484817,shell result swt,CLOSED WORKSFORME,P3 major
484818,expose interest attribute operations via jmx,RESOLVED MOVED,P3 enhancement
484819,symlinks download area,RESOLVED FIXED,P3 normal
484820,cannot create new class,RESOLVED WORKSFORME,P3 normal
484821,newly create model elements longer select current viewer basictransactionalformeditor,RESOLVED FIXED,P3 major
484822,jetty threadmonitor memory leak,RESOLVED FIXED,P3 normal
484823,false type must implement inherit pure virtual method,CLOSED DUPLICATE of bug 480892,P3 normal
484824,mark occurrences miss variable instance assign inside parentheses,RESOLVED FIXED,P3 normal
484825,wrong warn null pointer exit loop break,NEW,P3 normal
484826,property name find start upper case emf model,RESOLVED FIXED,P3 normal
484827,upgrade gemini blueprint support sprint,CLOSED DUPLICATE of bug 488009,P3 normal with 1 vote
484828,collection test bad printerstatereasons attribute,RESOLVED FIXED,P3 normal
484829,workbench window come top unexpectedly whilst another window active,NEW,P3 normal
484830,error generate classutility getarguments sample model,CLOSED FIXED,P3 normal
484832,ensure plugins properly mix require set,RESOLVED FIXED,P3 major
484833,support definition file project,RESOLVED FIXED,P3 enhancement
484834,popus maybe others wrong location,CLOSED FIXED,P3 normal
484835,remove unused handlers query type,RESOLVED FIXED,P3 minor
484836,error occur automatically activate bundle,CLOSED WONTFIX,P3 normal
484837,release bugzilla,RESOLVED FIXED,P3 normal
484838,aql log error status instead warn access unknown variable evaluation time,RESOLVED FIXED,P3 normal
484839,relax version constraint,CLOSED FIXED,P3 normal
484840,relax version constraint,CLOSED FIXED,P3 normal
484841,buildship recognize dependencies custom configurations create via plugins,CLOSED FIXED,P3 normal
484842,nullpointerexception cdi proxied entity,NEW,P3 normal
484843,spurious bug icons usage,RESOLVED INVALID,P3 normal
484844,custom task visible gradle task view,CLOSED WORKSFORME,P3 normal
484845,papyrus fail reverse constructor,UNCONFIRMED,P3 normal
484846,nullpointerexception,CLOSED FIXED,P3 critical
484847,allow completion multisourceeditors,RESOLVED FIXED,P3 normal
484848,change order completion propose metamodels elements first,NEW,P3 enhancement
484849,readable content list,RESOLVED DUPLICATE of bug 483096,P3 major
484850,upgrade egit hipp hudson fail,CLOSED FIXED,P3 normal
484851,show emf icon completion,CLOSED DUPLICATE of bug 477963,P3 enhancement
484852,provide replacement fxmlloaderfactory replacement base,RESOLVED FIXED,P3 normal
484853,image path selection wizard propose current image,NEW,P3 normal
484854,import perf capture tracecompass,RESOLVED FIXED,P3 normal
484855,current contextual variable propose completion lambda expressions,CLOSED FIXED,P3 normal
484856,add syntax documentation,RESOLVED FIXED,P3 enhancement
484857,false positive validation precondition selection wizard pane base selection wizard,NEW,P3 normal
484858,completion metamodel prefix add prefix,CLOSED FIXED,P3 normal
484859,collapse filter content list container work,NEW,P3 normal
484860,refresh automatically launch compartment specification update,NEW,P3 normal
484861,improve flowcontrolstrategy stall handle,RESOLVED FIXED,P3 normal
484862,import dsv file fail,RESOLVED FIXED,P3 blocker
484863,speed load time,UNCONFIRMED,P3 enhancement
484864,provide query ask instal definitions,RESOLVED FIXED,P3 enhancement
484865,filter maven target folder workspace,NEW,P3 trivial
484866,cannot create new class,CLOSED DUPLICATE of bug 484820,P3 normal
484867,clean lint warn command,RESOLVED FIXED,P3 normal
484868,please add speaker pc private comment field,CLOSED WONTFIX,P4 minor
484869,hover display function prototype incorrect structs contain function pointers,NEW,P3 minor
484870,ui hang breakpoint hit click switch,NEW,P3 blocker
484871,add extension point plugins add collection extractors,RESOLVED FIXED,P3 normal
484874,informationflow link contain default stereotype label,UNCONFIRMED,P3 normal
484875,problems install server,RESOLVED DUPLICATE of bug 480493,P3 normal
484876,make simpler customize flowcontrolstrategy,RESOLVED FIXED,P3 enhancement
484877,make public api package,NEW,P3 normal
484878,make configurable via jmx,RESOLVED FIXED,P3 enhancement
484879,active partial list,RESOLVED FIXED,P3 normal
484880,add fill drag handle support autofill action,CLOSED FIXED,P3 enhancement
484881,asyncmiddlemanservlet hang response server answer header value less actual,RESOLVED MOVED,P3 major
484882,npe call,VERIFIED FIXED,P3 normal
484883,compilation errors due method,CLOSED FIXED,P3 blocker
484884,please add blog eclipse triquetrum project,RESOLVED FIXED,P3 normal
484885,document valid,CLOSED INVALID,P3 blocker
484886,illegalargumentexception,RESOLVED FIXED,P3 normal
484887,resourceexception,RESOLVED FIXED,P3 normal
484888,filenotfoundexception,RESOLVED FIXED,P3 normal
484889,nullpointerexception,RESOLVED FIXED,P3 normal
484890,nullpointerexception,RESOLVED FIXED,P3 normal
484891,noen cpp internal error occur eclipse error report,CLOSED DUPLICATE of bug 484629,P3 normal
484892,nullpointerexception,RESOLVED FIXED,P3 normal
484893,nullpointerexception,RESOLVED FIXED,P3 normal
484894,disassembly work neon,RESOLVED FIXED,P3 normal
484895,keyword label lose move one link end,RESOLVED FIXED,P3 normal
484896,return type override nullable without warn,CLOSED DUPLICATE of bug 463359,P3 normal
484897,compiler know always return,RESOLVED FIXED,P3 normal
484898,syntax color constructor name inherit constructor,RESOLVED FIXED,P3 normal
484899,navigation inherit constructors,RESOLVED FIXED,P3 normal
484900,cdt remove cdi debug,RESOLVED FIXED,P3 normal
484901,add helpers setup table columns,RESOLVED FIXED,P3 normal
484902,add support setup treecolumns,RESOLVED FIXED,P3 normal
484903,illegalstateexception,RESOLVED FIXED,P3 normal
484904,illegalargumentexception,RESOLVED FIXED,P3 normal
484905,nullpointerexception,RESOLVED FIXED,P3 normal
484906,classcastexception,RESOLVED FIXED,P3 normal
484907,nullpointerexception,RESOLVED FIXED,P3 normal
484908,small cleanups dsf tutorial,RESOLVED INVALID,P3 normal
484909,two instance dsfsourcelookupparticipant register dsfsourcelookupdirector,NEW,P3 normal
484910,function disassembly cause assertion,NEW,P3 normal
484911,cleanup source directors participants,RESOLVED FIXED,P3 normal
484912,reproducable ui freeze edit via properties view,NEW,P3 normal
484913,get fresh build arduino,CLOSED DUPLICATE of bug 484925,P3 normal
484914,plugin work hudson,NEW,P3 critical
484915,undo upgrade jgit egit hipps,CLOSED FIXED,P3 normal
484916,nullpointerexception,RESOLVED FIXED,P3 normal
484917,swtexception,RESOLVED FIXED,P3 normal
484918,add support,CLOSED DUPLICATE of bug 506374,P3 major
484919,illegalargumentexception,RESOLVED FIXED,P3 normal
484920,swtexception,CLOSED FIXED,P3 normal
484921,nullpointerexception,RESOLVED FIXED,P3 normal
484922,illegalargumentexception,RESOLVED FIXED,P3 normal
484923,installers security vulnerability,NEW,P3 major
484925,path make windows wrong,RESOLVED FIXED,P3 major
484926,implement field,VERIFIED FIXED,P3 normal
484927,support emacs style replace behaviour match case,NEW,P3 enhancement
484928,svn kit base connector give wrong path,RESOLVED FIXED,P3 normal
484929,weird behavior feature,RESOLVED FIXED,P3 normal
484930,several ide db datasource combobox initial selection content sync,ASSIGNED,P3 normal
484931,show content action change script slowly feedback work,NEW,P3 enhancement
484933,resource already,RESOLVED WORKSFORME,P3 normal
484935,swtexception,CLOSED FIXED,P3 normal
484936,potential npe,NEW,P3 normal
484937,jetty httpparser send badmessage,RESOLVED WORKSFORME,P3 normal
484939,downsize much container vertical stack add scrollbar compartment stay upsizing,NEW,P3 normal
484940,impossible copy paste text diagram,NEW,P3 enhancement
484941,npe annotationdiscoveryvisitor,RESOLVED FIXED,P3 normal
484942,boost unit test runner pass wrong value,RESOLVED FIXED,P3 normal with 3 votes
484943,wrong link gmf runtime project pmi,RESOLVED FIXED,P3 normal
484944,slow push due mark uninteresting object,NEW,P3 normal
484945,leave various perform synchronize handlers enable even wizard status area,RESOLVED FIXED,P3 enhancement
484946,eclipse crash double click,RESOLVED WORKSFORME,P3 normal
484947,problems load image use,RESOLVED WORKSFORME,P3 normal
484948,filenotfoundexception,RESOLVED FIXED,P3 normal
484949,nullpointerexception,RESOLVED FIXED,P3 normal
484950,problems cause inconsistent installations,RESOLVED FIXED,P3 normal
484951,argument bug inconsistencies various command,RESOLVED FIXED,P3 normal
484952,birt report viewer cross site script,RESOLVED WONTFIX,P3 major
484953,execution standalone must test,UNCONFIRMED,P3 normal
484954,declaration null annotation lambda argument interpret,VERIFIED FIXED,P3 normal
484955,property miss samd board,RESOLVED FIXED,P3 normal
484956,add definition start,RESOLVED FIXED,P3 normal
484957,extra blank line consecutive javadoc comment,VERIFIED FIXED,P3 normal
484958,resourceexception,UNCONFIRMED,P3 normal
484959,return value constexpr function template instantiate,RESOLVED FIXED,P3 normal
484960,compile error use orelse stream map consumer super generic type,NEW,P3 normal
484961,slowness warn stay visible last artifact unsigned content dialog,RESOLVED FIXED,P3 normal
484962,initial bound within seem always,RESOLVED INVALID,P3 normal
484963,incorrectly infer method type arguments varargs call arguments,NEW,P3 major
484964,resource tree lock session open,NEW,P3 normal
484965,illegalargumentexception throw xsd editor,NEW,P3 normal
484966,committer email wrongly override gerrit rebase,RESOLVED FIXED,P3 major
484967,pdt ignore brace style work correctly autoformatter,NEW,P3 normal with 1 vote
484968,undo editor reliable,RESOLVED WORKSFORME,P3 normal
484969,find contribution class dialog errors,RESOLVED FIXED,P3 normal
484970,execute query postgre name datsource print result sql console,RESOLVED FIXED,P3 normal
484971,miss pseudo parameter,RESOLVED FIXED,P3 enhancement
484972,extract individual adapter bind zestfxmodule subclasses overwrite,RESOLVED FIXED,P3 normal
484973,commit command break path specify,RESOLVED FIXED,P3 normal
484974,java code generation fail silently save xcore file,RESOLVED WORKSFORME,P3 normal
484975,arraystoreexception,RESOLVED FIXED,P3 normal
484976,illegalargumentexception,CLOSED FIXED,P3 normal
484977,jsonb property default unmarshalling inheritance,RESOLVED FIXED,P3 normal
484978,intellij internal exception xtext,CLOSED FIXED,P3 major
484979,incorrect resolution label name,RESOLVED FIXED,P3 normal
484980,page break properties work issue microsoft word format generate report,NEW,P3 major
484981,type variables upper bound,VERIFIED FIXED,P3 normal
484982,egit history view exception unhandled event loop exception,UNCONFIRMED,P3 normal
484983,error event log message suggest disable xtend plugin appear,NEW,P3 normal
484984,fastview orientation correctly mode,NEW,P3 normal with 1 vote
484985,backport npe fix bug,CLOSED DUPLICATE of bug 472568,P3 normal
484986,override configurations parent project type could incorrectly add project,NEW,P3 normal
484987,simplelistcell constructor accept labelextractor,RESOLVED FIXED,P3 normal
484988,add utility simply set simple combobox,RESOLVED FIXED,P3 normal
484989,error apply,NEW,P3 normal
484990,displaytag attribute correctly hide uml tag datastorenodes centralbuffernodes,CLOSED WORKSFORME,P3 normal
484991,gridlayoutpane minimal size,RESOLVED FIXED,P3 normal
484992,bug convert second hours second display,RESOLVED FIXED,P3 normal
484993,support target,RESOLVED FIXED,P3 normal
484994,migrate arduino work master,RESOLVED FIXED,P3 normal
484995,make simple list cell use listcell slot,RESOLVED FIXED,P3 normal
484996,standinexception,RESOLVED FIXED,P3 normal
484998,nullpointerexception,RESOLVED FIXED,P3 normal
484999,arrayindexoutofboundsexception,RESOLVED FIXED,P3 normal
485000,ioexception,RESOLVED FIXED,P3 normal
485001,ioexception,RESOLVED WORKSFORME,P3 normal
485002,filenotfoundexception,RESOLVED FIXED,P3 normal
485003,connection recreate transaction,NEW,P3 major with 1 vote
485004,stackoverflowerror,RESOLVED FIXED,P3 normal
485005,illegalstateexception,RESOLVED FIXED,P3 normal
485006,ekeys consider exact match iobjectmatcher,UNCONFIRMED,P3 normal
485007,could create temp dir jgit hipp,RESOLVED FIXED,P3 normal
485008,nullpointerexception,RESOLVED FIXED,P3 normal
485009,action enable,NEW,P3 normal
485010,arithmeticexception edgelabelquery center computation,CLOSED FIXED,P3 normal
485011,filenotfoundexception,RESOLVED FIXED,P3 normal
485012,web service bug,RESOLVED WORKSFORME,P3 normal
485013,organize problem include paths,NEW,P3 normal with 6 votes
485014,filenotfoundexception,RESOLVED FIXED,P3 normal
485015,stereotype label opaqueactions cannot hide css,CLOSED FIXED,P3 normal
485016,eclemma cannot show enable code coverage anywhere,CLOSED NOT_ECLIPSE,P3 major
485017,arraystoreexception inheritance reconnect,RESOLVED FIXED,P3 normal
485018,nullpointerexception,RESOLVED FIXED,P3 critical with 1 vote
485019,sirius navigator content extension trigger point dynamic,CLOSED FIXED,P3 normal
485020,editiondistance featurefilter use ecoreweightprovider model,CLOSED FIXED,P3 major
485021,properties view display properties old selection,RESOLVED FIXED,P3 normal
485022,introduce svn api support,RESOLVED FIXED,P3 normal
485023,add svn connector,RESOLVED FIXED,P3 normal
485024,add svn support,RESOLVED FIXED,P3 normal
485025,add svn support,RESOLVED FIXED,P3 normal
485026,egit handle dead symbolic link,CLOSED DUPLICATE of bug 405326,P3 normal
485027,problem array typevariable nonnull upper bind access via binarytypebinding,VERIFIED FIXED,P3 normal
485028,toggle comment makefile editor,RESOLVED FIXED,P3 normal
485029,content assist proposal order maintain,CLOSED FIXED,P3 normal
485030,null generic array,VERIFIED FIXED,P3 normal
485031,two pathwatcher thread run automatically restart error next restart,RESOLVED FIXED,P3 normal
485032,eclipse error may assertj primitive type,RESOLVED FIXED,P3 normal with 1 vote
485033,need mail account,RESOLVED FIXED,P3 normal
485034,interruptedioexception,CLOSED WONTFIX,P3 normal
485035,recommendations try many things,CLOSED INVALID,P3 normal
485036,illegalargumentexception,RESOLVED FIXED,P3 normal
485037,ioexception,RESOLVED WORKSFORME,P3 normal
485038,illegalstateexception,RESOLVED FIXED,P3 normal
485039,illegalargumentexception,RESOLVED FIXED,P3 normal
485040,ioexception,RESOLVED FIXED,P3 normal
485041,nullpointerexception,RESOLVED FIXED,P3 normal
485042,standinexception,RESOLVED FIXED,P3 normal
485043,filenotfoundexception,RESOLVED WORKSFORME,P3 normal
485044,hudson maven build fail eclipse ogee project,RESOLVED FIXED,P3 major
485045,illegalstateexception,RESOLVED WORKSFORME,P3 normal
485046,filenotfoundexception,RESOLVED WORKSFORME,P3 normal
485047,hide,RESOLVED FIXED,P3 normal
485048,swtexception,RESOLVED FIXED,P3 normal
485049,nullpointerexception,CLOSED FIXED,P3 normal
485050,nullpointerexception,UNCONFIRMED,P3 normal
485051,runtimeexception,UNCONFIRMED,P3 normal
