id,title,status,importance
387412,team synchronize repository much slower juno helios,NEW,P3 major with 15 votes
387413,expressions view shall evaluate expressions select stack level context,NEW,P4 enhancement
387414,initial contribution client sample,CLOSED FIXED,P3 enhancement
387415,miss show view menu,CLOSED FIXED,P3 normal
387416,nullpointerexception call,RESOLVED INVALID,P3 major with 2 votes
387417,close workbench receive several illegalstateexceptions,RESOLVED FIXED,P3 normal
387418,maven pom miss dep,CLOSED FIXED,P3 normal
387419,extension support menus,CLOSED FIXED,P3 normal
387420,close jpa project cause resourceexception relate connection profile,VERIFIED FIXED,P3 major
387421,generate map,RESOLVED FIXED,P3 normal
387422,several group button possible,CLOSED INVALID,P3 critical
387423,clabel mouselistener work embed composite,CLOSED WORKSFORME,P3 normal
387424,syntax error,CLOSED FIXED,P3 normal
387425,misspell field user api,RESOLVED FIXED,P3 normal
387426,cache sign jar,CLOSED INVALID,P3 normal
387427,issue aggregation input file eols,RESOLVED FIXED,P3 normal
387428,npe refreshscopemanager,RESOLVED FIXED,P3 normal
387429,users lose job copy,NEW,P3 enhancement
387430,add index expression support sqlmodel,RESOLVED FIXED,P3 normal
387431,per job permission,RESOLVED FIXED,P3 enhancement
387432,update number scm thread tooltip,NEW,P3 enhancement
387433,job name santizing,NEW,P3 trivial
387434,enumerations serialize correctly xml,CLOSED FIXED,P3 normal
387435,project fail build checkout,CLOSED FIXED,P3 major
387436,oxm file override annotation,RESOLVED FIXED,P3 normal
387437,structarray annotation fail,CLOSED FIXED,P3 normal
387438,need folders launch setups,CLOSED DUPLICATE of bug 221141,P3 enhancement
387439,illegalstateexception list item unchecked,CLOSED FIXED,P3 normal
387440,need extend project hierarchy,RESOLVED WONTFIX,P3 enhancement
387441,validation check server directory exist,NEW,P3 normal
387442,mnemonic ignore button actuator presentation,CLOSED FIXED,P3 normal
387443,window builder fail attempt parse design view specific layout,ASSIGNED,P3 normal
387444,soften exception,RESOLVED FIXED,P3 normal
387445,must specify fact redundant,CLOSED FIXED,P3 minor
387446,apparent deadlock try shut jetty,CLOSED DUPLICATE of bug 357318,P3 minor
387447,create convert ear project use root content directory,RESOLVED FIXED,P3 normal
387448,modifications make grab releng file git repository instead cvs,NEW,P1 normal
387449,code completion support array index php code,CLOSED FIXED,P3 enhancement
387450,eliminate custom documentation build,NEW,P3 normal
387451,suspend test fail juno,RESOLVED FIXED,P3 normal
387452,project name validate new class wizard,NEW,P3 normal
387453,change default remote push cause conflict error,RESOLVED INVALID,P3 normal
387454,reach git ssh anymore,RESOLVED FIXED,P3 major
387455,lot jpa project change event handler,RESOLVED DUPLICATE of bug 386171,P3 normal
387456,quick switch editor two monitor fit one screen,CLOSED DUPLICATE of bug 383684,P3 normal
387457,xml schema xml validation fail use subtypes one schema,NEW,P3 normal
387458,possibly gather refactoring request conversion participants,CLOSED INVALID,P3 enhancement
387459,replace invalid character branch creation dialog underscore,RESOLVED FIXED,P3 enhancement
387460,return key trim text,RESOLVED WONTFIX,P3 normal
387461,non id base match,CLOSED FIXED,P3 major
387462,cannot override transitive dependencies gemini,CLOSED INVALID,P3 normal
387463,improve instructions set swt git,NEW,P3 enhancement
387464,domtoxmlstreamwriter add duplicate xmlns,RESOLVED FIXED,P3 normal
387465,incorrect string evaluations rhino,RESOLVED FIXED,P3 normal
387466,miss focus completion window,CLOSED DUPLICATE of bug 382839,P3 normal
387467,support secondary id,RESOLVED FIXED,P3 normal
387468,wrong item select click cell row span,RESOLVED FIXED,P3 normal
387469,check selection entry expect behavior unclear,CLOSED FIXED,P3 normal
387470,editors,CLOSED FIXED,P2 enhancement
387471,scroll bar overlap last item os x,RESOLVED DUPLICATE of bug 387095,P3 normal
387472,provide way contenttype cache contentdescriptionmanager,NEW,P3 enhancement
387473,migrate koneki website git,RESOLVED FIXED,P3 normal
387474,npe test build jpa project cause many test failures wtp build,CLOSED DUPLICATE of bug 387484,P3 major
387475,error editor initialization cause npe access compatibility editor,VERIFIED FIXED,P3 major with 1 vote
387476,jpa diagram editor need move graphiti kepler,RESOLVED FIXED,P3 major
387477,nightly build fail due new location jetty repository,CLOSED FIXED,P3 normal
387478,urimappingregistryreader invalid registry object,CLOSED FIXED,P3 normal
387479,convert javaee project package pom incorrectly invoke converters,RESOLVED FIXED,P3 normal
387480,subversion checkouts extremely slow mount,RESOLVED NOT_ECLIPSE,P3 normal
387481,add feature,RESOLVED FIXED,P3 enhancement
387482,comment instal emine vips use instructions,CLOSED FIXED,P3 enhancement
387483,crosstalk resource tab,RESOLVED FIXED,P3 normal
387484,npe create new jpa project,RESOLVED FIXED,P3 critical
387485,set block assignments dictionary wrong,CLOSED DUPLICATE of bug 387392,P3 normal
387486,gc override patch,NEW,P3 normal
387487,http client connect jetty startup hang,RESOLVED WORKSFORME,P3 major
387488,favourites associate custom editors,RESOLVED FIXED,P3 normal
387489,oleeditor hide content lose focus,VERIFIED FIXED,P3 normal
387490,open old workspace break workbench layout,NEW,P3 normal
387491,three junitjpqldatetimetestsuite test fail oracle jdbc driver,CLOSED FIXED,P3 normal
387492,provide iterators service taskschema,RESOLVED FIXED,P3 enhancement
387493,shorthand collect,CLOSED FIXED,P3 enhancement
387494,history delete file show revision file delete,NEW,P3 normal
387495,aggregator always display validation errors user,NEW,P3 normal
387496,jvm crash run jdtuirefactoring test,RESOLVED FIXED,P3 normal
387497,aggregator problem negative,RESOLVED FIXED,P3 normal
387498,,CLOSED FIXED,P3 enhancement
387499,enable prevent use inheritance,NEW,P3 enhancement
387500,go wrong address traditional memory view,RESOLVED FIXED,P3 normal
387501,egit pass version compare check,RESOLVED FIXED,P3 normal with 1 vote
387502,invalid code generate multidimensional array,RESOLVED FIXED,P3 normal
387503,change method signature refactoring fail nullpointerexception,CLOSED DUPLICATE of bug 397159,P3 normal
387504,bug program argument parse command,RESOLVED FIXED,P3 normal
387505,format html document make cdata delimiters disappear,NEW,P3 normal
387506,finish button maven disable go,RESOLVED WORKSFORME,P3 minor
387507,wrongly return false,RESOLVED FIXED,P3 normal
387508,commitexception include cause,REOPENED,P3 enhancement
387509,support json preference value,RESOLVED FIXED,P3 enhancement
387510,upgrade jetty,CLOSED WONTFIX,P3 enhancement
387511,methods copy constructors,RESOLVED FIXED,P3 minor
387512,race condition lead clean old error annotations situations slow,RESOLVED WONTFIX,P3 critical
387513,compare side side widget show additional vertical,RESOLVED FIXED,P3 normal
387514,tooltip display many icons,RESOLVED FIXED,P3 normal
387515,framework throw ise perform bundle context relate operation context,RESOLVED WORKSFORME,P3 normal
387516,unable open perl script,RESOLVED FIXED,P3 normal
387517,bind unrecognized input,CLOSED DUPLICATE of bug 387424,P3 normal
387518,extremely wide combo box cause crash,VERIFIED FIXED,P3 blocker
387519,site categories,VERIFIED FIXED,P3 normal
387520,maintenance repos mirrorurls,VERIFIED FIXED,P3 normal
387521,invalid thread access create new project,RESOLVED FIXED,P3 normal
387522,batch compiler source include annotations,NEW,P3 normal
387523,shutdown prompt leave translucent rectangle top windows,CLOSED WORKSFORME,P3 normal
387524,fail channel close problem,RESOLVED FIXED,P3 critical
387525,return date accept wrong value,RESOLVED INVALID,P3 major
387526,papyrusversion unscoped,NEW,P3 normal
387527,lock user,RESOLVED FIXED,P3 normal
387528,dozens npes contentmergeviewer even open,RESOLVED DUPLICATE of bug 348429,P3 major
387529,compile error include import another file,NEW,P3 normal
387530,archetype entry disappear press configure button,RESOLVED FIXED,P3 trivial
387531,convert line delimeters corrupt complete ocl,NEW,P3 normal
387532,javascript error rap workbench demo,RESOLVED DUPLICATE of bug 362248,P3 normal
387533,connection leak remote archetype catalog define,RESOLVED FIXED,P3 normal
387534,install new software respect share install,RESOLVED WONTFIX,P3 normal
387535,classpath state use workspace project open,NEW,P3 normal
387536,generate main method stub ignore generate comment set,RESOLVED FIXED,P3 normal
387537,error parser ignore absolute path outside project,RESOLVED INVALID,P3 normal
387538,table cell pad work markup enable,CLOSED DUPLICATE of bug 373652,P3 normal
387539,two swtbot job hang fastlane,RESOLVED FIXED,P3 normal
387540,precision loss convert certain units,RESOLVED FIXED,P3 major
387541,extra mess jar file signatures,RESOLVED FIXED,P3 normal
387542,svn appear old fashion update site instead,RESOLVED WORKSFORME,P3 normal
387543,install apache ant,RESOLVED FIXED,P3 normal
387544,capture crash log unit test run,VERIFIED FIXED,P3 enhancement
387545,namedquery null parameter fail runtime postgresql,NEW,P2 normal
387546,version significant even,RESOLVED FIXED,P3 normal
387547,extension point must specify available variables elements,ASSIGNED,P3 normal
387548,start juno,RESOLVED WORKSFORME,P3 normal
387549,edit,CLOSED DUPLICATE of bug 195655,P3 normal
387550,eclipse disappear,RESOLVED NOT_ECLIPSE,P3 blocker
387551,edit javascript error,CLOSED DUPLICATE of bug 406700,P3 normal
387552,error upon static import functionaljava class,CLOSED FIXED,P3 normal
387553,jsonobject text must begin character,RESOLVED FIXED,P3 normal
387554,content assist able show variables require expressions,CLOSED FIXED,P3 normal
387555,ignore query parameter empty,RESOLVED FIXED,P3 normal
387556,java editory pin enable,RESOLVED WORKSFORME,P3 normal
387557,jarprocessor sign jar case,RESOLVED FIXED,P3 normal
387558,filedialog display right content,NEW,P3 normal with 1 vote
387559,update work,RESOLVED INVALID,P3 normal
387560,extract loop produce bogus error message,RESOLVED FIXED,P3 normal
387561,remove webtools mirror,RESOLVED FIXED,P3 minor
387562,error build fragment project,RESOLVED INVALID,P3 normal
387563,generalize new object feature object,RESOLVED FIXED,P3 enhancement
387564,ensure lock notification send invalidation object,RESOLVED FIXED,P3 enhancement
387565,pde export wizard store password clear text,VERIFIED FIXED,P3 major
387566,nullpointerexception,CLOSED FIXED,P2 critical
387567,make,VERIFIED FIXED,P3 enhancement
387568,warn enums,VERIFIED FIXED,P3 normal
387569,choose edit file console use default editor,RESOLVED FIXED,P3 minor
387570,ui freeze cause main thread wait save,RESOLVED NOT_ECLIPSE,P3 normal
387571,two keystroke shortcuts break juno,CLOSED DUPLICATE of bug 369860,P3 critical
387572,add ability configure variables value pdt use statements,NEW,P3 normal
387573,add method boolean api,CLOSED FIXED,P2 normal
387574,npe,NEW,P2 normal
387575,increment bundle version number,RESOLVED FIXED,P3 normal
387576,illegalargumentexception,NEW,P3 normal
387577,friendly name,RESOLVED INVALID,P3 normal
387578,gotomarker operation call papyrus model explorer view,RESOLVED FIXED,P3 enhancement
387579,pin editor,CLOSED FIXED,P3 normal with 5 votes
387580,repeat content assist throw exception move outside editable region,RESOLVED WORKSFORME,P3 normal
387581,add remove character first index line remove annotation,RESOLVED FIXED,P3 minor
387582,test fail,RESOLVED FIXED,P3 normal
387583,tool tip use command description extension point,NEW,P3 normal
387584,javascript bracket match break bracket first character,RESOLVED FIXED,P3 minor
387585,part binder failure stack trace,CLOSED FIXED,P3 normal
387586,platform provide dafault value annotate class property,RESOLVED FIXED,P3 enhancement
387587,getter return value differ shorthand,CLOSED FIXED,P3 enhancement
387588,qq,CLOSED INVALID,P3 normal
387589,dd,CLOSED INVALID,P3 normal
387590,sort line select headers work,NEW,P5 normal
387591,table workbench provide handler open empty table,NEW,P5 normal
387592,mylyn fairly consistently crash zend studio enter text new task,RESOLVED DUPLICATE of bug 348068,P3 normal
387593,,CLOSED INVALID,P3 normal
387594,add folders,RESOLVED FIXED,P3 normal
387595,,CLOSED NOT_ECLIPSE,P3 normal
387596,customizations local customizations name,NEW,P5 normal
387597,local customizations declare correct metamodels,NEW,P5 normal
387598,bug,CLOSED NOT_ECLIPSE,P3 normal
387599,test,RESOLVED INVALID,P3 normal
387600,possible set default value advance tab,NEW,P3 minor
387601,ignore,CLOSED FIXED,P3 normal
387602,miss configuration parameter,CLOSED FIXED,P3 normal
387603,legal xtend code generate illigal java code use varialble method name,CLOSED FIXED,P3 minor
387604,project resource filter lead egit think file delete,RESOLVED FIXED,P3 normal
387605,,CLOSED INVALID,P3 normal
387606,contribution toolbar without give id let eclipse hang,VERIFIED FIXED,P3 normal
387607,builderparticpant call,CLOSED WORKSFORME,P3 normal
387608,bug,CLOSED INVALID,P3 normal
387609,,CLOSED NOT_ECLIPSE,P3 normal
387610,file browser field visible java service select,CLOSED WONTFIX,P3 normal
387611,instal new bundle always immediately update bundle,RESOLVED FIXED,P3 normal
387612,unreachable catch never throw try,VERIFIED FIXED,P3 major
387613,query hint seem cause ignore lazy fetchtype,NEW,P3 normal with 3 votes
387614,support interpret log category,CLOSED FIXED,P3 blocker
387615,checkout conflict dialog nothing juno,VERIFIED FIXED,P3 normal
387616,problem parse feature,RESOLVED FIXED,P3 normal with 1 vote
387617,repo corruption reuse,RESOLVED FIXED,P3 normal
387618,peerheartbeat trace need log level,NEW,P3 normal
387619,jsonname annotation fail,CLOSED FIXED,P3 normal
387620,redeploy rap workbench demo,RESOLVED FIXED,P1 normal
387621,unify classpath variables,CLOSED FIXED,P3 normal
387622,dbws simpleplsqlservicetestsuite failure stream,CLOSED WONTFIX,P3 normal
387623,illegalargumentexception open file windows xp version juno eclipse build,RESOLVED FIXED,P3 normal
387624,default file client impossible provide custom implementation service,RESOLVED WONTFIX,P3 normal
387625,switch outline result close table page,CLOSED FIXED,P3 normal
387626,consolidate virgo distribution products,NEW,P3 normal
387627,ajaxjsp,CLOSED NOT_ECLIPSE,P3 normal
387628,show hide file remote browser default,RESOLVED FIXED,P3 normal
387629,jpql content assist stringindexoutofboundsexception,RESOLVED FIXED,P3 normal
387630,convert java plural query converters xml plural annotation leave behind,RESOLVED FIXED,P3 normal
387631,tidy kernel remove dead code,CLOSED FIXED,P3 enhancement
387632,,RESOLVED FIXED,P3 normal
387633,npe abstractsharedcommandhandler,VERIFIED FIXED,P3 normal
387634,store statistics information state system,RESOLVED FIXED,P3 enhancement
387635,debugger terminate correctly target configuration,NEW,P3 normal
387636,swallow exception,CLOSED FIXED,P3 normal
387637,fix numerous compiler warn,NEW,P3 normal
387638,parity,NEW,P3 normal
387639,partial statistics wrong reload trace,RESOLVED FIXED,P3 normal
387640,cannot use selector restrictions ctabitem,RESOLVED FIXED,P3 blocker
387641,use cairo instead gdk deprecate methods sash widget,RESOLVED FIXED,P3 normal
387642,need move definitions top file,RESOLVED FIXED,P3 normal
387643,migrate git,RESOLVED FIXED,P3 normal
387644,internal infinite loop rpm package proposal,CLOSED WONTFIX,P3 normal
387645,break ui bundle,RESOLVED FIXED,P3 normal
387646,page need come back unless alternative,RESOLVED FIXED,P3 major
387647,add support import gyp project,NEW,P3 enhancement
387648,compare eglxml file use intern package,CLOSED FIXED,P3 critical
387649,source miss,ASSIGNED,P5 normal
387650,behavior command change,CLOSED DUPLICATE of bug 382839,P3 normal
387651,invalid arguments markers,RESOLVED WORKSFORME,P3 normal
387652,enable gerrit,RESOLVED FIXED,P3 normal
387653,create hudson job sisu,RESOLVED FIXED,P3 normal
387654,view tab text,RESOLVED WORKSFORME,P3 normal with 1 vote
387655,filename,CLOSED FIXED,P3 enhancement
387656,cannot assign command,RESOLVED FIXED,P3 normal
387657,inconsistent behavior dynamic context menus property testers eclipse,CLOSED DUPLICATE of bug 383815,P3 major with 1 vote
387658,editor dropdown list position error eclipse window maximize,CLOSED DUPLICATE of bug 383684,P3 normal
387659,work trait member trait use statement,CLOSED FIXED,P3 normal
387660,erroneous break end warn nest switch,CLOSED INVALID,P3 normal
387661,resource folders like java source folders,CLOSED INVALID,P3 normal
387662,seem break,RESOLVED FIXED,P3 critical
387663,add tomcat orbit,RESOLVED FIXED,P3 normal
387664,drag target support filetransfer swt always fire extra dragsetdata event require filetransfer data drag source begin dnd operation drop target,RESOLVED FIXED,P3 blocker
387665,bundlelookup via work virgo,CLOSED WONTFIX,P3 major
387666,,CLOSED NOT_ECLIPSE,P3 normal
387667,context menu uml,CLOSED FIXED,P3 major
387668,crash source code,ASSIGNED,P3 normal
387669,backport workaround bug,VERIFIED FIXED,P3 normal
387670,pull refactoring lose javadoc destination type interface,CLOSED DUPLICATE of bug 326832,P3 normal
387671,edit guard opaqueexpression,RESOLVED FIXED,P3 normal
387672,operation browser release work,RESOLVED WORKSFORME,P3 normal
387673,parametrized build option subversion work subversion plugin,RESOLVED FIXED,P3 major
387674,create nullpointerexception,VERIFIED FIXED,P3 major
387675,osee use windows login id unique userid create users case sensitive,NEW,P3 major
387676,css editor preferences general appearance resize,RESOLVED FIXED,P3 minor
387677,add support conditional breakpoints,VERIFIED FIXED,P3 enhancement with 2 votes
387678,drag drop view tabs behave unpredictably feedback drop,VERIFIED FIXED,P3 normal
387679,wizard include finish button get enable soon,NEW,P3 normal
387680,entries providers translate preferences,CLOSED FIXED,P3 major
387681,rework software installation page admin ui,RESOLVED FIXED,P3 normal
387682,show background process admin ui,ASSIGNED,P3 normal
387683,mavenize xtend gwt libs add deployment process,CLOSED FIXED,P3 normal
387684,form activate event fire dialogs,CLOSED FIXED,P3 normal
387685,vts smoke fail sometimes ci build,CLOSED FIXED,P3 normal
387686,error control demo,RESOLVED FIXED,P3 normal
387687,stereotype display,RESOLVED WORKSFORME,P3 normal
387688,memory cache update fail scenarios,RESOLVED FIXED,P3 normal
387689,abusive illegalstateexception dynamic feature delegation,CLOSED FIXED,P3 major
387690,occasional error create new form field,CLOSED WONTFIX,P3 normal
387691,sd card usage undocumented,RESOLVED NOT_ECLIPSE,P3 normal
387692,rename hudson job,CLOSED FIXED,P3 normal
387693,orbit build break due miss prereq eclipse,RESOLVED FIXED,P3 blocker
387694,overlay preference page display,RESOLVED FIXED,P3 normal
387695,pack bundle,CLOSED FIXED,P3 enhancement
387696,quick fix null type safety code formatter,NEW,P3 normal
387697,make new noteworthy link prominent,RESOLVED FIXED,P3 normal
387698,testflood test failure,NEW,P3 normal
387699,create se profile,RESOLVED FIXED,P3 normal
387700,new video rcp office automation integration,RESOLVED FIXED,P3 normal
387701,generate dependency products publish tycho,RESOLVED FIXED,P3 normal with 1 vote
387702,code coverage,ASSIGNED,P3 enhancement
387703,artifacts display apply sterotypes label compartment,ASSIGNED,P3 normal with 1 vote
387704,control package leave stereotype apply package parent file,CLOSED FIXED,P3 normal
387705,push simrel git,RESOLVED INVALID,P3 critical
387706,migrate sapphire website git,RESOLVED FIXED,P3 normal
387707,migrate xtend website git,RESOLVED FIXED,P3 normal
387708,migrate xtext website git,RESOLVED FIXED,P3 normal
387709,english string,CLOSED FIXED,P3 major
387710,task category property api,RESOLVED FIXED,P3 enhancement
387711,move gyrex website git,RESOLVED FIXED,P3 enhancement
387712,add update site,RESOLVED FIXED,P3 critical
387713,accept property name place modelproperty,CLOSED FIXED,P3 enhancement
387714,tag change propagate css class,RESOLVED WORKSFORME,P3 normal
387715,java cocoacomponent compatibility mode print stderr,NEW,P3 normal
387716,javascript json content type extensions overrideable specify default encode,RESOLVED FIXED,P3 normal
387717,gcov test failures,CLOSED FIXED,P3 normal
387718,runtimeexception try compile break code,RESOLVED FIXED,P3 normal
387719,plan submenu build server context menu confuse name,NEW,P3 minor
387720,emf regression xsd plugin id,CLOSED FIXED,P3 normal
387721,hudson users start window managers,CLOSED FIXED,P3 normal
387722,git clone hang,RESOLVED WORKSFORME,P3 major
387723,add oslc page support client library sample,CLOSED FIXED,P3 enhancement
387724,method jface applicationwindow,NEW,P3 normal
387725,external bind xsd master version,RESOLVED FIXED,P3 normal
387726,support one pickup folder,NEW,P3 enhancement
387727,concurrentmodificationexception libhoverloadjob,RESOLVED FIXED,P3 normal
387728,change keybindings unstable,RESOLVED FIXED,P3 normal
387729,gccscannerinfoconsoleparsertests fail consistently,RESOLVED FIXED,P3 normal
387730,fail consistently,RESOLVED INVALID,P3 normal
387731,outofmemoryerror language generation,CLOSED FIXED,P3 normal
387732,table scrollbar width mountain lion,NEW,P3 normal
387733,add tomee server list,NEW,P3 enhancement
387734,make test insensitive line end,RESOLVED FIXED,P3 normal
387735,model element editors allow edit persited state,RESOLVED FIXED,P3 normal
387736,npe throw supply pluginexecution,RESOLVED FIXED,P3 normal
387737,multiple instance service create,CLOSED FIXED,P3 normal
387738,caret disappear click hover back code,CLOSED DUPLICATE of bug 336600,P3 normal
387739,internal error occur,RESOLVED FIXED,P3 normal
387740,improper interruptedexception handle rhino debugger,NEW,P3 normal
387741,merge classlocator resourcelocator,CLOSED FIXED,P3 enhancement
387742,eclipse hang restart recent update,RESOLVED DUPLICATE of bug 388387,P3 normal
387743,cannot build run formtags sample,CLOSED FIXED,P3 normal
387744,xtend try manually box int integer annotation value use variable java error,CLOSED FIXED,P3 normal
387745,xtend source pass annotation generate code pass int,CLOSED INVALID,P3 normal
387746,potential deadlock rhino debugger,RESOLVED FIXED,P3 normal
387748,test title,CLOSED INVALID,P3 normal
387749,bug,CLOSED INVALID,P3 normal
387750,validate attribute feature,ASSIGNED,P3 enhancement
387751,content assist able show variables require include file inludepath library,RESOLVED FIXED,P3 normal
387752,emf default value persist,CLOSED FIXED,P3 normal
387753,columns hide tableconfiguration appear,CLOSED WORKSFORME,P2 major
387754,incorrect unset notification single unsettable ereference dynamic feature delegation,CLOSED FIXED,P3 normal
387755,work correctly mac retina screen,RESOLVED FIXED,P3 critical with 1 vote
387756,access simrel project,CLOSED FIXED,P3 normal
387757,tableviewer consider editability next cell correctly,NEW,P3 normal
387758,completion fail find match paths,CLOSED FIXED,P3 major
387759,cannot review ssh url use,RESOLVED FIXED,P3 normal
387760,join kepler release train,RESOLVED FIXED,P3 major
387761,synchronize table remove line action,CLOSED INVALID,P3 enhancement
387762,truncate string cdt gcc build output parser settings,NEW,P3 minor
387763,handler remove line action test refresh status,NEW,P5 normal
387764,duplicate mnemonic key,CLOSED FIXED,P3 minor
387765,something wrong display reviewrequest page,RESOLVED FIXED,P3 normal
387766,swt user agent string,NEW,P3 normal
387767,ip log contribution doc wrong update,NEW,P3 normal
387768,find target null,NEW,P3 blocker
387769,git commit ip log,VERIFIED FIXED,P3 normal
387770,move project creation templates project page,RESOLVED WONTFIX,P3 normal
387771,support latest version formlayout form,ASSIGNED,P3 normal
387772,zip unzip current directory,CLOSED FIXED,P3 normal
387773,create new launcher give warn,CLOSED FIXED,P3 normal
387774,cdo thread prevent jvm exit client side standalone,CLOSED FIXED,P3 normal
387775,extra fonts color snipmatch,CLOSED FIXED,P3 normal
387776,block definition cannot reorient association towards anything block,CLOSED FIXED,P3 normal
387777,home page open,RESOLVED INVALID,P3 normal
387778,follow custom,RESOLVED WORKSFORME,P3 normal
387779,dynamic access maintain name create dictionary field,CLOSED FIXED,P3 normal
387780,clean release update,CLOSED FIXED,P3 normal
387781,stackoverflow error generate,CLOSED FIXED,P3 critical
387782,ssh access block network,CLOSED FIXED,P3 blocker
387783,defaultscope use calculate line delimiter,RESOLVED FIXED,P3 normal
387784,unfortunate code prevent remote repository use archetype resolution,RESOLVED FIXED,P3 normal
387785,classcastexception reflectiveecoreeditor,RESOLVED WONTFIX,P3 major
387786,qvto hudson maintenance job,RESOLVED FIXED,P3 normal
387787,xtend debug intermittently stop work,CLOSED FIXED,P3 major
387788,context sensitive help get exception,NEW,P3 normal
387789,director application bail unknown args,NEW,P3 normal
387790,super cannot use xcore,CLOSED FIXED,P3 normal
387791,git fetch reject cmd line message,RESOLVED WONTFIX,P3 normal
387792,unzip virgo kernel server build new package repo script executable mac,CLOSED FIXED,P3 normal
387793,support,RESOLVED FIXED,P3 enhancement
