id,title,status,importance
52589,quick outline hierarchy stay editor lose focus,RESOLVED FIXED,P3 normal
52590,toolbar area twice expect height unexpected perspective button showup,RESOLVED DUPLICATE of bug 70049,P3 normal
52591,miss toolbar icons restart,RESOLVED DUPLICATE of bug 52549,P3 major
52592,loose first toolbar group restart,RESOLVED DUPLICATE of bug 52549,P3 normal
52593,paint problem,RESOLVED FIXED,P3 normal
52594,toolbar group,RESOLVED DUPLICATE of bug 52549,P3 major
52595,ctabfolder flash resize,RESOLVED FIXED,P3 normal
52596,compare element use wrong encode,RESOLVED DUPLICATE of bug 52055,P3 normal
52597,white background switch editors,RESOLVED DUPLICATE of bug 52433,P3 normal
52598,need better visual indication hide tabs part folder,RESOLVED FIXED,P2 enhancement
52599,wrong state editor button,RESOLVED FIXED,P3 normal
52600,main toolbar button display,RESOLVED DUPLICATE of bug 52549,P3 major
52601,screen cheese open manifest editor,RESOLVED FIXED,P3 normal
52602,use antialiasing winxp,RESOLVED DUPLICATE of bug 7075,P3 enhancement
52603,class display hierarchy view save shutdown,RESOLVED DUPLICATE of bug 45871,P3 major
52604,npe pullup,RESOLVED WORKSFORME,P3 normal
52605,maximize use keyboard shortcut update ui,RESOLVED FIXED,P3 normal
52606,workbench window toolbar high restart,VERIFIED DUPLICATE of bug 56829,P2 normal
52607,action drop press,VERIFIED FIXED,P3 minor
52608,mximized window mutliple editors usable,RESOLVED DUPLICATE of bug 52758,P3 normal
52609,ui fail start purge cdt plugins,RESOLVED DUPLICATE of bug 48839,P3 normal
52610,npe,VERIFIED FIXED,P2 normal
52611,let quickdiff hover adapt horizontal scrollbar,RESOLVED FIXED,P3 normal
52612,replace case sensitive find dialog editor,RESOLVED DUPLICATE of bug 28949,P3 enhancement
52613,duplicate debugger perspective open stop brk pt,VERIFIED FIXED,P3 normal
52614,could markers import,RESOLVED DUPLICATE of bug 21407,P3 enhancement
52615,widget wrong parent,RESOLVED INVALID,P3 normal
52616,relative include paths,RESOLVED FIXED,P3 enhancement with 1 vote
52617,manual build background give enough feedback,RESOLVED WORKSFORME,P3 enhancement
52618,work cdt explorer,RESOLVED FIXED,P3 normal
52619,npe run java model test,VERIFIED FIXED,P3 normal
52620,problem view display problem count,RESOLVED FIXED,P3 normal
52621,use eclipse network perspectives upon,RESOLVED INVALID,P3 normal
52622,disable development environment perspective,RESOLVED WORKSFORME,P3 enhancement
52623,content table tree control gray disable,RESOLVED DUPLICATE of bug 6492,P3 normal
52624,sticky editor input hover,RESOLVED WORKSFORME,P3 major
52625,new pde project templates sjpishould allow,RESOLVED FIXED,P3 normal with 1 vote
52626,template edit problem,RESOLVED FIXED,P3 normal
52627,significant addition startup time due command,RESOLVED FIXED,P3 blocker
52628,progress indicator disable open second workbench window,RESOLVED WORKSFORME,P3 normal
52629,colour honor,CLOSED FIXED,P3 normal
52630,japanese infopop help ui encode incorrect,RESOLVED FIXED,P3 minor
52631,change foreground color table tree control take effect,RESOLVED DUPLICATE of bug 51492,P3 normal
52632,use multiple editor tabs,RESOLVED INVALID,P3 normal
52633,snaptogeometry include select part clone operations,RESOLVED FIXED,P3 normal
52634,eclipse window really small start,RESOLVED DUPLICATE of bug 52434,P3 normal
52635,import plugins fragment dialog resizable,VERIFIED FIXED,P3 enhancement
52636,source folder option honor cvs checkout,RESOLVED WORKSFORME,P3 normal
52637,line style gtk vary greatly,RESOLVED FIXED,P3 normal
52638,eclipse always detect newly instal plugins,RESOLVED FIXED,P3 normal
52639,widget dispose error,VERIFIED FIXED,P3 normal
52640,software update improvement,RESOLVED FIXED,P3 enhancement
52641,list control behave correctly,RESOLVED WONTFIX,P3 normal
52642,diff viewer show differences line end,RESOLVED WORKSFORME,P3 normal
52643,blank area toolbar close perspectives,RESOLVED DUPLICATE of bug 52606,P3 normal
52644,list control behave,RESOLVED DUPLICATE of bug 52641,P3 normal
52645,activate contextual menu outside select area change selection,RESOLVED WONTFIX,P3 enhancement
52646,widget dispose errors log content assist,VERIFIED FIXED,P2 major
52647,make command editor property page parse utility name correctly,VERIFIED FIXED,P3 normal
52648,miss standard toolbar button,RESOLVED DUPLICATE of bug 52549,P3 normal
52649,consider hide option generate manifest,RESOLVED FIXED,P3 normal
52650,want option code formatter add two space semicolons statement,RESOLVED WONTFIX,P3 enhancement
52651,search plugins target platform,RESOLVED FIXED,P3 normal
52652,need option code formatter wrap clauses statement,RESOLVED DUPLICATE of bug 47018,P3 enhancement with 1 vote
52653,outline popup window small,RESOLVED FIXED,P3 normal
52654,new action also view toolbar,RESOLVED FIXED,P3 enhancement
52655,show due protocol,RESOLVED DUPLICATE of bug 52585,P3 normal
52656,quick typehierarchy show subtypes interfaces,RESOLVED FIXED,P3 normal
52657,feedback build,RESOLVED DUPLICATE of bug 52617,P3 major
52658,openeditor practice well principle,RESOLVED DUPLICATE of bug 46818,P3 normal
52659,unsupportedoperationexception close editor open quick hierarchy,RESOLVED FIXED,P3 normal
52660,progress view items retain expansion state,RESOLVED WONTFIX,P3 normal
52661,allow create set progress group,RESOLVED FIXED,P3 normal
52662,cvs annotate synch,RESOLVED WORKSFORME,P3 normal
52663,templates contain javadoc comment code get indent correctly,RESOLVED FIXED,P3 normal
52664,code gen incorrect components add container borderlayout,CLOSED FIXED,P3 normal
52665,text obscure decorations,RESOLVED DUPLICATE of bug 50996,P3 normal
52666,allow listener type widgets,RESOLVED WONTFIX,P3 enhancement
52667,search method ref work fully qualify,RESOLVED FIXED,P3 normal
52668,tab color settings match preview,RESOLVED DUPLICATE of bug 52629,P3 normal
52669,windows loose position,VERIFIED FIXED,P3 normal with 1 vote
52670,build frequently fail interrupt work process,RESOLVED DUPLICATE of bug 43957,P3 major
52671,cdt build number show,VERIFIED FIXED,P3 normal
52672,group restart,VERIFIED DUPLICATE of bug 52549,P3 major
52673,arraystoreexception parser,RESOLVED FIXED,P3 normal
52674,debug display bind,RESOLVED DUPLICATE of bug 50086,P3 normal
52675,test bug,RESOLVED INVALID,P3 normal
52676,makefile editor input via alt keystroke sequence clobber content,RESOLVED FIXED,P3 normal
52677,another test bug,RESOLVED WORKSFORME,P3 normal
52678,external plugin libraries include type hierarchy,RESOLVED WORKSFORME,P3 normal
52679,code formatter format brace case default settings exist,VERIFIED FIXED,P3 normal with 1 vote
52680,active tab close use close menu inactive tab,RESOLVED INVALID,P3 normal
52681,resource tree lock,RESOLVED INVALID,P3 normal
52682,way uninstall feature instal update,RESOLVED WORKSFORME,P3 major
52683,iworkbenchpagetest fail mac,RESOLVED DUPLICATE of bug 69892,P3 normal
52684,string index range error particular search,CLOSED WORKSFORME,P3 major
52685,evolve eclipse user experience,RESOLVED FIXED,P3 enhancement
52686,update ant launch configs rename,RESOLVED WONTFIX,P3 enhancement
52687,code assist propose properties define runtime prefs,VERIFIED FIXED,P3 normal
52688,provide variables,VERIFIED FIXED,P3 enhancement
52689,grey text like swt label,CLOSED FIXED,P4 normal
52690,getter setter work correctly,RESOLVED WORKSFORME,P3 normal
52691,add batch compiler option maxproblemsperunit,VERIFIED FIXED,P3 enhancement
52692,jet builder supected generate hyades full build,CLOSED FIXED,P3 critical
52693,workspace version check feature add work anymore,RESOLVED DUPLICATE of bug 48686,P3 normal
52694,use extension registry api confuse,RESOLVED FIXED,P1 normal
52695,return empty iterator,RESOLVED FIXED,P3 major
52696,freeze use progress service dialog,CLOSED FIXED,P3 normal
52697,arrow ctabfolder behave,RESOLVED WONTFIX,P3 normal
52698,editor part get focus even active first time declaration javadoc view open,RESOLVED WORKSFORME,P3 normal
52699,badly form situation element cbe,CLOSED FIXED,P3 normal
52700,port log interactions diagram,CLOSED FIXED,P3 normal
52701,provide way osgi console input output redirect,RESOLVED INVALID,P3 enhancement
52702,add mechanism extension validators like validator,CLOSED FIXED,P3 enhancement
52703,split variable declaration quick assist account declarations,RESOLVED FIXED,P3 normal
52704,cvs update block eclipse,RESOLVED FIXED,P3 enhancement
52705,sleak tool rebuild eclipse,CLOSED WORKSFORME,P3 normal
52706,scrollbars appear treeviewer,VERIFIED INVALID,P3 normal
52707,disable find string whole word upon whole word search,VERIFIED FIXED,P3 minor with 1 vote
52708,new formatter allow else separate line,RESOLVED FIXED,P3 normal
52709,open type dialog reset selection fill list,RESOLVED DUPLICATE of bug 57478,P4 minor
52710,quick fix miss javadoc parameters put exist tag,RESOLVED FIXED,P3 normal
52711,wait job appear progress float window,VERIFIED FIXED,P3 normal
52712,memory,RESOLVED WORKSFORME,P3 normal
52713,provide descriptions ant program config type,VERIFIED FIXED,P3 enhancement
52714,provide description runtime workbench launch config type,RESOLVED FIXED,P3 enhancement
52715,quick fix variable handle correctly,RESOLVED WONTFIX,P3 normal
52716,cvs hang intermittantly,RESOLVED WORKSFORME,P3 minor
52717,hit count could determine automatically,CLOSED WONTFIX,P3 enhancement
52718,provide description junit launch config type,RESOLVED DUPLICATE of bug 52714,P3 enhancement
52719,team loss function compare,RESOLVED WORKSFORME,P3 normal
52720,npe jface viewer,RESOLVED WORKSFORME,P3 normal
52721,reduce search menu contain,RESOLVED DUPLICATE of bug 49041,P3 normal
52722,tag,RESOLVED DUPLICATE of bug 45484,P3 normal
52723,fire navigation event,RESOLVED WONTFIX,P3 normal
52724,errors ant task provide link,VERIFIED FIXED,P3 enhancement
52725,message flash launch dialog,VERIFIED FIXED,P3 normal
52726,statistics collect heap option,CLOSED INVALID,P3 critical
52727,api,RESOLVED FIXED,P3 normal
52728,color prefpage dialog font,CLOSED FIXED,P3 normal
52729,typo,CLOSED FIXED,P3 normal
52730,titleareadialog wrong doc createdialogarea,VERIFIED FIXED,P3 normal
52731,problem launch,RESOLVED FIXED,P3 normal
52732,compare view loose window shrink enough,RESOLVED INVALID,P3 normal
52733,deadlock expand head,RESOLVED FIXED,P3 normal
52734,call search background,RESOLVED FIXED,P3 enhancement
52735,call workspace scope emulate reference search scope,RESOLVED WORKSFORME,P3 enhancement
52736,generate optional argument change,RESOLVED WONTFIX,P3 enhancement
52737,sample gots minor error,RESOLVED WORKSFORME,P3 trivial
52738,need way insert separators visual editor,NEW,P3 enhancement
52739,rename field menu items seem break code,CLOSED WORKSFORME,P3 normal
52740,first text look,RESOLVED FIXED,P3 normal
52741,computer reboot,RESOLVED WORKSFORME,P3 major
52742,sort source folders alphabetically project creation,RESOLVED FIXED,P3 enhancement
52743,launch configuration field keep history,RESOLVED FIXED,P3 normal
52744,problems emf classpath variables,VERIFIED FIXED,P3 normal
52745,provide user feedback format possible,RESOLVED DUPLICATE of bug 70037,P3 normal
52746,formatter preserve line break conflict keep blank line,VERIFIED FIXED,P3 normal
52747,formatter please special case empty array init,VERIFIED FIXED,P3 enhancement
52748,formatter conflict organize import,RESOLVED DUPLICATE of bug 52074,P3 normal
52749,ijobchangelistener events consistent order,RESOLVED FIXED,P3 normal
52750,correct indentation mess comment box,RESOLVED FIXED,P3 normal
52751,correct indentation move editor window,RESOLVED WORKSFORME,P3 normal
52752,unable launch plugin runtime workbench,RESOLVED WONTFIX,P3 normal
52753,text editor document eclipse crash log error,RESOLVED WORKSFORME,P3 normal
52754,generate code match ecore metadata,RESOLVED INVALID,P3 critical
52755,provide intermediate nod field methods,ASSIGNED,P3 enhancement
52756,get rid document dialogs,RESOLVED WORKSFORME,P3 enhancement
52757,provide outline,VERIFIED WORKSFORME,P3 enhancement
52758,editor drop cut edge monitor,RESOLVED FIXED,P1 normal
52759,tool bar remember pin sessions,RESOLVED WONTFIX,P3 normal
52760,toolbar background make button hard see,RESOLVED FIXED,P3 normal
52761,documentation eclipse installation,RESOLVED WORKSFORME,P3 critical
52762,view selection,RESOLVED WONTFIX,P3 enhancement
52763,edit string substitution variable dialog clear value name change,VERIFIED FIXED,P3 normal
52764,section keep conflict comparison view,RESOLVED WONTFIX,P3 major
52765,deprecation diagnosis indirect access member type,RESOLVED WONTFIX,P3 normal
52766,java editor recognize comment correctly,RESOLVED DUPLICATE of bug 3533,P3 minor
52767,npe,RESOLVED FIXED,P2 normal
52768,runtime port share data,RESOLVED FIXED,P3 normal
52769,runtime port share data,RESOLVED DUPLICATE of bug 52768,P3 normal
52770,option use getter,NEW,P3 enhancement
52771,java source code format work use keyword,RESOLVED DUPLICATE of bug 52246,P3 normal
52772,task view get corrupt click column header,RESOLVED WONTFIX,P3 minor
52773,check refactorings handle non java errors,CLOSED FIXED,P3 normal
52774,self encapsulate field create javadoc,CLOSED FIXED,P3 normal
52775,unable start visual editor,CLOSED INVALID,P3 blocker
52776,task tag completion comment,NEW,P5 enhancement
52777,add,RESOLVED WONTFIX,P3 enhancement
52778,ajc documentation,RESOLVED FIXED,P3 normal
52779,view always tabs,RESOLVED WORKSFORME,P3 normal
52780,preference set revert classic look ide please,RESOLVED FIXED,P3 normal with 46 votes
52781,vertical mini toolbars leak outside windows,RESOLVED FIXED,P3 normal
52782,allow look skinnable rcp apps,RESOLVED INVALID,P3 enhancement
52783,minimal view,RESOLVED DUPLICATE of bug 52782,P3 enhancement
52784,allow extensible content type identifier,RESOLVED DUPLICATE of bug 60291,P3 enhancement
52785,eclipse run fedora core,RESOLVED FIXED,P3 normal with 1 vote
52786,runtime error contribute,RESOLVED DUPLICATE of bug 52549,P3 normal
52787,please use native tabfolder widget,RESOLVED WONTFIX,P3 enhancement with 2 votes
52788,parser fail open save file contain old style field initialisers,RESOLVED DUPLICATE of bug 49167,P3 normal
52789,pageorientation,RESOLVED FIXED,P3 normal with 4 votes
52790,launch make windows,RESOLVED FIXED,P3 major
52791,provide new extract field refactoring,ASSIGNED,P3 enhancement with 11 votes
52792,ecore model match xml schema,RESOLVED INVALID,P3 critical
52793,builder launch background set forget,VERIFIED FIXED,P3 normal
52794,double confirmation upon launch,RESOLVED DUPLICATE of bug 54182,P3 normal
52795,urls handle correctly,RESOLVED FIXED,P2 major
52796,dialog need detail,RESOLVED WONTFIX,P4 enhancement
52797,npe compile bean example,RESOLVED FIXED,P3 normal
52798,add support surround synchronize block,RESOLVED DUPLICATE of bug 44806,P3 enhancement
52799,plugin load problem,RESOLVED DUPLICATE of bug 50448,P3 normal
52800,debugger source lookup unnecessary period,VERIFIED FIXED,P4 normal
52801,work hover,RESOLVED FIXED,P3 normal
52802,refresh junit view,RESOLVED DUPLICATE of bug 41858,P3 minor with 1 vote
52803,support file,RESOLVED DUPLICATE of bug 52864,P3 enhancement
52804,deprecate formatter constant indicate new way,VERIFIED FIXED,P3 normal
52805,compiler warn use,VERIFIED FIXED,P3 enhancement
52806,color theme export preferences,RESOLVED DUPLICATE of bug 52629,P3 normal
52807,bookmark view make useful,RESOLVED WONTFIX,P3 enhancement
52808,wsdl valitor fail arabic name file,CLOSED WONTFIX,P3 normal
52809,evaluate debugger stop breakpoint,VERIFIED FIXED,P3 enhancement
52810,problem filter resource filter everything,RESOLVED FIXED,P3 critical
52811,java browse perspective show project view,RESOLVED DUPLICATE of bug 51455,P3 major
52812,quick hierachy show implementations interface method,RESOLVED WORKSFORME,P3 normal
52813,compile error,RESOLVED INVALID,P3 normal
52814,different behaviour resolve plugin dependencies,RESOLVED FIXED,P3 major
52815,quick outline show inherit members inner class,RESOLVED WONTFIX,P3 normal
52816,create patch folder take wrong path new file,RESOLVED FIXED,P3 major
52817,javadoc tag higher prio spell suggestions,RESOLVED INVALID,P3 normal
52818,view tab longer zoom,RESOLVED FIXED,P3 normal
52819,jinternalframe throw exceptions property sheet,CLOSED WORKSFORME,P3 major
52820,need mechanism filter workbench extensions,RESOLVED WORKSFORME,P3 enhancement
52821,java syntax colour options,RESOLVED INVALID,P3 normal
52822,add capability multiple search string marker filter,RESOLVED DUPLICATE of bug 30456,P4 enhancement
52823,completions available inside empty,VERIFIED FIXED,P3 normal
52824,configuration options search,RESOLVED WORKSFORME,P3 normal
52825,class automatically export framework per osgi spec,RESOLVED INVALID,P3 normal
52826,default project configuration,RESOLVED WORKSFORME,P3 enhancement
52827,assertion fail,RESOLVED FIXED,P1 normal
52828,delete modify class,RESOLVED DUPLICATE of bug 52274,P2 major
52829,new class save problem,RESOLVED WORKSFORME,P3 normal
52830,paste text go wrong editor,RESOLVED FIXED,P3 critical
52831,syntax color operators number,RESOLVED DUPLICATE of bug 63573,P3 enhancement
52832,prompt overwrite workspace launch provide cancel,RESOLVED FIXED,P3 enhancement
52833,hard drive,RESOLVED FIXED,P3 normal
52834,parameter guess work constructors,RESOLVED DUPLICATE of bug 6930,P3 normal
52835,search next occurance without open dialog,RESOLVED WORKSFORME,P3 enhancement
52836,allow wildcard ant configuration ant script name,RESOLVED DUPLICATE of bug 22905,P3 enhancement
52837,close editor use multi tabs always redraw properly,RESOLVED FIXED,P3 normal
52838,progress report could smoother checkout,RESOLVED WORKSFORME,P2 normal
52839,datapool editor location editor seem open,CLOSED FIXED,P3 major
52840,howto generate lpg version,VERIFIED FIXED,P3 minor
52841,add close editor tabs context menu,VERIFIED FIXED,P3 enhancement
52842,getter collide block,RESOLVED WONTFIX,P3 normal
52843,lockup edit text,RESOLVED INVALID,P3 normal
52844,support,RESOLVED WONTFIX,P3 enhancement
52845,propose synthetic members,RESOLVED WORKSFORME,P3 normal
52846,implementation incorrect,RESOLVED FIXED,P3 normal
52847,view menus lock view default,RESOLVED WORKSFORME,P3 normal
52848,define keybinding string use modn,VERIFIED FIXED,P4 enhancement
52849,lightweight close button ctabfolder problematic,RESOLVED FIXED,P3 minor
52850,junit plugin test wizard fail find test extend subclass testcase,RESOLVED DUPLICATE of bug 46407,P3 normal
52851,space else remove case,VERIFIED FIXED,P3 normal
52852,datapool editor location editor seem open,CLOSED FIXED,P3 major
52853,datapool initial creation equivalence class variable cause proper cursor,CLOSED FIXED,P3 minor
52854,long line constant declaration wrap properly,RESOLVED WONTFIX,P3 normal
52855,javadoc bat wrap extra whitespace add html tag,RESOLVED DUPLICATE of bug 49686,P3 normal
52856,new look leak gdi handle,RESOLVED FIXED,P3 major
52857,spell check work reuse editors,RESOLVED FIXED,P3 normal
52858,content relevance sort mix order structs class,VERIFIED FIXED,P3 normal
52859,deadlock shutdown turn,RESOLVED FIXED,P3 normal
52860,must tag,RESOLVED FIXED,P3 normal
52861,wrong font use,CLOSED FIXED,P3 normal
52862,space get insert styledtext use system menu,RESOLVED FIXED,P3 normal
52863,bind cvs synch view focus,VERIFIED FIXED,P3 normal
52864,core model customizable way detect itranslationunit,VERIFIED FIXED,P3 normal
52865,npe,RESOLVED INVALID,P3 normal
52866,npe variables view,VERIFIED FIXED,P3 normal
52867,new look console longer view title,VERIFIED FIXED,P3 normal
52868,check unused unread private members fail,RESOLVED INVALID,P3 minor
52869,repo view reset compare versions,RESOLVED DUPLICATE of bug 40333,P3 normal
52870,check unused unread private members fail,RESOLVED DUPLICATE of bug 52868,P3 minor
52871,toolitem heights consistent across toolbars,RESOLVED DUPLICATE of bug 99984,P3 normal
52872,rac translation problem,CLOSED FIXED,P1 critical
52873,open menu contribution incorrectly add context menu,CLOSED INVALID,P3 normal
52874,nullpointerexception load file editor personaljava,CLOSED INVALID,P3 normal
52875,revert eclipse ui classic look,RESOLVED WONTFIX,P3 normal with 31 votes
52876,styledtext line number enable java editor,RESOLVED INVALID,P3 normal
52877,exception java awt native code,RESOLVED DUPLICATE of bug 34940,P3 normal
52878,connection type menu empty,RESOLVED INVALID,P3 normal
52879,compare methods garble compare dialog,RESOLVED DUPLICATE of bug 52055,P3 normal
52880,call,CLOSED DUPLICATE of bug 124673,P5 normal
52881,find dialog select text linux,RESOLVED WORKSFORME,P3 normal
52882,must restart workbench activites involve menu items,RESOLVED DUPLICATE of bug 44455,P3 normal
52883,separatevm ant build cannot specify run foreground,VERIFIED FIXED,P2 normal
52884,npe,RESOLVED WORKSFORME,P3 normal
52885,run http test cause test suite delete,CLOSED FIXED,P3 major
52886,run http test cause test suite delete,CLOSED FIXED,P3 major
52887,translate help show corrupt,RESOLVED FIXED,P2 major
52888,work right,VERIFIED FIXED,P2 major
52889,please swt class implement serializable,RESOLVED WONTFIX,P4 normal
52890,flexible import order options,RESOLVED FIXED,P3 enhancement
52891,configuration options set profile options ui open,CLOSED FIXED,P3 critical
52892,workbench look feel apps,RESOLVED FIXED,P3 normal with 9 votes
52893,assignment operator code format options,RESOLVED DUPLICATE of bug 52854,P3 normal
52894,need extension expose javadoc,RESOLVED FIXED,P3 normal with 2 votes
52895,progress indicator bottom right subtle,RESOLVED WONTFIX,P3 normal
52896,npe,RESOLVED FIXED,P3 normal
52897,eclipse offer option trim trail space save,RESOLVED DUPLICATE of bug 25360,P3 enhancement
52898,change marker icon since,RESOLVED WORKSFORME,P2 major
52899,unacceptably poor performance use replace dialog,RESOLVED FIXED,P2 normal with 2 votes
52900,multiple filter,RESOLVED DUPLICATE of bug 52180,P3 enhancement
52901,right click line editor tabs cause flash,RESOLVED FIXED,P3 major
52902,task filter support resource,RESOLVED DUPLICATE of bug 52810,P3 major
52903,allow team update,RESOLVED DUPLICATE of bug 13569,P3 enhancement
52904,right maximize,VERIFIED WORKSFORME,P3 normal
52905,java debugger work slow,RESOLVED WORKSFORME,P3 normal
52906,jsp compile errors reason,RESOLVED INVALID,P3 normal
52907,code format work half time,RESOLVED WORKSFORME,P3 major with 7 votes
52908,wrong text element position,VERIFIED FIXED,P3 normal
52909,flag inside,RESOLVED DUPLICATE of bug 95342,P3 minor
52910,contextinformationpopup must resizable,RESOLVED FIXED,P3 normal
52911,generate incorrect tag arguments,RESOLVED FIXED,P2 normal
52912,pin editors use multiple tabs work,VERIFIED FIXED,P3 major
52913,revert file inside text editor current line stay,RESOLVED WORKSFORME,P2 minor
52914,several dispose errors,RESOLVED DUPLICATE of bug 52399,P3 normal
52915,problem indication editor tab work,RESOLVED FIXED,P3 normal
52916,strange error message use libraries,RESOLVED FIXED,P3 normal
52917,del work outliner,RESOLVED FIXED,P3 normal
52918,change modifier type icon update,RESOLVED FIXED,P2 normal
52919,extendedtexteditor rename meaningful name,RESOLVED FIXED,P3 normal
52920,javadoc bad wrap,RESOLVED DUPLICATE of bug 46341,P3 normal
52921,javadoc extra newline,VERIFIED FIXED,P3 normal with 5 votes
52922,quick diff support editor reuse,VERIFIED FIXED,P3 major
52923,java quick diff promote work progress pref page pref page,RESOLVED FIXED,P3 trivial
52924,exception soften soften exceptions designate ones,RESOLVED DUPLICATE of bug 48522,P3 normal
52925,filereader delete file cannot read,RESOLVED INVALID,P3 normal
52926,console view show run ant task,RESOLVED WORKSFORME,P3 minor
52927,autogeneration generate erranous source,ASSIGNED,P3 enhancement
52928,private members introduce via interface visible class,RESOLVED FIXED,P2 normal
52929,java applet configuration parameters,RESOLVED WONTFIX,P3 enhancement
52930,ant properties per project instead per workspace,RESOLVED INVALID,P3 enhancement
52931,preference change always cause rebuild,VERIFIED FIXED,P3 normal
52932,completion work,RESOLVED INVALID,P3 normal
52933,add search action menu back,RESOLVED DUPLICATE of bug 49041,P2 normal
52934,submissions immediate,RESOLVED FIXED,P3 minor
52935,emulate coolbar support wrap,RESOLVED FIXED,P3 critical
52936,invalid incoming deletion crash,RESOLVED WONTFIX,P3 normal
52937,let remove sticky tag change tag artifact,RESOLVED DUPLICATE of bug 41094,P3 normal
52938,test suit dynamic ui addition,CLOSED FIXED,P3 normal
52939,launch context menu editor,VERIFIED FIXED,P3 enhancement
52940,separate control new line control statements statement type,VERIFIED FIXED,P3 enhancement
52941,reference workspace find match,RESOLVED FIXED,P2 critical
52942,incremental compiler generate error access protect attribute,RESOLVED INVALID,P3 major
52943,outline view process need block edit,RESOLVED FIXED,P3 normal
52944,legacy jar cause exception,RESOLVED INVALID,P3 normal
52945,line number find,RESOLVED INVALID,P3 normal
52946,reveal selection,RESOLVED WORKSFORME,P3 normal
52947,cheese toolbar parent,RESOLVED FIXED,P3 major
52948,type appear completion,VERIFIED FIXED,P3 normal
52949,autoindent move line,RESOLVED DUPLICATE of bug 38559,P3 enhancement
52950,declare throw badlocationexception,ASSIGNED,P3 normal
52951,reveal selection suppose,RESOLVED DUPLICATE of bug 52946,P3 normal
52952,show env vars replace environment,VERIFIED FIXED,P3 enhancement
