id,title,status,importance
402581,request oslc client crud link elements,NEW,P3 enhancement
402582,git unsubmodule vjet,NEW,P3 normal
402583,warn version match bundle manifest version,RESOLVED FIXED,P3 enhancement
402584,machine regions always split vertically,RESOLVED FIXED,P3 normal
402585,npe,RESOLVED FIXED,P3 minor
402586,try access ml archive,RESOLVED WORKSFORME,P3 major
402587,crosstab filter use display incorrectly clear,RESOLVED FIXED,P3 normal
402588,support vararg last argument type,NEW,P3 normal
402589,fix documentation refer download page libraries,NEW,P3 normal
402590,introduce qvti,CLOSED FIXED,P3 normal
402591,introduce coherent import package construct,NEW,P3 normal
402592,edit pane work,CLOSED DUPLICATE of bug 402073,P3 normal
402593,controlcontrubution notify register juno,NEW,P3 normal
402594,start virgo scratch tomcat fail windows,CLOSED NOT_ECLIPSE,P3 blocker
402595,autotools nature loose builders add contribute wizard page,RESOLVED FIXED,P3 normal
402596,add support,CLOSED FIXED,P3 enhancement
402597,two versions include,VERIFIED FIXED,P3 normal
402598,message provide wrong string observe pojo property,RESOLVED WORKSFORME,P3 enhancement
402599,cannot change require hwi clock args supply value intnum,CLOSED FIXED,P3 normal
402600,informixplatform customize output,CLOSED DUPLICATE of bug 405645,P2 normal with 1 vote
402601,indexer hang index header file,CLOSED FIXED,P3 normal
402602,template superclass ctor resolve,RESOLVED FIXED,P3 normal
402603,open project,CLOSED FIXED,P3 trivial
402604,remove gnu arm target,CLOSED INVALID,P3 normal
402605,inline local variable create multiple instance class,CLOSED DUPLICATE of bug 349276,P3 major
402606,compile error,VERIFIED FIXED,P3 blocker
402607,invalid initialize delegate constructors,RESOLVED FIXED,P3 normal
402608,set,RESOLVED INVALID,P3 enhancement
402609,aioob exception program use method,RESOLVED FIXED,P3 normal
402610,adjustments need pde build,RESOLVED WONTFIX,P3 normal
402611,wrong item bound constellation,RESOLVED FIXED,P3 normal
402612,disassembly backend overwrite exist entry disassemblers list,RESOLVED FIXED,P3 enhancement
402613,eclipse suddenly close run project clean,RESOLVED NOT_ECLIPSE,P3 normal
402614,dialog modify location jre original location symbolic link,CLOSED DUPLICATE of bug 266651,P3 major
402615,example search work,RESOLVED INVALID,P3 normal
402616,runtime improve proxyresolutionbehavior,NEW,P1 enhancement
402617,code completion templates sometimes work together,RESOLVED FIXED,P3 normal
402618,compiler fail resolve type annotations reference,RESOLVED FIXED,P3 normal
402619,apache batik transcoder lack support certain svg feature,VERIFIED NOT_ECLIPSE,P3 normal
402620,promote sandbox server,CLOSED MOVED,P3 normal
402621,wrong update sit state real state due wrong proxy,CLOSED DUPLICATE of bug 388923,P3 normal
402622,toolbar truncate open many perspectives,NEW,P3 normal with 1 vote
402623,nullpointerexception eclipse juno startup,RESOLVED FIXED,P3 normal
402624,repositories label contain,RESOLVED FIXED,P3 trivial
402625,problem,CLOSED FIXED,P3 trivial
402626,ssl client certificate work jetty,CLOSED MOVED,P3 normal with 1 vote
402627,provide string modifications,CLOSED WONTFIX,P3 enhancement
402628,invalid sibling create new class,ASSIGNED,P3 normal
402629,vjet type conversion error,ASSIGNED,P3 minor
402630,navigation keyboard work context sensitive help,NEW,P3 normal
402631,create new page,RESOLVED INVALID,P3 critical
402632,unexpected attribute wildcard error,NEW,P3 normal
402633,fetch gerrit respect preference,RESOLVED FIXED,P3 enhancement with 1 vote
402634,spash screen type copyrhy,CLOSED INVALID,P3 blocker
402635,validation error markers filter correctly,NEW,P3 normal
402636,miss,CLOSED FIXED,P3 normal
402637,project project project page,CLOSED WONTFIX,P3 normal
402638,print toolbar real id name,RESOLVED FIXED,P3 normal
402639,location directory,UNCONFIRMED,P3 normal
402640,sign button,RESOLVED INVALID,P3 trivial
402641,exception modification track enable,RESOLVED WORKSFORME,P3 normal
402642,invalid java nest file,VERIFIED FIXED,P3 normal
402643,lock ui thread,RESOLVED WORKSFORME,P3 major
402644,easy solution tcf client get properties server connect,RESOLVED FIXED,P3 normal
402645,antrunner call apitooling use target,RESOLVED FIXED,P3 normal
402646,custom keyboard shortcuts stop work,NEW,P3 normal
402647,fake feature cbi build,RESOLVED FIXED,P4 normal
402648,jvmconstructorimplcustom seem wrong,CLOSED FIXED,P3 normal
402649,source miss sdk build,VERIFIED FIXED,P3 major
402650,ant junit,RESOLVED FIXED,P3 normal
402651,remove,RESOLVED FIXED,P3 trivial
402652,provide helper application singletons,RESOLVED FIXED,P3 enhancement
402653,allow intra repository,NEW,P3 enhancement
402654,junit test view pane execute display test app run,RESOLVED NOT_ECLIPSE,P3 major
402655,diagram stylesheets documentation,RESOLVED FIXED,P3 enhancement
402656,model search documentation,RESOLVED FIXED,P3 enhancement
402657,invalid request crash git clone firefox ers,RESOLVED FIXED,P3 normal
402658,need shell access account,VERIFIED FIXED,P3 critical
402659,error markers inconsistent save file,CLOSED WORKSFORME,P3 normal
402660,selectionlayer event point cell occasionally,CLOSED FIXED,P3 normal
402661,hpux swt native libraries need chmod execute,CLOSED DUPLICATE of bug 407433,P3 major
402662,papyrus shall provide service open associate element,RESOLVED FIXED,P3 enhancement
402663,provide delegate ui mechanism shell page,RESOLVED FIXED,P3 enhancement
402664,sort repositories order specify,RESOLVED FIXED,P3 normal
402665,variabledeclarationfragment miss source range,RESOLVED FIXED,P3 normal
402666,improve handle tls exceptions due raw socket close,RESOLVED FIXED,P3 normal
402667,use library delete directory tree,RESOLVED FIXED,P3 normal
402668,option link gerrit server instead native git server source repositories,RESOLVED FIXED,P3 enhancement
402669,ecoregeneratorfragment exploit custom implementations use ecoregenerator,REOPENED,P3 normal
402670,npe rollback change boolean value,CLOSED FIXED,P3 normal
402671,directory find,CLOSED DUPLICATE of bug 420723,P3 enhancement
402672,exception throw conflict xmlelementdecls appear objectfactory,RESOLVED FIXED,P3 normal
402673,asts must create new node type,RESOLVED FIXED,P3 normal
402674,return null,RESOLVED FIXED,P3 normal
402675,launcher hpux find feature others include,RESOLVED WONTFIX,P3 normal
402676,compare arbitrary file contexts target file versions,NEW,P3 enhancement
402677,npe tool select new etfw jaxb parse,CLOSED FIXED,P3 normal
402678,import forum information old portal metadata,RESOLVED FIXED,P3 normal
402679,test result trend graph completely display fail test,VERIFIED FIXED,P3 normal with 1 vote
402680,build single mtl file freeze take respect,CLOSED FIXED,P3 major
402681,decorator connection misalign relative polyline connection,ASSIGNED,P3 normal
402682,generate table content contain filename generate ant task even file split disable,RESOLVED FIXED,P3 normal
402683,documentation conversion rule error check,NEW,P3 normal
402684,task context include active git,RESOLVED DUPLICATE of bug 309578,P3 normal
402685,stag view block ui significant periods,CLOSED WORKSFORME,P3 normal
402686,illegalargumentexception throw parameter use setparametervalue wrong type,RESOLVED FIXED,P3 normal
402687,pom versions need update,RESOLVED FIXED,P3 normal
402688,pom versions need update,RESOLVED FIXED,P3 normal
402689,hudson horribly slow,RESOLVED FIXED,P3 major
402690,enhancement improve json key name collection properties,RESOLVED FIXED,P3 enhancement
402691,remove bundle,RESOLVED FIXED,P3 normal
402692,npe apply background color change,RESOLVED FIXED,P3 normal
402693,repo miss,VERIFIED FIXED,P1 major
402694,produce warn threadpool,RESOLVED FIXED,P3 normal
402695,eclipse add tomcat blank server name,NEW,P3 normal
402696,fix version errors wtp,CLOSED FIXED,P3 normal
402697,add java name store procedure query fail name native query define ahead,VERIFIED FIXED,P3 normal
402698,nullpointerexception open metadata conversion wizard without valid map file exist project,VERIFIED FIXED,P3 normal
402699,force push break,RESOLVED FIXED,P3 normal
402700,schedule rule break juno release,RESOLVED NOT_ECLIPSE,P3 normal
402701,provide validation option opt dependency validations,NEW,P3 normal
402702,able import project eclipse ide,RESOLVED WORKSFORME,P3 normal
402703,stl documentation code completion popup,NEW,P3 enhancement
402704,perspectives icons hiden perspectives icons bar long second,CLOSED DUPLICATE of bug 402622,P3 normal
402705,command undefined,NEW,P3 minor
402706,change jdbcsession expiry,RESOLVED FIXED,P3 normal
402707,repo,VERIFIED FIXED,P3 normal
402708,test framework zip repo contain,RESOLVED DUPLICATE of bug 403805,P3 normal
402709,node different root work root validation make,UNCONFIRMED,P3 normal
402710,proposal rank,CLOSED FIXED,P3 normal
402711,drag drop work tree table,ASSIGNED,P2 major
402712,workspace project source path remote debug,CLOSED WONTFIX,P3 major
402713,get access revisions deltas cdocommithistory elements,NEW,P3 enhancement
402714,local change consider,RESOLVED FIXED,P3 normal
402715,birt release repo,RESOLVED FIXED,P3 normal
402716,content assist show function type instead,CLOSED FIXED,P3 normal
402717,structure drag classifier structure compartment always create property type classifier,RESOLVED FIXED,P3 normal
402718,birt available maven repositories,RESOLVED FIXED,P3 normal
402719,go,CLOSED FIXED,P1 normal
402720,register foundational problems relate omg issue,RESOLVED FIXED,P3 normal
402721,memory improvements markerjob,NEW,P2 major
402722,use aliases type,NEW,P3 normal
402723,go,ASSIGNED,P1 normal
402724,wrong type infer,CLOSED FIXED,P3 normal
402725,need query get image uri,CLOSED FIXED,P2 normal
402726,webappcontext reference old websocket package system server class,CLOSED FIXED,P3 normal
402727,use predictable index name generation audit table index name,NEW,P3 enhancement
402728,semantic whitespace template expressions modify,CLOSED FIXED,P3 normal
402729,,RESOLVED FIXED,P3 normal
402730,use edit service,CLOSED FIXED,P3 normal
402731,user name spell usernme,CLOSED INVALID,P3 trivial
402732,selection events scrollbar detect,CLOSED DUPLICATE of bug 393269,P3 major with 4 votes
402733,php template work line delimiter default,CLOSED FIXED,P3 trivial
402734,string value cannot display expressions view,CLOSED FIXED,P3 trivial
402735,support,CLOSED FIXED,P3 normal
402736,hyperlink stacktrace fail one class exist simple name exist,CLOSED FIXED,P3 normal
402737,local variable extensions work,CLOSED FIXED,P3 normal
402738,wrong line number select click stack class,NEW,P3 normal
402739,issue columns specific,CLOSED FIXED,P3 normal
402740,http basic auth break,RESOLVED FIXED,P3 critical
402741,sporadic cces open xtend editor,NEW,P3 normal
402742,possible memory leak,RESOLVED FIXED,P3 normal
402743,macro expansion available macro definition,RESOLVED INVALID,P3 enhancement
402744,eliminate,CLOSED FIXED,P3 normal
402745,rest sample readme contain defunct information build command line,NEW,P3 normal
402746,eliminate,RESOLVED FIXED,P3 normal
402747,nodeeditpart affix children compartment,RESOLVED FIXED,P3 normal
402748,rest sample deploy successfully give drive,NEW,P3 normal
402749,boolean feature link instead method,CLOSED FIXED,P3 normal
402750,error log bind optional reference without match,RESOLVED FIXED,P3 normal with 7 votes
402751,infinite cause test time grow log large zip,RESOLVED DUPLICATE of bug 402779,P3 blocker
402752,performance regression marker update handle,NEW,P3 normal
402753,mislead warn message return type cannot detect,NEW,P3 normal
402754,support source folder specific output locations,RESOLVED FIXED,P3 normal
402755,different semantics static extension import,CLOSED WONTFIX,P3 normal
402756,moxy support multiple registries per package,NEW,P3 enhancement
402757,websocket client module use websocket server module war,RESOLVED FIXED,P3 normal
402758,complete api new diagram feature provide examples,VERIFIED FIXED,P3 enhancement
402759,npe dispose widget,VERIFIED FIXED,P3 normal
402760,docu diagram view,CLOSED FIXED,P3 enhancement
402761,papyrus nattable editor must declare label provider headers cells,CLOSED FIXED,P3 enhancement
402762,huge problems latest update,NEW,P3 enhancement
402763,integrate jsr,ASSIGNED,P4 minor
402764,remove model class,VERIFIED FIXED,P3 normal
402765,mark noreference,VERIFIED FIXED,P3 normal
402766,remove ehandlerservice method,VERIFIED FIXED,P3 normal
402767,bad parse non unity single value cardinality,CLOSED FIXED,P3 normal
402768,c generator handle dataclass header dependencies portclass,RESOLVED FIXED,P3 normal
402769,make conversion rule extensible anvils strict type conversion rule default,NEW,P3 normal
402770,fix tooltips typos,CLOSED FIXED,P3 normal
402771,please create mail list,RESOLVED FIXED,P3 normal
402772,enhance additional environment variables,CLOSED FIXED,P3 normal
402773,update compilers preference page doc pom version checker,RESOLVED INVALID,P3 normal
402774,update installer include big warn dependency,CLOSED FIXED,P3 normal
402775,validation report multiple writable mappings,NEW,P3 normal
402776,suspend fail label test,CLOSED FIXED,P3 normal
402777,miss new file action orionhub,RESOLVED WORKSFORME,P3 major
402778,make sure optional flag preserve,NEW,P3 normal
402779,fail archive,RESOLVED WORKSFORME,P3 major
402780,pivot model saveable readily reloadable,CLOSED FIXED,P3 major
402781,extend emodelservice provide factory capabilities model elements,VERIFIED FIXED,P3 normal
402782,add decorator decorate file patch set section gerrit task editor,RESOLVED DUPLICATE of bug 383359,P3 enhancement
402783,add support wolverine devices,CLOSED FIXED,P3 enhancement
402784,orion windows test fail,RESOLVED WONTFIX,P3 normal
402785,exception pdf output render dynamic html,RESOLVED FIXED,P3 normal
402786,rename top level folder create new folder,RESOLVED FIXED,P3 normal
402787,move etfw version menu preference page,RESOLVED FIXED,P3 normal
402788,support bigdecimal biginteger,CLOSED FIXED,P3 enhancement with 2 votes
402789,empty string environment variables set new etfw jaxb parser,CLOSED FIXED,P3 normal
402790,workspace test fail windows,RESOLVED INVALID,P3 normal
402791,wrong author commit accept via gerrit,RESOLVED INVALID,P3 normal
402792,enhance model support gerrit functionality,RESOLVED FIXED,P3 enhancement
402793,capture project logos,RESOLVED FIXED,P3 normal
402794,support access mongodb,VERIFIED FIXED,P3 enhancement
402795,support access cassandra,RESOLVED FIXED,P3 normal
402796,support ms powerpoint output format,RESOLVED FIXED,P3 enhancement
402797,support ms word output format,RESOLVED FIXED,P3 normal
402798,support access oda,VERIFIED FIXED,P3 enhancement
402799,automate test package download twice hudson,VERIFIED FIXED,P3 normal
402800,provide access applicationcontext uisession,RESOLVED FIXED,P3 enhancement
402801,infinite look reference name substitutionheadname,RESOLVED FIXED,P3 normal
402802,add,RESOLVED FIXED,P3 normal
402803,cause use,RESOLVED FIXED,P3 major
402804,name field accept blank space,CLOSED INVALID,P3 major
402805,,RESOLVED FIXED,P2 major
402806,state machine relate errors detect validation,CLOSED WONTFIX,P3 normal
402807,partial specialization vararg function type,RESOLVED FIXED,P3 normal
402808,application run eclipse run low resolution retina screen,CLOSED NOT_ECLIPSE,P3 blocker
402809,improve robustness completion test,RESOLVED FIXED,P3 enhancement
402810,let di use adapter pattern,NEW,P3 normal
402811,editor dropdown list close mouse hover follow mode,RESOLVED WORKSFORME,P3 normal with 1 vote
402812,code completion problems interface,RESOLVED FIXED,P3 normal
402813,add json browser type library,NEW,P3 normal
402814,add support type array constructors core javascript lib,NEW,P3 normal
402815,import fail symbolic link directories,RESOLVED WONTFIX,P3 normal
402816,alwas return null,CLOSED FIXED,P3 normal
402817,sftp report progress errors,RESOLVED FIXED,P3 normal
402818,code carry interfaces halt format,RESOLVED FIXED,P3 normal
402819,effect format cast operator contain intersection,RESOLVED FIXED,P3 normal
402820,jst nullpointerexception edit,RESOLVED WORKSFORME,P3 normal
402821,styledtext insert mac voice dictation text,NEW,P3 enhancement with 5 votes
402822,add test code test basic digest authentication,RESOLVED WONTFIX,P3 enhancement
402823,remember commit detail across commit,RESOLVED WONTFIX,P3 enhancement
402824,highlight variable reference constantly stop,CLOSED DUPLICATE of bug 398509,P3 normal
402825,fail load,NEW,P3 normal with 5 votes
402826,function name validation allow specify module function,ASSIGNED,P3 major
402827,get pointer exception select link elements diagram,NEW,P3 normal
402828,cannot remove php executable,CLOSED FIXED,P3 trivial
402829,php script arguments pass script,REOPENED,P3 trivial
402830,complete ocl document must package,NEW,P3 normal
402831,referenceexpression implement,RESOLVED FIXED,P3 normal
402832,nullpointerexception build,RESOLVED FIXED,P3 blocker
402833,servlet global error support jetty,RESOLVED WORKSFORME,P3 major
402834,pick fail new directory already exist,RESOLVED FIXED,P3 normal
402835,derive object delete project,NEW,P3 normal
402836,support use complete ocl document,NEW,P3 enhancement
402837,historypolicy generate wrong update stmt mysql,CLOSED INVALID,P3 normal
402838,unify number spellers,RESOLVED FIXED,P3 normal
402839,primary key set historypolicy enable,NEW,P2 normal
402840,add apache sshd versioin orbit,CLOSED FIXED,P3 normal
402841,unable fetch upstream use,RESOLVED DUPLICATE of bug 402131,P3 normal
402842,add blog,RESOLVED FIXED,P3 normal
402843,select something package explorer make blank,NEW,P3 trivial
402844,behaviour change,CLOSED FIXED,P3 normal
402845,let containerincludejarpattern flexible include class pattern annotation scan,RESOLVED FIXED,P3 enhancement
402846,slow access repositories hudson,RESOLVED FIXED,P3 normal
402847,unable find action,NEW,P3 normal
402848,eclipse juno http preview server start,CLOSED FIXED,P3 normal
402849,property clearpersistedstate rule product configuration,RESOLVED FIXED,P3 normal
402850,unable find action,ASSIGNED,P3 normal
402851,unable find action,NEW,P3 normal
402852,problems invoke code,CLOSED NOT_ECLIPSE,P3 normal
402853,unable load class,CLOSED NOT_ECLIPSE,P3 normal
402854,qualify name lookup find name enclose scope,RESOLVED FIXED,P3 normal
402855,,CLOSED DUPLICATE of bug 395239,P3 normal
402856,,CLOSED DUPLICATE of bug 402855,P3 normal
402857,keybinding conflict,RESOLVED DUPLICATE of bug 222410,P3 normal
402858,invalidargumenterror paint matchingcharacterpainter,CLOSED NOT_ECLIPSE,P3 major
402859,subscribe notification change,NEW,P3 normal
402860,include project name page title release,RESOLVED FIXED,P3 normal
402861,error involve template class,RESOLVED FIXED,P3 normal
402862,java,RESOLVED FIXED,P3 minor
402863,doco miss section debug log,RESOLVED MOVED,P3 major
402864,actionset display behind perspective switcher change java perspective,NEW,P3 normal with 2 votes
402865,incorrect cascade discovery new object map embeddables,REOPENED,P3 critical with 1 vote
402866,work mappings embeddables,REOPENED,P3 critical with 1 vote
402867,hudson job configuration update atomic kill executors,NEW,P3 major
402868,reach sandbox hudson,RESOLVED FIXED,P3 normal
402869,rename test framework folder remove old test framework version,RESOLVED FIXED,P3 normal
402870,connection time,RESOLVED FIXED,P3 critical
402871,cbi use version,CLOSED FIXED,P3 normal
402872,write access scout simultaneous release git repository,RESOLVED FIXED,P3 normal
402873,serviceutilsforactionhandler deprecate use anymore,NEW,P3 normal
402874,project correctly use maven,CLOSED INVALID,P3 normal
402875,import model elements legacy rcp,RESOLVED FIXED,P3 normal
402876,work extension variables parameters,CLOSED FIXED,P3 enhancement
402877,process order,CLOSED FIXED,P3 major
402878,visibility information nest class index,RESOLVED FIXED,P3 minor
402879,dependency upgrade,NEW,P3 normal
402880,problems configure content confuse,RESOLVED WORKSFORME,P3 trivial
402881,unable clone new project github,RESOLVED WORKSFORME,P3 major
402882,relax requirement lucene,RESOLVED FIXED,P3 trivial
402883,improve iqbase interface,CLOSED FIXED,P3 normal
402884,fail cbi build,CLOSED DUPLICATE of bug 401801,P3 normal
402885,performance reuse deflaters gzip filter,RESOLVED FIXED,P3 enhancement
402886,conflict textedits,CLOSED FIXED,P3 normal
402887,java source folder deploy although delete deployment assembly,RESOLVED DUPLICATE of bug 363803,P3 normal with 15 votes
402888,misplace port,RESOLVED FIXED,P3 normal
402889,deactivate task result orhpaned task editor headers,RESOLVED DUPLICATE of bug 407422,P3 normal
402890,task task list open task editor background,RESOLVED WORKSFORME,P3 normal
402891,closure parameter count properly infer,CLOSED DUPLICATE of bug 391638,P3 enhancement
402892,code formatter understand type annotations,RESOLVED FIXED,P3 normal
402893,color way,CLOSED FIXED,P3 enhancement
402894,mihini agent c malformed json data send tablerow emp command,RESOLVED FIXED,P3 normal
402895,add element palette,RESOLVED FIXED,P3 normal
402896,add link palette,CLOSED FIXED,P3 normal
402897,add element palette,CLOSED FIXED,P3 normal
402898,mislead error message return type,NEW,P3 normal
402899,relationship package figure,RESOLVED DUPLICATE of bug 397998,P3 minor
402900,treeviewer able set focus programmaticaly particular cell,CLOSED WORKSFORME,P3 enhancement
402901,compilation error resultsetmock,CLOSED FIXED,P3 enhancement
402902,update platform project settings gerrit,RESOLVED FIXED,P3 normal
402903,update project settings gerrit,RESOLVED FIXED,P3 normal
402904,disable work mobile widgets,NEW,P3 normal
402905,refactoring control command stable,RESOLVED FIXED,P3 normal
402906,add new variables dummystatusreport tree handler,RESOLVED FIXED,P3 normal
402907,regenerate code compliant infrastructure,RESOLVED FIXED,P3 minor
402908,artifact repository build cbi contain property,VERIFIED FIXED,P2 major
402909,extension methods show content assist,CLOSED DUPLICATE of bug 402876,P3 normal
402910,use express rout request,RESOLVED WONTFIX,P3 normal
402911,cannot rename field class annotate,RESOLVED WORKSFORME,P3 normal
402912,outofmemoryerror eclipse leave overnight,VERIFIED FIXED,P3 critical
402913,bogus selection rename field,CLOSED DUPLICATE of bug 402911,P3 normal
402914,generate code view display old content,CLOSED FIXED,P3 normal
402915,enable api tool bundle,RESOLVED FIXED,P3 normal
402916,rename type constructor call fail,CLOSED FIXED,P3 normal
402917,handle whitespace around keyword,RESOLVED FIXED,P3 normal
402918,quickfix produce invalid local class,CLOSED FIXED,P3 normal
402919,treetable custom treeimagepainter,CLOSED FIXED,P3 normal
402920,quickfix create java signature instead notation,CLOSED FIXED,P3 normal
402921,add support list widget,RESOLVED FIXED,P3 enhancement
402922,support extensions,CLOSED WONTFIX,P3 normal
402923,quickfix method different signature already exist,NEW,P3 enhancement
402924,module tell module external,CLOSED FIXED,P3 normal
402925,fix calendartest,CLOSED FIXED,P3 enhancement
402926,npe jvmmodelgenerator,CLOSED FIXED,P3 normal
402927,add package client manifest,CLOSED FIXED,P3 normal
402928,handle generics creation interfaces class,NEW,P3 normal
402929,handle generics create new method,CLOSED FIXED,P3 normal
402930,report tamper file juno release,RESOLVED FIXED,P2 normal
402931,use codeformatterprofile,CLOSED FIXED,P3 enhancement
402932,npe swing aut map custom component swing extension,CLOSED FIXED,P2 critical
402933,miss abstract methods must private,RESOLVED FIXED,P3 normal
402934,conflict text edit,CLOSED FIXED,P3 normal
402935,test execution unresolved variables,CLOSED WONTFIX,P3 normal
402936,miss access private members,NEW,P3 normal
402937,observation enter reference parameters check dialog cause errors,CLOSED WONTFIX,P3 major
402938,observation preferences replace text key combination work,CLOSED WONTFIX,P3 major
402939,change make entities always do db multithreaded environment,RESOLVED NOT_ECLIPSE,P3 critical
402940,help rename,ASSIGNED,P3 enhancement
402941,make optional,CLOSED WONTFIX,P3 enhancement
402942,support entity graph,NEW,P3 enhancement
402943,gerrit commit part individual commit activity,RESOLVED WORKSFORME,P3 normal
402944,provide way treat infer type type,NEW,P3 enhancement
402945,add new hummingbird project creation wizard hummingbird examples,RESOLVED FIXED,P3 enhancement
402946,fail,VERIFIED FIXED,P3 normal
402947,diagram shall use navigation service,RESOLVED FIXED,P3 enhancement
402948,table shall use navigation service,ASSIGNED,P3 enhancement
402949,better way handle source tree,RESOLVED FIXED,P3 major
402950,refine relationship miss,CLOSED WONTFIX,P3 normal
402951,add new hummingbird file creation wizard hummingbird examples,RESOLVED FIXED,P3 enhancement
402952,transport relate test failures,RESOLVED FIXED,P3 normal
402953,informixplatform need operators currentdate currenttime,CLOSED DUPLICATE of bug 405645,P2 normal with 1 vote
402954,selection correctly map indicator size,RESOLVED FIXED,P3 normal
402955,serviceconfigurationpreferencepage visible outside,RESOLVED FIXED,P3 normal
402956,reference component cannot remove file remove,RESOLVED WONTFIX,P3 normal
402957,output folder configureable per source folder,CLOSED FIXED,P3 enhancement
402958,use output folder specify,CLOSED FIXED,P3 enhancement
