id,title,status,importance
147250,set chart interactivity axis marker line range interactivity,CLOSED FIXED,P3 normal
147251,auto page break take effect table,CLOSED FIXED,P3 normal
147252,dataset work preview,CLOSED WONTFIX,P3 normal
147253,set context help button work jdbc data set get focus,CLOSED FIXED,P3 minor
147254,change parameter value display preview,CLOSED WONTFIX,P3 enhancement
147255,table page break row grid display one,CLOSED FIXED,P3 major
147256,enhance sync logic create dateformatter map,RESOLVED FIXED,P2 normal
147257,fail get connection database cause preview error,CLOSED WONTFIX,P3 normal
147258,header work,CLOSED FIXED,P3 normal
147259,context help button work new flatfile data,CLOSED FIXED,P3 normal
147260,exception teardown hide exception test,RESOLVED INVALID,P3 normal
147261,improve test run listener support,RESOLVED FIXED,P3 normal
147262,improve test run listener support,RESOLVED DUPLICATE of bug 147261,P3 normal
147263,data retrieve extend item,CLOSED FIXED,P3 major
147264,classpath exist,RESOLVED FIXED,P3 normal
147265,delete data delete warn dialog help text,RESOLVED FIXED,P1 normal
147266,insert element dialog evenhandler dialog help,RESOLVED FIXED,P1 normal
147267,start debug unsaved debuger run,CLOSED FIXED,P3 major
147268,view icons overlay editor,RESOLVED DUPLICATE of bug 128455,P3 normal
147269,functionality fail launch exception,RESOLVED FIXED,P3 major
147270,ecore diagram annotations cannot add attribute,NEW,P1 normal
147271,work html,CLOSED FIXED,P3 normal
147272,description code asisst show update,CLOSED FIXED,P3 normal
147273,properties autotext,CLOSED DUPLICATE of bug 140756,P3 enhancement
147274,library convert report publish,CLOSED WONTFIX,P3 normal
147275,export data,RESOLVED WONTFIX,P3 major
147276,tag get render wrong lot text,RESOLVED FIXED,P3 normal
147277,functionality fail launch exception,RESOLVED FIXED,P3 major
147278,warn message accept modify,CLOSED WORKSFORME,P3 normal
147279,jdt deltaprocessor post resource deltas,RESOLVED DUPLICATE of bug 189722,P3 major
147280,validationprovider template restrict single domain model package,RESOLVED FIXED,P3 normal
147281,save file cause exception,CLOSED FIXED,P3 normal
147282,diagram validation include live constraints validation,RESOLVED FIXED,P3 normal
147283,,RESOLVED DUPLICATE of bug 114344,P3 enhancement
147284,character use code snippets within javadoc,ASSIGNED,P3 minor
147285,trace violate constraints diagram runtime,NEW,P3 enhancement
147286,conditional image,RESOLVED FIXED,P3 normal
147287,english string,CLOSED INVALID,P3 minor
147288,annotation use,VERIFIED FIXED,P3 normal
147289,english string preferences key name,CLOSED FIXED,P3 minor
147290,internal error occur change set,RESOLVED DUPLICATE of bug 147086,P3 major
147291,content endlessly indent,VERIFIED DUPLICATE of bug 99738,P3 minor
147292,plugins dir builddirectory result error,RESOLVED FIXED,P3 normal
147293,accessibility radio group annonuce position button group total number button group,NEW,P3 normal with 1 vote
147294,eclipse restart os x crash,RESOLVED WORKSFORME,P3 blocker
147295,view support new dynamic extension,RESOLVED WORKSFORME,P2 major
147296,multiversion support functionality tool,RESOLVED FIXED,P3 major
147297,uppercase format option result accent capital letter invalid greek,RESOLVED NOT_ECLIPSE,P4 normal
147298,dependency management default project target osgi,RESOLVED FIXED,P3 normal
147299,presentationreconciler instal idocument already set,RESOLVED FIXED,P3 minor
147300,accessibility throw nullpointerexception,NEW,P3 normal
147301,slow performance use custom colour scheme windows,RESOLVED INVALID,P3 normal
147302,regression sticky default settings ear project name,CLOSED FIXED,P2 major
147303,augment textviewer use linestylelistener,RESOLVED WONTFIX,P3 enhancement
147304,need method get url featureentry,RESOLVED WONTFIX,P3 normal
147305,fix detection early event loop spin debug mode,RESOLVED FIXED,P3 normal
147306,cannot finish connector project target runtime choose,CLOSED FIXED,P2 critical
147307,de base extra mnemonics key preferences panel,CLOSED FIXED,P3 minor
147308,atl console output go mofscript console,ASSIGNED,P3 minor
147309,miss serial version id static variable servlet creation,CLOSED DUPLICATE of bug 118891,P3 normal
147310,switch project aspectj project remove exluded,RESOLVED FIXED,P3 major
147311,fonts editparts,NEW,P3 normal
147312,crossreferenceadapter updateimportsandexports performance improve,RESOLVED FIXED,P3 major
147313,iterative output pattern work lazy rule,RESOLVED WONTFIX,P3 normal
147314,schema editor save choice occurences,RESOLVED FIXED,P3 normal
147315,diagramcolorregistry cache million color,NEW,P3 normal
147316,access diffed revision chunk information,RESOLVED FIXED,P3 enhancement
147317,browse incorrectly show initial selection service wizard,CLOSED FIXED,P3 normal
147318,use jet nature allow reuse already compile dynamic templates,VERIFIED FIXED,P3 enhancement with 3 votes
147319,ws performance testcases throw classcastexceptions,CLOSED FIXED,P2 major
147320,setbounds fail resize shell without decorations,RESOLVED WORKSFORME,P3 normal
147321,crash eclipse large image small scale value,ASSIGNED,P5 normal
147322,persistence format change import plugins,CLOSED FIXED,P3 normal
147323,inconsistent date format history view change set,ASSIGNED,P3 normal
147324,could download report error,RESOLVED FIXED,P3 normal
147325,need set context help ids,RESOLVED WORKSFORME,P3 enhancement
147326,random jump editors,RESOLVED WORKSFORME,P3 blocker
147327,designer crash preview old report parameters,RESOLVED FIXED,P2 major
147328,allow inlining method call,NEW,P3 normal
147329,create time correlation file alone cause,CLOSED INVALID,P1 major
147330,make less interest work xml file,RESOLVED FIXED,P3 blocker
147331,get text item render client side,RESOLVED FIXED,P3 normal
147332,platform help break new link pde new,RESOLVED INVALID,P3 minor
147333,jet able generate markers,NEW,P3 enhancement with 3 votes
147334,jdo datasource birt,NEW,P3 enhancement
147335,source tab context help topic,VERIFIED FIXED,P3 normal
147336,dialog tray restore proper layout add jre dialog,NEW,P5 trivial
147337,need link source option ant build script,VERIFIED FIXED,P3 normal
147338,publish firefox hover headers odd,CLOSED FIXED,P3 normal
147339,database image support,RESOLVED FIXED,P3 major
147340,diagram bar policy lose palette listener,NEW,P3 normal
147341,massive performance problem navigate code locations,RESOLVED INVALID,P3 normal
147342,linuxagent monitor work,CLOSED WORKSFORME,P3 major
147343,note field hyperlink detector,RESOLVED FIXED,P2 enhancement
147344,remove newlines comment,CLOSED FIXED,P3 normal
147345,remove,CLOSED FIXED,P3 normal
147346,problems unconnected nod affect line rout nod string,RESOLVED FIXED,P3 major
147347,task notifications task complete,RESOLVED FIXED,P2 normal
147348,update bundle version number sse plugins,CLOSED FIXED,P2 normal
147349,rm refactor use case model separate content package,CLOSED FIXED,P3 normal
147350,icons move element move,CLOSED FIXED,P3 normal
147351,rm need create case model provide content,CLOSED FIXED,P2 normal
147352,support method adoption workshop,NEW,P3 normal
147353,opengl article update,RESOLVED FIXED,P3 normal
147354,rm require content,CLOSED FIXED,P1 major
147355,cannot switch diagram wbs,CLOSED FIXED,P3 normal
147356,rm require content,CLOSED WONTFIX,P1 major
147357,inconsistentcy field layout name,NEW,P3 normal
147358,path project must one segment methods,RESOLVED INVALID,P3 normal
147359,add standard date editor,RESOLVED DUPLICATE of bug 19945,P3 enhancement
147360,jvmpi detect thread,CLOSED WONTFIX,P2 major
147361,cell editor border render dot line grid line dot,RESOLVED FIXED,P3 normal
147362,need better installation download instructions,CLOSED FIXED,P3 major
147363,update large log documentation apache derby information,CLOSED DUPLICATE of bug 156892,P1 normal
147364,architecture api concern,RESOLVED WORKSFORME,P3 enhancement
147365,page mess,RESOLVED FIXED,P2 normal
147366,jvm version fail silently exit,RESOLVED FIXED,P3 normal
147367,task step edit expand rte show step name,CLOSED FIXED,P3 enhancement
147368,unused servicetracker,RESOLVED INVALID,P3 normal
147369,ensure interoperability callisto tool,RESOLVED FIXED,P2 normal
147370,format categories property editor,RESOLVED WONTFIX,P3 normal
147371,bring licence headers date,RESOLVED FIXED,P3 normal
147372,inconsistent button bind group tabs property editor,RESOLVED WONTFIX,P3 normal
147373,context assist block type,CLOSED DUPLICATE of bug 126698,P3 normal with 2 votes
147374,audit metrics collect require plugin ids external model package,RESOLVED FIXED,P3 normal
147375,preference dialog title overwrite message message empty,RESOLVED WONTFIX,P3 normal
147376,need override,RESOLVED FIXED,P3 enhancement
147377,open proposal popup close valid proposals leave,VERIFIED FIXED,P3 enhancement
147378,emfbasic tutorials provide cheat sheet,VERIFIED FIXED,P3 enhancement
147379,external file save recent file list,RESOLVED FIXED,P3 normal with 1 vote
147380,allow tailor generate impl class name,RESOLVED DUPLICATE of bug 233843,P3 enhancement with 3 votes
147381,generics discrepancy eclipse compiler sun,VERIFIED FIXED,P3 normal
147382,remove migrate rarely use attribute delivery process,NEW,P2 enhancement
147383,launcher docs,RESOLVED FIXED,P3 normal
147384,simpledebugger induce deadlock ioconsolepartitioner,NEW,P3 major
147385,data set parameters direction value reflect whether data set type support parameters,RESOLVED FIXED,P3 normal
147386,optionally allow equinox launch configuration group,RESOLVED DUPLICATE of bug 115157,P3 enhancement
147387,suggestion use instead,NEW,P3 normal
147388,create work product diagram open cause work product create diagram,CLOSED FIXED,P3 normal
147389,validation markers remove validation,CLOSED FIXED,P3 normal
147390,class use template formatter,RESOLVED FIXED,P3 minor
147391,auto page break work properly html report,CLOSED FIXED,P3 major
147392,effect display create template item style report item,RESOLVED WONTFIX,P3 normal
147393,include ds build,VERIFIED FIXED,P3 normal
147394,eclipse application launcher plugin tabs include start level start option like equinox,RESOLVED WONTFIX,P3 normal
147395,initialize display name new data may get sync,CLOSED FIXED,P3 normal
147396,text pdf,CLOSED FIXED,P3 normal
147397,easy redirect,RESOLVED WONTFIX,P3 normal
147398,list border apply group,CLOSED WONTFIX,P3 normal
147399,popup menu glitches open action,RESOLVED FIXED,P3 normal
147400,test failures mac comboupdatingtest,RESOLVED WORKSFORME,P3 normal
147401,toc webviewer couse error,CLOSED FIXED,P3 major
147402,work target report,CLOSED WONTFIX,P3 normal
147403,attach script report throw,CLOSED FIXED,P3 normal
147404,plugin version number issue,CLOSED FIXED,P3 normal
147405,error runandrender attach,CLOSED FIXED,P3 major
147406,name dataset create,CLOSED DUPLICATE of bug 147395,P3 normal
147407,preview attach report web viewer first time click toc button cause npe error,CLOSED FIXED,P3 normal
147408,page break page report create incorrect page break print report header,RESOLVED WONTFIX,P3 normal
147409,jsp semantics validator fail derive properties,CLOSED FIXED,P3 normal
147410,work table group,CLOSED FIXED,P3 normal
147411,jsp semantics validator datatable row,VERIFIED FIXED,P3 normal
147412,old script data design file use new build,CLOSED WONTFIX,P5 normal
147413,completion throw method body give empty window,RESOLVED WORKSFORME,P3 normal
147414,npe analysislaunchconfigurationdelegate,CLOSED WONTFIX,P3 normal
147415,editor descriptor,RESOLVED DUPLICATE of bug 140473,P3 normal
147416,issue require bundle version range,CLOSED FIXED,P3 normal
147417,prompt text cascade parameter group translate,CLOSED FIXED,P3 normal
147418,properly set client area,RESOLVED FIXED,P3 normal
147419,remove dtp plugins birt report framework,RESOLVED FIXED,P3 normal
147420,click toc cause error,CLOSED FIXED,P3 normal
147421,support partial project load,ASSIGNED,P5 normal
147422,template handle diagram without domain model,RESOLVED FIXED,P3 normal
147423,npe remove item table custom draw hook,RESOLVED FIXED,P3 normal with 1 vote
147424,mousebuttons work,NEW,P3 normal with 2 votes
147425,wrong code completions,NEW,P5 normal
147426,term use different,CLOSED WONTFIX,P3 normal
147427,metricprovider template handle diagram without domain model correctly,RESOLVED FIXED,P3 normal
147428,task php invoke every project,CLOSED FIXED,P3 normal with 2 votes
147429,autoboxing color work negative number,RESOLVED FIXED,P3 normal
147430,exception rename method directly source code,CLOSED FIXED,P3 normal
147431,rm artifact actor need content,CLOSED FIXED,P1 major
147432,better support build project,CLOSED DUPLICATE of bug 303960,P3 normal
147433,expand project builder extension point enable better support project,RESOLVED WONTFIX,P3 enhancement
147434,breakpoints duplicate class,RESOLVED DUPLICATE of bug 22536,P3 critical
147435,host name persist always select host list,CLOSED FIXED,P1 normal
147436,editable table keyboard accessible,VERIFIED FIXED,P3 enhancement
147437,expand binary node include cannot open,RESOLVED INVALID,P3 normal
147438,restart dialog update use term workbench,RESOLVED FIXED,P3 normal
147439,eclipse ftp webdav plugin work windows iis ftp server,RESOLVED FIXED,P3 normal
147440,gef info information incorrect,RESOLVED FIXED,P3 normal
147441,servicetracker pay attention service rank change,RESOLVED FIXED,P3 normal
147442,must hold move slider change position,CLOSED FIXED,P3 normal
147443,show checkbox position context,NEW,P3 normal
147444,xml catalog schema location work,CLOSED DUPLICATE of bug 104001,P3 normal
147445,improve terminology stag web service creation,NEW,P3 normal
147446,,ASSIGNED,P5 enhancement
147447,window small,RESOLVED DUPLICATE of bug 44420,P3 normal
147448,treeviewer hold filter dispose,VERIFIED FIXED,P3 major
147449,docs say extension point schemas valid xml schemas,RESOLVED FIXED,P3 normal
147450,web document create custom profilers probekit,CLOSED FIXED,P3 enhancement
147451,show wizard wsdl validation even browse button press,NEW,P3 normal
147452,disable wsdl wizard wsdl validation,CLOSED INVALID,P3 normal
147453,replace disable regex enable initial selection present,RESOLVED INVALID,P3 normal
147454,add keyboard accessibility document sdk,RESOLVED FIXED,P3 normal
147455,test log bugzilla defect section show type defect,CLOSED FIXED,P1 normal
147456,facet runtimes combo sort,CLOSED FIXED,P3 normal
147457,runtime remember,CLOSED FIXED,P3 normal
147458,jsf editor honor xml format options,RESOLVED DUPLICATE of bug 141721,P3 normal
147459,conflict two extensions different value,RESOLVED WONTFIX,P3 normal
147460,change graphically one end relationship reflect model,RESOLVED DUPLICATE of bug 146889,P3 major
147461,tighten use within access restriction specifications,VERIFIED FIXED,P3 normal
147462,ear nest module wizard wrong default,CLOSED FIXED,P3 normal
147463,content markup schema problems,NEW,P3 normal
147464,debug view activate perspective,VERIFIED FIXED,P3 normal
147465,wrong entry new ejb client,CLOSED FIXED,P3 normal
147466,class cast exception open log thread interactions view db serialize correlation,CLOSED FIXED,P3 major
147467,error markers display correctly view,CLOSED FIXED,P2 major
147468,project classpath wipe use,CLOSED FIXED,P3 normal
147469,runtime combo reenabling necessary,CLOSED FIXED,P3 major
147470,war validation throw exceptions errors,CLOSED WORKSFORME,P3 normal with 1 vote
147471,database creation script fail couple statements cloudscape,CLOSED WORKSFORME,P3 normal
147472,setup trac test repository,RESOLVED FIXED,P2 enhancement
147473,check fix problem defect model load xml test execution,CLOSED FIXED,P1 normal
147474,need way search bug patch,RESOLVED DUPLICATE of bug 104099,P3 enhancement
147475,even show log view run log sample,CLOSED FIXED,P2 normal
147476,provide way specify genmodel kind create emf wizards,VERIFIED FIXED,P3 enhancement
147477,call pure design diagram,RESOLVED FIXED,P3 normal
147478,dnd role multiple time team cannot add role use filter,CLOSED FIXED,P3 normal
147479,text miss testcase description view manual test view,CLOSED DUPLICATE of bug 128424,P3 normal
147480,validation enhance,RESOLVED WONTFIX,P3 normal
147481,detail value synch viewer selection,CLOSED FIXED,P3 major
147482,header validation extra comma result error manifest edtior,RESOLVED FIXED,P3 normal
147483,distinguishable viewer,RESOLVED FIXED,P3 normal
147484,break context menu label display view,VERIFIED FIXED,P3 trivial
147485,anonymous type miss java model,VERIFIED FIXED,P3 normal
147486,create junit testcase problem outline bug,CLOSED FIXED,P3 normal
147487,uncategorized artifact display name instead presentation name configuration,CLOSED FIXED,P3 minor
147488,npe remove expand category,VERIFIED FIXED,P3 major
147489,compositevalidator validationerror,NEW,P3 enhancement
147490,need highlight latest development download tab latest release,CLOSED FIXED,P3 enhancement
147491,delete link two sync ad reopen link miss predecessors,CLOSED FIXED,P3 normal
147492,roadmap activity filter use default config instead select config,CLOSED FIXED,P3 normal
147493,compare revision,RESOLVED WORKSFORME,P3 major
147494,automate management provide button,RESOLVED FIXED,P3 enhancement
147495,automate management provide context menu options,RESOLVED DUPLICATE of bug 67582,P3 enhancement
147496,comment sql query,RESOLVED WONTFIX,P3 minor
147497,button appearance tab style,RESOLVED FIXED,P3 minor
147498,validation visitor reject operations parse successfully,CLOSED FIXED,P2 major
147499,change font color affect children override font color,RESOLVED WORKSFORME,P3 normal
147500,styledtext visualy show line alignment text present line,NEW,P3 normal
147501,could change component jsf,RESOLVED WORKSFORME,P3 normal
147502,relevant view bring top,VERIFIED FIXED,P3 normal
147503,encapsulate api recorder generic record framework,CLOSED WONTFIX,P3 normal
147504,improve content assist import miss,VERIFIED DUPLICATE of bug 44984,P3 normal
147505,miss conversion ref string project,VERIFIED FIXED,P3 normal
147506,eclipse test result miss powerpc platform,RESOLVED WONTFIX,P3 normal
147507,swt license miss new agent controller zip file,CLOSED DUPLICATE of bug 146346,P3 blocker
147508,disable control disable scroll bar,RESOLVED WONTFIX,P3 normal
147509,axis generation miss class present restrict type,CLOSED DUPLICATE of bug 146629,P3 normal
147510,corrupt file commit cvs,CLOSED WORKSFORME,P1 major
147511,large log open time base correlation cause nullpointer exception,CLOSED DUPLICATE of bug 146610,P3 normal
147512,gmf runtime build provide complete many diagram plugins,RESOLVED WORKSFORME,P3 major
147513,take account existane macs,RESOLVED FIXED,P3 normal
147514,visibility text item still show item,RESOLVED WORKSFORME,P3 normal
147515,separate type information iobservable,VERIFIED FIXED,P3 normal
147516,warn refactoring derive file,RESOLVED FIXED,P3 enhancement
147517,phoenix validate,RESOLVED FIXED,P3 normal
147518,styledtext arrow break,RESOLVED FIXED,P3 critical
147519,performance test os x need additional vm parameters,RESOLVED WONTFIX,P3 normal
147520,runtimearchive property set intel macs,RESOLVED FIXED,P3 normal
147521,attribute column properties disable column select available,CLOSED FIXED,P2 normal
147522,work linux,RESOLVED FIXED,P3 normal
147523,mouse wheel support slow,CLOSED INVALID,P3 normal
147524,duplicate data display report,CLOSED INVALID,P3 major
147525,able provide project properties,ASSIGNED,P3 enhancement
147526,bind aggregate function report detail cause error,RESOLVED FIXED,P3 critical
147527,agent controller miss information get version,CLOSED FIXED,P3 normal
147528,fail linux,RESOLVED FIXED,P3 minor
147529,explorer sometimes print console,CLOSED WONTFIX,P3 minor
147530,provide event object change listeners,VERIFIED FIXED,P3 enhancement
147531,hostprocessfilterimpl get username system property,RESOLVED FIXED,P3 normal
147532,connect enter password dialog always require password proceed,CLOSED FIXED,P2 normal
147533,incorrect report document create attach report design,RESOLVED FIXED,P2 major
147534,cannot reconnect java persistence properties database explorer open,CLOSED FIXED,P3 normal
147535,change schema select java persistence project cause combos update,CLOSED FIXED,P3 normal
147536,create export target create ant build file package web enterprise,NEW,P3 enhancement
147537,add activity history display task,NEW,P4 enhancement with 3 votes
147538,garabage japanese character pdf ms mincho,RESOLVED FIXED,P3 normal
147539,export rcp application use environment variable work,RESOLVED WONTFIX,P3 normal with 1 vote
147540,allow multirepositoryawarewizard finish first page,RESOLVED FIXED,P3 enhancement
147541,component name store arm identity properties,CLOSED FIXED,P3 normal
147542,xml data set designer show available columns attach file,RESOLVED FIXED,P2 major
147543,dev guide update,CLOSED FIXED,P3 normal
147544,tooltips task list show correctly,RESOLVED FIXED,P2 normal
147545,attempt fire stale event abstractobservable throw classcastexception,VERIFIED FIXED,P3 normal
147546,suppress duplicate give stack trace,RESOLVED FIXED,P3 normal
147547,eclipse appear hang short period preview report,RESOLVED FIXED,P2 normal
147548,nullpointerexception try kill process,CLOSED FIXED,P2 normal
147549,execution statistics view display data,CLOSED FIXED,P3 normal
147550,work text,RESOLVED FIXED,P3 normal
147551,roadmap activity filter use default config instead select config,CLOSED DUPLICATE of bug 147492,P3 normal
147552,wpdependancy diagram extend display wps wbs ta,CLOSED FIXED,P3 normal
147553,free text widget,CLOSED FIXED,P3 normal
147554,edit free text diagram editor difficult confuse,CLOSED FIXED,P3 normal
147555,need able copy paste free text,CLOSED FIXED,P3 normal
147556,format text box always go back default,CLOSED FIXED,P3 normal
147557,datetime parameter modify default specify,RESOLVED WORKSFORME,P3 normal
147558,pass date parameters report,RESOLVED FIXED,P3 normal
147559,file transfer protocol java side print debug statements,CLOSED FIXED,P3 normal
147560,test must edit usable linux side,CLOSED FIXED,P3 normal
147561,support integer data type report parameters,RESOLVED FIXED,P1 normal
147562,distribute linux usable,CLOSED FIXED,P3 normal
147563,remove observable factories data bind context,VERIFIED FIXED,P3 normal
147564,weird errors log,RESOLVED FIXED,P3 normal
147565,cacaded multi data set parameter doesnt work,RESOLVED WORKSFORME,P2 normal
147566,parameter selection space display,CLOSED FIXED,P3 normal
147567,manage makefile,RESOLVED INVALID,P3 major
147568,dataextractiontask work,CLOSED INVALID,P3 normal
147569,java script work preview web viewer,CLOSED FIXED,P3 normal
147570,text transform support,CLOSED WORKSFORME,P3 normal
147571,highlight set grid cell work properly,CLOSED FIXED,P3 normal
147572,provide utility methods gridlayout margins,NEW,P5 enhancement
147573,attach master page report return html file blank,CLOSED FIXED,P3 major
147574,page generate page break set,CLOSED FIXED,P3 normal
147575,eofexception render attach report engine api,CLOSED DUPLICATE of bug 147576,P3 normal
147576,eofexception render attach report engine api,CLOSED FIXED,P3 major
147577,list header repeat viewer,CLOSED FIXED,P3 normal
147578,grid column highlight work,CLOSED FIXED,P3 normal
147579,error,CLOSED FIXED,P3 normal
147580,border style set inline style text item display solid pdf generate birt pdf,CLOSED FIXED,P3 normal
147581,report api page break lose html output,CLOSED FIXED,P3 normal
147582,incorrect message resource file,CLOSED FIXED,P3 normal
147583,color miss preview attach report design,CLOSED FIXED,P3 major
147584,miss preview exist report design,CLOSED INVALID,P3 normal
147585,output incorrect,CLOSED WORKSFORME,P3 major
147586,redundant border table detail,CLOSED FIXED,P3 normal
147587,always exclude last work properly,CLOSED FIXED,P3 normal
147588,top margin automatically preview layout,CLOSED FIXED,P3 normal
147589,evaluate correctly preview layout,CLOSED FIXED,P3 major
147590,work runtask runandrendertask,CLOSED FIXED,P3 major
147591,work properly certain report items,CLOSED FIXED,P3 normal
147592,attach report preview correctly web view,CLOSED FIXED,P3 normal
147593,attach report subquery display,CLOSED FIXED,P3 normal
147594,jet compiler create miss target folder,VERIFIED FIXED,P3 enhancement
147595,page break behavior attach report subquery,CLOSED FIXED,P3 normal
147596,inner group page break,RESOLVED WONTFIX,P3 normal
147597,happen preview attach design file,CLOSED FIXED,P3 normal
147598,name expression table cannot use total,CLOSED INVALID,P3 normal
147599,error inner table without header row nest structure,CLOSED FIXED,P3 major
147600,table caption repeat work correctly subquery,CLOSED INVALID,P3 normal
147601,preview report column name include double quotation mark,CLOSED WORKSFORME,P3 normal
147602,cache data set data report preview work incorrectly,CLOSED INVALID,P3 normal
147603,set default name file get preview pdf,CLOSED WORKSFORME,P3 normal
147604,value parameter list display incorrectly paramter group,CLOSED FIXED,P3 normal
147605,new style apply,CLOSED INVALID,P3 normal
147606,line space java editor change hyperlink use font size,RESOLVED DUPLICATE of bug 115172,P3 normal
147607,library container always work,CLOSED FIXED,P3 critical
147608,publish ejb project contain utility jar file,CLOSED DUPLICATE of bug 149995,P3 major
