id,title,status,importance
497325,dark unusable many place plain visible,CLOSED DUPLICATE of bug 497562,P3 normal with 1 vote
497326,failure load unit detach revision,NEW,P3 major
497327,paste possible row columns select,RESOLVED FIXED,P3 normal
497328,popup menu disable items first click outside table,RESOLVED FIXED,P3 normal
497329,code generator update site break,CLOSED FIXED,P3 normal
497330,test failures gtk,RESOLVED FIXED,P3 normal
497331,test fail,RESOLVED FIXED,P3 normal
497332,test fail,RESOLVED FIXED,P3 normal
497333,consider replace bugzilla tuleap,CLOSED WONTFIX,P3 normal with 1 vote
497334,detachment eresource honor containment proxies,NEW,P3 normal
497335,cannot debug executable work directory,ASSIGNED,P3 normal
497336,add mylyn section neon,RESOLVED FIXED,P3 enhancement
497337,papyrus editor unusable defer reload,NEW,P3 normal
497338,unit error output shall show wrap line console,NEW,P3 normal
497339,need update page wiki,RESOLVED FIXED,P3 normal
497340,improvements format,RESOLVED FIXED,P3 normal
497341,npe stereotypeelementlistener unbatched notifications,RESOLVED FIXED,P2 normal
497342,loadresourcesnippet make change without transaction,RESOLVED FIXED,P2 normal
497343,check tp provision single install,RESOLVED FIXED,P3 enhancement
497344,fail,CLOSED FIXED,P2 normal
497345,styledtext selection use hotkeys work windows,NEW,P3 major
497346,standard dirt report need update,RESOLVED FIXED,P3 normal
497347,custom event aspects incorrect mix experiment,NEW,P3 normal
497348,drag drop overfly editor tabs break,VERIFIED FIXED,P3 major
497349,reverse debug always enable attach process,RESOLVED FIXED,P3 normal
497350,platformua setup break,RESOLVED FIXED,P3 normal
497351,support new library track events,RESOLVED FIXED,P3 normal
497352,query miss icons,RESOLVED FIXED,P3 normal
497353,add check box include exclude,CLOSED WORKSFORME,P3 enhancement
497354,arrayindexoutofboundsexception,VERIFIED WORKSFORME,P3 normal
497355,fix compiler warn newindex branch,RESOLVED FIXED,P3 normal
497356,birt webviewerexample start,CLOSED FIXED,P3 critical with 11 votes
497357,occasionally unable commit container use docker explorer contextual menu,CLOSED FIXED,P3 normal
497358,click control raise mousedown event control b,NEW,P3 normal
497359,performance statically generate profile,CLOSED FIXED,P2 enhancement
497360,upgrade target platform neon,CLOSED FIXED,P3 normal
497361,possibility customize label booleanradio editors,RESOLVED FIXED,P3 enhancement
497362,boldface highlight proposals neon,NEW,P3 normal
497363,svg image load correctly error message instead,UNCONFIRMED,P3 enhancement
497364,access svn info page lead error message,RESOLVED FIXED,P3 major
497365,forte crash use publish fb send string longer char,CLOSED FIXED,P3 normal
497366,format code papyrus formatter,RESOLVED FIXED,P3 normal
497367,possibility change layout abstractpropertyeditor,RESOLVED FIXED,P3 enhancement
497368,pull refactoring interface generate break code,RESOLVED FIXED,P3 normal
497369,basicfamily image provide svg,CLOSED FIXED,P3 enhancement
497370,unable retrieve image tag,CLOSED FIXED,P3 normal
497371,documentation intoducation specific emfcompareconfiguration,CLOSED FIXED,P3 normal
497372,memory leak case multi selection,RESOLVED FIXED,P3 normal
497373,cnbrowser refresh miss tceditor save,CLOSED FIXED,P3 normal
497374,view potential npe property type define,CLOSED FIXED,P3 normal
497375,update target neon,RESOLVED FIXED,P3 normal
497376,raw layer add data stream,CLOSED FIXED,P3 normal
497377,create field hotfix determine correct field type,NEW,P3 normal
497378,need visibility package uml service type,CLOSED FIXED,P3 enhancement
497379,validation deadlocks proxy resolution load resources,VERIFIED FIXED,P1 critical
497380,eclipse capture wildcard lower bind javac cannot capture,VERIFIED INVALID,P3 normal
497381,change tree folder parent archetype,CLOSED FIXED,P3 normal
497382,wait conditionally restart aut,CLOSED DUPLICATE of bug 478615,P3 major
497383,unexpected error occur,CLOSED DUPLICATE of bug 487192,P3 normal
497384,encode problem revision properties view modify revision property form,CLOSED DUPLICATE of bug 489818,P3 normal
497385,table shall allow select one package root element,CLOSED DUPLICATE of bug 507291,P3 enhancement
497386,phpexe point allow php execs locate outside bundle,CLOSED FIXED,P3 enhancement
497387,tabitem set image null doesnt resize tabitem,RESOLVED FIXED,P3 normal
497388,fragment position list tag well define,CLOSED FIXED,P3 normal
497389,cannot call java constructor via reflection,UNCONFIRMED,P3 normal
497390,siwtch components integration,RESOLVED FIXED,P3 normal
497391,memory leak qualifiednamedisplayeditpolicy,CLOSED FIXED,P3 normal
497392,way tag release directly hudson,CLOSED FIXED,P3 normal
497393,debugger launch neon windows xp,RESOLVED WONTFIX,P3 blocker
497394,generate code choice pseudo state compile,RESOLVED FIXED,P3 normal
497395,typo main,CLOSED FIXED,P3 normal
497396,cannot box java type,UNCONFIRMED,P3 normal
497397,windows disappear,RESOLVED WORKSFORME,P3 major
497398,compartment layout problem addition semantic elements involve refresh diagram,CLOSED FIXED,P3 normal
497399,illegalargumentexception stereotype tooltip,CLOSED FIXED,P3 normal
497400,npes several drop policies,CLOSED FIXED,P3 normal
497401,mylyn task repository ignore eclipse proxy basic authentication settings,NEW,P3 normal
497402,horizontal vertical stack children presentation respect initial user size,CLOSED FIXED,P3 normal
497403,wrong size useless scroll bar,CLOSED FIXED,P3 normal
497404,inconsistent gmf location region insertion,CLOSED FIXED,P3 normal
497405,size problem regions container,CLOSED FIXED,P3 normal
497406,genie drop comment anymore,RESOLVED FIXED,P3 normal
497407,bundle updatable,CLOSED FIXED,P3 normal
497408,update download page content release,RESOLVED FIXED,P3 normal
497409,incorrect presentation input parameters level stack frame,CLOSED FIXED,P3 normal
497410,set api baseline use target file,CLOSED DUPLICATE of bug 491874,P3 enhancement
497411,debugger show value array native object,CLOSED FIXED,P3 normal
497412,task task key prepended unreadable text task list,RESOLVED FIXED,P2 critical
497413,abstract time graph view jul logger incorrectly enable,RESOLVED FIXED,P3 normal
497414,could find artifact,NEW,P3 normal
497415,task list tooltip display incoming arrow empty text,RESOLVED FIXED,P2 normal
497416,impossible add word spell checker,CLOSED WONTFIX,P3 normal
497417,type argument inconsistency detect,NEW,P3 normal
497418,system log sort confuse time,NEW,P3 enhancement
497419,fix crlf line end source,CLOSED FIXED,P3 normal
497420,nullpointerexception,CLOSED FIXED,P3 normal
497421,nullpointerexception,CLOSED DUPLICATE of bug 497420,P3 normal
497422,nullpointerexception,CLOSED FIXED,P3 normal
497423,static method generic type add favorites show,NEW,P3 normal
497424,source find main file inside,RESOLVED FIXED,P3 normal
497425,let developers target platform add vm arguments,CLOSED FIXED,P3 normal
497426,add linux tool section neon,RESOLVED FIXED,P3 normal
497427,archive repository recognize,RESOLVED INVALID,P3 blocker
497428,replace preferences dialog box preferences editor,NEW,P3 enhancement
497429,delete preference progress dialog,RESOLVED WONTFIX,P3 normal
497430,provide tutorial popup help users discover progress icon first time appear,RESOLVED WONTFIX,P3 normal
497431,allow key bind assign quick access menu,NEW,P3 enhancement
497432,linux kill releng hipp,CLOSED FIXED,P3 major
497433,sysmin sign unsigned comparison need unnecessary cast,CLOSED FIXED,P3 normal
497434,externs file result useless,CLOSED FIXED,P3 normal
497435,performance cpu memory,RESOLVED FIXED,P3 normal
497436,clean work windows,RESOLVED FIXED,P3 normal
497437,nullpointerexception,RESOLVED FIXED,P3 normal
497438,state value support arithmetic operations,RESOLVED FIXED,P3 normal
497439,synchronise view show false positives due line end,NEW,P3 major with 1 vote
497440,multiple start time scenarios state,NEW,P3 normal
497441,event listener detect whiteboard service,RESOLVED WONTFIX,P3 normal
497442,need install libraries versioned directories,RESOLVED FIXED,P3 normal
497443,errors run builder resource project,UNCONFIRMED,P3 major
497444,progress indicator update splash screen eclipse,VERIFIED FIXED,P3 normal
497445,perform setup task command yield npe,RESOLVED WORKSFORME,P3 normal
497446,community vote show admin,CLOSED FIXED,P3 normal
497447,npe use annotations,RESOLVED WONTFIX,P3 normal
497448,swtexception throw class creation undo stringeditor active,CLOSED WORKSFORME,P3 minor
497449,improve technically collapse regions,NEW,P3 enhancement
497450,add preference option image dockerfile,NEW,P3 normal
497451,remove workaround,NEW,P3 normal
497452,spurious npes drop illegal reference,RESOLVED FIXED,P3 normal
497453,need register qvto transformations library,CLOSED FIXED,P3 normal
497454,,RESOLVED NOT_ECLIPSE,P3 normal
497455,matchers improvements property,CLOSED FIXED,P3 normal
497456,compare anything subversive,RESOLVED FIXED,P3 major with 1 vote
497457,variable scoping issue invocation parameters,CLOSED FIXED,P3 normal
497458,provide api fetch latest eclipse release,RESOLVED FIXED,P3 normal
497459,regression introduce correction bug wrong result recursive call,CLOSED DUPLICATE of bug 497457,P3 critical
497460,docker connection available build suggest remediations,CLOSED FIXED,P3 enhancement
497461,view annoy keywords,CLOSED FIXED,P3 normal
497462,windows test time due swt error,NEW,P3 major
497463,share maven plugin parent pom designer,CLOSED FIXED,P3 normal
497464,slow download server,RESOLVED FIXED,P3 normal
497466,use generics databinding,NEW,P3 normal
497467,possible npe nattablemodelmanager dispose,RESOLVED FIXED,P3 normal
497468,make eslint aware envs correspond index load tern,RESOLVED FIXED,P3 normal
497469,export representations action aird close session model project,CLOSED FIXED,P3 normal
497470,miss listener unregistrations call dispose,RESOLVED FIXED,P3 normal
497471,buildship keep rename project,CLOSED WORKSFORME,P3 normal
497472,add php version info different page dialogs php executables,CLOSED FIXED,P3 enhancement
497473,ctrl shift doesnt work js file open editor,NEW,P3 normal
497474,implement keyboard shortcuts docker view,NEW,P3 enhancement
497475,generify listenerlists,RESOLVED FIXED,P3 normal
497476,allign style toolbar perspective switcher windows,CLOSED DUPLICATE of bug 551390,P3 normal
497477,base text direction enforce bidi support enable,RESOLVED FIXED,P3 normal
497478,inconsistency explicit implicit disjuncts,UNCONFIRMED,P3 normal
497479,uri field empty fetch gerrit dialog,RESOLVED FIXED,P3 normal
497480,illegalstateexception trigger error dialog open,NEW,P3 normal
497481,replace reference specialization ereferences,CLOSED FIXED,P3 normal
497482,project properties svn info work,RESOLVED FIXED,P3 major
497483,produce duplicate get request,RESOLVED FIXED,P3 normal with 4 votes
497484,would nice launcher somehow publish bound show,NEW,P3 normal with 1 vote
497485,issue detect affixednodealignmenteditpolicy call align action,CLOSED FIXED,P3 normal
497486,viewpoint plugin miss feature,CLOSED FIXED,P3 critical
497487,need open api,RESOLVED FIXED,P3 enhancement
497488,ui freeze due defaultphonetichashprovider process long,NEW,P3 minor
497489,,RESOLVED FIXED,P3 normal
497490,allign style toolbar perspective switcher windows,RESOLVED FIXED,P3 normal
497491,make work test setup code,CLOSED FIXED,P3 normal
497492,npe tooltip providers,CLOSED FIXED,P3 normal
497493,unable connect svn,CLOSED WORKSFORME,P3 enhancement
497494,need create new wizard create json file,NEW,P3 enhancement
497495,performance optimization,RESOLVED FIXED,P3 normal
497496,need open api textobservablevalue,CLOSED FIXED,P3 enhancement
497497,workspacemodelindex limit number job,RESOLVED FIXED,P2 major
497498,request hipp instance milo,RESOLVED FIXED,P3 normal
497499,test bug tool component,CLOSED FIXED,P3 normal
497500,add time information cdt indexer debug trace,RESOLVED FIXED,P3 enhancement
497501,generate profile shall allow choose source domain model,CLOSED FIXED,P3 normal
497502,abstractvisualpart call access visual within,RESOLVED INVALID,P3 normal
497503,load query result visible context menus,RESOLVED FIXED,P3 normal
497504,duplicate problem report import declarations use module source,CLOSED DUPLICATE of bug 497508,P3 normal
497505,use default imagedescriptor imagemanager,CLOSED FIXED,P3 enhancement
497506,script return error,ASSIGNED,P3 normal
497507,close project appear query registry dependencies open project,RESOLVED FIXED,P3 normal
497508,duplicate problem report import declarations use module source,RESOLVED FIXED,P3 normal
497509,cannot execute new expression debug,VERIFIED FIXED,P3 normal
497510,return decode uri,RESOLVED FIXED,P3 normal with 4 votes
497511,delete local branch do outside main thread,NEW,P3 normal
497512,use support bash,RESOLVED FIXED,P3 normal
497513,rework jdt model cache work better new index,NEW,P3 normal with 1 vote
497514,nullpointerexception,CLOSED FIXED,P3 normal
497515,trademark approval require capra,RESOLVED FIXED,P3 normal
497516,executable,NEW,P3 major
497517,mentor require capra,RESOLVED FIXED,P3 normal
497518,rename binarytypeprinter,VERIFIED FIXED,P3 normal
497519,add help committers determine whether cq require project code,NEW,P3 normal
497520,record preference apply oomph,RESOLVED FIXED,P3 normal
497521,save invalid xml file delete supplementary file close trace,NEW,P3 normal
497522,nullpointerexception,CLOSED DUPLICATE of bug 317216,P3 normal
497523,initial contribution eclipse january,RESOLVED FIXED,P3 normal
497524,index code project generate cmake,NEW,P3 normal
497525,move charsets string constants standardcharsets,RESOLVED FIXED,P3 normal
497526,set git descriptions repositories,CLOSED FIXED,P3 normal
497527,register startupprogressbundlelistener never unregisters,RESOLVED FIXED,P3 normal
497528,need api set editor readonly mode,REOPENED,P3 normal
497529,splash screen flash message annoy cost startup performance,CLOSED DUPLICATE of bug 445802,P3 normal
497530,create target eclipse oxygen,RESOLVED FIXED,P3 enhancement
497531,full screen open preference page dialog visible main ide unreachable,CLOSED DUPLICATE of bug 493685,P3 normal
497532,need switch static parser web inspector protocol,RESOLVED FIXED,P3 normal
497533,release mylyn,RESOLVED FIXED,P3 normal
497534,branch create release candidate,RESOLVED FIXED,P3 normal
497535,name resolution problem template method,RESOLVED FIXED,P3 normal
497536,eclipse variable recognize dsf launcher,ASSIGNED,P3 normal
497537,permgem space,CLOSED FIXED,P3 blocker
497538,excel ole exception,RESOLVED WORKSFORME,P3 major
497539,centos test report mail list wrong link,NEW,P3 normal
497540,create example implementation base localsearch runtime,RESOLVED WONTFIX,P3 normal
497541,generator offer possibility derive generate actor class,RESOLVED FIXED,P3 enhancement
497542,extremly slow,RESOLVED FIXED,P3 normal
497543,add duplicate message choreography participant cause error,RESOLVED FIXED,P3 normal
497544,screen look break windows,RESOLVED INVALID,P3 normal
497545,provide way group settings testsuite,CLOSED FIXED,P3 normal
497546,inconsistent,NEW,P3 normal
497547,remove underline main toolbar windows quickfix break,RESOLVED FIXED,P3 normal
497548,make use standardcharsets,RESOLVED FIXED,P3 normal
497549,windowbuilder encounter unexpected internal,CLOSED DUPLICATE of bug 497162,P3 normal
497550,remove redundant confuse problems view configuration dialog,CLOSED DUPLICATE of bug 497942,P3 normal
497551,remove execution override,RESOLVED FIXED,P3 normal
497552,npe use history view commitgraphtable,NEW,P3 normal
497553,parameters use new task url,RESOLVED WONTFIX,P3 minor
497554,remove execution environment apierrorswarningspreferencepage,NEW,P3 normal
497555,fxtransformprovider provide property accessor affine,CLOSED INVALID,P3 normal
497556,fxhovertool disable,NEW,P3 normal
497557,hipp unable create download area directories,RESOLVED FIXED,P3 major with 1 vote
497558,add minimal set classpath,RESOLVED FIXED,P3 normal
497559,unsupported operation exception save representations sirius use xbase,CLOSED FIXED,P3 normal
497560,delete,RESOLVED FIXED,P3 normal
497561,allow operations multiple remotes,NEW,P3 enhancement
497562,umbrella bug improve dark theme,NEW,P3 normal with 1 vote
497563,dark search dialogue barely visible,CLOSED DUPLICATE of bug 496523,P3 normal
497564,npe,RESOLVED FIXED,P3 normal
497565,create child siblings group base feature instead list,RESOLVED FIXED,P3 normal
497566,merge action never alter physical file actual ask,RESOLVED FIXED,P3 normal
497567,replace use branch info available instead commit,NEW,P3 normal
497568,icons bug page,RESOLVED FIXED,P3 major
497569,negative priority activefocuscontrol,NEW,P3 normal
497570,uml package merge,NEW,P3 normal
497571,move column use boolean filter break table,RESOLVED FIXED,P3 major
497572,introduce argument phpexe point,CLOSED FIXED,P3 enhancement
497573,unnamed orbit plugins,CLOSED FIXED,P3 normal
497574,commit action stage change honour select untracked,RESOLVED FIXED,P3 normal
497575,extend controlsexample rectable size,RESOLVED FIXED,P3 normal
497576,augment bundle metadata,RESOLVED FIXED,P3 normal
497577,help page support env vars,RESOLVED FIXED,P3 normal
497578,deprecate attribute phpexe point,CLOSED FIXED,P3 enhancement
497579,unwanted deletion aes name want delete ae prefix,RESOLVED FIXED,P3 normal
497580,excludedworkingset disappear,RESOLVED WORKSFORME,P3 minor
497581,allow choose language dialect parser,CLOSED DUPLICATE of bug 449542,P3 normal
497582,click reference widget log error miss onclickexpression,CLOSED FIXED,P3 normal
497583,documentation reference widget use allinstances,RESOLVED FIXED,P3 normal
497584,ensure geometrynode align clickable area shape geometry,RESOLVED FIXED,P3 normal
497585,remove underline main toolbar linux,RESOLVED FIXED,P3 normal
497586,allow define selection highlighter via understore active tab,CLOSED DUPLICATE of bug 325937,P3 normal
497587,upgrade share hudson,CLOSED FIXED,P3 enhancement
497588,remove trail whitespace,RESOLVED FIXED,P3 normal
497589,remove trail whitespace,RESOLVED FIXED,P3 normal
497590,test result mail list give,RESOLVED FIXED,P3 normal
497591,remove underline main toolbar mac,RESOLVED FIXED,P3 normal
497592,wait request gdb inferior name complete,ASSIGNED,P3 normal
497593,support new aggregation function,CLOSED FIXED,P3 enhancement
497594, hello,CLOSED INVALID,P3 normal
497595,unable launch neon use build still see noclassdeffounderrors apply workaround,CLOSED DUPLICATE of bug 493761,P3 normal with 1 vote
497596,text table cell editor cut vertically,NEW,P3 normal
497597,unable compile code call java build,CLOSED DUPLICATE of bug 497218,P3 normal with 1 vote
497598,fail new gradle project use install project name,CLOSED WORKSFORME,P3 normal
497599,custom codeformatter snippet javadoc format,NEW,P3 normal
497600,change line end confirmation,NEW,P3 enhancement
497601,search window others appear,NEW,P3 blocker
497602,problem conent assist type first character,CLOSED FIXED,P3 normal
497603,type inference bug,VERIFIED FIXED,P3 major
497604,memory exhaustion anonymous clone allow,NEW,P3 critical
497605,unable hide button row split pane editor view,CLOSED FIXED,P3 normal
497606,change xtext setup url,VERIFIED FIXED,P3 normal
497607,modal dialogs miss button,CLOSED DUPLICATE of bug 508692,P3 normal
497608,print margin column obscure text edit window,CLOSED DUPLICATE of bug 17805,P3 normal
497609,stop mark anonymous class final resolve,ASSIGNED,P3 normal
497610,change project description project milo github,CLOSED DUPLICATE of bug 497611,P3 normal
497611,update description github project milo,RESOLVED FIXED,P3 normal
497612,update description github project milo,CLOSED DUPLICATE of bug 497611,P3 normal
497613,blank final field may lambda expression,VERIFIED INVALID,P3 normal
497617,build job gef hipp cannot checkout,CLOSED FIXED,P3 critical
497618,quick switch editors center dialog,RESOLVED FIXED,P3 normal
497619,combofieldeditor doesnt fire propertychangeevent doloaddefault doload,RESOLVED FIXED,P3 normal
497620,annotation parameter bind,NEW,P3 normal
497621,add parameters pass reference function label,CLOSED FIXED,P3 normal
497622,modify iparameter tell parameter pass reference,CLOSED FIXED,P3 enhancement
497623,classnotfoundexception,CLOSED INVALID,P3 normal
497625,skip two fail proxy junit test,RESOLVED FIXED,P3 normal
497626,update description github project milo,CLOSED DUPLICATE of bug 497611,P3 normal
497627,access eclipse marketplace possible jre,CLOSED DUPLICATE of bug 495989,P3 normal
497628,put first character line instead place begin,NEW,P3 enhancement
497629,depart arrive,CLOSED INVALID,P3 critical
497630,allow cancel deletion branch operation,RESOLVED FIXED,P3 normal
497631,wrong icon project,CLOSED WONTFIX,P3 normal
497632,terminate button disable console view,NEW,P3 minor
497633,remove redundant type information,RESOLVED FIXED,P3 normal
497634,perspectiveswitcher modify draw toolbar,RESOLVED FIXED,P3 normal
497635,revert fix bug,VERIFIED FIXED,P3 normal
497636,allow restart process attach session,ASSIGNED,P3 normal
497637,system display error message user enter charecters,RESOLVED NOT_ECLIPSE,P3 minor
497638,test failures build,RESOLVED FIXED,P3 normal
497639,search help find result search method name,NEW,P3 normal
497640,qualifier miss version manifest viewpoint specification project generate wizard,CLOSED FIXED,P3 normal
497641,viewpoint specification project creation wizard check project name wizard start,NEW,P3 normal
497642,add blog planet eclipse,RESOLVED FIXED,P3 normal
497643,oomph setups master need move oxygen,RESOLVED FIXED,P3 normal
497644,check accepteventaction update,RESOLVED FIXED,P3 enhancement
497645,classcastexception,NEW,P3 normal
497646,incorrect warn entry require,NEW,P3 normal with 1 vote
497647,cannot set value grid width height preferences page,VERIFIED FIXED,P3 normal
497648,cannot set value grid width height preferences page,CLOSED DUPLICATE of bug 497647,P3 normal
497649,cannot set value grid width height preference page,CLOSED DUPLICATE of bug 497647,P3 normal
497650,refine stereotype shall inherit refine stereotype define standard profile,NEW,P3 normal
497651,bug,CLOSED INVALID,P3 normal
497652,gerrit icon miss,CLOSED DUPLICATE of bug 497568,P3 normal
497653,merge irefreshextension irefreshoverride,CLOSED FIXED,P3 minor
497654,avoid various npes tablehelper class,RESOLVED FIXED,P3 normal
497655,initial version papyrus requirements sysml,CLOSED FIXED,P3 normal
497656,still local path jdk home property,CLOSED WONTFIX,P3 major
497657,oversized logo polarsys cgit page,CLOSED DUPLICATE of bug 496699,P3 normal
497658,app hang search project,CLOSED WONTFIX,P3 major
497659,app remember git credentials across restart,CLOSED WONTFIX,P3 normal
497660,app hang open search file,CLOSED WONTFIX,P3 normal
497661,allow validation,CLOSED INVALID,P3 normal
497662,graphcopier make accessible,RESOLVED FIXED,P3 normal
497663,class generate use compiler,RESOLVED FIXED,P3 normal
497664,provide separate api content assist hover,CLOSED WONTFIX,P3 enhancement
497665,delete tag branch stardust repos,CLOSED DUPLICATE of bug 499087,P3 normal
497666,migrate subprogressmonitor submonitor,NEW,P3 enhancement
497667,consider update toolbar command tooltip colour,CLOSED WONTFIX,P3 normal
497668,cdt indexer infer type return value,RESOLVED FIXED,P3 normal
497669,indexoutofboundsexception,RESOLVED FIXED,P3 normal
497670,support compiler provide hint,RESOLVED FIXED,P3 normal
497671,wrong informations requirement refinedby traceto compartment,CLOSED FIXED,P3 normal
497672,incorrect warn entry require,CLOSED DUPLICATE of bug 497646,P3 normal
497673,different definitions,NEW,P3 normal
497674,miss image use neon,RESOLVED FIXED,P3 normal
497675,undo stack clear add new operation,RESOLVED WORKSFORME,P3 normal
497676,add saner model search service emodelservice,NEW,P3 normal
497677,allow specify environment variables aut pom,UNCONFIRMED,P3 minor
497678,npe open requirements diagram,CLOSED FIXED,P3 normal
497679,fxcanvasex ensure ui always update process,RESOLVED FIXED,P3 normal
497680,remove orion css editor tool repo,RESOLVED FIXED,P3 normal
497681,implement custom filterrule,NEW,P3 normal
497682,icons miss bugzilla link,CLOSED DUPLICATE of bug 497568,P3 normal
497683,ability display feed eclipse project,RESOLVED FIXED,P3 normal
497684,commit link add bug gerrit patch merge,RESOLVED WORKSFORME,P3 normal
497685,cannot set breakpoint node modules,RESOLVED FIXED,P3 normal
497686,set oomph oxygen dev,NEW,P3 normal
497687,svnmergehelper restore proper state,RESOLVED FIXED,P3 normal
497688,menu appear place diagram model explorer,UNCONFIRMED,P3 normal
497689,make use standardcharsets,RESOLVED FIXED,P3 normal
497690,factorize check,NEW,P3 normal
497691,serial port show el capitan,RESOLVED FIXED,P3 normal
497692,please delete branch create accident,CLOSED FIXED,P3 normal
497693,sysroot space,RESOLVED FIXED,P3 normal
497694,space build configuration name always exands environment variables generate file,NEW,P3 normal
497695,edge selection two border node impossible regard zoom factor,CLOSED DUPLICATE of bug 497702,P3 normal
497696,provide local,CLOSED WONTFIX,P3 enhancement
497697,space input output location always exands environment variables generate file,NEW,P3 normal
497698,,VERIFIED FIXED,P3 major
497699,npe profileutil,CLOSED FIXED,P3 normal
