id,title,status,importance
407346,exception configure new synchronize fortran project,RESOLVED FIXED,P3 trivial
407347,eclipse preserve junit history,CLOSED DUPLICATE of bug 98076,P3 enhancement
407348,httplistenaddress parameter honor,VERIFIED FIXED,P3 critical with 1 vote
407349,inline method could avoid array creation varargs argument pass,ASSIGNED,P5 enhancement
407350,open file delete remote type hierarchy view generate error,RESOLVED FIXED,P3 normal
407351,tabbed property view section layout correctly base aftersection specification,NEW,P3 major
407352,warn log unmet test feature requirements,NEW,P3 normal
407353,pdf width different table database use insert dynamic text,NEW,P3 major
407354,test,CLOSED INVALID,P3 critical
407355,null warn assert field,VERIFIED INVALID,P3 normal
407356,order selection browser dependent,RESOLVED FIXED,P3 normal
407357,replace cvs git website,RESOLVED FIXED,P3 normal
407358,error create db first insert elements,CLOSED FIXED,P3 major
407359,howto provide information company switch,RESOLVED FIXED,P3 normal
407360,incorrect converter code generate datatypes use generics,CLOSED FIXED,P3 normal
407361,package presentation preference persist restart,RESOLVED INVALID,P3 normal
407362,job lock spam job,RESOLVED FIXED,P3 major
407363,javascript client reference,CLOSED FIXED,P3 minor
407364,incorrect astrewrite qualifiedtype,RESOLVED FIXED,P3 normal
407365,birt cannot export chart,NEW,P3 normal
407366,problems markers view synchronize selection,RESOLVED WORKSFORME,P3 major
407367,go offline,RESOLVED FIXED,P3 normal
407368,detect expire passwords show mislead error message,CLOSED WORKSFORME,P3 normal
407369,feature miss brand bundle,VERIFIED WONTFIX,P3 normal
407370,npe central test data editor use context menu,CLOSED FIXED,P3 normal
407371,tomcat hang shutdown,RESOLVED FIXED,P2 major with 1 vote
407372,change namespace javascript mqtt client,RESOLVED FIXED,P2 major
407373,switch perspectives tabitem control fill client area,RESOLVED INVALID,P3 major
407374,initial bound set gtk,CLOSED DUPLICATE of bug 406808,P3 normal
407375,miss kepler repo,CLOSED DUPLICATE of bug 404213,P3 normal
407376,npe refresh workspace,VERIFIED DUPLICATE of bug 442755,P3 normal
407377,cce try close minimize view via context menu,VERIFIED FIXED,P3 normal
407378,show location query result break,CLOSED FIXED,P3 normal
407379,incquery databinding clean,CLOSED FIXED,P3 normal
407380,functionnality work acceleo,CLOSED WORKSFORME,P3 normal
407381,formatjs nothing post message,RESOLVED FIXED,P3 normal
407382,npe content assist new workspace,VERIFIED FIXED,P3 normal
407383,create initial kepler new document,RESOLVED FIXED,P3 enhancement
407384,new kepler,RESOLVED FIXED,P3 enhancement
407385,update help documentation new feature,VERIFIED FIXED,P3 enhancement
407386,cookies copy servletwebsocketrequest,CLOSED FIXED,P3 normal
407387,source flag aggregate step,ASSIGNED,P3 enhancement
407388,around duplicate test executions,CLOSED WONTFIX,P5 enhancement
407389,source feature partially break,RESOLVED WORKSFORME,P2 normal
407390,ximportsection sometimes work,VERIFIED FIXED,P3 normal
407391,launch second runtime workbench workspace,VERIFIED FIXED,P3 normal
407392,export vector graphics,NEW,P3 normal
407393,change project options submit,VERIFIED FIXED,P3 normal
407394,compareeditor cannot cast repositoriesview,CLOSED DUPLICATE of bug 398925,P3 normal
407395,wrong boot classpath access rule activate requirejrepackageimport,RESOLVED FIXED,P3 normal
407396,drag drop outline project explorer view,NEW,P3 enhancement
407397,controldecorator dispose decorate control dispose,RESOLVED FIXED,P2 normal
407398,add support jca,RESOLVED FIXED,P3 enhancement
407399,classcastexception bundle provide file,CLOSED FIXED,P3 normal
407400,assertionfailedexception,CLOSED DUPLICATE of bug 366012,P3 normal
407401,add support client,RESOLVED FIXED,P3 normal
407402,check jre system jre jre define,RESOLVED FIXED,P3 major
407403,publish scout sdk test api,CLOSED FIXED,P3 enhancement
407404,menu items tool bar items always disable,RESOLVED FIXED,P3 normal
407405,cdt build console slow line wrap,RESOLVED FIXED,P3 major
407406,jpars moxy example,RESOLVED FIXED,P3 normal
407407,synchronize unable synchronize multiple host,CLOSED FIXED,P3 normal
407408,public methods defaulteobjectlabelprovider subclass break editor instal repo,NEW,P3 normal
407409,extension activator stop method never call,RESOLVED FIXED,P3 normal
407410,wrong stt target runtime environment path,NEW,P3 normal
407411,ensure copyright date update feature,VERIFIED FIXED,P3 normal
407412,click specific type button lead configuration error,CLOSED FIXED,P2 blocker
407413,feature call closure cannot sugar,CLOSED FIXED,P3 normal
407414,incorrect warn primitive type null,VERIFIED FIXED,P3 normal with 3 votes
407415,wrong btd new project wizard wtp,RESOLVED FIXED,P3 normal
407416,allow storage hook validate,RESOLVED FIXED,P3 normal
407417,mechanism avoid evaluation idynamicvariables,NEW,P3 enhancement with 1 vote
407418,exist wizard allow filter project,VERIFIED FIXED,P3 enhancement
407419,wrong btd new wtp,CLOSED DUPLICATE of bug 381487,P3 normal
407420,job stick,VERIFIED FIXED,P3 normal
407421,overly zealous remove repo,VERIFIED FIXED,P3 normal
407422,mylyn context deactivation always close editors,VERIFIED FIXED,P3 major
407423,optimize lookup storage resourcedescriptionsdata,CLOSED FIXED,P3 normal
407424,move tycho,VERIFIED FIXED,P3 normal
407425,action work contextpath,RESOLVED FIXED,P3 normal
407426,contain duplicate source file,RESOLVED FIXED,P3 normal
407427,newchild work package,RESOLVED FIXED,P3 major
407428,allow drag file shell,RESOLVED FIXED,P3 normal
407429,backport allow drag file shell,RESOLVED FIXED,P3 normal
407430,lazy start longer wait another thread trigger start,RESOLVED FIXED,P3 normal
407431,run fix copyright tool ui bundle,RESOLVED FIXED,P3 normal
407432,remove break externalize string ui bundle,RESOLVED FIXED,P3 normal
407433,eclipse launcher companion library require execute permission hpux,RESOLVED FIXED,P3 critical
407434,wrong btd templates,VERIFIED FIXED,P3 normal
407435,run fix copyright tool pde tool bundle,VERIFIED FIXED,P3 normal
407436,cause npe compare editor,VERIFIED FIXED,P3 major
407437,configure remote repository use correct remote information,NEW,P3 normal
407438,thememanager fail theme configure ioob,RESOLVED FIXED,P3 normal
407439,breakpoint delete two line move,NEW,P3 normal
407440,occasionally fail test,NEW,P3 normal
407441,fail install,RESOLVED FIXED,P3 normal
407442,fix,RESOLVED FIXED,P3 minor
407443,support package modifier,RESOLVED FIXED,P3 normal
407444,new application wizard miss dependency kepler model,RESOLVED WORKSFORME,P3 normal
407445,provide web locations test,RESOLVED FIXED,P3 trivial
407446,find toolbar break follow search link,RESOLVED FIXED,P3 normal
407447,need folder php write,RESOLVED WORKSFORME,P3 normal
407448,uncomment work,RESOLVED WORKSFORME,P3 normal
407449,wrong stt new emf project,CLOSED DUPLICATE of bug 131711,P3 normal
407450,wrong btd new emf project creation,CLOSED DUPLICATE of bug 131711,P3 normal
407451,simplecache hold weak reference model elements,CLOSED FIXED,P3 normal
407452,jsonreader update xmlanyelement present report everything attribute,NEW,P3 normal
407453,nullpointerexception try customize,CLOSED DUPLICATE of bug 413329,P3 normal
407454,run test setup dependencies need update,RESOLVED WONTFIX,P3 normal
407455,debug button right perspective switcher,CLOSED DUPLICATE of bug 399401,P3 major
407456,gig help docs need info,CLOSED WONTFIX,P3 normal
407457,browser longer work solaris,RESOLVED FIXED,P3 major
407458,default name copy file expect simplify chinese support,NEW,P3 normal
407459,servletbridge support class use webapps class loader launch,RESOLVED FIXED,P3 normal
407460,enhancement simplify key base map class embed ids,NEW,P3 enhancement
407461,xmladapter return null throw npe,RESOLVED FIXED,P3 normal
407462,npe prevent resources save,CLOSED FIXED,P3 critical
407463,please create job modeler,CLOSED FIXED,P3 normal
407464,test fail fixture,RESOLVED DUPLICATE of bug 386147,P3 normal
407465,configure branch pull display wrong branch name,RESOLVED FIXED,P3 normal
407466,update file,RESOLVED FIXED,P3 normal
407467,apply select order column radio button,VERIFIED FIXED,P3 normal
407468,support default server side preferences editor,RESOLVED FIXED,P3 normal
407469,method parameters support throwable,CLOSED FIXED,P3 normal
407470,javadoc incorrectly reference websocketframe object,CLOSED FIXED,P3 normal
407471,npe search text file,RESOLVED WORKSFORME,P3 normal
407472,document height get whack,RESOLVED FIXED,P3 major
407473,warn message configuro yellow ccs console view,CLOSED FIXED,P3 normal
407474,exceptions throw open close trace events,RESOLVED FIXED,P3 normal
407475,directory entries,RESOLVED FIXED,P3 normal
407476,adapterfactoryobservablelist compile,RESOLVED FIXED,P3 normal
407477,submittaskjob provide access catch coreexception,RESOLVED WONTFIX,P3 enhancement
407478,npe checkout repo relative worktree paths,RESOLVED FIXED,P3 normal
407479,tracker window show taskbar even though suppose,RESOLVED FIXED,P3 normal
407480,name resolution problem inappropriately report template code,RESOLVED FIXED,P3 normal
407481,nvda silent use xulrunner,CLOSED WONTFIX,P3 normal
407482,implementation ptp support ibm platform mpi,CLOSED FIXED,P3 normal
407483,cdt decorators bite slow work project,RESOLVED FIXED,P3 normal
407484,improve format support,CLOSED FIXED,P3 normal
407485,xulrunner navigate page invalid certificate show dialogs,RESOLVED WONTFIX,P3 normal
407486,find security bug cross site script site,VERIFIED FIXED,P3 critical
407487,method select outline view reveal java editor drag,ASSIGNED,P3 minor
407488,diagnosis output,CLOSED WORKSFORME,P3 enhancement
407489,use statement add namespace cause error,CLOSED FIXED,P3 normal
407490,cast state type need,RESOLVED FIXED,P3 enhancement
407491,npe parse malformed http request,RESOLVED FIXED,P3 minor
407492,base featuremaps,RESOLVED FIXED,P3 normal
407493,debug display show wrong value condition,NEW,P3 normal
407494,classnotfoundexception classname contain multiple dollar character,RESOLVED FIXED,P3 normal
407495,bugzilla search operate outdated result,VERIFIED FIXED,P3 critical
407496,false positive invalid template arguments use nest templates,CLOSED DUPLICATE of bug 407497,P3 minor
407497,false positive template use nest,RESOLVED FIXED,P3 minor
407498,exception unmarshalling freeform json object contain json array,RESOLVED FIXED,P3 normal with 1 vote
407499,xtext template editor dialog allow numeric variables,NEW,P3 normal
407500,option let bree define jdk test,RESOLVED FIXED,P3 enhancement
407501,scriptcontext lose locale report contain javascript test report,CLOSED WORKSFORME,P3 major
407502,npe open make target view,VERIFIED FIXED,P3 normal
407503,message nls miss,RESOLVED FIXED,P3 normal
407504,provide release note,CLOSED FIXED,P3 normal
407505,cause hide editor area show,VERIFIED FIXED,P3 minor
407506,npe casebreakchecker,RESOLVED FIXED,P3 normal
407507,birt java heap space issue,NEW,P3 blocker
407508,zip export allow exclude file,RESOLVED FIXED,P3 normal
407509,error log view miss,RESOLVED INVALID,P3 normal
407510,color background without grid layer turn gray,VERIFIED FIXED,P3 normal
407511,tooltips reliably show truncate view title,VERIFIED FIXED,P3 normal
407512,zip import override exist file,RESOLVED FIXED,P3 normal
407513,deadlock run job,RESOLVED FIXED,P3 normal
407514,new ubm version include new action,CLOSED FIXED,P1 enhancement
407515,print sometimes print wrong specification,RESOLVED FIXED,P3 normal
407516,wrong time zone detection,VERIFIED NOT_ECLIPSE,P3 normal
407517,make pivot trace evaluator extensible,CLOSED FIXED,P3 normal
407518,javadoc toc link common api,CLOSED FIXED,P3 normal
407519,exceptions swallow rap terminate thread,NEW,P3 normal
407520,multiple email invisible post jubula forum,CLOSED FIXED,P3 normal
407521,forums break,VERIFIED FIXED,P3 normal
407522,perspective reset work correctly,CLOSED DUPLICATE of bug 383569,P3 normal
407523,builderstateutil optimize,CLOSED FIXED,P3 normal
407524,sample project,CLOSED FIXED,P1 enhancement
407525,log warn old style plugin detect,RESOLVED FIXED,P3 normal
407526,compute alternate solutions incredibly slow cancellable,RESOLVED FIXED,P3 normal
407527,allow access implement zookeeper service,RESOLVED FIXED,P3 normal
407528,enhancement enable inheritance indicators,NEW,P3 enhancement
407529,implement incremental build test,VERIFIED FIXED,P3 normal
407530,editor page dump error text buffer,RESOLVED FIXED,P3 normal
407531,popup menus clip orion editor pane,RESOLVED FIXED,P3 normal
407532,incorrectly map composite key base relationship produce confuse result,NEW,P3 normal
407533,cannot read sit annotation declaration,CLOSED WONTFIX,P3 minor
407534,remove unused nls string ant,RESOLVED FIXED,P3 normal
407535,solrserverfactory compatible apache solr,RESOLVED FIXED,P3 normal
407536,actionsets cdt cannot turn start enable,VERIFIED FIXED,P3 normal
407537,cannot create register resource factory need,CLOSED INVALID,P3 normal
407538,support xhtml content string,RESOLVED FIXED,P3 normal
407539,use throw throw arraystoreexception,RESOLVED WONTFIX,P3 normal
407540,wrong stt display folder structure url,RESOLVED WONTFIX,P3 normal
407541,logout option miss user drop,RESOLVED FIXED,P3 major
407542,check remove unused nls string debug,RESOLVED FIXED,P3 normal
407543,rtl type support orion editor,RESOLVED WONTFIX,P3 normal
407544,sdo test failures,CLOSED FIXED,P3 normal
407545,hudson aggregation job get content file,RESOLVED FIXED,P1 normal
407546,local provide useful tool tip replace field regex flag,RESOLVED FIXED,P3 normal
407547,java rather,RESOLVED INVALID,P3 major
407548,upgrade use guava,VERIFIED FIXED,P3 normal
407549,dbws builder test fail,CLOSED FIXED,P3 normal
407550,wrong order hebrew shell,CLOSED WONTFIX,P3 normal
407551,jsp translation incorrect expressions script block,RESOLVED FIXED,P3 normal
407552,include link newsgroups project page,RESOLVED FIXED,P3 normal
407553,jsp translation incorrect expressions script block,RESOLVED FIXED,P3 normal
407554,context menus scout explorer disable kepler,CLOSED FIXED,P3 critical
407555,stackoverflowerror swt widgets mac os,RESOLVED FIXED,P3 major
407556,discoverytestsuite correctly detect add junit annotate test test suite,RESOLVED FIXED,P3 normal
407557,fileclient throw error timeout happen save,RESOLVED FIXED,P3 normal
407558,provide option stay offline,NEW,P3 enhancement with 1 vote
407559,miss base text direction support,CLOSED WONTFIX,P3 normal
407560,odd flow cause mail list css style,RESOLVED FIXED,P3 normal
407561,gridrow height incorrect first session,RESOLVED FIXED,P2 normal
407562,throw repositorynotfoundexception bare repository windows,NEW,P3 normal
407563,potential issue transformerfactory optimization,RESOLVED FIXED,P3 normal
407564,emf milestone repository longer available,RESOLVED FIXED,P3 normal
407565,jsp translation incorrect expressions script block,RESOLVED FIXED,P3 normal
407566,add link editor plugin,RESOLVED WONTFIX,P3 normal
407567,bug list urls project plan flexible,CLOSED WONTFIX,P3 normal
407568,error detail use vertical space,RESOLVED FIXED,P3 normal
407569,visit plain show project,RESOLVED FIXED,P3 normal
407570,attribute inherit unmapped pojo persist,CLOSED FIXED,P3 normal
407571,trace validation classic trace import work anymore,RESOLVED FIXED,P3 major
407572,work properly interruptedexception,RESOLVED FIXED,P3 normal
407573,cursor track zoomtext mac eclipse,NEW,P3 normal
407574,,RESOLVED FIXED,P3 normal
407575,correct indentation disagree formatter,CLOSED DUPLICATE of bug 48433,P3 enhancement
407576,get new icons jboss,RESOLVED FIXED,P3 normal
407577,set foreground color radio check button effect windows,NEW,P3 major with 1 vote
407578,several jpa proxy test fail persistence jar setup issue,RESOLVED FIXED,P3 normal
407579,false ambiguity template function resolution,RESOLVED FIXED,P3 normal
407580,build project gnumakefile use autotools,RESOLVED FIXED,P3 normal
407581,provide task operations execute inline,NEW,P3 enhancement
407582,ioobe add duplicate link bidirectional reference,CLOSED FIXED,P3 normal
407583,avoid spurious npe model processor create,VERIFIED FIXED,P3 minor
407584,gmf runtime miss source bundle,RESOLVED FIXED,P3 normal
407585,many file git repo ms word document need,RESOLVED FIXED,P4 minor
407586,nattable default bind use control modifier mac instead command,CLOSED FIXED,P3 normal
407587,link navigation dropdown open shell location base current context,CLOSED DUPLICATE of bug 407826,P3 normal
407588,phantom tool iu name relationships appear,REOPENED,P3 normal
407589,server field serverdelegete update workingcopy server save,NEW,P3 normal
407590,use sliders mitigate information overload,RESOLVED WONTFIX,P3 normal
407591,unsupportedoperationexception throw,RESOLVED FIXED,P3 normal
407592,,RESOLVED FIXED,P3 normal
407593,,RESOLVED FIXED,P3 normal
407594,,RESOLVED FIXED,P3 normal
407595,,RESOLVED FIXED,P3 normal
407596,,RESOLVED FIXED,P3 normal
407597,,RESOLVED FIXED,P3 normal
407598,nullpointerexception cellpaintermouseeventmatcher,CLOSED FIXED,P3 normal
407599,make remediation operation api,NEW,P3 normal
407600,print layout data children,NEW,P3 enhancement
407601,file filter cannot add filter new sync project dialog,RESOLVED FIXED,P3 normal
407602,set null generate incorrect line script,ASSIGNED,P3 normal
407603,arrayindexoutofboundsexception,UNCONFIRMED,P3 normal with 1 vote
407604,string xtrnalizr config fail,RESOLVED WORKSFORME,P3 normal
407605,change connect parameter url,RESOLVED FIXED,P3 enhancement
407606,insufficient endpointlistener support,RESOLVED FIXED,P3 major
407607,add presentation options git stag view,RESOLVED FIXED,P3 minor
407608,xdcscript parser errors longer provide valid file line number info,ASSIGNED,P3 major
407609,decimal float point literals parse,NEW,P3 normal
407610,cannot create new sync project jgit problem,RESOLVED WORKSFORME,P3 normal
407611,,CLOSED INVALID,P3 normal
407612,update,RESOLVED FIXED,P3 normal
407613,reduce resolver timeout,RESOLVED FIXED,P3 critical
407614,gzipfilter prevent efficient serve static content,RESOLVED FIXED,P3 normal
407615,update,RESOLVED FIXED,P3 normal
407616,update jsp,RESOLVED FIXED,P3 normal
407617,incorrect compiler error pass class parameter unimported class,NEW,P3 minor
407618,create method interface,CLOSED FIXED,P3 normal
407619,plan longer appear project page,NEW,P3 normal
407620,migrate dltk project website git,RESOLVED FIXED,P3 normal
407621,honor webresources section configuration,CLOSED INVALID,P3 enhancement
407622,update,RESOLVED FIXED,P3 normal
407623,comparator log show many file,NEW,P3 normal
407624,comparator log show swt version,VERIFIED FIXED,P3 normal
407625,comparator log show twice,VERIFIED FIXED,P3 normal
407626,plugin use hard disk space,CLOSED DUPLICATE of bug 404417,P3 enhancement
407627,client disconnect due timeout pingreq,RESOLVED FIXED,P2 major
407628,pom editor throw error editor,CLOSED DUPLICATE of bug 371534,P3 blocker
407629,java source fail close javadoc miss comment,VERIFIED DUPLICATE of bug 303519,P3 normal
407630,manytoone id allow conjunction id,VERIFIED FIXED,P2 major
407631,incoming generate error,RESOLVED FIXED,P3 minor
407632,,CLOSED DUPLICATE of bug 393852,P3 normal
407633,tree also enable nothing,RESOLVED FIXED,P3 minor
407634,icon update synchronize view remove property dialog,RESOLVED DUPLICATE of bug 401619,P3 minor
407635,problems kubuntu,RESOLVED WORKSFORME,P3 normal
407636,copy test resources target folder property true,CLOSED NOT_ECLIPSE,P3 major
407637,incoming set property,NEW,P3 normal with 1 vote
407638,throw several exceptions,CLOSED INVALID,P3 normal
407639,illegalstateexception use fileupload widget,CLOSED WONTFIX,P3 normal
407640,make multicore visualizer model persistent duration debug session,ASSIGNED,P3 enhancement
407641,compiler test fail cme,CLOSED FIXED,P3 normal
407642,shell ignore set menubar calculation prefer size,RESOLVED WORKSFORME,P3 major
407643,ignore file certain,CLOSED DUPLICATE of bug 448094,P3 normal
407644,search enter key search completion go search directly partial,RESOLVED FIXED,P3 normal
407645,unnecessary debug string,RESOLVED INVALID,P3 trivial
407646,add coverity scan plugin,RESOLVED FIXED,P3 normal
407647,duplicate target line breakpoints create set gdb console line breakpoint,RESOLVED FIXED,P3 normal
407648,bpel break,NEW,P3 normal
407649,review editor show subm category display web ui,RESOLVED FIXED,P3 minor
407650,encounter problem nullpointerexception,CLOSED DUPLICATE of bug 371534,P3 normal
407651,error occur run operation job,CLOSED FIXED,P3 normal
407652,generate entities table wizard generate entities implement,VERIFIED FIXED,P3 normal
407653,rework appearance section,RESOLVED FIXED,P3 normal
407654,generate entities table wizard clear selection invoke second time,RESOLVED WONTFIX,P3 normal
407655,class load issue sctm executor plugin jboss,NEW,P3 critical
407656,build path cycle warn prevent export ant buildfile,RESOLVED FIXED,P3 normal
407657,find file editor refocus navigator location file select,RESOLVED FIXED,P3 normal
407658,sonar disk space,RESOLVED FIXED,P3 normal
407659,many errors test morning,RESOLVED INVALID,P3 normal
407660,add jsch platform,RESOLVED FIXED,P2 major
407661,resourceexception create jpa project rename do project,NEW,P3 normal
407662,dropdown menus appear icons arrow,RESOLVED WONTFIX,P3 normal
407663,exception batch import cause end scan,CLOSED WONTFIX,P3 normal
407664,rename folder root create new folder,CLOSED DUPLICATE of bug 402786,P3 normal
407665,navigator new name dialog sometimes fail appear,RESOLVED WONTFIX,P3 normal
407666,remote debug label miss space,VERIFIED FIXED,P3 trivial
407667,command line properties sentence say break,RESOLVED FIXED,P3 normal
407668,markplace respond,RESOLVED INVALID,P3 blocker
407669,try save delete file pop strange,RESOLVED FIXED,P3 normal
407670,use system value proxy settings,NEW,P3 normal
407671,java api usage,CLOSED FIXED,P3 major
407672,builder test without jdt target platform,CLOSED FIXED,P3 normal
407673,canvas filter sometimes wrongly hide thread,RESOLVED FIXED,P3 normal
407674,exceptions batch import project select,CLOSED FIXED,P3 normal
407675,glitch ganttchart view use gantsection windows,CLOSED INVALID,P3 normal
407676,generate repository use mac bundle miss iu,RESOLVED FIXED,P3 minor
407677,avoid key bind conflict narrow contexts,CLOSED WONTFIX,P3 normal with 2 votes
407678,authentication work hudsonmonitor hudsontracker gadgets,NEW,P3 major
407679,memory setup incorrectly file,CLOSED FIXED,P3 normal
407680,convert project synchronize project,CLOSED FIXED,P3 normal
407681,source bundle miss bundle name provider name,RESOLVED FIXED,P3 normal
407682,editor settings change invoke panel,RESOLVED FIXED,P3 normal
407683,currently eclipse install file eclipse directory,RESOLVED WORKSFORME,P3 normal
407684,edit job add additional label configuration,VERIFIED FIXED,P3 normal
407685,childs job project start,NEW,P3 normal
407686,inconsistent guava import,RESOLVED FIXED,P1 major
407687,port bug potential issue transformerfactory optimization,RESOLVED FIXED,P3 normal
407688,error load debugger ui component,RESOLVED FIXED,P3 normal
407689,,RESOLVED WORKSFORME,P3 normal
407690,commit dialog remember last dialog size,RESOLVED FIXED,P3 normal
407691,several jetty junit test fail,CLOSED FIXED,P3 normal
407692,update jdt compiler,VERIFIED FIXED,P3 normal
407693,preprocessor include paths dialog need scroll bar,NEW,P3 normal
407694,several key bind conflict instal cdt together jdt,CLOSED DUPLICATE of bug 413410,P3 normal
407695,call terminate application linux,RESOLVED WORKSFORME,P3 normal
407696,include paths remain uninitialized code compile create new c project,RESOLVED FIXED,P3 normal
407697,modify index could write,NEW,P3 normal
407698,llistat de halls,CLOSED INVALID,P3 normal
407699,eclipse fail launch debugger,NEW,P3 major
407700,log mvs rse move focus away mvs rse,RESOLVED INVALID,P3 normal
407701,control deployment view reverse mismatch order sashform,CLOSED DUPLICATE of bug 406621,P3 normal
407702,jslint validator recognize recognize,RESOLVED FIXED,P3 normal
407703,issue,RESOLVED DUPLICATE of bug 401037,P3 normal
407704,provide option disable validation,CLOSED DUPLICATE of bug 413246,P3 normal
407705,add support generate node application skeletons,RESOLVED WONTFIX,P3 normal
407706,need ability configure source feature brand bundle,VERIFIED FIXED,P3 normal
407707,number file change jdt compiler,VERIFIED FIXED,P3 normal
407708,httpupgradehandler must support injection,RESOLVED FIXED,P3 normal
407709,click column header select cells,CLOSED WONTFIX,P3 normal
407710,override endpointdescription properties,RESOLVED FIXED,P3 major
407711,npe,CLOSED WORKSFORME,P3 normal
407712,rsa include service properties,RESOLVED FIXED,P3 major
407713,strike underline work font config dialog geoshape editor,NEW,P3 normal
407714,remote system explorer display extra line ssh,NEW,P3 normal
407715,exception update external folders link resources support,NEW,P3 normal
407716,java,RESOLVED FIXED,P3 enhancement
407717,underline shortcut character options main,VERIFIED INVALID,P3 minor
407718,shortcut work mongodb data set,CLOSED WONTFIX,P3 minor
407719,unsafe method call,RESOLVED FIXED,P3 normal
407720,shotcut tab chart cause npe,VERIFIED FIXED,P3 normal
407721,conflict fit chart,VERIFIED FIXED,P3 normal
