id,title,status,importance
405148,remove antrunner replace task,VERIFIED INVALID,P3 normal
405149,remove antrunner replace task,RESOLVED WONTFIX,P3 normal
405150,http authentication web service client wizard,RESOLVED WORKSFORME,P3 normal
405151,remove antrunner replace task,RESOLVED WONTFIX,P3 normal
405152,remove antrunner replace task,RESOLVED WONTFIX,P3 normal
405153,enforce base text direction name description new connection profile wizard,NEW,P3 normal
405154,zip file cache virtual version work,RESOLVED FIXED,P3 normal
405155,factory pattern generics issue,CLOSED FIXED,P3 normal
405156,wrong distribution link download section,CLOSED FIXED,P3 normal
405157,return extra part,VERIFIED FIXED,P3 critical
405158,array string pass parameter,CLOSED WORKSFORME,P3 normal
405159,extract fragment placeholder import reference part,RESOLVED FIXED,P3 normal
405160,create property signal lead error validate model,RESOLVED FIXED,P3 normal
405161,moxy support java api json process,CLOSED FIXED,P3 normal
405162,generate thread message service actor instance deploy,RESOLVED WONTFIX,P3 enhancement
405163,table configuration must embed table editors plugins,CLOSED FIXED,P3 enhancement
405164,dwarfcache local variable name ok cause build issue os define ok macro,RESOLVED FIXED,P3 normal
405165,cache nullresource correctly work,CLOSED FIXED,P3 normal
405166,install number show available,CLOSED FIXED,P3 normal
405167,add new nattable plugins releng,RESOLVED FIXED,P3 enhancement
405168,internal error occur cannot cast,RESOLVED FIXED,P3 normal
405169,pack jar bundle inside pack jar,NEW,P3 normal
405170,malformedparameterizedtypeexception throw class extend class extend,NEW,P3 normal with 1 vote
405171,formdata doesnt support attachment sibling,NEW,P3 major
405172,wrong problems unsupported interface,CLOSED DUPLICATE of bug 402393,P3 normal
405173,navigate restore relate elements work anymore,RESOLVED DUPLICATE of bug 428055,P3 normal
405174,css concatenate,RESOLVED FIXED,P3 normal
405175,carriage return template lead wrong format,CLOSED WORKSFORME,P2 normal
405176,add newline end ecj error output,VERIFIED FIXED,P3 normal
405177,pack jar bundle inside pack jar,RESOLVED FIXED,P3 normal
405178,jdtbasedtypefactory typeurihelper significantly improve,CLOSED FIXED,P3 normal
405179,support git,NEW,P3 enhancement with 1 vote
405180,update tag documentation,VERIFIED FIXED,P3 normal
405181,add diagnostic log log exceptions higher log level,RESOLVED FIXED,P3 enhancement
405182,rebuild,CLOSED FIXED,P3 normal
405183,new warn introduce merge,RESOLVED FIXED,P3 normal
405184,bad indentation first indent comment,NEW,P3 normal
405185,remove workaround code baseapianalyzer,RESOLVED FIXED,P3 normal
405186,http redirection render instal plugin unusable,RESOLVED WONTFIX,P3 normal
405187,cbi remove file rap target,CLOSED FIXED,P3 normal
405188,http get return internal ip address,RESOLVED FIXED,P3 normal
405189,cbi export rap target instead build update site,CLOSED FIXED,P3 normal
405190,use unc path file url repository definition,RESOLVED WORKSFORME,P3 minor
405191,nil value commit unsettable attribute,CLOSED FIXED,P2 normal
405192,mylyn update kill eclipse leave corrupt,RESOLVED DUPLICATE of bug 407825,P3 normal
405193,json schema metadata,RESOLVED FIXED,P3 enhancement
405194,provide version catalog,NEW,P3 enhancement
405195,generation handle etags,NEW,P3 enhancement
405196,break link readme documentation,RESOLVED FIXED,P3 normal
405197,ssh access block,RESOLVED FIXED,P3 blocker
405198,add generic template content assist support,RESOLVED FIXED,P3 normal
405199,stashapplycommand throw unwanted stashapplyfailureexception,RESOLVED FIXED,P3 normal
405200,new public interfaces misplace,VERIFIED FIXED,P3 normal
405201,xmlvalue use class extend anything,NEW,P3 enhancement
405202,error occur delete file project explorer,RESOLVED NOT_ECLIPSE,P3 normal
405203,support user extend collections,RESOLVED FIXED,P3 normal
405204,support user extend map,RESOLVED FIXED,P3 normal
405205,provide extension point viewer sandbox tabs,CLOSED FIXED,P3 normal
405206,show annotation properties view,CLOSED INVALID,P3 normal
405207,potential profile launch configuration tab group clash linux tool ptp,RESOLVED FIXED,P3 normal
405208,sequence strange layouting first field label,CLOSED WONTFIX,P3 minor
405209,use infinite timeout network download cause hard lockup,UNCONFIRMED,P3 normal with 1 vote
405210,textview send keypress keydown events,RESOLVED FIXED,P3 normal
405211,treat old style plugins valid bundle,VERIFIED FIXED,P3 normal
405212,pack jar bundle inside pack jar,RESOLVED FIXED,P3 normal
405213,enable gerrit eclipse scout,RESOLVED FIXED,P3 normal with 1 vote
405214,pack jar bundle inside pack jar,RESOLVED FIXED,P3 normal
405215,pack jar bundle inside pack jar,NEW,P3 normal
405216,widget dispose exception,VERIFIED FIXED,P3 normal
405217,document use apache,RESOLVED MOVED,P3 normal
405218,suppr delete transition instead hide,RESOLVED FIXED,P3 major
405219,file readonly error rename project project rename even though keep oldname,RESOLVED WORKSFORME,P3 normal
405220,add default shortcut launch xslt,RESOLVED FIXED,P3 enhancement
405221,state newly fork process valid,RESOLVED FIXED,P3 normal
405222,cant open eclipse,CLOSED FIXED,P3 major
405223,process file match output type xsl,NEW,P3 normal
405224,repository create mvn verify use mvn,RESOLVED INVALID,P3 normal
405225,batchcompiler throw npe java,RESOLVED FIXED,P3 critical
405226,getsingleresult,CLOSED DUPLICATE of bug 241322,P3 blocker
405227,marshal anytype field enum value incorrect,ASSIGNED,P3 normal
405228,completion assist enter navigation operators,CLOSED FIXED,P3 normal
405229,override ease debug,CLOSED FIXED,P3 enhancement
405230,source download package miss moxy classas,RESOLVED FIXED,P3 normal
405231,maven downstream build notification mess,NEW,P3 critical
405232,batch compiler support java version,RESOLVED FIXED,P3 normal
405233,cannot parse previous date time format,CLOSED FIXED,P3 major
405234,api tabbox bottom alignment,CLOSED WONTFIX,P3 enhancement
405235,parameters fully qualify type create different proposals simple type,RESOLVED FIXED,P3 normal
405236,canonicalmodelprocessor generate wrong java code wildcard base collection,NEW,P2 blocker with 1 vote
405237,menu define menucontribution rather objectcontribution,ASSIGNED,P3 minor
405238,last char appear black comment html,RESOLVED WORKSFORME,P3 normal with 1 vote
405239,index action available within context menu,RESOLVED FIXED,P3 normal
405240,annotations suggestions oblivious context,RESOLVED WONTFIX,P3 normal
405241,explore string hashcode optimization,RESOLVED WONTFIX,P3 enhancement
405242,class find error class higher level,NEW,P3 normal
405243,duplicate annotations get suggest,NEW,P3 normal
405244,way supply group position information support,RESOLVED FIXED,P3 critical
405245,call hang eclipse fetch xsd schema,CLOSED FIXED,P3 normal
405246,remove syntax errors present,NEW,P3 enhancement
405247,provide public getter remoteobject id,RESOLVED FIXED,P3 enhancement
405248,remove implementation bundle declare also apis,CLOSED FIXED,P3 normal
405249,log cycle trace option enable,VERIFIED FIXED,P3 major
405250,annotations get suggest import statements,RESOLVED FIXED,P3 normal
405251,problems deploy persistence applications,CLOSED FIXED,P3 normal
405252,cycle log warn severity message,VERIFIED FIXED,P3 normal
405253,nosuchprofileexception connection info selection,NEW,P3 normal
405254,annotations suggest super reference expressions,RESOLVED INVALID,P3 normal
405255,import relative workspace possible,RESOLVED WONTFIX,P3 major
405256,method destroyuser call,RESOLVED WONTFIX,P3 normal
405257,nil value commit unsettable attribute,CLOSED FIXED,P2 normal
405258,interpreterview use current selection initialize select eobjects list,CLOSED FIXED,P3 normal
405259,menu order completely go crazy,VERIFIED FIXED,P3 critical
405260,papyrus ui view synch,CLOSED FIXED,P3 major
405261,update versions enterprise components,CLOSED FIXED,P3 normal
405262,duplicate context menu entries xml editor source tab,VERIFIED FIXED,P3 normal with 5 votes
405263,compute column correct date cube,NEW,P3 normal
405264,require,RESOLVED FIXED,P3 normal
405265,remove usage deprecate constructor,RESOLVED FIXED,P3 normal
405266,reverse order generic definition,CLOSED FIXED,P3 minor
405267,nullpointer exception typeconvertingcompiler,CLOSED NOT_ECLIPSE,P3 normal
405268,reconcile delete require unresolvable genpackages,NEW,P3 normal
405269,console hyperlink detector fail use template variable launch config,CLOSED WONTFIX,P3 minor
405270,handle receiver parameter ui refactoring,ASSIGNED,P3 enhancement
405271,define filter viewermodels,CLOSED FIXED,P3 normal
405272,create filter observablelists,CLOSED FIXED,P3 normal
405273,ui detect invalid model,RESOLVED FIXED,P3 normal
405274,stackoverflow error merge diff,CLOSED FIXED,P3 blocker
405275,code assist insert redundant parenthesis,CLOSED DUPLICATE of bug 325374,P3 normal
405276,hamcrest,RESOLVED FIXED,P3 blocker
405277,xtend annotation example set encode,CLOSED FIXED,P3 normal
405278,setup gerrit locationtech,RESOLVED FIXED,P3 normal
405279,even simplest bracket match would extremely useful makefile editor,RESOLVED FIXED,P3 enhancement
405280,hudson per project locationtech,VERIFIED FIXED,P3 normal
405281,impossible set,RESOLVED FIXED,P3 normal
405282,eclipse errors,NEW,P3 normal
405283,hudson per project lts,RESOLVED FIXED,P3 normal
405284,add legacy test config automate build,CLOSED FIXED,P3 enhancement
405285,unable launch junit npe ejbclientclassifierclasspathprovider,RESOLVED FIXED,P3 major
405286,provide hudson slave lts,RESOLVED WONTFIX,P3 normal
405287,provide hudson slave locationtech,CLOSED DUPLICATE of bug 405752,P3 normal
405288,release kepler,RESOLVED FIXED,P3 normal
405289,provide concept texts,NEW,P3 enhancement with 1 vote
405290,point compare editor dirty leave easy way recalculate diffs,RESOLVED FIXED,P3 normal
405291,matcher factory engine api revision,CLOSED FIXED,P3 normal
405292,gerrit ssh port locationtech,CLOSED FIXED,P3 normal
405293,enforce base text direction class name new class wizard,NEW,P3 normal
405294,weave generic class return different number result getinterfaces getgenericinterfaces,CLOSED FIXED,P3 normal
405295,jsdt cannot resolve root script file,NEW,P3 major
405296,extension point contributions stay active contribute available,NEW,P3 major
405297,copy content disable smartfield work swing,CLOSED NOT_ECLIPSE,P3 normal
405298,code fail compile access introduce public field,NEW,P3 normal
405299,bogus error markers source,NEW,P3 normal
405300,bug use identity column sybase table,NEW,P2 blocker with 2 votes
405301,rethink use immutabiliy api,CLOSED FIXED,P3 normal
405302,work,RESOLVED WONTFIX,P3 normal
405303,implicit oclasset fail refresh,CLOSED FIXED,P3 normal
405304,change etfw message,CLOSED FIXED,P3 normal
405305,ui work lambdaexpression,RESOLVED FIXED,P3 normal
405306,constraints fail refresh ecore,CLOSED FIXED,P3 normal
405307,tag file display cannot errors open,RESOLVED FIXED,P3 normal
405308,lot spring srg test fail allow join transaction share entitymanager use spring transactions ejb cmt,CLOSED FIXED,P3 normal
405309,directory sometimes expand spirit,RESOLVED FIXED,P3 normal
405310,repository eclipse scout,VERIFIED FIXED,P3 normal
405311,test fail glassfish,CLOSED FIXED,P2 normal
405312,moxyjsonprovider issue,RESOLVED FIXED,P3 normal
405313,websocket client ssl hostname verification always default raw ip string,RESOLVED FIXED,P3 normal
405314,able override defaultbehavior implementation without configuration,VERIFIED FIXED,P3 normal
405315,provide way discover available image format,NEW,P3 enhancement
405316,replace,RESOLVED WONTFIX,P3 enhancement
405317,encapsulate field fail field reference via array loop variable,ASSIGNED,P3 normal
405318,copy difference end document insert new line ignore whitespace use,NEW,P3 normal
405319,unable draw table header label dataset,RESOLVED WORKSFORME,P3 normal
405320,intermittent failure jpa project creation start eclipse,VERIFIED FIXED,P3 major
405321,generatextendstub set workflow still generate validator main project proposal provider ui project xtend,CLOSED WORKSFORME,P3 normal
405322,able specify localhost system monitor,RESOLVED FIXED,P3 normal
405323,grid engine system monitor overview seem incorrect,CLOSED FIXED,P3 normal
405324,error message bugzilla version try create task without set require attribute,NEW,P3 normal
405325,git operations force mylyn context filter update,NEW,P3 normal
405326,view properly handle symlinks,CLOSED DUPLICATE of bug 484498,P3 major with 3 votes
405327,document style distro configuration,RESOLVED FIXED,P3 enhancement
405328,delete class require save change class,RESOLVED INVALID,P3 trivial
405329,work enable,CLOSED INVALID,P3 normal
405330,klingon language still,RESOLVED WONTFIX,P3 trivial
405331,need way customize behavior sourcelookuppanel,RESOLVED WONTFIX,P3 normal
405332,miss menu entries team context menu startup navigator view,NEW,P3 minor
405333,refactor enum members fail perform enum list,NEW,P3 major
405334,render svg image fail diagram,RESOLVED FIXED,P3 critical
405335,incorrect platform specification,VERIFIED WORKSFORME,P3 normal
405336,test error,NEW,P3 normal
405337,replace tika dependencies bundle work without manually clean osgi cache,CLOSED FIXED,P3 normal
405338,run command line many file cause arrayindexoutofboundsexception,CLOSED FIXED,P3 normal with 1 vote
405339,code style formatter add whitespace define,RESOLVED INVALID,P3 normal
405340,extra user permission add,RESOLVED INVALID,P3 normal
405341,click editor inside separate window transfer focus editor main window completely,CLOSED DUPLICATE of bug 402073,P3 normal
405342,command label menuitem set,RESOLVED FIXED,P3 normal
405343,automatically determine whether ecore must map,CLOSED FIXED,P3 enhancement
405344,use asyncexec stateful edit policies,RESOLVED FIXED,P3 normal
405345,memory,CLOSED FIXED,P3 normal
405346,unable enter slovenian keyboard,RESOLVED INVALID,P3 major
405347,problem char string,UNCONFIRMED,P3 normal
405348,platform incorrect implementation,NEW,P3 normal
405349,improve performance retain size calculation,RESOLVED FIXED,P3 enhancement
405350,npe update synchronize view,CLOSED DUPLICATE of bug 403827,P3 normal
405351,service configuration property page show config active allow set active config,RESOLVED FIXED,P3 normal
405352,servlet always override webservlet annotation,RESOLVED FIXED,P3 normal
405353,server server proxy,CLOSED FIXED,P3 enhancement
405354,swingscouttable instantiation,CLOSED FIXED,P3 enhancement
405355,support filter query parameter,NEW,P3 enhancement
405356,preference set x,NEW,P3 normal
405357,support expand query parameter,NEW,P3 enhancement
405358,hibernate map xml miss attribute idbag association,CLOSED INVALID,P3 normal
405359,npe,CLOSED DUPLICATE of bug 348429,P3 normal
405360,goal members tab miss menu options,CLOSED FIXED,P3 normal
405361,performance regressions,NEW,P2 normal
405362,binary data map class cause npe unmarshal,RESOLVED FIXED,P3 normal
405363,require miss,RESOLVED WORKSFORME,P3 normal
405364,implement,CLOSED FIXED,P3 normal
405365,support options http call,NEW,P3 enhancement
405366,fail jboss server,CLOSED FIXED,P3 normal
405367,method support null input,CLOSED FIXED,P3 minor
405368,increase memory usage birt,CLOSED DUPLICATE of bug 402243,P3 normal
405369,completion condition,CLOSED INVALID,P3 normal
405370,new jpa test fail derby db,RESOLVED FIXED,P3 normal
405371,celleditoractionhandler cause lose global handlers,RESOLVED INVALID,P3 normal
405372,provide synchronization method ensure consistency qvt source container definition file,NEW,P3 normal
405373,text blank wrap correctly linux,CLOSED INVALID,P3 normal
405374,load emf file come magicdraw,VERIFIED FIXED,P2 normal
405375,restore default work api use scan preference page,VERIFIED FIXED,P3 normal
405376,open input action info view disable input,RESOLVED FIXED,P4 minor
405377,test ddltestsuite fail glassfish,RESOLVED FIXED,P3 normal
405378,please add blog,RESOLVED FIXED,P3 normal
405379,try compartments lead illegalstateexception,RESOLVED FIXED,P3 normal
405380,enable gerrit project,RESOLVED FIXED,P3 normal
405381,resources maven filter work eclipse,CLOSED FIXED,P3 major
405382,testsimplegraph fail glassfish,CLOSED DUPLICATE of bug 402382,P3 normal
405383,imagepainter allow,CLOSED FIXED,P3 normal
405384,rm area layout,CLOSED FIXED,P3 normal
405385,update plexus compiler api,RESOLVED FIXED,P3 normal
405386,apply patch compare viewer action close viewer,NEW,P3 normal
405387,slave version miss indicate question mark,NEW,P3 normal
405388,application error cannot assign user name,CLOSED FIXED,P3 normal
405389,papyrus shall provide generic extendible framework execution debug model,NEW,P3 enhancement
405390,implement filter multicore visualizer display,RESOLVED FIXED,P3 normal
405391,moka shall provide implementation fuml execution model,NEW,P3 enhancement
405392,moka shall provide documentation,NEW,P3 enhancement
405393,moka shall provide user documentation,RESOLVED FIXED,P3 enhancement
405394,varargs mit dem block,CLOSED WONTFIX,P3 enhancement
405395,moka shall provide developper documentation,NEW,P3 enhancement
405396,brand locationtech,RESOLVED FIXED,P3 normal
405397,merge account,RESOLVED FIXED,P3 normal
405398,merge account,CLOSED FIXED,P3 normal
405399,include jpql metadata,CLOSED FIXED,P3 enhancement
405400,resourcepathcache abstractcdoview clear situations,CLOSED FIXED,P3 normal
405401,add ability run analysis workflow step local machine remote machine,NEW,P3 enhancement
405402,able write test case navigation history enable multipage editor,NEW,P3 normal
405403,optimize import outer inner aspect introduce field,NEW,P3 normal
405404,oslc performance monitor test suite contribution,CLOSED FIXED,P3 enhancement
405405,constructor confuse formatter,RESOLVED FIXED,P3 normal
405406,defaultcomparator return object type comparable,CLOSED FIXED,P3 normal
405407,groupbydatalayer create new treelist instance group,CLOSED FIXED,P3 normal
405408,bug inference datatype,CLOSED FIXED,P3 normal
405409,formatter get confuse preprocessor namespace,RESOLVED FIXED,P3 normal
405410,context menu available minimize share area,VERIFIED FIXED,P3 normal
405411,event context update,RESOLVED FIXED,P3 normal
405412,update file ti target clear ier register,CLOSED FIXED,P3 major
405413,nest modules handle ems,CLOSED FIXED,P3 normal
405414,hudson sandbox unavailable,RESOLVED FIXED,P3 normal
405415,create,CLOSED FIXED,P3 normal
405416,reference highlight appear leave return window,CLOSED DUPLICATE of bug 398509,P3 normal
405417,server data become stale purge branch,ASSIGNED,P3 normal
405418,glcanvas flicker repaint although style bite set,RESOLVED WORKSFORME,P3 major with 6 votes
405419,lml resource manager request unavailable perl script,RESOLVED FIXED,P3 normal
405420,double click,RESOLVED WORKSFORME,P3 normal
405421,selection change remove index,RESOLVED FIXED,P3 normal
405422,implement spec section new httpsessionidlistener class,RESOLVED FIXED,P3 normal
405423,npe,CLOSED FIXED,P3 normal
405424,implement recommendation section header,CLOSED FIXED,P3 normal
405425,code fold disruptions js editor comment use code,NEW,P3 normal
405426,miss,CLOSED FIXED,P3 normal
405427,version neutral system property configuration discovery catalog,RESOLVED FIXED,P3 normal
405428,check implementation section forward method handle async,RESOLVED WORKSFORME,P3 normal
405429,illegalstateexception miss garbage collector block complete,CLOSED INVALID,P3 major
405430,check implementation section error page default error page status,RESOLVED WORKSFORME,P3 normal
405431,check implementation section programmatic security,RESOLVED FIXED,P3 normal
405432,check implementation section httpmethodconstraint clarifications,RESOLVED FIXED,P3 normal
405433,partially apply,RESOLVED INVALID,P3 normal
405434,nullpointerexception,RESOLVED FIXED,P3 normal
405435,implement section redirect form auth,RESOLVED FIXED,P3 normal
405436,check implementation section combine security constraints,RESOLVED FIXED,P3 normal
405437,implement section uncover http methods,RESOLVED FIXED,P3 normal
405438,generation svnlocation elements default attribute value,UNCONFIRMED,P3 trivial
405439,extract fragment command reference,RESOLVED FIXED,P3 normal
405440,parameter set additional dependency resolution,RESOLVED FIXED,P3 enhancement
405441,keyboard help dialog inaccessible,RESOLVED FIXED,P3 normal
405442,new table must manage datatype edition,RESOLVED FIXED,P3 enhancement
405443,repository getreflogreader return reflogreader internal class prevent extension repository,RESOLVED FIXED,P3 major
405444,ui freeze connect two agents,RESOLVED INVALID,P3 normal
405445,add custom feature removal bend point,RESOLVED FIXED,P3 enhancement
405446,preprocessor include path data store outside project,RESOLVED INVALID,P3 normal
405447,add general feature removal bend point,ASSIGNED,P4 enhancement
405448,accessible object occupy many memory,RESOLVED FIXED,P3 major
405449,improve behaviour duplicate stream ids,CLOSED FIXED,P3 minor
405450,redundant call accessible class setfocus child control,REOPENED,P3 major
405451,ddlgenerations test fail due cast,CLOSED FIXED,P3 normal
405452,jenkins build posible maven repository seem error,CLOSED NOT_ECLIPSE,P3 critical
405453,accelerators stop work menu items,VERIFIED FIXED,P3 normal
405454,sms,CLOSED INVALID,P3 normal
405455,generate field getter method,ASSIGNED,P3 enhancement
405456,allow test disable job,VERIFIED FIXED,P3 normal
405457,dead link,RESOLVED FIXED,P3 minor
405458,array items,RESOLVED FIXED,P3 enhancement
405459,search full class name,VERIFIED WORKSFORME,P3 enhancement
405460,duplicate set model explorer button,RESOLVED FIXED,P3 normal
405461,pdf export report grid work correctly cell break across two page,NEW,P3 critical with 1 vote
405462,add parser edit properties stereotype type datatype,ASSIGNED,P3 enhancement
405463,wrong warn manage version override use test classifier,CLOSED DUPLICATE of bug 355882,P3 normal
405464,setup exclusion jacoco plugin,RESOLVED FIXED,P3 normal
405465,exception throw post object map use set,CLOSED FIXED,P2 normal
405466,diagramview button strange,RESOLVED DUPLICATE of bug 384954,P3 normal
405467,create sample work,RESOLVED FIXED,P3 normal
405468,need write jpa query metadata store well crud operations,RESOLVED FIXED,P3 normal
405469,create hudson job deploy,RESOLVED FIXED,P3 normal
405470,ability push merge commit eclipse scout repositories,CLOSED WORKSFORME,P3 normal
405471,incorrectly handle mmenu element contributions dynamicmenucontribution,VERIFIED FIXED,P3 normal
405472,content show correctly markup enable,RESOLVED FIXED,P3 enhancement
405473,retain scroll position instead scroll top,RESOLVED FIXED,P2 normal
405474,support custom json remoteobject operationhandler,RESOLVED FIXED,P3 enhancement
405475,eclipse ide use old icon taskbar favicon,NEW,P3 enhancement with 1 vote
405476,use new imavenexecutioncontext api,NEW,P3 enhancement
405477,test bug component,CLOSED INVALID,P3 trivial
405478,abstractsqlstyle bind bigdecimal character,CLOSED FIXED,P3 enhancement
405479,fail application servers,CLOSED FIXED,P3 normal
405480,background color inactive tab easy identify ubuntu system,CLOSED FIXED,P3 major
405481,create new job gerrit verify,RESOLVED FIXED,P3 normal
405482,allow textual serialization intent editor contain syntax errors,NEW,P3 enhancement
405483,cdolazycontentadapter problems,NEW,P3 normal
405484,request miss deltas repository,NEW,P3 enhancement with 1 vote
405485,npe cancel egf activity execution,RESOLVED FIXED,P3 normal
405486,c client library versioned,RESOLVED FIXED,P3 normal
405487,c client export symbols control compile linux,RESOLVED FIXED,P3 major
405488,duplicate toolbar items,CLOSED DUPLICATE of bug 402561,P3 normal
405489,bug delete old guest account prevent login,RESOLVED FIXED,P3 normal
405490,metadata comply,RESOLVED FIXED,P3 normal
405491,display deviceid log start agent,RESOLVED WORKSFORME,P3 normal
405492,seem work instal repository composite repository,CLOSED NOT_ECLIPSE,P3 normal
405493,time archive older release,VERIFIED FIXED,P3 normal
405494,add support know baseline change,NEW,P3 normal
405495,oslcdialog javadoc need specify use get post methods,NEW,P3 enhancement
405496,egit project set support kepler,RESOLVED INVALID,P3 normal
405497,add sample resources automation reference implementation,CLOSED FIXED,P3 enhancement
405498,error navigate file efs provider use local service config,RESOLVED FIXED,P3 normal
405499,product miss provider name,RESOLVED FIXED,P3 minor
405500,validation errors,RESOLVED FIXED,P3 normal
405501,deploy update server,RESOLVED FIXED,P3 normal
405502,flexible way define specify usage,ASSIGNED,P3 enhancement
405503,add client support architecture management rational design manager,CLOSED FIXED,P3 enhancement
405504,code review show blank patchset file box refresh button click,RESOLVED DUPLICATE of bug 404470,P3 normal
405505,delete remote file use api generate event,NEW,P3 normal
405506,exception gerrit note yet,RESOLVED WORKSFORME,P3 major
405507,add file path remotetoolsfilestore coreexception message,CLOSED FIXED,P3 normal
405508,convert choice map use xpath instead attributename,RESOLVED FIXED,P3 normal
405509,update copyright brand bundle,VERIFIED FIXED,P3 normal
405510,dynamic jaxb work callbacks,NEW,P3 normal
405511,cause deadlocks project build,RESOLVED FIXED,P3 critical
