id,title,status,importance
55163,parser spin,RESOLVED FIXED,P3 normal
55164,select editor dropdown give editor focus,RESOLVED FIXED,P3 normal
55165,table widget send events state change,RESOLVED WORKSFORME,P3 critical
55166,emf help exception launch help content,VERIFIED WORKSFORME,P3 normal
55167,need add progress support presentations,RESOLVED WONTFIX,P5 normal
55168,unable open text editor,RESOLVED FIXED,P3 normal
55169,hyades help exceptions launch help content,RESOLVED FIXED,P3 normal
55170,change font color fonts preference page cause view editors appear active,CLOSED FIXED,P3 normal
55171,npe runtolineadapter,VERIFIED FIXED,P3 normal
55172,view category miss category show,VERIFIED FIXED,P2 normal
55173,objmove elements never generate,CLOSED INVALID,P3 normal
55174,memory leak java editors,RESOLVED DUPLICATE of bug 53473,P3 major
55175,eclipse remove java package restart memory,RESOLVED WORKSFORME,P3 normal
55176,tab position configurable per tab group,RESOLVED INVALID,P3 enhancement
55177,navigator longer show view input text tooltip,RESOLVED FIXED,P2 normal
55178,cannot browse folder open file dialog,CLOSED DUPLICATE of bug 58730,P3 normal
55179,toggle breakpoint action key bind miss,VERIFIED FIXED,P3 normal
55180,bring back workbench toolbar icons,RESOLVED WONTFIX,P3 enhancement
55181,work text field accelerators,VERIFIED DUPLICATE of bug 55951,P3 normal
55182,shutdown take minute,RESOLVED FIXED,P3 major
55183,preference switch perspective suspend eager,VERIFIED FIXED,P3 normal
55184,pane refresh setselection,CLOSED FIXED,P3 normal
55185,listeners children nod,RESOLVED WONTFIX,P3 normal
55186,indexoutofbounds deadlockdetector subsequent lock,RESOLVED WORKSFORME,P3 major
55187,swt work gtk,RESOLVED FIXED,P3 normal
55188,class cast exception loaders,CLOSED FIXED,P3 critical
55189,assertion fail compare xml file,RESOLVED FIXED,P3 normal
55190,hideviewtest fail test,RESOLVED WORKSFORME,P3 normal
55191,provide way navigate node select correlation,CLOSED FIXED,P3 normal
55192,log interactions page info refresh page size change,CLOSED DUPLICATE of bug 54368,P3 normal
55193,revert file delete instruction,RESOLVED WONTFIX,P4 normal
55194,problems debugpreferencepage,VERIFIED FIXED,P3 normal
55195,bar pixel wide,RESOLVED DUPLICATE of bug 50359,P3 normal
55196,link resource name file name cause problems,NEW,P4 normal
55197,think bug griddata,RESOLVED WORKSFORME,P3 normal
55198,need click twice synchronize,RESOLVED WORKSFORME,P5 normal
55199,custom save perspectives lose cannot create new ones,VERIFIED FIXED,P3 critical
55200,context change editors right mouse button click,RESOLVED DUPLICATE of bug 19825,P3 normal
55201,click empty editor area close fast view,RESOLVED FIXED,P3 normal
55202,check number text field,RESOLVED WONTFIX,P4 minor
55203,convert local variable bad default field name,RESOLVED DUPLICATE of bug 54444,P3 normal
55204,prefs java code formatter preview incorrect,VERIFIED FIXED,P2 major
55205,need support manipulate document form non ui thread,NEW,P3 normal
55206,default property preferences lose,RESOLVED INVALID,P3 normal
55207,merge see delete stream change come,RESOLVED FIXED,P2 major
55208,terminate java process console run shutdownhandler,RESOLVED DUPLICATE of bug 38016,P3 normal
55209,ui form depend,RESOLVED FIXED,P3 normal
55210,pref page double mnemonic,CLOSED FIXED,P3 normal
55211,ui form miss tag new api class,RESOLVED FIXED,P3 normal
55212,concurrentmodificationexception,RESOLVED FIXED,P2 normal
55213,option fastviews hard find,RESOLVED FIXED,P1 normal
55214,colour red use identify change register value,RESOLVED DUPLICATE of bug 55297,P3 minor
55215,depend,RESOLVED FIXED,P3 normal
55216,generalize type tell generalization possible,NEW,P3 enhancement with 1 vote
55217,add option show sync view current perspective,RESOLVED INVALID,P3 normal
55218,pen users inadventently drag drop part,RESOLVED FIXED,P3 normal
55219,method rename refactorying problem overload methods,RESOLVED FIXED,P3 normal
55220,move log higher startup sequence,RESOLVED FIXED,P3 normal
55221,bug comment grab next javadoc,VERIFIED FIXED,P3 normal
55222,unwanted message appear shell raserver start import log file,CLOSED INVALID,P3 minor
55223,bug comment comment map statements,VERIFIED FIXED,P3 normal
55224,ability specify resources schedule,RESOLVED WORKSFORME,P3 enhancement
55225,log set button text truncate,CLOSED FIXED,P3 normal
55226,finish doc,CLOSED FIXED,P3 normal
55227,properties editor take input strange order,RESOLVED WORKSFORME,P3 major
55228,configurator filter faetures applicable current environment,RESOLVED FIXED,P3 normal
55229,property fire exception change sync view layout,RESOLVED WORKSFORME,P3 normal
55230,java package explorer second start,RESOLVED WORKSFORME,P3 normal
55231,adapt search new encode support,RESOLVED FIXED,P3 normal
55232,warn user end tag match tag disk,RESOLVED WONTFIX,P3 enhancement
55233,prompt switch team perspective,RESOLVED FIXED,P3 normal
55234,profile decoration property propagation,RESOLVED FIXED,P3 normal
55235,property propagation test,RESOLVED WORKSFORME,P3 normal
55236,please support platforms mac,RESOLVED WONTFIX,P3 enhancement with 13 votes
55237,fast view restore,RESOLVED WONTFIX,P3 normal
55238,property propagation work well hierarchical folders,RESOLVED WORKSFORME,P3 normal
55239,iperspectivefactory,RESOLVED WONTFIX,P3 enhancement
55240,split expressions operator precedence,RESOLVED WONTFIX,P3 normal
55241,create javadoc comment method insert tag,RESOLVED WORKSFORME,P3 normal
55242,npe shut eclipse,VERIFIED FIXED,P2 normal
55243,configure color theme active problematic,CLOSED FIXED,P3 normal
55244,parameter assist method creation,RESOLVED WONTFIX,P3 enhancement
55245,ctabfolder give available space tab early enough,RESOLVED FIXED,P3 normal
55246,workbench create,RESOLVED DUPLICATE of bug 51985,P3 normal
55247,work set support multiple selection,RESOLVED WORKSFORME,P3 enhancement
55248,miss javadoc comment ignore main method,RESOLVED WONTFIX,P3 normal
55249,radio button loose selection page disable,VERIFIED FIXED,P2 major
55250,miss thread events creation time currently create thread events absolute time,CLOSED FIXED,P3 major
55251,getcharset return default charset file exist,RESOLVED FIXED,P3 enhancement
55252,app launcher wait forever build complete,RESOLVED DUPLICATE of bug 58173,P3 normal
55253,appearance page show description text theme,VERIFIED FIXED,P3 normal
55254,delete log correlation update view accordingally,CLOSED FIXED,P3 normal
55255,eclipse crash gtk,VERIFIED WORKSFORME,P5 normal
55256,rollback change colorregistry color exist,CLOSED FIXED,P3 normal
55257,unreported compiler exception,CLOSED INVALID,P3 normal
55258,radio button loose selection page disable,RESOLVED DUPLICATE of bug 55249,P3 normal
55259,need fix initial presentation page,CLOSED FIXED,P3 major
55260,share acces configuration area,RESOLVED FIXED,P2 normal
55261,cbanner shrink properly,RESOLVED WORKSFORME,P3 normal
55262,enter text string need,CLOSED FIXED,P3 major
55263,classcastexception registry class,VERIFIED FIXED,P3 major
55264,code assist switch,RESOLVED INVALID,P3 minor
55265,review usage listener list,RESOLVED FIXED,P3 normal
55266,error message open profile log perspective,CLOSED INVALID,P3 normal
55267,error try read write keyring selfhosting,RESOLVED FIXED,P3 normal
55268,exception launch remote java application profile,CLOSED FIXED,P3 normal
55269,last editor hang onto editorworkbook saveaction,RESOLVED DUPLICATE of bug 53473,P2 major
55270,debug,RESOLVED WORKSFORME,P3 enhancement
55271,last editor hang onto editorpresentationsystemcontribution,RESOLVED DUPLICATE of bug 53473,P2 major
55272,editorpresentation hang onto preference listener,RESOLVED DUPLICATE of bug 53473,P2 major
55273,error markers resources,RESOLVED FIXED,P3 normal
55274,drag empty editor area,RESOLVED FIXED,P3 normal
55275,jface tableviewer pass wrong property cellmodifier,RESOLVED DUPLICATE of bug 55485,P4 normal
55276,provide support block properties merge,VERIFIED FIXED,P3 enhancement
55277,provide support block properties merge,RESOLVED DUPLICATE of bug 55276,P3 enhancement
55278,content assist bind still ui plugin,VERIFIED FIXED,P1 normal
55279,npe,RESOLVED DUPLICATE of bug 52619,P3 normal
55280,numberformatexception relate errors sync view startup,RESOLVED INVALID,P3 normal
55281,hover constant debug show value,VERIFIED FIXED,P3 normal
55282,eclipse crash browse class,RESOLVED WORKSFORME,P3 normal
55283,investigate move ant preference page use java classpath model,RESOLVED WONTFIX,P3 normal
55284,invalid thread access ftp upload,RESOLVED FIXED,P3 normal
55285,cvs progress percentage wrong,VERIFIED FIXED,P3 normal
55286,remove user scope,RESOLVED FIXED,P3 normal
55287,classpath issue,CLOSED WORKSFORME,P3 normal with 1 vote
55288,command understand error ftp,RESOLVED DUPLICATE of bug 22892,P3 normal
55289,sync incoming change,RESOLVED FIXED,P3 normal
55290,ccombo process arrow,RESOLVED WONTFIX,P3 enhancement
55291,change directory structure,RESOLVED FIXED,P3 normal
55292,mouse stop drag,RESOLVED DUPLICATE of bug 58575,P3 normal
55293,regression leak memory,RESOLVED DUPLICATE of bug 53473,P3 critical
55294,hyades example dialog,CLOSED DUPLICATE of bug 55373,P3 normal
55295,view menu show even items invisible,VERIFIED FIXED,P5 normal
55296,file transfer feature crash data collection engine,CLOSED FIXED,P3 major
55297,colour red use identify change variable value variables view,RESOLVED WONTFIX,P3 enhancement
55298,add action synchronize compare input toggle layout,RESOLVED FIXED,P2 major
55299,items appear error log pull focus,RESOLVED WORKSFORME,P3 major
55300,styledtext single border cause cheese resize,RESOLVED FIXED,P3 normal
55301,info run visible eclipse,CLOSED INVALID,P3 normal
55302,instance prefs use different dir structure,RESOLVED FIXED,P3 normal
55303,option override update unchanged file,RESOLVED WORKSFORME,P3 normal
55304,attach agent,CLOSED INVALID,P3 normal
55305,indicate start monitor attach agent,CLOSED FIXED,P3 normal
55306,incorrect schema,VERIFIED FIXED,P3 normal
55307,title area control one pixel,RESOLVED FIXED,P1 normal
55308,createguidecommand execute properly,RESOLVED FIXED,P3 normal
55309,retargetwatchpointaction hang onto last activate part,VERIFIED FIXED,P3 normal
55310,cannot launch profile local applications due incorrect classpath hyades,CLOSED FIXED,P3 major
55311,sync view dirs flatten,RESOLVED WORKSFORME,P3 normal
55312,ui display log agents use hyades data collection,CLOSED WORKSFORME,P3 major
55313,add mnemonic one launch config tabs builders,VERIFIED FIXED,P3 normal
55314,work,RESOLVED FIXED,P3 normal
55315,adaptor need notify framework shut,RESOLVED FIXED,P3 normal
55316,align eclipsestarter launcher,RESOLVED WONTFIX,P3 normal
55317,breakpoint associate marker,RESOLVED DUPLICATE of bug 54993,P3 normal
55318,finish button become enable,RESOLVED DUPLICATE of bug 43396,P3 normal
55319,cvs repository location cannot connect,CLOSED WORKSFORME,P3 normal
55320,statustexteditor show log status,ASSIGNED,P3 normal
55321,file close error,RESOLVED FIXED,P3 major
55322,view toolbars background color set part background,RESOLVED FIXED,P3 normal
55323,coolbar resize properly perspective bar manually resize,RESOLVED FIXED,P3 normal
55324,drag view right edge editor workbook allow detach,RESOLVED FIXED,P3 normal
55325,start javadoc comment insert tag next method,VERIFIED FIXED,P3 minor
55326,box local rename clean type outside box,RESOLVED FIXED,P2 normal
55327,perspective save list,RESOLVED DUPLICATE of bug 55199,P3 normal
55328,cannot cannot read apparently,CLOSED INVALID,P3 normal
55329,npe set property,RESOLVED FIXED,P3 major
55330,try launch notepad get jvm error,RESOLVED WORKSFORME,P3 normal
55331,map display null,RESOLVED DUPLICATE of bug 46835,P3 normal
55332,unbind,RESOLVED WORKSFORME,P3 normal
55333,binary compare editor show internal error compare incoming icon,RESOLVED WORKSFORME,P3 normal
55334,compare tool group always go new line toolbar,RESOLVED WORKSFORME,P3 normal
55335,fast view menu item miss fast view,RESOLVED FIXED,P1 major
55336,disable state new icons invisible,RESOLVED DUPLICATE of bug 53617,P2 major
55337,gla log unnecessary message invalid situation type,CLOSED FIXED,P3 normal
55338,would better cursor position,RESOLVED DUPLICATE of bug 53602,P3 normal
55339,operationcanceledexception throw,RESOLVED DUPLICATE of bug 55362,P3 normal
55340,documentation location selector show zip file,RESOLVED FIXED,P3 normal
55341,error type cannot convert,RESOLVED FIXED,P3 normal
55342,cannot create visual class eclipse,CLOSED WORKSFORME,P3 normal
55343,unsupported protocol,RESOLVED WORKSFORME,P3 normal
55344,show variables variables view,RESOLVED DUPLICATE of bug 28976,P3 enhancement
55345,property save trace page,RESOLVED DUPLICATE of bug 51921,P3 normal
55346,multipageeditor description text resource bundle key,RESOLVED FIXED,P3 normal
55347,surround qf corrupt code,RESOLVED FIXED,P3 normal
55348,npe,VERIFIED FIXED,P2 major
55349,delete key quick outline text box delete text editor,RESOLVED DUPLICATE of bug 54815,P3 normal
55350,cvs read check file,RESOLVED WORKSFORME,P3 normal
55351,link hover listener,NEW,P3 enhancement with 6 votes
55352,get source display text,RESOLVED DUPLICATE of bug 107142,P3 enhancement
55353,generate build script use preference set source target,RESOLVED FIXED,P3 enhancement
55354,inactivepartbackgroundend set,RESOLVED WONTFIX,P3 normal
55355,move new template extension point ant editor,VERIFIED FIXED,P3 normal
55356,templates format insert,RESOLVED WONTFIX,P3 normal
55357,templates appear content assist expect,VERIFIED FIXED,P3 normal
55358,create templates commonly use task,VERIFIED FIXED,P3 normal
55359,ejbjar task need include ant plugin,RESOLVED WONTFIX,P3 normal
55360,close editors fail splitted view,RESOLVED FIXED,P3 normal
55361,npe run ejbjar task jboss session bean,RESOLVED WONTFIX,P3 normal
55362,cause operationcanceledexception,RESOLVED FIXED,P3 major
55363,modify default logginglevel critical errors,CLOSED FIXED,P3 normal
55364,workspace launcher dialog mention create new workspaces,ASSIGNED,P3 normal
55365,compare cvs version copy need save request,RESOLVED WORKSFORME,P3 enhancement
55366,fastviews extend full workbench size,RESOLVED DUPLICATE of bug 55213,P3 normal
55367,need description return,CLOSED FIXED,P3 normal
55368,spawn job,CLOSED FIXED,P3 normal
55369,require one extra arrow,RESOLVED WONTFIX,P4 enhancement
55370,shell style problem,RESOLVED DUPLICATE of bug 37052,P3 normal
55371,infinite progress,VERIFIED FIXED,P3 normal
55372,assume return properties,VERIFIED FIXED,P3 normal
55373,examples wizard initially empty,CLOSED FIXED,P3 normal
55374,launch jdt test anymore,VERIFIED FIXED,P3 major
55375,extra space around javadoc html tag,RESOLVED DUPLICATE of bug 49686,P3 normal
55376,sync background update slightly optimistic,RESOLVED DUPLICATE of bug 55285,P3 normal
55377,manual test datapools descriptions new wizard,CLOSED FIXED,P3 normal
55378,npe jdidebuguiplugin,RESOLVED WORKSFORME,P3 minor
55379,ant target dialog render error,RESOLVED WORKSFORME,P3 normal
55380,issue windows multiple columns,RESOLVED WONTFIX,P3 normal
55381,directory appear package explorer,RESOLVED INVALID,P3 normal
55382,menuitem show error linux,RESOLVED FIXED,P3 normal
55383,share violation try set version feature manifest,RESOLVED FIXED,P3 normal
55384,debug relate activities,RESOLVED WONTFIX,P3 normal
55385,preferences lose exist workspace,RESOLVED FIXED,P1 normal
55386,ant run junit test require popup dialog dismiss,VERIFIED WORKSFORME,P3 major
55387,extension registry update,RESOLVED DUPLICATE of bug 55390,P3 normal
55388,npe pointselectionpage,RESOLVED FIXED,P3 normal
55389,preserve case option replace,RESOLVED DUPLICATE of bug 28949,P3 enhancement
55390,new class find startup,RESOLVED FIXED,P2 normal
55391,inactive part active part color color preference change,RESOLVED DUPLICATE of bug 55170,P3 normal
55392,critical gtk error,RESOLVED FIXED,P3 normal
55393,last,RESOLVED FIXED,P3 normal
55394,provide dialogs,ASSIGNED,P3 enhancement
55395,,RESOLVED DUPLICATE of bug 51730,P3 normal
55396,debugexception console,RESOLVED DUPLICATE of bug 54993,P3 normal
55397,exception switch synchronize perspective,RESOLVED DUPLICATE of bug 55657,P3 normal
55398,execution profile type attribute effect,CLOSED FIXED,P3 normal
55399,exception code style preference page,RESOLVED FIXED,P3 normal
55400,context variables view expressions view,VERIFIED FIXED,P3 normal
55401,assertionfailedexception tree expand synchronizeviewer,RESOLVED FIXED,P3 normal
55402,build data collection engine break platforms,CLOSED FIXED,P3 normal
55403,comment uncomment,RESOLVED WORKSFORME,P3 normal
55404,add browse button plugin class,RESOLVED FIXED,P3 enhancement
55405,problem optional enumerate type model,RESOLVED INVALID,P3 major
55406,combo box cell editor ignore first entry,CLOSED FIXED,P2 normal
55407,resourceexception open compare editor incoming change,RESOLVED FIXED,P3 normal
55408,label providers cache proxies locally wrong,CLOSED FIXED,P3 normal
55409,verify problem way ibm jdk sun jdk report events,CLOSED WONTFIX,P3 minor
55410,key valid char,RESOLVED FIXED,P3 normal
55411,delete project remove file reference file menu,RESOLVED WORKSFORME,P5 normal
55412,editor drop target small,RESOLVED FIXED,P3 normal
55413,effect,RESOLVED WORKSFORME,P3 normal
55414,delete config project delete,VERIFIED FIXED,P3 enhancement
55415,undefined behaviour multiple plugins use claim filename extension,RESOLVED DUPLICATE of bug 49594,P3 blocker
55416,garbage collection,RESOLVED WONTFIX,P3 normal
55417,workbenchlaunchconfigurationdelegate extend launchconfigurationdelegate,RESOLVED FIXED,P3 normal
55418,fix chkpii report errors,CLOSED FIXED,P3 normal
55419,generalize compilation error detection launchers,VERIFIED FIXED,P3 enhancement
55420,native method work correctly,CLOSED FIXED,P3 normal
55421,cannot save file project anymore,VERIFIED FIXED,P2 blocker
55422,conflict mark disappear project,RESOLVED FIXED,P3 minor
55423,schedule build already build,VERIFIED FIXED,P3 normal
55424,npe update wizard search result,RESOLVED FIXED,P3 normal
55425,incorrect write cascade case,RESOLVED FIXED,P3 normal
55426,issue launcher agent native code,CLOSED WONTFIX,P3 normal
55427,organize import error class extend protect inner class,RESOLVED DUPLICATE of bug 56704,P3 normal
55428,gla log level process need clean,CLOSED FIXED,P3 normal
55429,ant editor type slow due reconcile,VERIFIED FIXED,P3 normal
55430,migrate popup keybinding support new enabledsubmission api,VERIFIED FIXED,P2 normal
55431,npe shape class change,CLOSED FIXED,P3 critical
55432,hyades show twice help welcome,CLOSED INVALID,P3 normal
55433,enhance property file support,VERIFIED FIXED,P3 enhancement
55434,,RESOLVED DUPLICATE of bug 55285,P3 normal
55435,create template preference page,RESOLVED FIXED,P3 enhancement
55436,template additional proposal info work,VERIFIED FIXED,P3 normal
55437,show system menu keyboard shortcut break,RESOLVED FIXED,P3 normal
55438,help document show programmatically show toc,RESOLVED FIXED,P2 major
55439,erroneous report method undefined type comment,RESOLVED WORKSFORME,P3 normal
55440,reset perspective new arrival make welcome go away,CLOSED FIXED,P3 normal
55441,child creation support emaps,RESOLVED WORKSFORME,P3 enhancement
55442,classcastexception launchvieweventhandler,VERIFIED FIXED,P3 minor
55443,possible deadlock populate markers,RESOLVED WORKSFORME,P3 normal
55444,ignore many saxparseexceptions,RESOLVED DUPLICATE of bug 54723,P3 normal
55445,need get product name arbitrary language,RESOLVED WONTFIX,P3 enhancement
55446,superflous entries,RESOLVED DUPLICATE of bug 46576,P3 normal
55447,unable choose fonts,RESOLVED WONTFIX,P3 normal
55448,invalid url command line mode,RESOLVED FIXED,P3 normal
55449,leave shortcut toolbar miss new gtk,RESOLVED DUPLICATE of bug 50359,P3 normal with 1 vote
55450,redundant classpath entries,RESOLVED DUPLICATE of bug 51533,P3 normal
55451,assertion fail astprovider,VERIFIED FIXED,P3 blocker
55452,line indicate compare range,RESOLVED DUPLICATE of bug 28842,P3 normal
55453,classcastexception,VERIFIED FIXED,P3 major
55454,share project break,VERIFIED FIXED,P3 normal
55455,coolbars miss startup,VERIFIED FIXED,P2 major
55456,toolbar setbackground incorrect,RESOLVED FIXED,P3 normal
55457,alltypes cache thread block,RESOLVED DUPLICATE of bug 58173,P3 critical
55458,editor workbook need indicate inactive,CLOSED FIXED,P2 normal
55459,breakpoint hit line optimize compiler,NEW,P3 enhancement
55460,errors startup get lose,RESOLVED DUPLICATE of bug 51268,P3 normal
55461,migration eclipse,VERIFIED FIXED,P3 normal
55462,edatagraphimpl need implement writereplace serialize directly,VERIFIED FIXED,P3 normal
55463,performance improvements help speed sdo data accessors,VERIFIED FIXED,P3 normal
55464,cheat sheet aware user cancel action,RESOLVED FIXED,P3 critical
55465,cheat sheet require mechanism obtain return code last wizard dialog,RESOLVED WONTFIX,P3 major
55466,ability launch without splash,RESOLVED WORKSFORME,P3 normal
55467,resourcesplugin cannot resolve generate code,RESOLVED WORKSFORME,P3 minor
55468,setselection fire selectionlistener,RESOLVED WONTFIX,P3 major
55469,runtime workbench launcher expose boostrap entries,RESOLVED FIXED,P3 normal
55470,breakpoint associate marker,RESOLVED DUPLICATE of bug 54993,P3 normal
55471,cannot instantiate custom perspectives,RESOLVED DUPLICATE of bug 55199,P3 normal
55472,want able turn tool bar,RESOLVED FIXED,P4 normal
55473,regain view real estate,RESOLVED FIXED,P3 normal
55474,speed key work toolbar item enable,RESOLVED INVALID,P3 normal
55475,request icon editor,RESOLVED WONTFIX,P3 enhancement
55476,organize import find class start lowercase letter,RESOLVED WONTFIX,P3 normal
55477,default perspective get pick primary feature,RESOLVED FIXED,P3 major
55478,unused import report ide,VERIFIED FIXED,P3 normal
55479,multiple editpart selection,RESOLVED FIXED,P3 normal
55480,junit test result,RESOLVED DUPLICATE of bug 47815,P3 normal
55481,failure open cvs perspective,RESOLVED INVALID,P3 normal
55482,editor crash enter char,RESOLVED INVALID,P3 blocker
55483,cannot launch eclipse,RESOLVED WONTFIX,P3 critical
55484,display tab width preference ignore,RESOLVED WORKSFORME,P3 normal
55485,icellmodifier get wrong call modify method,RESOLVED DUPLICATE of bug 34819,P4 normal
55486,open proper system menu,VERIFIED FIXED,P1 critical
55487,list work show project,RESOLVED FIXED,P3 enhancement
55488,need better description purpose synchronize page,RESOLVED FIXED,P3 normal
55489,potential performance problem,RESOLVED FIXED,P2 normal
55490,nosuchmethoderror compare release,RESOLVED WORKSFORME,P3 normal
55491,build classpath order different debug classpath order,RESOLVED WORKSFORME,P3 normal
55492,bug outoforderlistener,VERIFIED FIXED,P2 normal
55493,commit change show progress,RESOLVED DUPLICATE of bug 55285,P3 normal
55494,description label editor render correctly,RESOLVED FIXED,P3 normal
55495,box underline text annotations hide underline character,ASSIGNED,P3 minor
55496,extract interface produce empty interface,RESOLVED WORKSFORME,P3 normal
55497,support task tag javacommentscanner,RESOLVED FIXED,P3 normal
55498,click editor tab longer drop list open editors,RESOLVED INVALID,P3 normal
55499,compiler warn build process javadoc,RESOLVED DUPLICATE of bug 55478,P3 minor
55500,detect toolbar,CLOSED DUPLICATE of bug 65679,P3 enhancement
55501,use palettetemplateentry without icons cause exception entry select,RESOLVED FIXED,P3 normal
55502,change method show error signature initial,RESOLVED FIXED,P3 normal
55503,exception delete method javadoc follow without linebreak,RESOLVED FIXED,P3 normal
55504,report,VERIFIED FIXED,P3 normal
55505,search reference tostring method return implicit reference,RESOLVED WONTFIX,P3 normal
55506,editor draw blue border even focus,RESOLVED DUPLICATE of bug 55458,P3 normal
55507,inconsitent paint,RESOLVED FIXED,P3 minor
55508,project exist cvs module loop,VERIFIED FIXED,P3 major
55509,call setsite,RESOLVED FIXED,P1 normal
55510,infinite recursion,RESOLVED FIXED,P3 normal
55511,mislead error message unable set value instance,NEW,P5 normal
55512,hierarchy toolbar button large,RESOLVED INVALID,P3 normal
55513,task tag work,VERIFIED FIXED,P3 minor
55514,apply patch fool sync view,RESOLVED INVALID,P3 normal
55515,choose compare menu message talk synch,RESOLVED FIXED,P3 normal
55516,classpaths set properly pde project load team project set,RESOLVED DUPLICATE of bug 60653,P3 critical
55517,remove dependency,RESOLVED FIXED,P3 normal
55518,make releng tool part regular build,RESOLVED FIXED,P3 normal
55519,illegal argument acception log view,RESOLVED FIXED,P3 major
55520,tag wrap line correctly,RESOLVED DUPLICATE of bug 51426,P3 normal
55521,showbusycursorwhile reset cursor,RESOLVED INVALID,P3 normal
55522,mouse button,RESOLVED FIXED,P3 normal
55523,editors preference page odd space,RESOLVED WORKSFORME,P4 normal
55524,compare two remote file directly open compare editor,RESOLVED WONTFIX,P3 normal
55525,send mouse mousemove,RESOLVED FIXED,P3 normal
55526,assertionfailedexception new project wizard,CLOSED FIXED,P3 normal
55527,contain code,RESOLVED FIXED,P3 normal
55528,contain call,RESOLVED FIXED,P3 normal
55529,javadoccompletionevaluator contain call,RESOLVED FIXED,P3 normal
55530,bad accelerator text shortcuts,VERIFIED DUPLICATE of bug 53918,P3 normal
55531,single click mode open collapse,RESOLVED FIXED,P2 major
55532,junitaddlibraryproposal contain call,RESOLVED FIXED,P3 normal
