id,title,status,importance
384831,check mark show review review item,NEW,P5 trivial
384832,implement new text widget base,ASSIGNED,P3 enhancement
384833,exception delete project,NEW,P3 normal
384834,tag also match subclasses,RESOLVED FIXED,P3 normal
384835,fix make,RESOLVED FIXED,P3 critical
384836,ctf trace context clone problem cause incorrect seek time stamp,CLOSED FIXED,P3 normal
384837,overflow exception throw function parm type float pass int,RESOLVED FIXED,P3 normal
384838,file compatible latest css editor,RESOLVED WONTFIX,P3 normal
384839,implicit asexpression miss array assignment,CLOSED DUPLICATE of bug 395181,P3 normal
384840,open email client ubuntu,RESOLVED WORKSFORME,P3 normal
384841,part tab folder clip chevron dropdown,CLOSED DUPLICATE of bug 383684,P3 normal
384842,jpa test fail linux due class load issue,RESOLVED FIXED,P3 normal
384843,provide generic render framework make easier implement render engines ui toolkits,RESOLVED WONTFIX,P3 enhancement
384844,add current time variable resolver,RESOLVED FIXED,P3 enhancement
384845,new hudson job osee,RESOLVED FIXED,P3 normal
384846,internal error generate access size method sequence choosemany,CLOSED FIXED,P3 normal
384847,crossoriginfilter work,RESOLVED FIXED,P3 normal
384848,aspectj apply multiple time,NEW,P3 major
384849,report sql data set quick designer way slow,NEW,P3 critical
384850,possible string,RESOLVED FIXED,P3 normal
384851,top right control destroy border last ctabitem,NEW,P3 critical with 3 votes
384852,criteria api fetch work unidirectional onetomany relationship,CLOSED DUPLICATE of bug 367452,P2 major
384853,support define infix operations,NEW,P3 enhancement
384854,support templated contexts,NEW,P3 enhancement
384855,nullpointerexception nve throw foreach statement item set null,CLOSED FIXED,P3 normal
384856,nullvalueexception throw foreach statement item set null,CLOSED FIXED,P3 normal
384857,allow specification pattern list support type widget,NEW,P3 enhancement
384858,log categories support jpa platform,NEW,P3 enhancement
384859,moxyjsonprovider wrong domain class return type,RESOLVED FIXED,P3 normal
384860,plugin version use,RESOLVED FIXED,P3 normal
384861,editor markers persist builder disable,CLOSED FIXED,P3 normal
384862,convert platform debug trace,NEW,P3 enhancement
384863,unsigned birt chart framework feature plugin custom update site,CLOSED WORKSFORME,P3 normal with 1 vote
384864,able install jibx eclipse juno,VERIFIED INVALID,P3 major
384865,eclipse juno crash click help icon close help window,RESOLVED WORKSFORME,P3 critical
384866,time window java client keepalive handle,CLOSED FIXED,P3 normal
384867,move wtp common project git,RESOLVED FIXED,P3 normal
384868,refresh folder file outside rse properly refresh file,NEW,P3 minor
384869,moxyjsonprovider wrong domain class return,RESOLVED FIXED,P3 normal
384870,annotation detect precede annotation,VERIFIED FIXED,P3 normal
384871,incorrect,VERIFIED FIXED,P3 normal
384872,convert platform debug trace,NEW,P3 enhancement
384873,miss,RESOLVED FIXED,P3 normal
384874,cbi swt build deliver strange artifacts,RESOLVED FIXED,P3 blocker
384875,java debug restore default could reset sub categories,RESOLVED FIXED,P3 normal
384876,avoid open pde editors react every file change,RESOLVED WONTFIX,P3 normal
384877,create synchronize,CLOSED INVALID,P3 major
384878,multiple trace import fail trace similar name,CLOSED FIXED,P3 normal
384879,dojomobilelistitem format change add children,RESOLVED FIXED,P3 normal
384880,order event handlers important reuse editor elsewhere enforce,CLOSED DUPLICATE of bug 341141,P3 normal
384881,unexpected error task submission,RESOLVED WORKSFORME,P3 normal
384882,event handle order mean cannot use textview without projectiontextmodel want annotations,RESOLVED FIXED,P3 normal
384883,slow switch file log show,CLOSED DUPLICATE of bug 384916,P3 major
384884,swt support consistently support vertical scale vertical toolbars,NEW,P3 normal
384885,headless miss option import copy project specify workspace,NEW,P3 minor
384886,require client call,RESOLVED FIXED,P3 normal
384887,fail line delimiter segmentschar,RESOLVED FIXED,P3 normal
384888,command line hard read process properties page,RESOLVED FIXED,P3 enhancement
384889,closure define field annotation,CLOSED DUPLICATE of bug 393561,P3 normal
384890,add doc new variable,RESOLVED WONTFIX,P3 normal
384891,update doc extra process attribute update property page,ASSIGNED,P3 normal
384892,build jee web project fail,RESOLVED DUPLICATE of bug 380254,P3 major
384893,eclipse constantly open error popups,CLOSED FIXED,P3 major
384894,delete diagram file common file delete editor remain open,NEW,P3 normal
384895,need integrate environment management paths symbols,NEW,P3 normal
384896,jdbcsessionmanager fail load exist sessions oracle contextpath,RESOLVED FIXED,P3 normal
384897,item add default menu,RESOLVED WORKSFORME,P3 normal
384898,normalization character cannot use path variable path,NEW,P3 normal
384899,,RESOLVED WORKSFORME,P3 normal
384900,rebind,CLOSED WORKSFORME,P3 normal
384901,new method setactivestepinternal allow wizard implementations set active step,CLOSED FIXED,P3 enhancement
384902,,RESOLVED NOT_ECLIPSE,P3 normal
384903,bundle import bundle,CLOSED WORKSFORME,P3 minor
384904,cursor jump next line element unfold automatically,CLOSED DUPLICATE of bug 104373,P3 normal
384905,import package resolve,NEW,P3 normal
384906,allow style table headers swt,VERIFIED FIXED,P3 normal with 2 votes
384907,full support css style swt,CLOSED DUPLICATE of bug 260408,P3 normal
384908,cannot copy paste keyboard,RESOLVED WORKSFORME,P3 normal
384909,build fail due outdated dependencies,CLOSED INVALID,P3 normal
384910,synchronize connection understand neither symlinks hardlinks,CLOSED FIXED,P3 major
384911,call get null,CLOSED NOT_ECLIPSE,P3 normal
384912,get instance iproject lexer,CLOSED WONTFIX,P3 enhancement
384913,daterangechanged fire dependent combo set,CLOSED WONTFIX,P3 normal
384914,slow close dialogs,CLOSED DUPLICATE of bug 390379,P3 critical with 1 vote
384915,improve lua project file wizards,RESOLVED FIXED,P3 normal
384916,switch tabs slow,CLOSED FIXED,P3 major with 5 votes
384917,consider crash client requestcounter miss protocol message,CLOSED WONTFIX,P3 enhancement
384918,show content folders,RESOLVED FIXED,P3 enhancement
384919,json problem represent numeric type field annotate,RESOLVED FIXED,P3 normal
384920,ability ban secondary type,NEW,P3 enhancement
384921,api change equinox break access,CLOSED FIXED,P3 major
384922,assign parameter field create field,RESOLVED INVALID,P3 normal
384923,scrollbars sometimes miss create nattable freezelayer,CLOSED FIXED,P3 normal
384924,support css style nattable,CLOSED FIXED,P3 enhancement
384925,birt report parameter fail exception place sql clause,VERIFIED FIXED,P3 major with 2 votes
384926,editor egit history view break,CLOSED DUPLICATE of bug 384068,P3 normal
384927,titledborder default color get replace color edit,ASSIGNED,P3 minor
384928,cce expressioncontentprovider inspect treemap show logical structure,RESOLVED FIXED,P3 major
384929,js throw nullvalueexception boolean xor,CLOSED FIXED,P3 normal
384930,cce,RESOLVED FIXED,P3 normal
384931,test rt guiscriptjob return,CLOSED FIXED,P3 normal
384932,better support custom encode lua editor,RESOLVED FIXED,P3 normal
384933,clean lua preference page break preferences,RESOLVED FIXED,P3 normal
384934,provide code cleanups save,UNCONFIRMED,P3 enhancement with 3 votes
384935,standard profile cannot apply,RESOLVED FIXED,P3 major
384936,consider change git repository page layout,RESOLVED FIXED,P3 normal
384937,state cannot delete properly stereotype apply,RESOLVED FIXED,P3 critical
384938,remove bundle time,NEW,P3 minor
384939,autocrlf settings may cause junit ui case fail,RESOLVED FIXED,P3 enhancement
384940,error dialog appear diagram use xtext editors,RESOLVED FIXED,P3 major
384941,unknown modelelements xmi file,CLOSED WONTFIX,P3 normal
384942,fail execute runnable workbench close logview open,NEW,P3 normal
384943,different buggy error dialog dataset preview,RESOLVED WORKSFORME,P3 normal
384944,editor gutter area liney,RESOLVED FIXED,P3 normal
384945,file name case sensitive sometimes,RESOLVED WONTFIX,P3 minor
384946,test rt support drag window border windows,CLOSED FIXED,P3 normal
384947,papyrus model give uml model lead npe,CLOSED FIXED,P3 major
384948,,CLOSED INVALID,P3 normal
384949,file exclusively lock get internal,NEW,P2 critical with 1 vote
384950,windows open file via already run window bring front,CLOSED FIXED,P3 major
384951,time function throw nullpointerexception,CLOSED FIXED,P3 normal
384952,unable omit keyword closure square bracket,CLOSED FIXED,P3 normal
384953,time function throw nullvalueexception,CLOSED FIXED,P3 normal
384954,incorrect behavior button,RESOLVED FIXED,P3 normal
384955,show content git dynamic way,RESOLVED FIXED,P3 normal
384956,juno crash immediataly result previously fedora crash another error update,CLOSED FIXED,P3 critical
384957,eclipse start,NEW,P3 normal with 1 vote
384958,cbi build eclipse scout runtime,CLOSED FIXED,P3 major
384959,add line wrap options generics,VERIFIED FIXED,P3 enhancement with 6 votes
384960,migrate eclipse scout svn git,CLOSED FIXED,P3 enhancement
384961,selection event table reveal selection trigger mouse keyboard,RESOLVED FIXED,P3 enhancement
384962,annotationbasedcommandresolvertests fail java,CLOSED FIXED,P3 normal
384963,run server wizard button,RESOLVED FIXED,P3 minor
384964,papyrus forbid background statemachine move,RESOLVED FIXED,P3 critical
384965,stack view hang window,VERIFIED FIXED,P3 normal
384966,base text direction control gef label,NEW,P3 normal
384967,cannot move editors windows,CLOSED DUPLICATE of bug 384308,P3 major
384968,need create form footer,CLOSED FIXED,P3 enhancement
384969,ptp encounter outofmemory,CLOSED WONTFIX,P3 normal
384970,nullpointerexception,CLOSED DUPLICATE of bug 343130,P3 normal
384971,select decorator property one map view change decorator property active map view,RESOLVED FIXED,P3 normal
384972,support long string,RESOLVED FIXED,P3 normal
384973,rg,CLOSED INVALID,P3 trivial
384974,consider explicit argument test run,NEW,P3 enhancement
384975,moxyjsonprovider valuewrapper never set null,RESOLVED FIXED,P3 normal
384976,set valuewrapper property null,RESOLVED FIXED,P3 normal
384977,confuse semantics histogram view,CLOSED FIXED,P3 normal
384978,unable control job launch via ptp,RESOLVED FIXED,P3 normal
384979,view display break multihead machine,NEW,P3 normal
384980,jetty client unable recover time out connection count per address hit max,CLOSED DUPLICATE of bug 382174,P3 major
384981,error open workspace perspective,CLOSED WONTFIX,P3 normal
384982,fail set current ts beyond last histogram view,CLOSED FIXED,P3 normal
384983,event view ctf trace respect base attribute integer datatypes,CLOSED FIXED,P3 enhancement
384984,sort record chronologically,RESOLVED FIXED,P3 enhancement
384985,open select record associate view,NEW,P3 enhancement
384986,repositories view must reveal elements,VERIFIED FIXED,P3 major
384987,empty path,CLOSED DUPLICATE of bug 378948,P3 normal
384988,static nest class import unqualified lead name clash,CLOSED FIXED,P3 normal
384989,enable fold comment,RESOLVED FIXED,P3 normal
384990,git migration request migrate wtp jsf tool project,RESOLVED FIXED,P3 normal
384991,adopt merge implementation java branch,RESOLVED FIXED,P3 enhancement
384992,adopt grammar change java,RESOLVED FIXED,P3 enhancement
384993,shortcuts work,RESOLVED FIXED,P3 normal
384994,remove fragment,VERIFIED FIXED,P3 normal
384995,better separate test build,RESOLVED WONTFIX,P3 normal
384996,live validation work extlibrary model editor,CLOSED INVALID,P3 normal
384997,workbenchmenuservice,CLOSED DUPLICATE of bug 366528,P3 major
384998,default folder import local repo repository set git prefs,NEW,P3 trivial
384999,history view initially populate,CLOSED DUPLICATE of bug 387276,P3 trivial
385000,apply arrow key inside abstractsvgfield move svg graphic swing,CLOSED WONTFIX,P3 trivial
385001,offer delete action file work directory,RESOLVED FIXED,P3 enhancement
385002,history checkout remote track branch point commit currently check branch,RESOLVED FIXED,P3 trivial
385003,provide set icons alpha transparency dark theme platform icons,VERIFIED FIXED,P3 enhancement with 1 vote
385004,stag check refresh wheather untracked file git ignore meantime,CLOSED INVALID,P3 minor
385005,define column label prefix constant,CLOSED FIXED,P3 minor
385006,numericoverflowexception throw assign type decimal type variable,CLOSED FIXED,P3 normal
385007,toolbar button appear larger,CLOSED INVALID,P3 normal
385008,miss jsp components eclipse juno,RESOLVED FIXED,P3 normal
385009,run alternate reconnaissance mode could add,RESOLVED FIXED,P3 enhancement
385010,cbi build consume native filesystem,RESOLVED FIXED,P3 major
385011,crash startup gdipdeletefont,NEW,P3 normal
385012,review navigator modularization,CLOSED FIXED,P3 normal
385013,review editor modularization,CLOSED FIXED,P3 normal
385014,wrong number format color editor,RESOLVED FIXED,P3 normal
385015,easily adjust size color ui element,NEW,P3 enhancement
385016,import content interactionuse,ASSIGNED,P3 enhancement
385017,evaluate ecp,CLOSED WONTFIX,P3 normal
385018,release,CLOSED FIXED,P3 normal
385019,format file first line,RESOLVED FIXED,P3 normal
385020,notify commiters,CLOSED FIXED,P3 normal
385021,,RESOLVED NOT_ECLIPSE,P3 normal
385022,,RESOLVED NOT_ECLIPSE,P3 normal
385023,dynamic interaction creation interactionuse,NEW,P3 enhancement
385024,interactionuse navigation,RESOLVED FIXED,P3 normal
385025,mylyn intent brand issue,CLOSED FIXED,P3 enhancement
385026,eunit test pass instead bad status,CLOSED DUPLICATE of bug 394001,P3 normal
385027,switch build,CLOSED FIXED,P3 normal
385028,java ee package say require jre,CLOSED FIXED,P3 normal
385029,jump technical component name ome directly test result view,CLOSED WONTFIX,P3 enhancement
385030,build consume network native part,RESOLVED FIXED,P3 major
385031,tablecolumnlayout break resize behavior tabbed property section,NEW,P3 normal
385032,eclipse download page incomplete,RESOLVED WORKSFORME,P3 major
385033,use jface work osgi framework equinox,RESOLVED FIXED,P3 normal with 1 vote
385034,update svn kit,RESOLVED FIXED,P3 normal
385035,eclipse ide crash click one help menu items,RESOLVED DUPLICATE of bug 410739,P3 normal
385036,editingsupport gettcelleditor get wrong element table tableviewer long,RESOLVED DUPLICATE of bug 384589,P3 normal
385037,showviewdialog enable environment,VERIFIED FIXED,P3 normal
385038,update javahl,RESOLVED FIXED,P3 normal
385039,proxy resolution side effect cause econtentadapter adapt resource twice,CLOSED FIXED,P3 normal
385040,code formater preprocessor indentation support,NEW,P3 enhancement
385041,issue post code review verification,RESOLVED FIXED,P3 enhancement
385042,semantic highlight go one character far,RESOLVED FIXED,P3 normal
385043,problem emf gmf eclipse juno,CLOSED DUPLICATE of bug 390022,P3 blocker
385044,select element longer available jsp editor,RESOLVED WORKSFORME,P3 normal
385045,last edit location wrong,RESOLVED WORKSFORME,P3 minor
385046,abstracttableinformationcontrol usage,VERIFIED FIXED,P3 normal
385047,gnomeproxy cannot build latest versions glib,VERIFIED FIXED,P3 major
385048,classic theme point empty file,RESOLVED WORKSFORME,P3 normal
385049,null check right set null,CLOSED FIXED,P3 normal
385050,compare project different package,NEW,P3 minor
385051,toolbar lock response,CLOSED DUPLICATE of bug 375734,P3 normal
385052,joint dataset create columns use join cannot modify anymore,RESOLVED FIXED,P3 major
385053,tabs color pick operate system,NEW,P3 normal
385054,eunit test case issue,RESOLVED FIXED,P3 normal
385055,time graph selection prevent trace garbage collection,CLOSED FIXED,P3 normal
385056,operator handle properly,RESOLVED FIXED,P3 normal
385057,cannot get parent identifier undefined,CLOSED FIXED,P3 normal
385058,arrayindexoutofboundsexception,NEW,P3 normal
385059,fail need import nest class another project,CLOSED DUPLICATE of bug 473921,P3 normal
385060,validation error invoke overload method define default supertype,RESOLVED FIXED,P3 normal
385061,swtbottreeitem foregroundcolor backgroundcolor methods work,RESOLVED FIXED,P3 normal
385062,move wtp ejb tool project git,RESOLVED FIXED,P3 normal
385063,support delete key model elements,RESOLVED FIXED,P3 normal
385064,dbws test change require facilitate new blob test,CLOSED FIXED,P3 normal
385065,work withall implementations soap,RESOLVED FIXED,P3 normal
385066,remove unused function,RESOLVED FIXED,P3 normal
385067,memory function remove prjoect space memory,CLOSED FIXED,P3 normal
385068,could load repository template extension contribute connectorkind bugzilla error mobile package,RESOLVED FIXED,P3 minor
385069,use instead,RESOLVED FIXED,P3 normal
385070,use instead deprecate,RESOLVED FIXED,P3 normal
385071,help window cannot close,NEW,P3 normal
385072,problems occur invoke code,CLOSED NOT_ECLIPSE,P3 normal
385073,debug view refuse minimize,CLOSED DUPLICATE of bug 391808,P3 normal
385074,launch java,CLOSED WORKSFORME,P3 normal
385075,git test bug,RESOLVED FIXED,P3 normal
385076,convert platform debug trace,NEW,P3 enhancement
385077,export plugins longer work mac os x,CLOSED DUPLICATE of bug 392434,P3 major with 1 vote
385078,keyboard shortcut popup swallow key keybinding,CLOSED DUPLICATE of bug 369860,P3 normal
385079,toolbars composites miss,NEW,P3 normal
385080,core change support lyo query library,CLOSED FIXED,P3 enhancement
385081,simplify improve,NEW,P3 normal
385082,photran help menu need update eclipse platform ptp fortran support,NEW,P3 normal
385083,part menu show part add items,RESOLVED FIXED,P3 normal
385084,openmp artifact identification respect openmp artifacts prefix,RESOLVED FIXED,P3 normal
385085,convert platform debug trace,NEW,P3 enhancement
385086,error switch branch restructure,NEW,P3 normal
385087,juno base build internal could determine swt implementation fragment bundle,CLOSED INVALID,P3 minor
385088,eclipse close soon workbench load,RESOLVED FIXED,P3 critical
385089,activate task restore task editor,RESOLVED FIXED,P3 enhancement
385090,keep get ui errors state could render,CLOSED DUPLICATE of bug 398186,P3 normal
385091,data grid tooltip raise exception,RESOLVED FIXED,P3 normal
385092,file open editor still report errors fix replacement,CLOSED WORKSFORME,P3 minor
385093,luadocumentor comment,RESOLVED FIXED,P3 normal
385094,edit via ant cause false errors,RESOLVED WORKSFORME,P3 normal
385095,editor drag snap layout,NEW,P3 major with 4 votes
385096,stack overflow resolve name index modify local resource,CLOSED FIXED,P3 normal
385097,datastore spirit mechanism enable,RESOLVED FIXED,P3 normal
385098,cause,CLOSED INVALID,P3 normal
385099,administration right gef bugzilla,RESOLVED FIXED,P3 major
385100,trace options tree keyboard accessible,RESOLVED FIXED,P3 normal
385101,wrong visibility implement methods annotate interface,CLOSED DUPLICATE of bug 387940,P3 minor
385102,errors export war accessible,CLOSED FIXED,P3 normal
385103,palette draw wrong position,CLOSED DUPLICATE of bug 368543,P3 normal
385104,smarter name argument list instead,RESOLVED WORKSFORME,P3 enhancement
385105,restore original fast view ui behavior,RESOLVED WONTFIX,P3 normal with 8 votes
385106,copy code javascript file cause hang event loop,RESOLVED WORKSFORME,P3 critical
385107,launch configuration docsconnectionpropshelper reference project,RESOLVED INVALID,P3 normal
385108,build cancel block save,CLOSED DUPLICATE of bug 329657,P3 enhancement
385109,generate method use instead,CLOSED DUPLICATE of bug 304176,P3 normal
385110,codan generate false positive could,RESOLVED WORKSFORME,P3 normal
385111,compiler fail flag undefined annotation,RESOLVED FIXED,P3 enhancement
385112,npe check bundle fragment,CLOSED FIXED,P3 normal
385113,bad xml format,NEW,P3 normal
385114,  ,CLOSED INVALID,P3 normal
385115,  ,CLOSED INVALID,P3 normal
385116,sometimes paste open nowhere,CLOSED DUPLICATE of bug 384665,P3 normal
385117,pde unstable product corrupt project,RESOLVED WORKSFORME,P3 major
385118,findnodefor hit leafnodewithsyntaxerror throw npe,CLOSED DUPLICATE of bug 385636,P3 major
385119,lightweight decorator replace quadrant work,NEW,P3 normal with 1 vote
385120,incorrect complete argument lambda function,NEW,P3 major
385121,sometimes label package explorer disappear focus around open,NEW,P3 normal
385122,refactoring java editor temporarily blur text retina display,ASSIGNED,P3 normal with 3 votes
385123,register context cause npe menu show,CLOSED DUPLICATE of bug 390921,P3 major
385124,xtext interoperability custom nsuris,CLOSED FIXED,P3 normal
385125,always return true,RESOLVED FIXED,P3 normal
385126,child scheme bind override parent bind,CLOSED DUPLICATE of bug 387728,P3 normal
385127,define spi activity providers,RESOLVED FIXED,P3 enhancement
385128,nothing,VERIFIED FIXED,P3 normal
385129,startup,CLOSED DUPLICATE of bug 393612,P3 normal
385130,provide basic syntax highlight markdown luadocumentor comment,REOPENED,P4 enhancement
385131,java generator create parameter message send use replicate port,CLOSED FIXED,P3 normal
385132,syntax error say shouls say,RESOLVED FIXED,P3 normal
385133,rcp application support problems,NEW,P3 normal
385134,investigate apt change support jsr,RESOLVED FIXED,P3 enhancement
385135,extend class protect zero,CLOSED FIXED,P3 normal
385136,includable gzipfilter break,CLOSED FIXED,P3 normal
385137,type annotations must allow static member,RESOLVED FIXED,P3 enhancement
385138,mbean getter setters find class,CLOSED FIXED,P3 normal
385139,,CLOSED INVALID,P3 normal
385140,improve wizard zend studio,CLOSED FIXED,P3 normal
385141,bind conflict,CLOSED FIXED,P3 normal
385142,work,CLOSED DUPLICATE of bug 355294,P3 normal
385143,snapstagtests fail java,CLOSED FIXED,P3 normal
385144,invalid redefinition enum report enum use first parameter constructor,RESOLVED FIXED,P3 normal with 3 votes
385145,communicationexception jira connector,RESOLVED NOT_ECLIPSE,P3 major
385146,allow transformation web bundle,CLOSED FIXED,P3 enhancement
385147,workspace relative path feature support external project,CLOSED FIXED,P3 normal
385148,file visible php explorer,CLOSED FIXED,P3 normal
385149,concurrentmodificationexception registry,CLOSED DUPLICATE of bug 276701,P3 normal
385150,cannot open resource rtc sourcecontrol,CLOSED FIXED,P3 normal
385151,new launch configuration create project,RESOLVED WORKSFORME,P3 minor
385152,war deployer release hold deploy war pickup,CLOSED FIXED,P3 normal
385153,deployer release hold deploy jar pickup,CLOSED FIXED,P3 normal
385154,jdt core need way produce ecj jar tycho build,VERIFIED FIXED,P3 major
385155,war deployer incorrectly update war,CLOSED FIXED,P3 normal
385156,internal compiler,REOPENED,P3 major
385157,papyrus css theme,CLOSED FIXED,P3 enhancement
385158,array initializers indentation honour indentation settings,RESOLVED WORKSFORME,P3 normal
385159,feedback newsgroup,CLOSED FIXED,P3 normal
385160,command fail generate error string command fail,RESOLVED FIXED,P3 normal
385161,shutdownclienttests fail java security rmi class loader,CLOSED INVALID,P3 normal
385162,error save project different name empty,CLOSED DUPLICATE of bug 378819,P3 major
385163,override,CLOSED WORKSFORME,P3 normal
385164,miss data converter,CLOSED FIXED,P3 enhancement
385165,custom theme problem lightweight osgi setup rap,RESOLVED INVALID,P3 normal
385166,support pickup folder default web application,CLOSED FIXED,P3 enhancement
385167,store persistent settings file system,RESOLVED INVALID,P3 normal
385168,widget dispose open cell editor,CLOSED FIXED,P3 normal
385169,javascript proposals work android project,NEW,P3 major
385170,property unusable override gemini class loader,RESOLVED FIXED,P3 normal
385171,glazedlistssortmodel update structuralrefreshcommand,CLOSED FIXED,P3 normal
385172,enable gerrit lyo repo,RESOLVED FIXED,P3 normal
385173,cannot initiate save modify content common navigator property view,NEW,P3 normal
385174,uml typesystem produce find operation,CLOSED FIXED,P3 major
385175,suppress js validation warn like pmd,NEW,P3 enhancement
385176,os npe,NEW,P3 critical
385177,quasiframeworkintegrationtests fail java,CLOSED FIXED,P3 normal
385178,allow ignore untracked file stag view,RESOLVED FIXED,P3 enhancement
385179,loop,RESOLVED INVALID,P3 major
385180,ajdt uimessagehandler may throw npe,RESOLVED FIXED,P3 normal
385181,bdl wrong structure text library editor,CLOSED DUPLICATE of bug 131711,P3 normal
385182,android xml file,RESOLVED NOT_ECLIPSE,P3 normal
385183,create attribute operations class diagram,NEW,P3 enhancement
385184,add comment properties view,RESOLVED FIXED,P3 enhancement
385185,decrease index build time use options,RESOLVED FIXED,P3 enhancement
385186,improve index reusability memory fingerprint,NEW,P3 enhancement
385187,users bundle complicate,RESOLVED FIXED,P3 normal
385188,need able disable,CLOSED FIXED,P2 normal
385189,syntax highlight issue sentence,VERIFIED FIXED,P3 normal
385190,introduce constructor without parameters pattern,VERIFIED FIXED,P3 enhancement
385191,introduce service method property creation,CLOSED WORKSFORME,P3 enhancement
385192,make environment variables render process properties,RESOLVED FIXED,P3 normal
385193,provide id pattern lower development effort,VERIFIED FIXED,P3 enhancement
385194,cannot start another process exist process fully run,NEW,P3 normal
385195,unable load class,CLOSED FIXED,P3 normal
385196,backport datastore spirit mechanism enable,RESOLVED FIXED,P3 normal
