id,title,status,importance
490000,unable align pin different shape,RESOLVED FIXED,P3 normal
490001,generics difference javac type cannot convert hashset code,VERIFIED INVALID,P3 major
490002,edge preference pin corner instead middle,UNCONFIRMED,P3 normal
490003,wrong pin label position zoom diagram,CLOSED FIXED,P3 normal
490004,unassigned variable annotationzip,VERIFIED FIXED,P3 normal
490005,accepteventaction gradient,UNCONFIRMED,P3 minor
490006,tiralali,RESOLVED INVALID,P3 normal
490007,remove checkbox,VERIFIED FIXED,P3 normal
490008,avoid store complete jar manifest object package attribute declare,RESOLVED FIXED,P3 enhancement
490009,compare unchanged file even change pathset,VERIFIED FIXED,P3 major
490010,move code external annotation process classfilereader,RESOLVED FIXED,P3 normal
490011,enable secure xml process default,RESOLVED FIXED,P3 enhancement
490012,remove compatible override project eclipse sdk,RESOLVED FIXED,P3 normal
490013,remove processprompter need istatushandler,NEW,P3 normal
490014,cli sign fail ant error,CLOSED DUPLICATE of bug 489890,P3 normal
490020,one way flight work properly,CLOSED FIXED,P3 critical
490021,test bug,CLOSED INVALID,P3 normal
490022,kill hours,RESOLVED FIXED,P3 normal
490023,cdocheckoutviewersorter slow,RESOLVED FIXED,P3 enhancement
490024,classcastexception contribute mhandledmenuitem without label fragment,CLOSED DUPLICATE of bug 479136,P3 normal
490025,different syntax positioninlist depend context,NEW,P3 normal
490026,launch eclipse ubuntu mate,RESOLVED WORKSFORME,P3 blocker with 1 vote
490027,goal cannot load properties,RESOLVED FIXED,P3 major
490028,extract checksum calculation separate class,VERIFIED FIXED,P3 enhancement
490029,double click dependencies open package explorer,NEW,P3 normal
490030,backend code templates need handle function parameters,CLOSED FIXED,P3 enhancement
490031,dead link,NEW,P3 normal
490032,verbose log enable,NEW,P3 normal
490033,export samba drive possible access problems,NEW,P3 normal
490034,junit view failure trace shall dialog show full information,CLOSED DUPLICATE of bug 72847,P3 normal
490035,improve feature product ide support integrate pep tool,NEW,P3 enhancement with 1 vote
490036,wizard use gif without transparent background,NEW,P3 minor
490037,rename feature parsley instead parsley,RESOLVED FIXED,P3 normal
490038,new file wizard able create non exist folders,RESOLVED WONTFIX,P3 enhancement with 1 vote
490039,diagram export fail,UNCONFIRMED,P3 normal
490040,fix regions work,ASSIGNED,P3 major
490041,regions work,NEW,P3 major
490042,committer list twice,RESOLVED FIXED,P3 normal
490043,shell page load chrome uncaught function,RESOLVED FIXED,P3 normal
490044,adopt solstice theme java package,RESOLVED FIXED,P3 enhancement
490045,adopt solstice theme committers package,RESOLVED FIXED,P3 enhancement
490046,adopt solstice theme cpp package,RESOLVED FIXED,P3 enhancement
490049,slave offline,VERIFIED FIXED,P3 blocker
490051,triaging,CLOSED FIXED,P3 normal
490052,resourceexception,CLOSED DUPLICATE of bug 474470,P3 normal
490053,one way function work like round trip,CLOSED INVALID,P3 critical
490054,exception try delete activityparameternode,RESOLVED FIXED,P3 major
490055,move elements strangely distort connector,UNCONFIRMED,P3 normal
490056,unnecessary warn official build,VERIFIED FIXED,P3 normal
490057,jpa relationship create entity twice,NEW,P3 normal
490058,polish ds annotations,NEW,P3 enhancement
490059,file upload work switch cookies,CLOSED WORKSFORME,P3 normal
490060,annotation process enable automatically,RESOLVED WONTFIX,P3 enhancement
490061,work without,CLOSED DUPLICATE of bug 488800,P3 normal
490062,allow generate lazy activation policy osgi ds annotations use,VERIFIED FIXED,P3 normal
490063,generate header declarative service,REOPENED,P3 enhancement
490064,ioexception,NEW,P3 normal
490065,ioexception,RESOLVED FIXED,P3 normal
490066,main thym page miss,NEW,P3 normal
490067,exception delete element table display properties view,RESOLVED FIXED,P3 normal
490068,jsonb cdi adapters,RESOLVED FIXED,P3 normal
490069,implementation moxy jaxb,RESOLVED FIXED,P3 normal
490070,content assist inside javadoc contain templates java context,RESOLVED FIXED,P3 normal
490071,filenotfoundexception automatic import,CLOSED FIXED,P1 critical
490072,small accessibility improvements,RESOLVED FIXED,P3 normal
490073,block canonical prevent show inherit part,UNCONFIRMED,P3 normal
490074,show latest version available software work,NEW,P3 normal with 1 vote
490075,site improvement,RESOLVED FIXED,P3 normal
490076,update deployment publish module contexts separate xml file set,NEW,P3 normal
490077,multiple problems occur,CLOSED FIXED,P3 normal with 1 vote
490078,ccombo show horizontal scrollbars,NEW,P3 normal
490079,miss name type columns variables view debug,NEW,P3 normal
490080,click table cell editor cause eclipse hang,RESOLVED WORKSFORME,P3 major
490081,styledtextarea show,RESOLVED FIXED,P3 normal
490082,dnd content must undo one go,RESOLVED FIXED,P3 normal
490083,add support change maven pom properties,RESOLVED FIXED,P3 normal
490084,block create part assign name new type ignore,CLOSED FIXED,P3 normal
490085,critical path view handle well start time select,RESOLVED FIXED,P3 normal
490086,critical path view range time graph view,RESOLVED FIXED,P3 normal
490087,hipp help,RESOLVED FIXED,P3 major
490088,aut configuration arguments cannot contain value space,CLOSED FIXED,P3 normal
490089,remove source file content review dialog event list,NEW,P3 normal
490090,classcastexception socontainergroup use sslservercontainergroup,RESOLVED FIXED,P3 normal
490091,support define query example,RESOLVED FIXED,P3 enhancement
490092,classcast exception table multivalued attribute show feature column,CLOSED FIXED,P3 normal
490093,add search capabilities incidents user x time interval,NEW,P3 normal
490094,edit classpath java dynamic web valid location link resources,NEW,P3 normal
490095,refresh repository,RESOLVED NOT_ECLIPSE,P3 normal
490096,stackoverflowerror code complete lambda expression,CLOSED DUPLICATE of bug 535743,P3 normal
490097,please create serve default assignee new sirius bugzilla component,RESOLVED FIXED,P3 normal
490098,handle case reference vm miss,NEW,P3 enhancement
490099,display stereotype properties value correct,RESOLVED FIXED,P3 critical
490100,iworkingsetmanager allow order work set,REOPENED,P3 normal
490101,miss dependencies several emf bundle,CLOSED INVALID,P3 normal
490102,test failures merge branch,RESOLVED FIXED,P3 normal
490103,jrecontainer work without physical libraries,NEW,P3 normal
490105,containment support emf,RESOLVED FIXED,P3 normal
490106,fix break code,CLOSED WONTFIX,P3 normal
490107,mail list archive corrupt,RESOLVED FIXED,P3 normal
490108,file find navigate tell user,CLOSED WONTFIX,P3 enhancement
490109,fix remove unused remove much,RESOLVED FIXED,P3 normal
490110,provide resource filter filter nest project,NEW,P3 enhancement with 3 votes
490111,consider use model inferrer derive variable declarations local variables,RESOLVED FIXED,P3 enhancement
490112,add unique id user agent information,REOPENED,P3 normal
490113,targetdefinitiongenerator recognize wildcard requirement,RESOLVED FIXED,P3 normal
490114,nest embeddables within embed ids,RESOLVED FIXED,P3 normal
490115,offer open perspective invoke git action,NEW,P3 normal
490116,eclipse welcome render problems sdk windows,CLOSED DUPLICATE of bug 497924,P3 normal
490117,eclipse installer keep insist need java instal run,CLOSED DUPLICATE of bug 475640,P3 blocker
490118,use platform specific line separators,RESOLVED FIXED,P3 normal
490119,development sts discontinue dialog show break,CLOSED FIXED,P3 normal
490120,allow import contain class certain inner class,NEW,P3 enhancement with 1 vote
490121,action open stag dialog box,RESOLVED FIXED,P3 enhancement
490122,support opposite access poll,NEW,P3 normal
490123,support child order,RESOLVED WONTFIX,P3 normal
490124,name contain letter result java name,CLOSED FIXED,P3 minor
490125,incorrect warn return,RESOLVED FIXED,P3 normal
490126,git stag show full commit click,NEW,P3 enhancement with 5 votes
490127,accessibility problem commit dialog,RESOLVED WONTFIX,P3 normal
490128,file undeclared function errors go away come back different file select,CLOSED WONTFIX,P2 normal
490129,ui freeze,CLOSED FIXED,P3 normal
490130,update task view user close already,CLOSED FIXED,P3 normal
490131,swtexception,CLOSED FIXED,P3 normal
490132,run project preview user close wizard already,CLOSED FIXED,P3 normal
490133,setup deployment infrastructure,CLOSED FIXED,P3 normal
490134,ui freeze,CLOSED INVALID,P3 normal
490135,fail gradle nature investigate,CLOSED FIXED,P3 normal
490136,allow external build directories,CLOSED FIXED,P3 normal
490137,gradlepluginsruntimeexception,CLOSED DUPLICATE of bug 486161,P3 normal
490138,malformedjsonexception,CLOSED FIXED,P3 normal
490139,fix hashcode equal databinding class,CLOSED WONTFIX,P3 normal
490140,nullpointerexception,CLOSED FIXED,P3 normal
490141,error run simple simulation tutorial,RESOLVED FIXED,P3 major
490142,backingstoreexception,CLOSED FIXED,P3 normal
490143,make nashorn optional core,RESOLVED FIXED,P3 normal
490144,backingstoreexception,CLOSED FIXED,P3 normal
490145,allow link resources phsically exist yet,CLOSED FIXED,P3 normal
490146,nullpointerexception,CLOSED DUPLICATE of bug 488719,P3 normal
490147,notenabledexception,REOPENED,P3 normal
490148,speech api integration eclipse ui editor,RESOLVED WONTFIX,P3 enhancement
490149,proposal efficient change process databinding,NEW,P3 normal
490150,add syntax style file,RESOLVED FIXED,P3 enhancement
490152,disable remove automotive package project epp git repository,CLOSED FIXED,P3 normal
490153,add miss tag indicate provisional api,RESOLVED FIXED,P3 normal
490154,change method visibility unneeded,NEW,P3 normal
490155,nightly test performance test fail several operations,CLOSED WORKSFORME,P3 normal
490156,nightly test performance test fail import project,CLOSED WORKSFORME,P1 normal
490157,nightly test performance test fail open project without teststyle,CLOSED WORKSFORME,P1 normal
490158,nightly test performance test fail open project teststyle reset afterwards,CLOSED WORKSFORME,P1 normal
490159,provide variables,RESOLVED FIXED,P3 enhancement
490160,websockets support,RESOLVED FIXED,P3 major
490161,null pointer problempropagator,CLOSED FIXED,P3 critical
490162,intermediate maven plugin,CLOSED MOVED,P3 normal
490163,several plugins reference miss parent pom,UNCONFIRMED,P3 normal
490164,give better feedback unsuccesful session open,CLOSED FIXED,P3 normal
490165,delete useless branch diffmerge,RESOLVED FIXED,P3 normal
490166,createelementcallback allow init eobject add containment tree,CLOSED FIXED,P1 normal
490167,disappear rap hipp,RESOLVED FIXED,P3 normal
490168,use cbc instead ecb,RESOLVED FIXED,P3 normal
490169,generation requirements code fail case name elements null unset,CLOSED FIXED,P3 normal
490170,jubula ite poor performance connection database slow,CLOSED WONTFIX,P3 critical
490171,evaluate methodhandle use would result perf improvement,RESOLVED FIXED,P3 enhancement
490172,support order mappings,NEW,P3 normal
490173,external xml bind could extend allow configuration,NEW,P3 enhancement
490174,deletion branch,RESOLVED FIXED,P3 normal
490175,window builder n,CLOSED INVALID,P3 normal
490176,window builder detail description find,NEW,P3 normal
490177,papyrus support code generation c,NEW,P3 enhancement
490178,jacoco measure value differ swing aut depend test start via ite testexec,CLOSED FIXED,P3 normal
490179,submenu main menu show icons,RESOLVED WORKSFORME,P3 normal
490180,sure src directories respect convention diagram folder,CLOSED FIXED,P3 normal
490181,work link,RESOLVED FIXED,P3 critical
490182,file limit plugins load even without plugins entry,RESOLVED FIXED,P3 normal
490183,create minimal documentation create static profile,UNCONFIRMED,P3 normal
490184,component update failure,CLOSED NOT_ECLIPSE,P3 normal
490185,reveal part interaction,RESOLVED FIXED,P3 normal
490186,text type except allow,NEW,P3 normal
490187,npe stop test execution throgh testexec hudson job,CLOSED FIXED,P1 blocker
490188,tree icons cut leave,CLOSED WORKSFORME,P3 normal
490189,run navigator test surefire,RESOLVED FIXED,P3 enhancement
490190,error auto build,NEW,P3 normal with 2 votes
490191,space path name cause build fail,NEW,P3 major
490192,exception throw user cancel synchronization,CLOSED FIXED,P3 minor
490193,row selection break preserveselectionmodel,CLOSED FIXED,P3 normal
490194,progress bar update properly,CLOSED FIXED,P3 trivial
490195,upgrade gradle,CLOSED FIXED,P3 enhancement
490196,make subproject filter configurable,CLOSED FIXED,P3 enhancement
490197,create source folders exist phyiscally,CLOSED FIXED,P3 normal
490198,synchronize gradle project hit,CLOSED FIXED,P3 normal
490199,bulk copy feature versions repository explorer view setup editor,RESOLVED FIXED,P3 enhancement
490200,notification import fail,CLOSED FIXED,P3 normal
490201,add shadow field support property boilerplate code,UNCONFIRMED,P3 normal
490202,cross file linting show error able go declaration,CLOSED WONTFIX,P2 normal
490203,unacceptable virtual performance item datas get,RESOLVED FIXED,P3 critical
490204,minimum number character configurable,NEW,P3 minor
490205,websockets support script service,RESOLVED FIXED,P3 normal
490206,remove sysml papyrus move extra,CLOSED FIXED,P3 normal
490207,create new noteworthy wtp neon,NEW,P3 normal
490208,need add possibility select debug port launch,RESOLVED FIXED,P3 normal
490209,conflict leave right ancestor match,CLOSED FIXED,P3 normal
490210,provide fine grain events new event api,CLOSED NOT_ECLIPSE,P3 enhancement
490211,reply dialogue vote button base previous anyone elses,RESOLVED FIXED,P3 minor
490212,remove duplicate ui around paths symbols,NEW,P3 normal
490213,image constructors retain image dynamic scale,CLOSED WONTFIX,P3 normal
490214,eclipse think nashorn accessible,RESOLVED WONTFIX,P3 normal
490215,combinedworldrule need check char check none,RESOLVED FIXED,P3 normal
490216,add configuration option configure one match apply immediately,NEW,P3 normal
490217,,RESOLVED FIXED,P3 normal
490218,trademark approval require whisker,RESOLVED FIXED,P3 normal
490219,mouseclick control need cancel contentassistpopup,RESOLVED FIXED,P3 normal
490220,proposal list show need grab focus show,NEW,P3 normal
490221,support custom keycombinations trigger beside,RESOLVED FIXED,P3 normal
490222,rethink autotrigger key contribution presenter,RESOLVED FIXED,P3 normal
490223,add syntax style file,RESOLVED FIXED,P3 normal
490224,ip log cq collect display ip log generator,RESOLVED FIXED,P3 major
490225,add gate cq submission project pending,NEW,P1 major
490226,move isideeffect class sideeffect package,RESOLVED FIXED,P3 normal
490227,strongly encourage user specify release ip log submission,NEW,P3 normal
490228,mycbr sdk error,CLOSED WORKSFORME,P3 normal
490229,oracle xdk parser support reset functionality,RESOLVED FIXED,P3 normal
490230,cannot provide local inside plugin,RESOLVED FIXED,P3 normal
490231,implement call bind,NEW,P3 minor
490232,centos box unstable,RESOLVED FIXED,P3 major
490233,hang due native refresh monitor,CLOSED NOT_ECLIPSE,P3 major
490235,add lib file c like include,NEW,P3 normal
490238,cdo build fail sign,CLOSED DUPLICATE of bug 489890,P3 blocker
490239,false positive parser cannot deduce parameter pack forward reference,RESOLVED WORKSFORME,P3 normal
490240,misalign selection control flow view,CLOSED DUPLICATE of bug 495909,P3 normal
490241,teststyle show second action test suite browser,CLOSED FIXED,P3 normal
490242,rowselectionprovider imply modifier ctrl,UNCONFIRMED,P3 normal
490243,icons size bigger expect low,CLOSED DUPLICATE of bug 489771,P3 normal
490244,add multilinerule implementation already report success token beginsequence match,NEW,P3 normal
490245,model fragment editor display tooltips enhance compulsory field,RESOLVED FIXED,P3 normal
490246,put diagram code internal,UNCONFIRMED,P3 enhancement
490247,javadoc support properly handle,NEW,P3 normal with 8 votes
490248,jubula start first open project lead default teststyle load instead project specific,CLOSED FIXED,P3 normal
490249,compile log find,NEW,P3 normal
490250,provide feature make easier integrate code editor applications,RESOLVED FIXED,P3 normal
490251,sequence diagram misrendered mar,RESOLVED FIXED,P3 major
490252,sequence diagram misrendered mar,RESOLVED DUPLICATE of bug 490251,P3 normal
490253,eclipse installer launch instal java,RESOLVED FIXED,P3 normal
490254,dangle reference appliedstereotypecommentview cause integrityexception cdo,CLOSED DUPLICATE of bug 490296,P3 critical
490255,api thread management,RESOLVED FIXED,P3 normal
490256,want navigate diagram elements correspond code block,CLOSED INVALID,P3 normal
490257,scoped storage per instance,RESOLVED FIXED,P3 normal
490258,invalidvirtualfileaccessexception,NEW,P3 normal
490259,improve usability diagram,NEW,P3 enhancement
490260,adopt solstice theme model package,RESOLVED FIXED,P3 enhancement
490261,throw exceptions include,NEW,P3 normal
490262,fxcompletion support calculation ui information lazily,RESOLVED FIXED,P3 normal
490263,introduce target platform,CLOSED FIXED,P3 normal
490264,basicindexoutofboundsexception,UNCONFIRMED,P5 normal
490265,allow contribute rule dynamically,RESOLVED FIXED,P3 normal
490266,click list patchsets remove selection,VERIFIED WONTFIX,P3 normal
490267,checkboxes table widget get clip bottom,VERIFIED FIXED,P3 normal
490268,new fx application wizard complain one project already exist,NEW,P3 normal
490269,patch set horizontal scroll bar content fit,RESOLVED FIXED,P3 trivial
490270,remove dependency monitor model view model,CLOSED FIXED,P3 normal
490271,publish neon installers,RESOLVED FIXED,P3 critical
490272,introcude common base class editpartfactory,CLOSED FIXED,P3 normal
490273,move test junit,RESOLVED FIXED,P3 normal
490274,provide classpath variable,RESOLVED FIXED,P3 enhancement
490275,problem compilation,UNCONFIRMED,P3 normal
490276,test plugin code generation empty new repository,RESOLVED FIXED,P3 normal
490277,delete extra papyrus neon,RESOLVED FIXED,P3 normal
490278,gmfgen switch version,RESOLVED FIXED,P3 normal
490279,add,RESOLVED FIXED,P3 normal
490280,background inheritance mode color ignore,RESOLVED WORKSFORME,P3 normal
490281,possible toggle breakpoint jsdt editor,RESOLVED FIXED,P3 normal
490282,refactor gmfgen model match requirements,CLOSED WONTFIX,P3 normal
490283,remove,VERIFIED FIXED,P3 normal
490284,use new operator create instance readaccess,RESOLVED FIXED,P3 normal
490285,error css link,CLOSED FIXED,P3 normal
490286,use build,NEW,P3 normal
490287,dashboard layout persist across restart,VERIFIED FIXED,P3 normal
490288,consider use stringbuilder instead stringbuffer,RESOLVED FIXED,P3 enhancement
490289,position dashboard refresh resize smaller size,NEW,P3 normal
490290,one patch build thursday,RESOLVED FIXED,P3 normal
490291,remove editormodelmapping,CLOSED FIXED,P3 normal
490292,consider version cache,RESOLVED WONTFIX,P3 enhancement
490293,change default jdk code recommenders hipp,CLOSED FIXED,P3 normal
490294,timeout thread block process actiontype,CLOSED DUPLICATE of bug 490744,P3 blocker
490295,allow folders external dependencies,CLOSED FIXED,P3 normal
490296,undo problem apply stereotype comment,NEW,P3 normal with 1 vote
490297,fail silent behaviour load pattern bad vql file query explorer,RESOLVED WONTFIX,P3 normal
490298,create new papyrus still show empty dsml head,VERIFIED FIXED,P3 normal
490299,error query editor miss semicolon check expression,RESOLVED FIXED,P3 critical
490300,npe throw wid file contain duplicate entries,REOPENED,P3 normal
490301,extend rulespecification name attribute,RESOLVED FIXED,P3 normal
490302,provide adaptable evm instance,RESOLVED FIXED,P3 normal
490303,replace log evm dedicate tracer adapter,CLOSED WONTFIX,P3 normal
490304,jsp validation errors lambda expressions,RESOLVED WORKSFORME,P3 major
490305,styledtextarea lineruler api add click callback,RESOLVED FIXED,P3 normal
490306,test exist,NEW,P3 normal
490307,istmffastyet longer update,RESOLVED FIXED,P3 normal
490308,istmffastyet host,NEW,P3 normal
490309,,RESOLVED FIXED,P3 normal
490310,jis x support,CLOSED FIXED,P3 normal
490311,,RESOLVED FIXED,P3 normal
490312,trademark approval require polarsys rover,RESOLVED FIXED,P3 normal
490313,reduce warn,ASSIGNED,P3 normal
490314,add javadoc external dependencies,CLOSED FIXED,P3 enhancement
490315,classname invokedynamic,RESOLVED FIXED,P3 critical
490316,make comparisons possible,CLOSED FIXED,P3 normal
490317,improve wizard ask new representation name,CLOSED FIXED,P3 enhancement
490318,graphical shift leave nest part,RESOLVED FIXED,P3 normal
490319,property sheet interface elements editors,CLOSED FIXED,P3 normal
490320,bad link console log build output,RESOLVED FIXED,P3 normal
490321,layouts work dynamic resolution widgets keep original size,CLOSED WORKSFORME,P3 normal
490322,cannot enable kernel event specify name,RESOLVED FIXED,P3 normal
490323,add syntax style typescript file,RESOLVED FIXED,P3 normal
490324,validation detect errors,CLOSED DUPLICATE of bug 490325,P3 normal
490325,errors detect show problems view,RESOLVED FIXED,P3 normal
490326,hover text node take whole workspace area file large,RESOLVED FIXED,P3 normal
490327,,RESOLVED FIXED,P3 normal
490328,mentor require open standard business platform project proposal,RESOLVED FIXED,P3 normal
490329,trademark approval require open standard business platform,RESOLVED FIXED,P3 normal
490330,quick fix incorrect selection run,RESOLVED FIXED,P3 normal
490331,move job one team another cause copy rather move,NEW,P3 normal
490332,user add entry library available tern due file,RESOLVED FIXED,P2 enhancement
490333,warn require statement know index library without match directive,CLOSED DUPLICATE of bug 485219,P3 normal
490334,invalid location object tag,NEW,P3 normal
490335,cannot update,RESOLVED FIXED,P3 normal
490336,resize vertically work,NEW,P3 normal
490337,technically incorrect language quick fix inherit multiple interface methods,RESOLVED FIXED,P3 normal
490338,hang edit file,NEW,P3 normal
490339,accept null argument parameter type,VERIFIED WORKSFORME,P3 normal
490340,effect,CLOSED WORKSFORME,P3 normal
490341,consider add standard package,CLOSED FIXED,P3 enhancement with 1 vote
490342,channelendpointimpl trace time,RESOLVED FIXED,P3 normal
490343,aioobe external annotations,VERIFIED FIXED,P3 normal
490344,add syntax style sql file,RESOLVED FIXED,P3 normal
490348,nullpointerexception,RESOLVED DUPLICATE of bug 486920,P3 normal
490349,confuse download page entries,CLOSED FIXED,P3 minor
490350,dependency resolution problem due migration,CLOSED FIXED,P3 normal
490351,adopt solstice theme js package,RESOLVED FIXED,P3 enhancement
490352,rowselectionprovider fire event set empty selection,CLOSED FIXED,P3 normal
490353,activate close editors automatically default,RESOLVED FIXED,P3 enhancement
490354,add listpreferencehandler,RESOLVED FIXED,P3 enhancement
490355,use better name email,RESOLVED FIXED,P3 normal
490356,string literals ast tree escape,RESOLVED FIXED,P3 normal
490357,need upgrade target platform neon neon nigthly,CLOSED FIXED,P3 normal
490358,import list project abort state soon collision detect,CLOSED FIXED,P1 normal
490359,nest namespace definitions,RESOLVED FIXED,P3 normal with 4 votes
490360,allow feature border nod,CLOSED FIXED,P3 enhancement
490361,polish smart project importer,RESOLVED FIXED,P3 normal
490362,jsonb polymorphic adapters,RESOLVED FIXED,P3 normal
490363,malfunction,VERIFIED WORKSFORME,P3 normal
490364,migrate egit incubation team provider,RESOLVED FIXED,P3 normal
490365,deprecate,RESOLVED WONTFIX,P3 normal
490366,wizard forget volume paths,RESOLVED FIXED,P3 normal
490367,eclipse collections hipp download area access,RESOLVED FIXED,P3 normal
490368,provide file dialog,CLOSED WONTFIX,P3 normal
490369,ijson implementation,RESOLVED FIXED,P3 normal
490370,multiline string longer max width break format,NEW,P3 normal
490371,bind jvmmodeltargeturicollector default xbase base langauges,RESOLVED FIXED,P3 normal
490372,pie chart statistics view visible one event type,RESOLVED FIXED,P3 normal
490373,decouple papyrus model ui components,UNCONFIRMED,P3 normal
490374,enable framework test gerrit build job,RESOLVED FIXED,P3 normal
490375,delete unneeded file,CLOSED FIXED,P3 normal
490376,ui freeze due property tester network,CLOSED DUPLICATE of bug 489645,P3 normal
490377,unreadable text git annotation,CLOSED DUPLICATE of bug 491620,P3 normal
490378,npe validation preference page ok press nothing change,RESOLVED FIXED,P3 normal
490379,xvnc noclassdeffounderror cause job failures exhaustion available display,NEW,P3 major
490380,temporarily comment test need investigation,CLOSED WONTFIX,P3 normal
490381,request admin access rcptt hipp,RESOLVED FIXED,P3 normal
490382,fix maven plugin version,CLOSED FIXED,P3 normal
490383,markdown code surround triple show errors due incorrect parse,NEW,P3 normal with 1 vote
490384,default action tabbar,CLOSED FIXED,P3 enhancement
490385,languagespecificurieditoropener create invalid entry navigation history,VERIFIED FIXED,P3 normal
490386,add syntax style properties file,RESOLVED FIXED,P3 normal
490387,migration rap,RESOLVED FIXED,P3 normal
490388,move portal profile information form,CLOSED DUPLICATE of bug 426956,P3 normal
490389,fortran launch configuration break master,RESOLVED FIXED,P3 blocker
490390,fortran launch configuration break master,CLOSED DUPLICATE of bug 490389,P3 blocker
