id,title,status,importance
142550,update project matrix monitor,CLOSED FIXED,P3 normal
142551,drag drop edit data set work properly,RESOLVED FIXED,P2 normal
142552,perform type check set feature value elementinitializer,RESOLVED FIXED,P3 normal
142553,standalone plugin generator insert import generate one class next generate class,RESOLVED FIXED,P3 normal
142554,error configure handlers web service description multiple port,CLOSED FIXED,P3 major
142555,move recorderagentcontroller internal public api,CLOSED WONTFIX,P3 major
142556,controleditor fail scroll properly,RESOLVED DUPLICATE of bug 128574,P3 normal
142557,formtext hyperlinks leave artifacts blur select,REOPENED,P3 normal
142558,sdk documentation uniformization,VERIFIED FIXED,P3 enhancement
142559,sdk documentation uniformization,VERIFIED FIXED,P3 enhancement
142560,actl clean agent structure,CLOSED FIXED,P1 normal
142561,alter call getaftereditcommand,RESOLVED FIXED,P3 major
142562,move cp one plugin fail,CLOSED FIXED,P3 critical
142563,observablevalue databinding image label,RESOLVED INVALID,P3 normal
142564,eclipse hang delete product file project,VERIFIED FIXED,P2 critical
142565,improve automate build cleanup script implement um cleanup,VERIFIED FIXED,P3 enhancement
142566,automate build cleanup script,VERIFIED FIXED,P3 enhancement
142567,search index incremented update,NEW,P3 normal
142568,cp reference lose copy cp package contain cps,CLOSED FIXED,P3 major
142569,replace generate extension point documentation generic instructions,CLOSED FIXED,P3 normal
142570,add process package process default configuration,CLOSED DUPLICATE of bug 142574,P2 normal
142571,break html link,CLOSED FIXED,P1 normal
142572,ocl root package register without resource,CLOSED FIXED,P3 critical
142573,add process package process default configuration,CLOSED FIXED,P3 normal
142574,add process package process default configuration,CLOSED FIXED,P3 normal
142575,break html link,CLOSED FIXED,P1 normal
142576,break html link,CLOSED DUPLICATE of bug 142575,P3 normal
142577,break html link,CLOSED DUPLICATE of bug 142575,P3 normal
142578,reparenting olecontrolsite,RESOLVED INVALID,P3 normal
142579,create logo use agreement,RESOLVED WONTFIX,P3 normal
142580,restore wtp logos,RESOLVED WONTFIX,P3 normal
142581,test bug please ignore,RESOLVED INVALID,P3 normal
142582,reparenting olecontrolsite,NEW,P3 normal
142583,break html link,CLOSED FIXED,P1 normal
142584,break html link,CLOSED FIXED,P1 normal
142585,break html link,CLOSED FIXED,P1 normal
142586,refresh tag button merge dialog revalidate,ASSIGNED,P5 normal
142587,junit test honor string substitution variables,RESOLVED FIXED,P3 normal
142588,nullpointerexception set children content dtd properties view,RESOLVED FIXED,P3 normal with 1 vote
142589,update eclipse feature icons,VERIFIED FIXED,P3 enhancement
142590,tabs versus space problem,RESOLVED WORKSFORME,P3 normal
142591,new visual class wizard put message plugin project,CLOSED FIXED,P3 normal
142592,jointable tab populate,CLOSED FIXED,P2 normal
142593,scroll table eventually lock entire application,RESOLVED FIXED,P3 normal with 1 vote
142594,help content need improvement,CLOSED FIXED,P3 normal
142595,export deployable plugins ignore project specific compiler compliance set,RESOLVED INVALID,P3 major
142596,method invocation detail layout,CLOSED WONTFIX,P3 normal
142597,spell errors isv documentation,CLOSED FIXED,P1 normal
142598,method invocation detail layout,CLOSED DUPLICATE of bug 142596,P3 normal
142599,method invocation detail layout,CLOSED DUPLICATE of bug 142596,P3 normal
142600,method invocation detail layout,CLOSED DUPLICATE of bug 142596,P3 normal
142601,docs accessibility problems,CLOSED FIXED,P1 normal
142602,default breakpoint work set lose work set name change,VERIFIED FIXED,P3 normal
142603,uddi page wse doesnt appear firefox,CLOSED INVALID,P3 normal
142604,eclipse create call within,CLOSED FIXED,P3 critical
142605,false positive copyright flag,CLOSED FIXED,P3 normal
142606,incorrect copyright year,CLOSED FIXED,P1 normal
142607,method invocation detail view percentage,CLOSED WONTFIX,P3 normal
142608,test log viewer text message box limit html check,CLOSED FIXED,P3 normal
142609,report parameters enhancement,RESOLVED FIXED,P3 enhancement
142610,junits exceptions regard validator,CLOSED FIXED,P3 major
142611,stub server recognize web service wizard,CLOSED WORKSFORME,P3 normal
142612,parameters,RESOLVED FIXED,P3 enhancement
142613,translation errors log,CLOSED FIXED,P1 normal
142614,exclude file translation check,CLOSED FIXED,P3 normal
142615,guess type parameter usage,ASSIGNED,P3 minor
142616,jardepoperation cause duplicate classpath entries,CLOSED FIXED,P3 major
142617,null pointer application exit,CLOSED FIXED,P3 normal
142618,tostringvisitor omit keyword expression,CLOSED FIXED,P3 normal
142619,scanner discovery clear old settings change compiler invocation command,ASSIGNED,P2 major with 7 votes
142620,wsdl need reference menu option,CLOSED FIXED,P2 normal
142621,update get start docs,VERIFIED FIXED,P3 normal
142622,import wizard import ejb correctly,CLOSED WORKSFORME,P3 critical
142623,base text,RESOLVED WORKSFORME,P2 major
142624,tw button truncate manage jdbc drivers panel,CLOSED FIXED,P2 major
142625,wsdl add operation seem slow,CLOSED WONTFIX,P2 normal
142626,page break preventable nest table,RESOLVED FIXED,P2 major
142627,schema documentation incorrectly reference class,CLOSED FIXED,P3 minor
142628,precision class overwrite superclass methods higher,RESOLVED FIXED,P3 normal
142629,crash xtopendisplay eclipse core dump exit,RESOLVED DUPLICATE of bug 50145,P3 major
142630,symptom catalog symptom editor message cantains,CLOSED DUPLICATE of bug 143767,P1 critical
142631,run custom module type adapter cause invalid thread access,CLOSED FIXED,P3 major
142632,create new repository task set editor title,RESOLVED FIXED,P3 normal
142633,debug view doc,VERIFIED FIXED,P3 normal
142634,wrong decimal point grid space box,CLOSED FIXED,P3 normal
142635,launch sample check box effect,CLOSED FIXED,P3 normal
142636,wsdl element work link icon inline schema longer work,CLOSED INVALID,P3 normal
142637,wsdl need context menu option,CLOSED FIXED,P3 normal
142638,wsdl fix editpart order avoid cross reference line,CLOSED FIXED,P3 normal
142639,set inheritall generate subant call,RESOLVED FIXED,P3 normal
142640,error pass parameter drill hyperlink,RESOLVED FIXED,P3 major
142641,remove unused wrapper object editor,NEW,P3 enhancement
142642,package export,CLOSED FIXED,P3 major
142643,delete log file generate error,CLOSED WORKSFORME,P1 major
142644,drag drop swt view swing jtextpane crash suse linux,RESOLVED DUPLICATE of bug 110163,P3 major with 10 votes
142645,wsdl need display informative message design view blank,CLOSED FIXED,P2 normal
142646,tw english hover text edit data set panel,CLOSED FIXED,P3 normal
142647,tvt zh fail find break nls menu,CLOSED INVALID,P3 normal
142648,task text box name,CLOSED FIXED,P3 normal
142649,raserver hang,CLOSED FIXED,P1 normal
142650,schema folder,RESOLVED FIXED,P3 normal
142651,use assert keyword core service,NEW,P3 trivial
142652,new anonymous location still point,CLOSED FIXED,P3 normal
142653,jdt internal compiler nullpointerexception eclipe,VERIFIED FIXED,P3 major
142654,treeeditor,RESOLVED FIXED,P3 enhancement
142655,rethink viewer concept celleditor,RESOLVED DUPLICATE of bug 151295,P3 enhancement
142656,organize create menu items feature submenus,VERIFIED FIXED,P3 enhancement
142657,use label statement cause incorrect indentation,ASSIGNED,P3 minor
142658,task discipline contribute another miss config,CLOSED FIXED,P3 normal
142659,miss class,RESOLVED FIXED,P1 blocker
142660,class cast update mirror command,CLOSED FIXED,P3 blocker
142661,reduce dependency bugzilla search eclipse,RESOLVED FIXED,P3 enhancement
142662,source refactor top level menus mean edit menu,RESOLVED WORKSFORME,P3 minor
142663,get error check another person,CLOSED WORKSFORME,P3 major
142664,always fail,RESOLVED WORKSFORME,P3 critical
142665,make schedule option context menu work multiple selections,RESOLVED FIXED,P3 minor
142666,cannot delete capability pattern,CLOSED FIXED,P3 major
142667,client instal server slider set develop,CLOSED DUPLICATE of bug 141422,P3 normal
142668,slow draw view use alpha value,NEW,P3 normal
142669,suppress state still save although select close editor,CLOSED FIXED,P3 normal
142670,remove cc content elements generate unhandled,CLOSED FIXED,P3 normal
142671,contribute activity one action,NEW,P3 enhancement
142672,problems remain even fix,CLOSED FIXED,P2 major
142673,support ui preference limit report preview max row,RESOLVED FIXED,P3 enhancement
142674,include viewer folder,CLOSED FIXED,P2 normal
142675,change save without,CLOSED FIXED,P1 major
142676,enhance error report model side extend,RESOLVED FIXED,P3 normal
142677,null value accept parameter cascade parameter group,CLOSED DUPLICATE of bug 141201,P3 normal
142678,drill system respond,CLOSED FIXED,P2 normal
142679,link add wrong semantic model use hierachical model,RESOLVED FIXED,P3 normal
142680,report document attach report design incorrect,RESOLVED FIXED,P3 critical
142681,image attach report save absolute path,CLOSED DUPLICATE of bug 142948,P3 normal
142682,iexpansionlistener call,RESOLVED DUPLICATE of bug 70358,P3 normal
142683,search result bugzilla correct,CLOSED FIXED,P3 critical
142684,use nonexisted bind column sort key cause preview,CLOSED FIXED,P2 major
142685,set ax rotation chart top,CLOSED FIXED,P3 normal
142686,message exception launch eclipse platform,RESOLVED INVALID,P3 normal
142687,line chart area set marker interactivity take,CLOSED FIXED,P3 normal
142688,run dialog come full cheese,RESOLVED DUPLICATE of bug 142965,P3 major
142689,shadow color take,CLOSED FIXED,P3 normal
142690,complex path file error,CLOSED FIXED,P2 major
142691,switch window two design display bind list,CLOSED FIXED,P2 normal
142692,open xml file kill eclipse,RESOLVED FIXED,P3 normal
142693,table grid display incorrectly xml editor,CLOSED DUPLICATE of bug 111680,P3 normal
142694,ability set default name file get preview pdf,RESOLVED FIXED,P3 enhancement
142695,xsd string restriction maxlength constraint incorrectly validate,RESOLVED DUPLICATE of bug 88631,P3 normal
142696,refactor plugins separate service code,CLOSED WONTFIX,P3 enhancement
142697,new button launcher,RESOLVED WORKSFORME,P3 minor
142698,use absolute font size html content hover javadoc view,RESOLVED FIXED,P3 normal
142699,commit ability select text part workbench,RESOLVED DUPLICATE of bug 108124,P3 enhancement
142700,cannot bind incomplete key sequence,VERIFIED FIXED,P1 normal
142701,maxrow support viewer,CLOSED DUPLICATE of bug 142673,P3 major
142702,internal dirty xml file system entities,CLOSED INVALID,P3 normal
142703,box task activity task editor display different,RESOLVED FIXED,P2 normal with 1 vote
142704,publish report design file template folder save template file,CLOSED FIXED,P1 normal
142705,change parameter url webviewer,RESOLVED FIXED,P2 normal
142706,eclipse versions greater,RESOLVED DUPLICATE of bug 142529,P3 major
142707,jframe base app open,CLOSED FIXED,P3 major
142708,total page count incorrect pdf set last report,CLOSED FIXED,P3 normal
142709,new find send,RESOLVED INVALID,P3 enhancement
142710,npe try copy move connection team profile,CLOSED FIXED,P3 major
142711,filter group thread state,RESOLVED DUPLICATE of bug 44701,P3 enhancement
142712,new connections profile get default filter,CLOSED FIXED,P2 major
142713,workspace file arrayindexoutofboundsexceptions,VERIFIED FIXED,P3 normal
142714,hard put connections version control,ASSIGNED,P3 minor
142715,textfiledocumentprovider must ensure synchronize access document,RESOLVED FIXED,P3 normal
142716,connection cm impossible due timestamps,CLOSED FIXED,P3 major
142717,createinclude method itranslationunit create duplicate,CLOSED INVALID,P3 normal
142718,npe print stdout start rse dom,RESOLVED FIXED,P4 normal
142719,npe work rse team view,RESOLVED DUPLICATE of bug 158180,P3 normal
142720,rse view get empty choose reload rse,ASSIGNED,P2 normal
142721,exception log quit rse stop,RESOLVED WORKSFORME,P4 minor
142722,thread time wait initial start rse,CLOSED WORKSFORME,P3 normal
142723,npe layout defaultprovider,RESOLVED INVALID,P3 normal
142724,fail small,RESOLVED FIXED,P3 major
142725,flag rename source folder,RESOLVED WONTFIX,P3 normal
142726,problem cvs validation component,CLOSED INVALID,P3 blocker
142727,make mylar context capture intuitive fix,RESOLVED WORKSFORME,P3 enhancement
142728,cvs synchronize operation mark file,ASSIGNED,P5 normal
142729,switch resource perspective extremely slow,RESOLVED WORKSFORME,P4 normal
142730,conditional breakpoints seem work,RESOLVED WORKSFORME,P3 normal
142731,string problem new source folder dialog,VERIFIED DUPLICATE of bug 141527,P3 normal
142732,update java development user guide,RESOLVED FIXED,P3 normal
142733,truncation wizard page,NEW,P3 normal
142734,model exporter reconcile model diagnose problems,VERIFIED FIXED,P3 minor
142735,handle,RESOLVED DUPLICATE of bug 128278,P3 major
142736,compatibility problem,RESOLVED WONTFIX,P3 normal
142737,emf packagenotfoundexception open workbench perspective,CLOSED DUPLICATE of bug 143229,P3 normal
142738,column name show english,CLOSED FIXED,P3 major
142739,contribute documentation rse,CLOSED FIXED,P3 normal
142740,splitted weblogic generic server plugin,CLOSED FIXED,P3 normal
142741,update website content reflect openup name change,CLOSED FIXED,P3 normal
142742,check agents verify location ready execute test,CLOSED WONTFIX,P2 enhancement
142743,host description export dom,CLOSED FIXED,P3 normal
142744,npe,VERIFIED FIXED,P3 major
142745,value available xxaction class,RESOLVED INVALID,P3 normal
142746,analyzer fail resolve unqualified type name,CLOSED FIXED,P3 major
142747,product css use undefined value,RESOLVED FIXED,P3 normal
142748,eclipse error startup mac os x,RESOLVED WONTFIX,P3 blocker
142749,npe close input resource remove,NEW,P3 normal
142750,include,RESOLVED FIXED,P3 enhancement
142751,zoom animation take second complete,RESOLVED FIXED,P2 normal
142752,truncate button import panel,CLOSED DUPLICATE of bug 142308,P3 major
142753,truncate button,RESOLVED FIXED,P2 normal
142754,tw button truncate property editor report view,CLOSED FIXED,P3 normal
142755,web service test client translate,CLOSED INVALID,P3 major
142756,english invoke wsdl operation form,CLOSED INVALID,P3 minor
142757,birt scrollbar need,CLOSED FIXED,P3 major
142758,incompatibility,RESOLVED FIXED,P3 minor
142759,cardinality wildcard use,VERIFIED FIXED,P3 normal
142760,clean copywrite statements tthe test plugins,CLOSED FIXED,P3 major
142761,error pallete,CLOSED INVALID,P3 major
142762,need way open full separate browser external link,RESOLVED WORKSFORME,P3 enhancement
142763,ear nullpointers throw create new modules,CLOSED INVALID,P3 normal
142764,multiple severity field custom rule,CLOSED FIXED,P3 normal
142765,icon descriptions use consistent markup,RESOLVED FIXED,P3 trivial
142766,failure post comment bug open bugzilla search,RESOLVED FIXED,P3 normal
142767,miss file commons log feature,CLOSED FIXED,P3 normal
142768,url stereotype available,CLOSED FIXED,P3 normal
142769,ear creation wizard check box check create new modules,CLOSED FIXED,P3 normal
142770,put commons log feature enable feature section callisto update site,CLOSED FIXED,P3 normal
142771,new project wizards target runtime selection,CLOSED FIXED,P3 normal
142772,compilation succeed static import fail javac,VERIFIED FIXED,P3 normal
142773,birt test report show total test,CLOSED FIXED,P3 major
142774,see error message,CLOSED INVALID,P3 major
142775,tw truncation new ear application project panel,CLOSED FIXED,P3 major
142776,ear creation nullpointer throw try create exist default modules,CLOSED INVALID,P3 minor
142777,forward back button flip web service,CLOSED FIXED,P3 major
142778,merge validation relate properties gmfgen model,RESOLVED FIXED,P3 normal
142779,tvt zh business publish fail character business,CLOSED FIXED,P2 major
142780,truncation,CLOSED DUPLICATE of bug 142305,P3 major
142781,file cannot open,CLOSED INVALID,P3 major
142782,open issue editor bugzilla search rezults freeze workbench,RESOLVED FIXED,P2 normal
142783,generalize issue search,RESOLVED FIXED,P2 normal
142784,npe close dirty product editor,RESOLVED FIXED,P3 normal
142785,navigatorsaveablesservices npes shutdown,VERIFIED FIXED,P2 major
142786,runtime set file create ear project,CLOSED INVALID,P3 blocker
142787,small box select dataset,RESOLVED FIXED,P3 normal
142788,improve experience add jsf facet exist project,NEW,P3 enhancement
142789,xml data access component change public api,CLOSED FIXED,P3 blocker
142790,jsf app detection,NEW,P3 enhancement
142791,harden npes focus listeners,RESOLVED WONTFIX,P3 normal
142792,export ant tar miss file,RESOLVED WORKSFORME,P3 normal
142793,npe result,VERIFIED FIXED,P3 normal
142794,truncation,CLOSED DUPLICATE of bug 142624,P2 major
142795,try submit bug give error submission work anyway,RESOLVED FIXED,P2 normal
142796,gmfgen oclexpressionfactory template check result expression evaluation oclinvalid,RESOLVED FIXED,P3 normal
142797,tw tooltips englishon hyperlink options panel,CLOSED FIXED,P3 normal
142798,truncation report,CLOSED FIXED,P3 minor
142799,de birt truncation edit data set panel,CLOSED FIXED,P2 normal
142800,new data set wizard,CLOSED FIXED,P2 major
142801,tw truncate number format number properties,NEW,P3 major
142802,fieldseverityandmessage protect uninitialzed image,VERIFIED FIXED,P3 normal
142803,illegal asynchronous access resourcesetchangeevent diagrameventbrokerthreadsafe,RESOLVED FIXED,P3 critical
142804,constant lock up hang intel macbook pro,RESOLVED DUPLICATE of bug 142892,P3 critical
142805,diagram reload file change,RESOLVED FIXED,P2 major
142806,attribute write dom,CLOSED FIXED,P3 enhancement
142807,property set properties get persist properly dot name,RESOLVED FIXED,P3 critical
142808,consider use flat transaction compositetransactionalcommands,RESOLVED FIXED,P3 normal
142809,untranslated string,CLOSED INVALID,P3 normal
142810,truncate string custom date time format panel,CLOSED FIXED,P3 normal
142811,unnecessary dialog import log,CLOSED INVALID,P3 normal
142812,keybindings incorrectly disable,RESOLVED FIXED,P3 normal
142813,make extension point machine friendly,RESOLVED WONTFIX,P3 normal
142814,unnecessary dialog import sdbs,CLOSED INVALID,P3 normal
142815,software update fail retrieve windows server detection local disk space,RESOLVED FIXED,P3 critical with 1 vote
142816,help project explorer,RESOLVED FIXED,P3 normal
142817,help progress view,VERIFIED FIXED,P3 normal
142818,help internal web browser view,VERIFIED FIXED,P3 normal
142819,recommend analysis engine name,CLOSED WONTFIX,P2 normal
142820,help help view,RESOLVED FIXED,P3 normal
142821,error dialog exit path,CLOSED WORKSFORME,P3 major
142822,de birt truncation new parameter panel,RESOLVED DUPLICATE of bug 138951,P3 normal
142823,remove import export correlations,CLOSED FIXED,P1 normal
142824,workbench reference doc change,VERIFIED FIXED,P3 normal
142825,user exit highligther dialog filter select color,CLOSED FIXED,P1 critical
142826,colorfieldeditor return label text accessible listener methods,RESOLVED WONTFIX,P3 normal
142827,improve default sdb import file field,CLOSED DUPLICATE of bug 155253,P3 normal
142828,cdt parser confuse register aliasing statement,RESOLVED FIXED,P3 normal
142829,de birt truncation format builder panel,RESOLVED DUPLICATE of bug 142801,P3 normal
142830,tvt zh truncation expression,CLOSED DUPLICATE of bug 142801,P3 major
142831,example format result,RESOLVED FIXED,P3 normal
142832,need port extension agent,CLOSED FIXED,P1 critical
142833,site parse routines check validity file,RESOLVED WONTFIX,P3 normal
142834,check null semanticadapter,RESOLVED FIXED,P3 major
142835,need,CLOSED FIXED,P3 major
142836,help problems view,RESOLVED FIXED,P3 normal
142837,message empty library truncate,CLOSED FIXED,P3 major
142838,english item master page selection,CLOSED INVALID,P2 major
142839,tester bug,VERIFIED FIXED,P3 enhancement
142840,cldc compliance,RESOLVED FIXED,P3 normal
142841,property file persistence escape,CLOSED FIXED,P3 critical
142842,invalid thread access,VERIFIED FIXED,P3 normal
142843,log core junit test fail test case,CLOSED FIXED,P3 normal
142844,junit test case fail,CLOSED WONTFIX,P2 normal
142845,support one drop target widget hierarchy,CLOSED WONTFIX,P3 enhancement with 8 votes
142846,need use ide advisor use ide components,RESOLVED WORKSFORME,P3 normal
142847,aggregate produce correct result,RESOLVED FIXED,P1 normal
142848,incorrect ear use create new project,CLOSED INVALID,P3 normal
142849,capitalize word invalid host name message,RESOLVED FIXED,P3 minor
142850,create aggregate intuitive,RESOLVED FIXED,P2 normal
142851,issue background population create patch wizard,ASSIGNED,P5 normal
142852,es birt string cause problems translation,CLOSED FIXED,P1 normal
142853,dynamic probekit fail windows,CLOSED INVALID,P3 critical
142854,fragment exprted directories work right,RESOLVED WORKSFORME,P3 normal
142855,constructor javadoc lead,RESOLVED FIXED,P3 trivial
142856,generate epackage code package classifiers,RESOLVED WONTFIX,P3 enhancement with 15 votes
142857,add support,RESOLVED FIXED,P3 enhancement
142858,enter parameters display nothing,RESOLVED FIXED,P2 normal
142859,data elements appear grey layout editor,RESOLVED FIXED,P2 normal
142860,breakpoint marker show ruler,RESOLVED FIXED,P3 normal
142861,button shell clickable,RESOLVED DUPLICATE of bug 147808,P3 normal
142862,need add ant service tabular test report,CLOSED FIXED,P3 normal
142863,request method cdopersistable,CLOSED FIXED,P3 normal
142864,internal error occur,CLOSED INVALID,P3 normal with 1 vote
142865,report fail birt plugins,CLOSED FIXED,P3 critical
142866,decimal value display linear axis,RESOLVED FIXED,P2 normal
142867,webservicesmanager cause problem create project,CLOSED FIXED,P3 normal
142868,doc dynamic copy blog entry,NEW,P3 normal
142869,provide rich editor jira,RESOLVED FIXED,P3 enhancement
142870,generate parent select model element,VERIFIED FIXED,P1 enhancement
142871,instructions raserver agent controller need addtional info,CLOSED FIXED,P2 normal
142872,memory dispose observables null reference wrap object,RESOLVED INVALID,P3 major
142873,report design perspective throw exception open,RESOLVED DUPLICATE of bug 141981,P3 normal
142874,need debuggable ac build capability,CLOSED FIXED,P1 normal
142875,support svn active changesets,RESOLVED FIXED,P3 enhancement
142876,defaultfacets support variant jre versions,CLOSED INVALID,P3 enhancement
142877,users import file project,RESOLVED WONTFIX,P3 normal
142878,synchronize view miss change,RESOLVED FIXED,P3 normal
142879,epic browser feature platform,RESOLVED WONTFIX,P3 enhancement with 3 votes
142880,point behavior,RESOLVED FIXED,P3 normal
142881,del work editor,RESOLVED FIXED,P3 normal
142882,member possible inconsistency,NEW,P3 normal
142883,improve method library project management api implementation,CLOSED FIXED,P3 normal
142884,update file sync conflict eat trail whitespace,VERIFIED FIXED,P3 normal
142885,remove unreferenced saveas action dialog,CLOSED FIXED,P3 normal
142886,illegal thread access,RESOLVED DUPLICATE of bug 129490,P3 normal
142887,ms exchange,RESOLVED FIXED,P4 enhancement with 4 votes
142888,fail add cc bugzilla report,RESOLVED FIXED,P2 major
142889,functionality degradation new bugzilla query search view,RESOLVED FIXED,P3 critical
142890,bugzilla search always return entries,RESOLVED FIXED,P2 normal
142891,bugzilla search remember value last search,RESOLVED FIXED,P2 enhancement
142892,mac os x hang use eclipse release,RESOLVED NOT_ECLIPSE,P3 critical with 1 vote
142893,text key find library report use different resource file,RESOLVED FIXED,P2 normal
142894,background image simple master page show,RESOLVED FIXED,P3 normal
142895,background image simple master page always show upper leave corner,RESOLVED FIXED,P2 normal
142896,key bind interfere text entry,ASSIGNED,P3 normal
142897,compiler cannot resolve type inner class bound generic type,VERIFIED FIXED,P3 normal
142898,select project add repository query cause update,RESOLVED FIXED,P2 normal
142899,intelligent group sort members,ASSIGNED,P3 enhancement with 1 vote
142900,monitor agents attach execute cannot terminate,CLOSED DUPLICATE of bug 142346,P1 critical
142901,default time zone set set user exception,RESOLVED FIXED,P3 major
142902,plugin incorrectly make internal class visible,RESOLVED FIXED,P2 normal
142903,documentation improvements extension point schemas,RESOLVED FIXED,P3 minor
142904,click table firefox cause font problems document exist toc,RESOLVED DUPLICATE of bug 75272,P3 normal
142905,dialog need overhaul,RESOLVED INVALID,P3 enhancement
142906,use history view show repository task history,RESOLVED FIXED,P3 enhancement
142907,update manager claim missig feature,RESOLVED INVALID,P3 normal
142908,plugin compile error,RESOLVED INVALID,P3 normal
142909,build note platform build still incomplete outdated,RESOLVED DUPLICATE of bug 170545,P3 normal
142910,option automatically select default mirror site,RESOLVED WORKSFORME,P3 normal
142911,double click annotations line empty rise bookmark,CLOSED FIXED,P3 normal
142912,typo idebugcontextmanager class javadoc,VERIFIED FIXED,P3 trivial
142913,empty name create jsp,RESOLVED WORKSFORME,P3 normal
142914,launch code destroy code,CLOSED FIXED,P3 normal
142915,cannot bind incomplete key sequence,CLOSED FIXED,P1 blocker
