id,title,status,importance
482325,na would like add tweet new talk submit,RESOLVED FIXED,P3 normal
482326,plugins embed iframe need title,RESOLVED FIXED,P3 normal
482327,support multiple versions bundle,NEW,P3 normal
482328,problem format sql xml tag,RESOLVED WONTFIX,P3 enhancement
482329,error log verification listen events contexts,RESOLVED FIXED,P3 normal
482330,please include setup project jubula,RESOLVED FIXED,P3 enhancement
482331,cannot install developer statistics code recommenders,RESOLVED FIXED,P3 normal
482332,click figure find anchor,CLOSED FIXED,P1 critical
482333,invalid viewport open graph,RESOLVED FIXED,P3 normal
482334,update site hudson,CLOSED FIXED,P3 normal
482335,tab deletion,NEW,P3 normal
482336,qemu terminate suspend,RESOLVED INVALID,P3 normal
482337,riena maybe affect commons collections deserialization problem,CLOSED WONTFIX,P3 critical
482338,call null,RESOLVED FIXED,P3 normal
482339,open none workspace lead illegalargumentexception,NEW,P3 normal
482340,synchronous call animate execution terminate,RESOLVED FIXED,P3 enhancement
482341,add test plugin parametric diagram,CLOSED FIXED,P3 normal
482342,accept event action remain animate object execute wait,RESOLVED FIXED,P3 enhancement
482343,open empty lead saxparserexception,NEW,P3 normal
482344,duplicate version profile model creation,RESOLVED FIXED,P3 minor
482345,change fxmarqueeondragpolicy class attribute methods protect,RESOLVED DUPLICATE of bug 478901,P3 normal
482346,problem format ibm unrecognized,RESOLVED FIXED,P3 normal
482347,create internal block diagram class stereotype extend block,NEW,P3 normal
482348,change fxmarqueeondragpolicy class attribute methods protect,RESOLVED DUPLICATE of bug 482345,P3 normal
482349,generate msi installer,NEW,P3 normal
482350,expand treeitems get time slower,CLOSED FIXED,P3 major
482351,configurationconverter fail collections,RESOLVED DUPLICATE of bug 470781,P3 major
482352,stereotype compartments cannot hide,NEW,P3 normal
482353,possible display connector type associationblock,NEW,P3 normal
482354,svn checkout deadlocks eclipse,VERIFIED FIXED,P3 normal
482355,resource marker show generate editors,CLOSED FIXED,P3 normal
482356,add theme,NEW,P3 enhancement
482357,association read elements,NEW,P3 normal
482358,plugin xtend nosuchmethoderror,RESOLVED FIXED,P3 major
482359,npe throw initialization cyclic call pattern,RESOLVED FIXED,P3 critical
482360,restore change report,CLOSED FIXED,P3 normal
482361,git plug work mark override,NEW,P3 normal
482362,infinite loop infinitecanvas class,RESOLVED FIXED,P3 normal
482363,please windows test machine,CLOSED FIXED,P3 major
482364,updatevaluestrategy provide factory methods create strategy converter,RESOLVED FIXED,P3 normal
482365,provide upgrade capability hudson,CLOSED FIXED,P3 normal
482366,npe open model instancespecifications,CLOSED FIXED,P3 normal
482367,add factory create iconverter lamda expressions,RESOLVED FIXED,P3 normal
482368,npe generation data inheritance,NEW,P3 blocker
482369,diagram visible unable add items,RESOLVED INVALID,P3 normal
482370,thank,CLOSED WORKSFORME,P3 normal
482371,organize import remove annotation import,NEW,P3 normal
482372,registry map celleditorconfigurationfactory must map integer list instead one iaxiscelleditorconfiguration,RESOLVED FIXED,P3 normal
482373,ansi cod support,ASSIGNED,P3 enhancement
482374,api,RESOLVED FIXED,P3 normal
482375,generator service concept,NEW,P3 normal
482376,master repository provider concept,RESOLVED FIXED,P3 normal
482377,bad permissions download area,CLOSED FIXED,P3 normal
482378,top line border compartments overlap figure set,RESOLVED FIXED,P3 normal
482379,di work case,CLOSED FIXED,P1 critical
482380,isolate annotation processor classloader annotations class path,CLOSED FIXED,P3 major
482381,overall bugfixes enhancements osx tvos fork,CLOSED WONTFIX,P3 normal
482382,api removal process incomplete removal type,RESOLVED FIXED,P3 major
482383,icon viewpoint generate malformedurlexception,RESOLVED FIXED,P3 normal
482384,arm thumb crawler function without epilogue,NEW,P3 normal
482385,bash comment windows cmd file,RESOLVED FIXED,P3 minor
482386,limit tabs automatically close first save tabs user open new tab,CLOSED WORKSFORME,P3 enhancement
482387,add arm source fragment,CLOSED FIXED,P3 normal with 1 vote
482388,invalid project include path,CLOSED INVALID,P3 major with 1 vote
482389,illegal character discover constraint template,RESOLVED FIXED,P3 normal
482390,moka shall provide specific viewpoint ease executable model,REOPENED,P3 enhancement
482391,dsml overwrite package default uml package,RESOLVED DUPLICATE of bug 484464,P3 normal
482392,npe try terminate suspend debug session,CLOSED FIXED,P3 normal
482393,npe push hook without specify remote name,RESOLVED FIXED,P3 normal
482394,moka viewpoint shall provide smart strategies,ASSIGNED,P3 enhancement
482395,moka viewpoint shall provide smart advices,ASSIGNED,P3 enhancement
482396,moka viewpoint shall provide filter palettes,ASSIGNED,P3 enhancement
482397,moka viewpoint shall provide filter property view,ASSIGNED,P3 enhancement
482398,moka viewpoint shall provide filter model explorer,ASSIGNED,P3 enhancement
482399,moka shall preference activate deactivate moka viewpoint,ASSIGNED,P3 enhancement
482400,moka viewpoint shall provide contextual text editors,ASSIGNED,P3 enhancement
482401,generic configurations preference page,NEW,P3 normal
482402,add incquery addons maven repository,RESOLVED FIXED,P3 normal
482403,adapt templates use type control metadata,RESOLVED FIXED,P3 critical
482404,move label correctly identify coordinationchange,CLOSED FIXED,P3 normal
482405,messagerecv create lifeline top messagereply creation,NEW,P3 normal
482406,bundleexception start ice,CLOSED FIXED,P3 normal
482407,change package fragmentation cause npe,CLOSED FIXED,P3 normal
482408,packagebinding annotations available,NEW,P3 normal
482409,fix issue mac swt port,NEW,P3 normal with 1 vote
482410,messageoccurencespecification contain within interactionoperand,NEW,P3 normal
482411,wrong order relate elements,CLOSED FIXED,P3 normal
482412,add discussion regard project independence,NEW,P3 normal
482413,erroneous format leave curly brace line wrap,CLOSED WORKSFORME,P3 normal
482414,enable gerrit eclipse project handbook,CLOSED FIXED,P3 normal
482415,create maven build eclipse project handbook,RESOLVED FIXED,P3 normal
482416,compiler regression,VERIFIED FIXED,P3 normal
482417,filterabletreeitem sortabletreeitem fail compile,RESOLVED FIXED,P3 normal
482418,fonticonviewskin use internal javafx methods unused code part,RESOLVED FIXED,P3 normal
482419,remove unnecessary useage behavior,RESOLVED FIXED,P3 normal
482420,remove behavior useage styledlabelskin,RESOLVED FIXED,P3 normal
482421,invalid argument math function,RESOLVED FIXED,P3 normal
482422,remove styledtextbehavior use internal apis,RESOLVED FIXED,P3 normal
482423,,RESOLVED FIXED,P3 normal
482424,trademark approval require geobench,RESOLVED FIXED,P3 normal
482425,mentor require geobench,RESOLVED FIXED,P3 normal
482426,make messagedialog run api,RESOLVED FIXED,P3 normal
482427,eclipse search list result firefrox,RESOLVED FIXED,P3 normal
482428,support fxcanvas,RESOLVED FIXED,P3 normal
482429,getvaluelabels fall back getoptions contain value,RESOLVED FIXED,P3 enhancement
482430,gitflow action available repositories project,RESOLVED FIXED,P3 normal
482431,jrebel installation effect,CLOSED WORKSFORME,P3 blocker
482432,websocket handle frame byte incorrectly,RESOLVED FIXED,P3 normal
482433,update ant,VERIFIED FIXED,P3 enhancement
482434,fix handle export service package version,RESOLVED FIXED,P3 normal
482435,eclipse pdt hang run debug view xdebug,CLOSED DUPLICATE of bug 482436,P3 major
482436,eclipse pdt hang run debug view xdebug,CLOSED FIXED,P3 major
482437,firewall dialog windows test machine,CLOSED FIXED,P3 normal
482438,get non pretty print json,RESOLVED FIXED,P3 enhancement
482439,build fail miss file,CLOSED INVALID,P3 trivial
482440,lambda overload resolution generic lambda method,VERIFIED FIXED,P3 normal
482441,generic method interface generic method allow lambda expression,VERIFIED INVALID,P3 normal
482442,android service keep connection alive android,RESOLVED WORKSFORME,P3 critical
482443,table catalog integrate fully viewpoint mechanism provide table create,RESOLVED FIXED,P3 normal
482444,ensure compatibility,RESOLVED FIXED,P3 normal
482445,feature,RESOLVED FIXED,P3 critical
482446,hide activate functionality default,RESOLVED FIXED,P3 critical
482447,vertical scroll bar flicker java editor,CLOSED DUPLICATE of bug 480458,P3 normal with 1 vote
482448,provide way inspect contain repositories view,NEW,P3 enhancement
482449,provide way inspect contain pack index repositories view,NEW,P3 enhancement
482450,generate media example reuse,NEW,P3 normal
482451,add swagger ui support runtime well static documentation,CLOSED MOVED,P3 normal
482452,viewer runtime doesnt w,NEW,P3 major
482453,suppress release note,CLOSED FIXED,P3 normal
482454,provide better support mac os x,RESOLVED FIXED,P3 normal
482455,fun allow reference local function outside,NEW,P3 normal
482456,add extension point geometry page provider,UNCONFIRMED,P3 normal
482457,jvm crash debian,CLOSED WORKSFORME,P3 critical
482458,configure index update site,CLOSED FIXED,P3 enhancement
482459,neon update site seem functionnal,CLOSED FIXED,P3 blocker
482460,designer start fail launcher unable locate companion share,CLOSED MOVED,P3 normal
482461,point non exist update site emf,VERIFIED FIXED,P3 normal
482462,make local repository default,RESOLVED FIXED,P3 critical
482463,optimize preface frame write,RESOLVED MOVED,P3 normal
482464,delete artifact leave partial remnants behind,ASSIGNED,P3 normal
482465,fail catch exception,NEW,P3 normal
482466,bundle pool analyzer detect damage folders,RESOLVED FIXED,P3 normal
482467,classcastexception,CLOSED FIXED,P3 normal
482468,jbfatalabortexception,CLOSED WORKSFORME,P3 normal
482469,targzarchiver properly handle symlinks contain,RESOLVED FIXED,P3 normal
482470,tycho build create even think product define different launcher name,CLOSED DUPLICATE of bug 327707,P3 normal
482471,codeformatter extension point use,RESOLVED FIXED,P3 normal
482472,properties view protocol refresh correctly,CLOSED FIXED,P3 normal
482473,new text template multi line text field,RESOLVED WONTFIX,P3 enhancement
482474,provide configuration pomless build,RESOLVED FIXED,P3 enhancement
482475,delete hide elements diagram,NEW,P3 enhancement
482476,computesize calculate wrong width set alignment,VERIFIED FIXED,P3 normal
482477,import pingpong static attribute default value code generation compilation error,CLOSED FIXED,P3 normal
482478,code select resolve elements correctly file,RESOLVED WORKSFORME,P3 normal
482479,derive base file allow import parent translation key,RESOLVED FIXED,P3 normal
482480,structure view model,NEW,P3 enhancement
482481,sort make bad assumptions task type,RESOLVED FIXED,P3 normal
482482,allow subclasses filtereditemsselectiondialog nest list extend area inside sashform,NEW,P3 enhancement
482483,behavior component semantic,RESOLVED FIXED,P3 normal
482484,import pingpong umlrtmain function,CLOSED FIXED,P3 normal
482485,expand treeitems get time slower,CLOSED DUPLICATE of bug 482606,P3 major
482486,change use varargs,RESOLVED FIXED,P3 normal
482487,tycho support pomless product build,RESOLVED FIXED,P3 enhancement with 2 votes
482488,fail due emf,RESOLVED FIXED,P3 normal
482489,wrong email na site,RESOLVED FIXED,P3 normal
482490,show keybinding quickmenu pure,NEW,P3 normal
482491,eine um quivalente regeln f¨¹r unterklassen mit einer gemeinsamen abstrakten oberklasse einer regel zusammenfassend zu,CLOSED FIXED,P3 enhancement
482492,der zur auswahl und zum hinzuf¨¹gen erstellter,NEW,P3 enhancement
482493,allow leshan hipp release maven,CLOSED FIXED,P3 normal
482494,extract javascript relate runtime separate plugin,RESOLVED FIXED,P3 major
482495,extract command relate runtime separate plugin,RESOLVED FIXED,P3 major
482496,hipp help cannot upgrade smarthome hipp instance,CLOSED FIXED,P3 normal
482497,externalize,RESOLVED INVALID,P3 minor
482498,resourcepersister save corner case fail,CLOSED FIXED,P3 normal
482499,webappcontext sethandler nullpointerexception,CLOSED DUPLICATE of bug 486530,P3 normal
482500,invocationexception generation project,NEW,P3 critical
482501,event send composite,ASSIGNED,P3 minor
482502,expose apache velocity users,RESOLVED FIXED,P3 enhancement
482503,structure remove port position preference,RESOLVED DUPLICATE of bug 482504,P3 normal
482504,structure position preference remove,CLOSED FIXED,P3 normal
482505,update eslint,RESOLVED FIXED,P3 enhancement
482506,load test fail,RESOLVED FIXED,P3 normal
482507,support multiple level submodule directory,RESOLVED FIXED,P3 normal
482508,limit submodule path selection repository folder,RESOLVED FIXED,P3 normal
482509,update tern,RESOLVED FIXED,P3 enhancement
482510,read link action map,UNCONFIRMED,P3 normal
482511,keyboard shortcuts disable switch perspectives,RESOLVED WORKSFORME,P3 normal
482512,update acorn,RESOLVED FIXED,P3 enhancement
482513,exceptions throw dispose listener prevent disposal,RESOLVED FIXED,P3 normal
482514,concurrentmodificationexception run workflow eclipse guava,CLOSED FIXED,P3 normal
482515,hide badge spotlight area marketplace,RESOLVED FIXED,P3 normal
482516,windows xp eclipse mar installation,RESOLVED WORKSFORME,P3 normal
482517,cannot install api converter jubula,CLOSED FIXED,P3 normal
482518,,RESOLVED FIXED,P3 normal
482519,patch stick merge,RESOLVED FIXED,P3 blocker
482520,,RESOLVED FIXED,P3 normal
482521,update embed maven runtime maven better,RESOLVED FIXED,P3 normal
482522,mutation observer content assist tooltip resize cause duplicate content firefox,RESOLVED FIXED,P3 normal
482523,default call gc idle thread exhaust idle eclipse pop,RESOLVED FIXED,P4 enhancement
482524,frame need take account,RESOLVED FIXED,P3 normal
482525,import pingpong operation return type const char generate correctly,CLOSED FIXED,P3 normal
482526,update doctrine,RESOLVED FIXED,P3 enhancement
482527,nullpointerexception,NEW,P3 normal with 1 vote
482528,add support properties view specification,CLOSED FIXED,P3 enhancement
482529,update estraverse,RESOLVED FIXED,P3 enhancement
482530,visualization add plot one first add one display,ASSIGNED,P3 normal
482531,include github issue tab release,NEW,P3 normal
482532,improve operationcallexp etc flexibility,NEW,P3 normal
482533,repository reference dropdowns need name,CLOSED DUPLICATE of bug 495029,P3 normal
482534,persist task review mappings,RESOLVED FIXED,P3 enhancement
482535,application republish fail due miss stop call restartoperation,RESOLVED FIXED,P3 critical
482536,js hover service break file meta data parent empty,RESOLVED FIXED,P3 normal
482537,update,NEW,P3 normal
482538,name label name nod allow,CLOSED FIXED,P3 normal
482539,static data preclude ability easily romed,CLOSED WONTFIX,P3 normal
482540,cannot scroll tooltip jsdoc hover work well content,RESOLVED FIXED,P2 normal
482541,provide api synchronizejobs disable show progress,RESOLVED WONTFIX,P3 normal
482542,transaction lock table statement cause deadlock,NEW,P3 critical
482543,diagram update action property change,RESOLVED FIXED,P3 minor
482544,different workflow emf henshin similar task,RESOLVED WONTFIX,P3 minor
482545,jsonobject string constructor accept invalid json,NEW,P3 normal
482546,fail error,CLOSED INVALID,P3 blocker
482547,honor eclipse proxy settings contact server,RESOLVED FIXED,P3 enhancement
482548,german locale trigger profile name cannot contain,ASSIGNED,P3 normal
482551,potential indexoutofboundsexception nullpointerexception,RESOLVED FIXED,P3 normal
482552,web project multiple languages generate multiple servlets,CLOSED INVALID,P3 normal
482553,unable execute abap program eclipse,RESOLVED NOT_ECLIPSE,P3 normal
482554,warn,VERIFIED FIXED,P3 normal
482555,append stats uris,RESOLVED FIXED,P3 enhancement
482556,bcexception,NEW,P3 major
482557,add use id field meta model,ASSIGNED,P3 normal
482558,order magnitude slower cmdline,CLOSED INVALID,P3 normal
482559,work resume client get http,NEW,P3 minor
482560,internal error move nest class file,VERIFIED NOT_ECLIPSE,P3 normal
482561,relocate repository project root work copy disk,RESOLVED FIXED,P3 normal
482562,cdt switch workspace error,NEW,P3 normal
482563,interference figure correct type jdk,VERIFIED INVALID,P3 normal
482564,cannot reset password require field miss,RESOLVED DUPLICATE of bug 482581,P3 normal
482565,prompt ask project relocation show loop forever,RESOLVED FIXED,P3 normal
482566,nohttpresponseexception use digest,RESOLVED MOVED,P3 normal
482567,umlrt viewpoint cause double menu choices create class diagram,CLOSED FIXED,P3 normal
482568,extend command service template mac specifics,RESOLVED FIXED,P3 minor
482569,invalid textual representation classifier behavior class latter compile,UNCONFIRMED,P3 enhancement
482570,compiler warn,VERIFIED FIXED,P3 normal
482571,upgrade software installation dialog screenshot,RESOLVED FIXED,P3 normal
482572,gerrit job fail insufficient memory,RESOLVED WORKSFORME,P3 normal
482573,mavenmaterializepomwizard allow empty fail finish,CLOSED WONTFIX,P3 normal
482574,archive,CLOSED FIXED,P3 trivial
482575,additional server link dialog nothing,NEW,P3 normal
482576,fix performance issue pde,RESOLVED FIXED,P3 normal
482577,investigate manifest editor performance issue large manifest,RESOLVED WONTFIX,P3 normal
482578,syntax color new keywords,RESOLVED FIXED,P3 enhancement
482579,version builder complain lax lower bound lower bind empty version,RESOLVED FIXED,P3 normal
482580,creation tiaki git repo,RESOLVED FIXED,P3 normal
482581,cannot update password,RESOLVED FIXED,P3 normal
482582,option create source wizard,CLOSED DUPLICATE of bug 488748,P3 enhancement
482583,allinstances return orderedset,NEW,P3 enhancement
482584,assign key bind open menu,NEW,P3 enhancement
482585,testcase cannot de delete though use test suite,CLOSED WORKSFORME,P3 normal
482586,anchor work oval,RESOLVED FIXED,P3 normal
482587,create diagram mark model dirty model possible save,ASSIGNED,P3 major
482588,marketplace drag install work microsoft edge microsoft explorer,RESOLVED FIXED,P3 normal
482589,show snippets also mwindow model editor,RESOLVED FIXED,P3 normal
482590,apache vulnerability,RESOLVED FIXED,P3 normal
482591,product editor start level add recommend add,CLOSED DUPLICATE of bug 485584,P3 normal
482592,eclipse hang everytime make change code,NEW,P3 normal
482593,fbuilderroccured never set true,NEW,P3 normal
482594,contenttype respect multiple codeedit instance,CLOSED WONTFIX,P3 normal
482595,enable gerrit xsd,CLOSED FIXED,P3 normal
482596,provide way get access commandlauncher,NEW,P3 normal
482597,http preview publish error,NEW,P3 normal with 6 votes
482598,windows hudson fail input redirection error,RESOLVED FIXED,P3 normal
482599,capsule part service port position relative position capsule,CLOSED FIXED,P2 normal
482600,maven console break eclipse dsl developers,RESOLVED FIXED,P3 normal
482601,color incorrectly reset,NEW,P3 normal
482602,put breakpoints comment define throw npe,CLOSED FIXED,P3 normal
482603,cannot cycle editors target focus,VERIFIED FIXED,P3 normal
482604,search list name match first,CLOSED DUPLICATE of bug 506823,P3 normal
482605,javadoc view eclipse work xtend file,UNCONFIRMED,P3 normal
482606,expand treeitems get time slower,CLOSED FIXED,P3 normal
482607,exist index read egit show wrong status error,RESOLVED FIXED,P3 normal
482608,griditems get register twice objectregistry lead crash destruction,RESOLVED FIXED,P3 normal
482609,debug xdebug ssh tunnel still work,CLOSED DUPLICATE of bug 478402,P3 normal
482610,image containers view sometimes reflect connection state,RESOLVED FIXED,P3 normal
482611,papyrus must provide api manipulate table,RESOLVED FIXED,P3 normal
482612,update escope,RESOLVED FIXED,P3 enhancement
482613,text editor gutter border cannot style,NEW,P3 normal
482614,git base master repository,RESOLVED FIXED,P3 normal
482615,link feedback edge label currently cap layout bound visual edgecontentpart,RESOLVED FIXED,P3 normal
482616,provide rule irregular whitespaces,RESOLVED FIXED,P3 normal
482617,update platform development help content,CLOSED DUPLICATE of bug 494642,P3 normal
482618,arm crawler issue question,NEW,P3 major
482619,consume quote rule,RESOLVED FIXED,P3 enhancement
482620,impossible push git project pmf,RESOLVED FIXED,P3 normal
482621,rebase conflict flow break,CLOSED FIXED,P3 normal
482622,attribute name upcase find,RESOLVED FIXED,P3 normal
482623,dead resource site,RESOLVED WORKSFORME,P3 normal
482624,equinox storage unstable due optimistic use,RESOLVED FIXED,P3 normal
482625,cannot find eclipse mar,CLOSED NOT_ECLIPSE,P3 normal
482626,eliminate unnecessary import oppose reorganize,RESOLVED WORKSFORME,P3 enhancement
482628,eventspy leak class hudson build,RESOLVED NOT_ECLIPSE,P3 major
482629,grid line correctly print,CLOSED FIXED,P3 normal
482630,content print,CLOSED FIXED,P3 normal
482631,grid line color configuration apply regions,CLOSED FIXED,P3 normal
482632,branch release,RESOLVED FIXED,P3 enhancement
482633,connectors suggest query title,RESOLVED FIXED,P3 enhancement
482634,callbacks call multiple,CLOSED MOVED,P3 normal
482635,http request origin server https proxy contain absolute url,RESOLVED MOVED,P3 normal
482636,network connection error active provider show nothing proxy entries cannot edit,CLOSED DUPLICATE of bug 479075,P3 critical
482637,certain file break transfer browser jetty base ssl websocket server,CLOSED DUPLICATE of bug 481567,P3 critical
482638,install maven hipp,CLOSED FIXED,P3 enhancement
482639,platformresourcemap initialization need support different project layouts,NEW,P3 normal
482640,target editor improvements,RESOLVED FIXED,P3 normal
482641,eventspy leak class hudson build,NEW,P3 major
482642,performance,RESOLVED WONTFIX,P3 normal
482643,performance,RESOLVED FIXED,P3 normal
482644,invalid handle state,UNCONFIRMED,P3 normal
482645,support sysml port nest,NEW,P3 normal with 2 votes
482646,synchronization connection point,UNCONFIRMED,P3 normal
482647,mperspective also extend mbindings,RESOLVED FIXED,P3 normal
482648,sequence diagram refresh check ipermissionauthority refresh,CLOSED FIXED,P3 normal
482649,rework commandserviceaddon,RESOLVED FIXED,P3 normal
482650,rework contextserviceaddon,RESOLVED WORKSFORME,P3 normal
482651,rework bindingserviceaddon,RESOLVED WORKSFORME,P3 normal
482652,state cannot composite,UNCONFIRMED,P3 normal
482653,rework commandprocessingaddon,RESOLVED WORKSFORME,P3 normal
482654,port circular unwire plain unconjugated,CLOSED DUPLICATE of bug 476882,P3 enhancement
482655,restrictive rule eef initializer composition initialization,CLOSED FIXED,P3 normal
482656,splitted separate accelo dependencies,NEW,P3 enhancement
482657,different state state diagram,UNCONFIRMED,P3 normal
482658,quality requirements model must evaluate build test phase,NEW,P3 enhancement
482659,numericalhelper support,CLOSED FIXED,P3 normal
482660,comment constraint nod shall use generic figure,NEW,P3 normal
482661,add xpaths model contribution test,RESOLVED FIXED,P3 normal
482662,rtcppproperties profile lot dangle properties,CLOSED FIXED,P3 normal
482663,infinite loop jdt completion parser,NEW,P3 normal
482664,java editor cannot compile call method reference argument,CLOSED DUPLICATE of bug 485057,P3 normal
482665,formatter ignore last hide region document,CLOSED FIXED,P3 normal
482666,performance improve,RESOLVED FIXED,P3 normal
482667,javafx toolkit treeview wrong node select,CLOSED DUPLICATE of bug 479625,P3 normal
482668,memory leak due list support components never clear aut,CLOSED FIXED,P3 normal
482669,new palette configuration model shall editable advance ui,RESOLVED FIXED,P3 normal
482670,httpuri wrongly parser uri paths start,RESOLVED FIXED,P3 normal
482671,shortcut switch view wrong behavior since mar release,RESOLVED WORKSFORME,P3 major
482672,benchmark command line interface,ASSIGNED,P2 enhancement
482673,performance improve,RESOLVED FIXED,P3 normal
482674,papyrus hipp update fail,CLOSED FIXED,P3 normal
482675,negative bigdecimal number export string,CLOSED FIXED,P3 normal
482676,concurrentmodificationexception open nest graph use java,RESOLVED FIXED,P3 normal
482677,miss parenthesis debugantlrgrammar,CLOSED FIXED,P3 critical
482678,hello test,CLOSED NOT_ECLIPSE,P3 normal
482679,test hello,CLOSED NOT_ECLIPSE,P3 normal
482680,performance look command element id could,RESOLVED FIXED,P3 normal
482681,session unnecessarily terminate initial source file find,CLOSED FIXED,P3 normal
482682,make prototype web site,CLOSED WONTFIX,P3 normal
482683,make prototype web site,CLOSED FIXED,P3 normal
482684,configdescriptionparameter methods return null,RESOLVED FIXED,P3 normal
482685,failure,RESOLVED FIXED,P3 major
482686,istreamwrapper configurable,RESOLVED FIXED,P3 enhancement
482687,canundo call twice,RESOLVED INVALID,P3 normal
482688,hudson git plugin clone http authentification fail first time,NEW,P3 normal
482689,drop constraint compartment constraint cannot display,CLOSED FIXED,P3 major
482690,better name tab editor,RESOLVED WONTFIX,P3 normal
482691,capsulepart capsule icon,CLOSED FIXED,P3 enhancement
482692,optional capsule hatch pattern,CLOSED FIXED,P3 enhancement
482693,bpuserlibraryelement constructor update parent give children,RESOLVED FIXED,P3 normal
482694,multiple capsule part show stack capsuleparts,CLOSED FIXED,P3 enhancement
482695,share capsulepart dash border,CLOSED FIXED,P3 enhancement
