id,title,status,importance
487354,abort request response send frame,RESOLVED FIXED,P3 normal
487355,oomph installer os x inform user jdk require,REOPENED,P3 major
487356,code generation fail connectors,CLOSED FIXED,P3 normal
487357,content findreplacedialog hide,VERIFIED FIXED,P5 enhancement
487358,depend clip region debian,RESOLVED WORKSFORME,P3 normal
487359,give pls admin access github,NEW,P3 enhancement
487360,mar installer accessible use jaw screenreader,NEW,P3 normal
487361,set background color column header effect,CLOSED FIXED,P3 normal
487362,publish neon installers,RESOLVED FIXED,P3 critical
487363,variable declaration object update unnecessarily,RESOLVED FIXED,P3 normal
487364,css base consider relayouting,RESOLVED FIXED,P3 normal
487365,hipp jts,RESOLVED FIXED,P3 normal
487366,mylyn hipp cannot connect,CLOSED FIXED,P3 normal
487367,maven profile work,CLOSED WONTFIX,P3 normal
487368,maven profile work,CLOSED DUPLICATE of bug 487367,P3 normal
487369,maven profile work,CLOSED DUPLICATE of bug 487367,P3 normal
487370,maven custom filter work,ASSIGNED,P3 normal with 1 vote
487371,preferences save xml blob never update,RESOLVED FIXED,P3 normal
487372,change call convention methods receive iprogressmonitor,RESOLVED FIXED,P3 normal
487373,clean callisto page,RESOLVED FIXED,P4 minor
487374,mac test fail,CLOSED FIXED,P3 normal
487375,block comment front method signature effect much indentation,VERIFIED FIXED,P3 normal
487376,previously use luna try mar ui mess large toolbar icons border,NEW,P3 normal
487377,json preference page throw exceptions,RESOLVED FIXED,P3 normal
487378,aggregate outstanding feedback locationtech website refresh,RESOLVED FIXED,P3 normal
487379,project depend extension point,RESOLVED FIXED,P3 normal
487380,setup neon build,CLOSED FIXED,P3 normal
487381,controller implementation unfair,CLOSED FIXED,P3 normal
487382,cce team monitor,RESOLVED FIXED,P3 normal
487383,discrepancy eclipse compiler sun compiler use wildcards inference,CLOSED DUPLICATE of bug 492939,P3 normal
487384,eclipse unresponsive resize application,NEW,P3 normal
487385,,RESOLVED FIXED,P3 normal
487386,launch default configs reset target target,RESOLVED FIXED,P3 normal
487388,intermittent test,RESOLVED FIXED,P3 normal
487389,unable include logo,RESOLVED FIXED,P3 normal
487390,aioobe throw compile lambda functional type syntax error,VERIFIED FIXED,P3 normal
487391,detect super type cycle due new rule jls,NEW,P3 normal
487392,whole word start,CLOSED DUPLICATE of bug 253236,P3 normal
487393,cla form link send,RESOLVED FIXED,P2 major
487394,reset elements section work,CLOSED INVALID,P3 normal
487395,eclipse run anymore,NEW,P3 normal
487396,eclipse run anymore,CLOSED DUPLICATE of bug 487395,P3 normal
487397,chrome debugger crash console output,RESOLVED WONTFIX,P3 major
487398,sockettimeoutexception send onwebsocketerror,CLOSED MOVED,P3 normal
487399,update site content run markdown engine,RESOLVED FIXED,P4 critical
487400,enable filter classpath tab entries,RESOLVED FIXED,P3 enhancement
487401,add new template variable name,RESOLVED WONTFIX,P3 enhancement
487402,internal error occur error log entry,RESOLVED WONTFIX,P3 normal
487405,please include setup project,RESOLVED FIXED,P3 enhancement
487406,add alternative resize cursors,CLOSED FIXED,P3 enhancement
487407,export diagram project explorer log many exceptions,NEW,P3 normal
487408,bogus resource leak warn reuse resource variable,ASSIGNED,P3 normal
487409,document use,NEW,P3 normal
487410,improve sign check use equinox service,NEW,P3 enhancement
487411,improve versioning check report,NEW,P3 enhancement
487412,add statistics repositories,NEW,P3 enhancement
487413,add integration test report application build,NEW,P3 normal
487414,check validity input file,NEW,P3 enhancement
487415,extend header layer support n selectionlayer reference,CLOSED FIXED,P3 enhancement
487416,widget dispose close dialog nattable,CLOSED FIXED,P3 normal
487417,protect duplicate name,RESOLVED FIXED,P3 enhancement
487418,nullpointerexception legacyhandlerservice,RESOLVED FIXED,P3 normal
487419,modify handle export failure case,RESOLVED FIXED,P3 normal
487420,sftp problem,RESOLVED WONTFIX,P2 normal
487421,support java options command line compiler,RESOLVED FIXED,P3 normal
487422,rov leak memory simple loop,CLOSED FIXED,P3 major
487423,dark mode need serious help,CLOSED WORKSFORME,P3 normal
487424,nosuchmethoderror,RESOLVED FIXED,P3 normal
487425,,RESOLVED NOT_ECLIPSE,P3 normal
487426,error connect marketplace,RESOLVED INVALID,P3 major
487427,reference longer display dash border line ibd,CLOSED FIXED,P3 normal
487428,direct edit tree elements start press,CLOSED FIXED,P3 normal
487429,save action cleanup action create syntax error,RESOLVED FIXED,P3 normal
487430,improve compartment border management,CLOSED FIXED,P3 normal
487431,multi drop port supperposed,NEW,P3 enhancement
487432,migrate feature extra designer,RESOLVED FIXED,P3 normal
487433,clean old folders,CLOSED FIXED,P3 normal
487434,extract xtendcodecontexttype xtext plugin abstractxtextlanguageawarecontexttype,NEW,P3 normal
487435,exception shpinputstream import shapefile,RESOLVED FIXED,P3 normal
487436,install java os update,RESOLVED FIXED,P3 normal
487437,jsonb adapters implementation,RESOLVED FIXED,P3 normal
487438,help dialog lose title become use translation package,VERIFIED FIXED,P3 major
487439,basicindexoutofboundsexception,RESOLVED FIXED,P3 normal
487440,nullpointerexception,CLOSED FIXED,P3 normal
487441,align ua gerrit validation job ui job,RESOLVED FIXED,P3 normal
487442,elementtypeconfiguration framework profile stereotype,CLOSED FIXED,P3 enhancement
487443,operationcanceledexception,RESOLVED FIXED,P3 normal
487444,fail child process cannot breakaway parent job,RESOLVED FIXED,P3 normal
487445,derive action able apply stereotype case synchronization remove return parameter,ASSIGNED,P3 major
487446,merge code,RESOLVED FIXED,P3 normal
487447,xcore unmapped ecore model path,RESOLVED FIXED,P3 normal
487448,bug add optional parameter make template propose anymore,CLOSED DUPLICATE of bug 486903,P3 normal
487449,add description plugins feature,RESOLVED FIXED,P3 normal
487450,deployment model code generate exception,ASSIGNED,P3 normal
487451,plugins right place,ASSIGNED,P3 normal
487452,look,RESOLVED FIXED,P3 normal
487453,communication failures hudson gerrit,CLOSED FIXED,P3 critical
487454,external web browser parameters edit field taller eat,RESOLVED FIXED,P3 normal
487456,create first prototype designer web,CLOSED FIXED,P3 normal
487457,property order customization,RESOLVED FIXED,P3 normal
487458,remove repo hudson,NEW,P3 normal
487459,retire hipp move job back platform hipp,RESOLVED WONTFIX,P3 normal
487460,fire,RESOLVED FIXED,P3 normal
487461,use platform parent pom,NEW,P3 enhancement
487462,content assist background color select line miss,CLOSED WONTFIX,P3 major
487463,entries log hudson ci gerrit patch,CLOSED DUPLICATE of bug 487453,P3 normal
487464,,RESOLVED FIXED,P3 normal
487465,typescript debug,RESOLVED FIXED,P3 enhancement with 1 vote
487466,bundlefiles close removal pending wire uninstalled bundle shutdown,RESOLVED FIXED,P3 normal
487467,fail,RESOLVED FIXED,P3 normal
487468,provide repository report maven plugins,NEW,P3 enhancement
487469,push gerrit prohibit gerrit,RESOLVED INVALID,P3 normal
487470,use splitscreen dialog popups,CLOSED DUPLICATE of bug 478975,P3 normal
487471,comply eclipse look feel,RESOLVED FIXED,P3 normal
487472,disconnect close,UNCONFIRMED,P3 normal
487473,search result open new tabs,REOPENED,P3 normal
487474,unable debug mix code nashorn,NEW,P3 normal with 3 votes
487475,npe,CLOSED FIXED,P3 normal
487476,report executable,RESOLVED FIXED,P3 normal
487477,stackoverflowerror,RESOLVED FIXED,P3 normal
487478,create pom base build aggregator cbi hipp instance,RESOLVED FIXED,P3 normal
487479,hipp,RESOLVED INVALID,P3 normal
487480,runtimevalueseditionadviceconfiguration,CLOSED FIXED,P3 normal
487481,unit test failures recent,RESOLVED WORKSFORME,P3 normal
487482,several platform resources test fail linux run,RESOLVED FIXED,P3 normal
487483,events ignore generate code,RESOLVED MOVED,P3 critical
487484,eclipse team show history blank eclipse luna,CLOSED WORKSFORME,P3 normal
487485,image page next trim max image number max image,NEW,P3 enhancement
487486,ioexception fail create temp file rap hipp,CLOSED FIXED,P3 normal
487487,perform first stable release,RESOLVED FIXED,P3 enhancement
487488,concurrentmodificationexception,NEW,P3 normal
487489,dependency relationships model explorer nest aid readability uml,UNCONFIRMED,P3 normal
487490,associations model explorer collect together folder uml,ASSIGNED,P3 normal
487491,adjust swt templates provide default empty,RESOLVED WONTFIX,P3 normal
487492,formatter fail type parameters,RESOLVED DUPLICATE of bug 121728,P3 normal
487493,use varargs,RESOLVED FIXED,P3 normal
487494,show system explorer folder open select folder,NEW,P3 normal
487495,remove unnecessary whitespace template file,RESOLVED WONTFIX,P3 normal
487496,cannot delete elements generic tree table,CLOSED FIXED,P3 normal
487497,use default service,CLOSED FIXED,P3 normal
487498,delete action confuse,RESOLVED FIXED,P3 normal
487499,lock leave view close,RESOLVED FIXED,P3 normal
487500,association always create create part property ibd,NEW,P3 normal
487501,cannot move message easily lead poor usability,ASSIGNED,P3 normal with 1 vote
487502,java code style,RESOLVED WORKSFORME,P3 major
487503,switch one editor produce swtexception,CLOSED FIXED,P3 blocker
487504,activity seem wrong project github,RESOLVED WORKSFORME,P3 major
487505,arrow navigation context menus work firefox anymore,RESOLVED FIXED,P2 major with 2 votes
487506,notification display rss icon instead eclipse icon,CLOSED WONTFIX,P3 normal
487507,npe create new arm eclipse project,NEW,P3 normal
487508,nullpointer exception generate xtext,CLOSED FIXED,P3 blocker
487509,runtime service catalogue service,RESOLVED FIXED,P3 normal
487510,paths symbols reference,NEW,P3 normal
487511,jetty http work turkish,RESOLVED FIXED,P3 normal
487512,conflict resolution prevent eclipse select continue,NEW,P3 normal
487513,update site product deploy nexus,CLOSED FIXED,P3 enhancement
487514,basicfamily odesign reference basicfamily metamodel,NEW,P3 normal
487515,scout hipp instance write build result comment vote gerrit anymore,CLOSED DUPLICATE of bug 487453,P3 normal
487516,set bugzilla components read,RESOLVED FIXED,P3 normal
487517,provide child menu rtstate,CLOSED WONTFIX,P3 normal
487518,rtregion create add entry point state state machine diagram,CLOSED FIXED,P3 normal
487519,users profile picture gravatar include rest api,RESOLVED FIXED,P2 enhancement
487520,icons miss model explorer rtpseudostates,CLOSED FIXED,P4 normal
487521,merge deprecate module,CLOSED MOVED,P5 trivial
487522,widgets smaller heights,VERIFIED FIXED,P3 normal
487523,snippet invalid link snippets git repo,VERIFIED FIXED,P3 normal
487524,extension bundle content add framework creation unresolved,RESOLVED FIXED,P3 normal
487525,serialization would nice test would work,NEW,P3 normal
487526,new revers plugins,RESOLVED FIXED,P3 enhancement
487527,provide option user turn code fold completely,CLOSED WONTFIX,P4 normal
487528,hide elements change,RESOLVED FIXED,P3 enhancement
487529,show information upper section compare editor,RESOLVED FIXED,P3 enhancement
487530,allow different patch set select,RESOLVED FIXED,P3 enhancement
487531,wrong pathmap,RESOLVED FIXED,P3 normal
487532,code fold disable fold ruler show,RESOLVED FIXED,P3 normal
487533,fail delete statemachine,CLOSED FIXED,P3 normal
487534,patheditor support package drag drop,NEW,P3 enhancement with 2 votes
487535,propose contribute test cbi,RESOLVED FIXED,P3 normal
487536,binary container recognize binaries output folder project root,NEW,P3 normal
487537,resolve multiple framework extensions add content start extension activators,RESOLVED FIXED,P3 normal
487538,receive miss header,RESOLVED FIXED,P3 normal
487539,window render debug mode slow,RESOLVED WORKSFORME,P3 normal
487540,testbrokensymlinkattributes fail windows run,RESOLVED FIXED,P3 normal
487541,excessive memory usage memory leak run jetty jre,RESOLVED INVALID,P3 major
487542,propose move project cbi project,RESOLVED FIXED,P3 normal
487543,propose move project cbi project,RESOLVED FIXED,P3 normal
487544,bad layout start older workspace,NEW,P3 normal
487545,reply multi line comment may add single character line,RESOLVED FIXED,P3 normal
487546,unable submit additional reply httpresponseexception bad request,RESOLVED FIXED,P3 normal
487547,add discussion regard file,RESOLVED FIXED,P3 normal
487548,create command launch welcome questionnaire,RESOLVED FIXED,P3 normal
487549,ide doesnt run high resolution laptops,CLOSED DUPLICATE of bug 382972,P3 critical
487550,ide doesnt run high resolution laptops,CLOSED DUPLICATE of bug 487549,P3 critical
487551,junit test name break eclipse junit view,CLOSED DUPLICATE of bug 457515,P3 normal
487552,declare,RESOLVED FIXED,P3 normal
487553,final step release,RESOLVED FIXED,P3 normal
487554,add menu toolbar,VERIFIED FIXED,P3 enhancement with 1 vote
487555,error involve overload aggregate initialization,RESOLVED FIXED,P3 normal
487556,remove redundant type parameters,RESOLVED FIXED,P3 normal
487557,memleak,CLOSED FIXED,P3 normal
487558,remove orion project page,RESOLVED FIXED,P3 normal
487559,set enum value annotation nest enum,RESOLVED FIXED,P3 normal
487560,admin right,CLOSED FIXED,P3 normal
487561,use matchbasedconflictdetector lead false diff detection,RESOLVED FIXED,P3 normal
487562,hipp help,CLOSED FIXED,P3 normal
487563,eclipse compiler detect ambiguous method call like oracle compiler,CLOSED DUPLICATE of bug 485057,P3 critical
487564,provide reusable base implementation iurichangedetectordelegate uris hierarchical fragment,RESOLVED FIXED,P3 enhancement
487565,pmc able contact project,CLOSED WORKSFORME,P3 normal
487566,clean non php project throw exception log,CLOSED FIXED,P3 normal
487567,add update xx next update plan info dashboard homepage,RESOLVED FIXED,P3 normal
487568,testhyperlinkmatchsignatureextended fail,NEW,P3 normal
487569,jdt debug test testtranslatecontainers fail,RESOLVED FIXED,P3 normal
487570,move navigate maximize minimize current view editor windows appearance menu,RESOLVED FIXED,P3 normal
487571,improve statuspart,NEW,P3 normal
487572,use convertpath ant task resources without fail,RESOLVED FIXED,P3 normal
487573,delete branch repository,CLOSED FIXED,P3 normal
487574,open clipboard handle separator,ASSIGNED,P3 normal
487575,add shortcut open clipboard,CLOSED WORKSFORME,P3 enhancement
487576,source folder add plugin exclude eclipse build path contain non java resources,CLOSED DUPLICATE of bug 486721,P3 normal
487577,ist way trigger command url display,NEW,P3 normal
487578,hipp help hipp upgrade fail,RESOLVED FIXED,P3 major
487579,use builtin debugger instal,RESOLVED FIXED,P3 normal
487580,change git branch task activation,RESOLVED DUPLICATE of bug 309578,P3 enhancement
487581,display view proposals order wrong substring completion,RESOLVED FIXED,P3 major
487582,find,NEW,P3 normal
487583,add better support exceptions merge operations,ASSIGNED,P3 normal
487584,clarify avoid call,RESOLVED FIXED,P3 normal
487585,jubula git repository ci infrastructure components,RESOLVED FIXED,P3 enhancement
487586,intersection type wrongly claim functional interface,VERIFIED FIXED,P3 normal
487587,npe save perspectives relaunched eclipse mar,RESOLVED WORKSFORME,P3 critical
487588,fonts policy,RESOLVED FIXED,P3 normal
487589,maintenance update sit point mirror,NEW,P3 major
487590,eclipse installer oomph fail install mar,RESOLVED WORKSFORME,P3 blocker
487591,adapterfactory lower rank permanently favour load first,ASSIGNED,P3 normal
487592,merge exist object affect database object,NEW,P3 normal
487593,remove keybinding display command,VERIFIED FIXED,P3 normal
487594,error log file try open eclipse,VERIFIED WORKSFORME,P3 normal
487595,use modelexplorer tree within treecontentmergeviewer,CLOSED FIXED,P3 normal
487596,validation warn literals visibility explicitly set,UNCONFIRMED,P3 normal
487597,unable ssh,CLOSED FIXED,P3 critical
487598,eclipse block cod action,RESOLVED FIXED,P3 major
487599,comment include statement irrelevant,RESOLVED FIXED,P3 normal
487600,marketplace support units general,NEW,P3 enhancement
487601,committee members need able modify pc tag,RESOLVED WONTFIX,P3 normal
487602,selection lose filter event viewer,NEW,P3 normal
487603,file tab counter review file total number file,NEW,P3 enhancement
487604,explicit dependency system element support,CLOSED FIXED,P3 normal
487605,create updatesite papyrus designer,CLOSED FIXED,P3 normal
487606,detach windows take ui decorations parent window,VERIFIED FIXED,P3 minor
487607,,RESOLVED FIXED,P3 normal
487608,scm stats,RESOLVED FIXED,P3 normal
487609,fetch upstream multiple repos,CLOSED DUPLICATE of bug 349560,P3 enhancement
487610,possible memory leak cause indexmanager,NEW,P3 major
487611,significant cpu time consume save action,NEW,P3 major
487612,marketplace require feature,RESOLVED DUPLICATE of bug 469864,P3 normal
487613,,RESOLVED FIXED,P3 normal
487614,improve ability extend xbaseidecontentproposalprovider cleanly xbase grammar rule,NEW,P3 normal
487615,cannot read property null,CLOSED WONTFIX,P3 normal
487616,cannot read property null,CLOSED WONTFIX,P3 normal
487617,markdown editor lose content name change,RESOLVED FIXED,P3 normal
487618,work rename even though menu item shortcut,CLOSED WONTFIX,P3 normal
487619,would like migrate rtsc vserver,RESOLVED FIXED,P3 normal
487620,select port kind update port visibility,CLOSED FIXED,P3 normal
487621,toolbar appear choose editor last,VERIFIED FIXED,P3 normal
487622,register properly,CLOSED FIXED,P3 normal
487623,,RESOLVED FIXED,P3 normal
487624,error open gerrit review recent update connector,REOPENED,P3 critical
487625,code formatter mess scientific number depend previous code,NEW,P3 minor
487626,support headless mode installer,UNCONFIRMED,P3 enhancement with 10 votes
487627,illegalstateexception dispatchtargets,RESOLVED FIXED,P3 minor
487628,,RESOLVED FIXED,P3 normal
487629,cla check github branch,CLOSED FIXED,P3 normal
487630,support relaunch stop,NEW,P3 normal
487631,application archive resolve application,RESOLVED FIXED,P3 normal
487632,editor line number enough color contrast,RESOLVED FIXED,P2 normal
487633,build arduino due,RESOLVED FIXED,P3 normal
487634,ck argument esptool break nodemcu board,RESOLVED FIXED,P3 normal
487635,support optiboot bootloader programmers general,RESOLVED FIXED,P3 enhancement
487636,sync non translatable string,CLOSED FIXED,P3 normal
487637,fxtraversefocusontypepolicy reveal,RESOLVED FIXED,P3 normal
487638,invalid tokentype content assist parser,NEW,P3 major with 1 vote
487639,object map mode recognize newly open popup windows,CLOSED FIXED,P3 critical
487640,default preferences,RESOLVED FIXED,P3 normal
487641,performance issue standalone,CLOSED FIXED,P1 blocker
487642,performance problem jubula,CLOSED DUPLICATE of bug 487641,P3 normal
487643,npe shut eclipse,RESOLVED FIXED,P3 normal
487644,multiplicity attribute set,CLOSED WORKSFORME,P3 major
487645,remove pre java workarounds,RESOLVED FIXED,P3 normal
487646,remove versionized dependency,RESOLVED FIXED,P3 normal
487647,miss feature,RESOLVED FIXED,P3 normal
487648,scaledgraphics support,UNCONFIRMED,P3 normal
487649,plugins respect name convention,UNCONFIRMED,P3 normal
487650,many subscriptions take long time,CLOSED MOVED,P3 major
487651,nls miss,CLOSED FIXED,P3 normal
487652,specify change date file search,CLOSED DUPLICATE of bug 197470,P3 enhancement
487653,asynchronous text file buffer,NEW,P3 enhancement
487654,preference recorder save setttings click,CLOSED DUPLICATE of bug 480833,P3 minor
487655,update eclipse foundation gerrit user name,RESOLVED FIXED,P3 normal
487656,use compiler produce,RESOLVED FIXED,P3 normal
487657,multiple aut agent statuses status bar,CLOSED FIXED,P3 normal
487658,desktop icons superpose,NEW,P2 normal
487659,method body associate wrong method,RESOLVED FIXED,P3 normal
487660,methods class,RESOLVED FIXED,P3 normal
487661,revert require,RESOLVED FIXED,P3 normal
487662,resources way information show,NEW,P3 normal
487663,cache pathentrymanager,RESOLVED FIXED,P3 normal
487664,extract method fail report return select block contain one assignment local,ASSIGNED,P3 normal
487665,variables view content assist duplicate templates,NEW,P3 normal
487666,match character completion proposals jdt debug,VERIFIED FIXED,P3 enhancement
487667,implement migrator tool,RESOLVED FIXED,P3 normal
487668,substring completion still break proposal sort,RESOLVED FIXED,P3 normal
487669,attach remote gdbserver support remote executable ask binary,NEW,P3 normal
487670,retire example,RESOLVED FIXED,P3 normal
487671,fix javadoc wordselection template variable,RESOLVED FIXED,P3 trivial
487672,log exceptions happen evaluation,CLOSED FIXED,P3 normal
487673,recent workspaces sort similar box,RESOLVED FIXED,P3 normal
487674,drop model class npe,CLOSED FIXED,P3 normal
487675,external primitive type name generate include,RESOLVED FIXED,P3 normal
487676,remove optional dependency reexport,NEW,P3 normal
487677,ignore rule,RESOLVED FIXED,P3 normal
487678,date preference page message bug,RESOLVED FIXED,P3 trivial
487679,dependency create classifiers,RESOLVED FIXED,P3 normal
487680,httpclient return onresponsefailure random failure tls expire cert,CLOSED MOVED,P3 normal
487681,invert condition,NEW,P3 normal
487682,show process selection list detect process already debug,RESOLVED FIXED,P3 normal
487683,xcore code generation fail model refer model object another plugin,RESOLVED WORKSFORME,P3 normal with 1 vote
487684,static attribute initializer equal,ASSIGNED,P3 normal
487685,include root nls message webpack build js possibly move string root,CLOSED WONTFIX,P3 normal
487686,make default profile work disable format comment code,VERIFIED FIXED,P3 enhancement
487687,quickview linux render white white,VERIFIED FIXED,P3 major
487688,implement frameworkwiringdto,RESOLVED FIXED,P3 normal
487689,reverse constructor list initialization static attribute,RESOLVED FIXED,P3 normal
487690,gdb python extensions,NEW,P3 enhancement
487691,select iu availableiuspage select instance element branch,NEW,P5 enhancement
487692,cyclic region need example,RESOLVED FIXED,P3 normal
487693,stringconcatenation never leak local variable stack,UNCONFIRMED,P3 enhancement
487694,race condition annotation unpack surface spring aop,RESOLVED FIXED,P3 normal
487695,provide quickfix radix rule,RESOLVED FIXED,P3 enhancement
487696,modulecontainer avoid dynamically resolve package export,RESOLVED FIXED,P3 normal
487697,leaf,CLOSED NOT_ECLIPSE,P3 critical
487698,candidates,RESOLVED FIXED,P3 normal
487699,allow disable connection pool http client,CLOSED FIXED,P3 normal
487700,advance heuristics content assist inside template,NEW,P3 normal
487701,dialogs open unscaled content,NEW,P3 normal
487702,cannot submit profile job profile configuration,NEW,P3 critical
487703,expansion template template parameter pack base specifier,RESOLVED FIXED,P3 normal
487704,remote connection information lose switch ssh key settings,NEW,P3 normal
487705,disable automatic consistency check,UNCONFIRMED,P3 normal
487706,new project interchange format break export project test result summaries,CLOSED FIXED,P3 blocker
487707,enumerationliteral specification,RESOLVED FIXED,P3 normal
487708,disassembly thumb current isa cannot arm,RESOLVED FIXED,P3 normal
487709,private protect inheritance,RESOLVED FIXED,P3 normal
487710,faulty condition abstractmodelmanipulations,RESOLVED FIXED,P3 normal
487711,unexpected response unknown warn,CLOSED FIXED,P3 normal
487712,crash fedora,RESOLVED FIXED,P3 normal
487713,,NEW,P3 minor
487714,avoid npe close race async write,RESOLVED FIXED,P3 normal
487715,key preferences page show ampersand xsd,NEW,P3 normal
487716,type use annotations attach constructor elements,VERIFIED FIXED,P3 normal
487717,update bree,RESOLVED FIXED,P3 normal
487718,make api,CLOSED FIXED,P3 normal
487720,todo support type set non default properties offer add enum type annotation value,NEW,P3 major
487722,dead link topic find,REOPENED,P3 normal
487723,enable build examples,RESOLVED FIXED,P3 normal
487724,offer unused n problems category quick fix call via keyboard,RESOLVED WORKSFORME,P3 enhancement with 1 vote
487725,add task cop resources plugin management,NEW,P3 enhancement
487726,npe open network connections,CLOSED DUPLICATE of bug 479075,P3 normal
487727,abstractmodelinferrer setcontext protect instead package local,CLOSED WONTFIX,P3 major
487728,create instancespecifications associations yield unexpected result,NEW,P3 normal
487729,textcontrolswtrenderer configurable use databinding,CLOSED FIXED,P1 normal
487730,hipp tinydtls,CLOSED FIXED,P3 normal
487735,miss tag generate phpdoc,CLOSED FIXED,P3 normal
487737,struct inheritance,RESOLVED FIXED,P3 normal
487738,version heap space error run eclipse ide,CLOSED WORKSFORME,P3 normal
487739,incorrect oclistypeof instancespecification,RESOLVED INVALID,P3 normal
487740,access program api,NEW,P3 normal
487741,issue validate wsdl find resource bundle key,NEW,P3 enhancement
487742,stereotype attribute,RESOLVED FIXED,P3 normal
487743,get incorrect tree item mouse event expand tree item,NEW,P3 major
487744,inheritance visibility,RESOLVED FIXED,P3 normal
487745,qtp thread,RESOLVED MOVED,P3 critical
487746,type inference always correct,VERIFIED FIXED,P3 normal
487747,line number display incorrectly line wrap enable,RESOLVED WORKSFORME,P3 normal
