id,title,status,importance
145083,radio button label plural,RESOLVED FIXED,P3 normal
145084,spurrious errors,CLOSED WONTFIX,P2 major
145085,invalidclassexception restart,RESOLVED FIXED,P2 normal
145086,npe weak reference set signature,RESOLVED FIXED,P3 normal
145087,error message server runtime exist prefer one,NEW,P3 normal
145088,clock format use birt report select time frame dialog,CLOSED FIXED,P3 major
145089,gif file fail open,RESOLVED WORKSFORME,P3 normal
145090,resource change take second,CLOSED FIXED,P2 critical
145091,display associate defect fail verdicts tptp report,CLOSED WONTFIX,P3 enhancement
145092,url test type support test execution,CLOSED WONTFIX,P3 enhancement
145093,npe rectlinear router,RESOLVED DUPLICATE of bug 145094,P3 normal
145094,npe rectlinear router,REOPENED,P5 normal
145095,another npe bug rectlinear router,CLOSED DUPLICATE of bug 145094,P5 normal
145096,return invalid file url,ASSIGNED,P3 normal with 9 votes
145097,nl work update uddi businesses,CLOSED DUPLICATE of bug 142779,P2 normal
145098,xml datasource create temporary file delete generation,CLOSED FIXED,P2 major
145099,mbs internal switch use spawner detect executable launch,RESOLVED FIXED,P3 normal
145100,exception load project workspace startup,CLOSED DUPLICATE of bug 143229,P3 critical
145101,lite support bendpoints format generate diagram,RESOLVED FIXED,P3 normal
145102,concept batchfeatureoperation flaw,RESOLVED WONTFIX,P3 major
145103,index view sort alphabetically,RESOLVED WONTFIX,P3 normal
145104,support dnd project onto server instance,CLOSED FIXED,P3 enhancement
145105,lookup c symbol fail c project work project,RESOLVED FIXED,P3 normal
145106,new extension point allow action server view,CLOSED INVALID,P3 enhancement
145107,memory size grow user open close symptom catalog symptom editor,CLOSED INVALID,P1 major
145108,uninstall uninstall select feature,RESOLVED DUPLICATE of bug 145102,P3 normal
145109,support customization columns order consolidate view way process view change,NEW,P3 enhancement
145110,xsd editor throw npe xsd,CLOSED DUPLICATE of bug 144230,P3 normal
145111,run birt rc websphere,RESOLVED FIXED,P3 normal
145112,make release note,CLOSED FIXED,P1 normal
145113,allow mark incoming change,RESOLVED FIXED,P2 minor
145114,xdoclet file generate proper location,CLOSED WORKSFORME,P3 major
145115,test run commandline linux place result proper,CLOSED WONTFIX,P2 normal
145116,function preview browser,CLOSED FIXED,P3 major
145117,connector module field still editable checkbox unchecked,CLOSED FIXED,P3 trivial
145118,xdoclet preference apply even cancel button click,CLOSED FIXED,P3 normal
145119,mouse require navigation action page web service explorer,NEW,P3 minor
145120,xml plugin import fail access deny error rup plugin,CLOSED FIXED,P2 major
145121,nl doesnt work properly wsil page wse,CLOSED DUPLICATE of bug 150301,P3 normal
145122,test one,CLOSED INVALID,P3 critical
145123,support generic repositories,RESOLVED FIXED,P3 enhancement
145124,developers guide diagram runtime miss two image,RESOLVED FIXED,P3 normal
145125,improve method search result display,ASSIGNED,P3 enhancement
145126,consider allow common navigator view filter preserve,RESOLVED FIXED,P3 normal
145127,legal page break,RESOLVED FIXED,P3 normal
145128,add external jar file add new jre work,RESOLVED WORKSFORME,P3 normal
145129,add progress message bar feature splash page incomplete,RESOLVED FIXED,P3 normal
145130,xml plugin prompt add log source control,CLOSED FIXED,P3 normal
145131,add empty plugin,CLOSED FIXED,P1 major
145132,jdt migration guide content break link,RESOLVED FIXED,P3 normal
145133,w,RESOLVED INVALID,P3 critical
145134,work cheatsheet,NEW,P3 normal with 1 vote
145135,bogus warn log miss data set definition,CLOSED FIXED,P2 minor
145136,graphical editor longer work rename xsd file,CLOSED FIXED,P2 normal
145137,repeat login attempt require wiki use bugzilla account,RESOLVED FIXED,P3 normal
145138,ijavacompletionproposalcomputer corecontext initialize,RESOLVED FIXED,P3 enhancement
145139,npe welcome view detach,RESOLVED FIXED,P3 normal
145140,new servlet wizard fail,CLOSED DUPLICATE of bug 143229,P2 major
145141,file longer support relative paths,RESOLVED DUPLICATE of bug 35037,P3 normal
145142,need description birt report,CLOSED FIXED,P1 major
145143,need description birt report,CLOSED FIXED,P1 major
145144,svg interactivity cannot highlight gradient color,RESOLVED FIXED,P3 major
145145,update iac doc,CLOSED FIXED,P3 normal
145146,generic recorder framework,CLOSED WONTFIX,P3 enhancement with 7 votes
145147,visual editor meltdown recursive base modifications source code properties window stink,CLOSED FIXED,P3 normal
145148,import log file result miss msgcatalogtokens,CLOSED FIXED,P1 major
145149,move focus prefix target namespace field schema property section make editor dirty,CLOSED FIXED,P3 normal
145150,bad string dialog export analysis result,CLOSED FIXED,P3 major
145151,impossible determine wizard create database connection,RESOLVED WONTFIX,P3 normal
145152,support,RESOLVED INVALID,P3 enhancement
145153,specify directory ms project export wizard throw exception,CLOSED FIXED,P3 normal
145154,three place preferences specify proxy,RESOLVED DUPLICATE of bug 119278,P3 normal
145155,first step icon may offensive countries,CLOSED FIXED,P3 normal
145156,work jar,CLOSED FIXED,P3 normal
145157,npe click derby synonym,CLOSED FIXED,P3 normal
145158,june code checkpoint,CLOSED FIXED,P3 normal
145159,ant editor functional callisto install,RESOLVED WORKSFORME,P3 normal
145160,insert chart report design,RESOLVED WORKSFORME,P4 normal
145161,master page display hour behind,RESOLVED FIXED,P3 normal
145162,chart editor break,RESOLVED WORKSFORME,P5 normal
145163,specify report parameter chart filter,RESOLVED WORKSFORME,P3 normal
145164,validator report irelevant problems,CLOSED WORKSFORME,P3 normal
145165,search path serviceconfig wrong call,CLOSED FIXED,P1 major
145166,need logic derive uri context root correctly,CLOSED FIXED,P2 major
145167,project settings validate,CLOSED FIXED,P2 major
145168,jsf project shareable team provider,CLOSED DUPLICATE of bug 142056,P3 major
145169,support way auto arange navigation rule diagram,NEW,P3 enhancement
145170,update manager preserve cookies set server,RESOLVED WONTFIX,P3 major
145171,dev content developer role,CLOSED WORKSFORME,P1 major
145172,dev develop content design elements,CLOSED FIXED,P1 major
145173,dev develop content elements relate,CLOSED FIXED,P1 major
145174,choose jboss configuration,CLOSED DUPLICATE of bug 128444,P3 enhancement
145175,import open lot windows add elements source control,CLOSED FIXED,P2 major
145176,handle filename,CLOSED FIXED,P3 normal
145177,rte remove subfolders,CLOSED FIXED,P3 normal
145178,typo message,RESOLVED DUPLICATE of bug 149721,P3 trivial
145179,small font size java visual wizard,NEW,P3 trivial
145180,automate management link work editor save,RESOLVED WONTFIX,P3 normal
145181,use management confuse,RESOLVED WONTFIX,P3 normal
145182,add project build settings,NEW,P3 normal
145183,automate management link add version,RESOLVED FIXED,P3 normal
145184,value series line change color value marker line,NEW,P3 enhancement
145185,profile console charset corruption,CLOSED FIXED,P3 major
145186,profile console show java app,CLOSED WONTFIX,P2 major
145187,syntetic constructors binary type always source type always invisible,RESOLVED DUPLICATE of bug 20565,P3 normal
145188,add support axis,CLOSED WONTFIX,P3 enhancement
145189,support gwt design subsystem,CLOSED WONTFIX,P3 enhancement
145190,api determine point valid character offset,CLOSED DUPLICATE of bug 522103,P3 enhancement
145191,atl work document,NEW,P3 normal
145192,last task delete,RESOLVED FIXED,P2 normal
145193,delete category delete subtasks,RESOLVED FIXED,P2 normal
145194,task task list seem subtasks allthough children,RESOLVED FIXED,P3 minor
145195,register package displace,RESOLVED WONTFIX,P3 normal
145196,vm crash debug,RESOLVED WONTFIX,P3 critical
145197,could create bugzilla editor input,RESOLVED FIXED,P1 critical
145198,activate action task popup menu,RESOLVED FIXED,P3 major
145199,add option change package explorer mode,RESOLVED WONTFIX,P4 enhancement
145200,crash start symbolic link,RESOLVED DUPLICATE of bug 105554,P3 major
145201,update progress dialog mem leak,RESOLVED WONTFIX,P3 major with 1 vote
145202,false positive null reference analyzer negate instanceof,RESOLVED INVALID,P3 major
145203,invalid null reference report,RESOLVED FIXED,P3 normal
145204,red cross synchronize error message update manager,RESOLVED WORKSFORME,P3 normal
145205,dev develop content elements relate implementation,CLOSED FIXED,P1 major
145206,dev develop content elements relate build,CLOSED FIXED,P1 major
145207,dev develop content elements relate ui,CLOSED FIXED,P1 major
145208,dev develop content visual design elements,CLOSED FIXED,P1 major
145209,dev develop content elements relate refactoring,CLOSED FIXED,P2 major
145210,dev develop content elements relate,CLOSED FIXED,P2 major
145211,could add blog fee,RESOLVED FIXED,P3 normal
145212,perfmonagent need remove package,CLOSED FIXED,P1 major
145213,update show release name,RESOLVED WONTFIX,P3 enhancement
145214,allow create link project issue repositories,RESOLVED FIXED,P1 enhancement
145215,cant save anithing,RESOLVED DUPLICATE of bug 140064,P3 critical
145216,drag drop multiple columns edit data set dialog work,RESOLVED FIXED,P3 normal
145217,npe junitcopyaction,RESOLVED DUPLICATE of bug 149800,P3 normal
145218,drop cool item display drop arrow,RESOLVED WONTFIX,P3 normal
145219,copy datatools feature,CLOSED FIXED,P1 major
145220,indexer get confuse nest class,RESOLVED FIXED,P3 normal
145221,startup undesirable startup activity,NEW,P3 normal
145222,require file miss jvmti profiler distribution tptp download site,CLOSED FIXED,P3 blocker
145223,asmemfmodel corrupt global package registry,RESOLVED FIXED,P3 normal
145224,weaverresourceutil corrupt global package registry,RESOLVED FIXED,P3 normal
145225,diagram render although outline look fine,RESOLVED INVALID,P3 normal
145226,incomplete,NEW,P3 normal
145227,press one click element function view cause error,CLOSED WORKSFORME,P3 normal
145228,internal debugger work give execute permission phpexe,CLOSED FIXED,P3 normal
145229,despite menu button php project right click option,CLOSED FIXED,P3 normal
145230,preview tab cause swt error,RESOLVED FIXED,P3 critical
145231,view report pdf give adobe reader error,RESOLVED FIXED,P3 normal
145232,har find info report java object,RESOLVED WORKSFORME,P5 normal
145233,make obvious way specify input rcp,RESOLVED DUPLICATE of bug 143430,P2 enhancement with 4 votes
145234,open declaration definition incorrect behavior,RESOLVED FIXED,P3 major with 1 vote
145235,find fail one update mirror fail,RESOLVED WONTFIX,P3 normal with 1 vote
145236,action cause collapse action php project,CLOSED FIXED,P3 normal
145237,elements project display php explorer navigetor,CLOSED FIXED,P3 normal
145238,unhelpful jre classpath diagnostic,RESOLVED WONTFIX,P3 minor
145239,support static registration dynamic epackages,VERIFIED FIXED,P3 enhancement
145240,uncomment multiline comment work,CLOSED FIXED,P3 normal
145241,feature editor information tab add new content,RESOLVED DUPLICATE of bug 138588,P3 normal
145242,eclipse crash manage make project close angle bracket,RESOLVED FIXED,P3 blocker
145243,choose default new project select workspace get message,CLOSED INVALID,P3 normal
145244,conflict key accelerators popup menu,VERIFIED FIXED,P3 major
145245,stackoverflowerror open declaration,RESOLVED FIXED,P3 critical
145246,genmodel longer resolve,VERIFIED DUPLICATE of bug 143797,P3 major
145247,eclipse callisto ui freeze click,RESOLVED WONTFIX,P3 normal
145248,checksums miss jdt core batch compiler jar,RESOLVED FIXED,P3 normal
145249,connection fork protocol library miss entry point,RESOLVED INVALID,P3 normal
145250,,RESOLVED WONTFIX,P3 critical
145251,problems restore report perspective,RESOLVED INVALID,P1 normal
145252,rm ui components reference,RESOLVED FIXED,P3 normal
145253,technical review test docs,CLOSED FIXED,P1 normal
145254,miss,RESOLVED FIXED,P3 normal
145255,need topic verdict summary chart,CLOSED FIXED,P3 normal
145256,compile error daily build,CLOSED FIXED,P2 blocker
145257,file edit menu error page,ASSIGNED,P5 minor
145258,sudoku rcp application,NEW,P3 normal
145259,jsp validation handle explicit content type,NEW,P3 enhancement
145260,move space description total function,CLOSED FIXED,P3 normal
145261,bookmarks pane show pdf click pdf button,CLOSED FIXED,P2 normal
145262,pane accessible keyboard,CLOSED FIXED,P3 normal
145263,throw use function expression builder,CLOSED FIXED,P3 normal
145264,remove manifest,CLOSED FIXED,P3 normal
145265,web viewer cannot print whole report one,CLOSED DUPLICATE of bug 144577,P3 normal
145266,dialog select properties,CLOSED FIXED,P3 normal
145267,button disappear window,CLOSED FIXED,P3 blocker
145268,throw use function expression builder,CLOSED DUPLICATE of bug 145263,P3 normal
145269,windows active simultaneously keyboard operation,CLOSED FIXED,P3 normal
145270,empty define work like gcc,RESOLVED FIXED,P3 normal
145271,check pdomsearchre pull outer,RESOLVED FIXED,P3 normal
145272,drag data set library report design give error,RESOLVED WORKSFORME,P3 normal
145273,compile error daily build,CLOSED FIXED,P2 blocker
145274,work properly parameters default value,CLOSED FIXED,P3 normal
145275,junit backwards compatibility work junit test,NEW,P3 normal
145276,export invisible column,CLOSED INVALID,P3 major
145277,area preivew web vertical line chart,CLOSED FIXED,P3 normal
145278,override property library report item restore properties,RESOLVED WORKSFORME,P2 normal
145279,display change set,CLOSED FIXED,P3 normal
145280,value bind none instead,CLOSED DUPLICATE of bug 145021,P2 normal
145281,suppressduplicate fail duplicate data,CLOSED DUPLICATE of bug 144383,P3 normal
145282,update plugin finish busson disable,RESOLVED DUPLICATE of bug 142815,P3 critical
145283,default name style tactic,RESOLVED WONTFIX,P3 normal
145284,chart outline click chart builder still wil,CLOSED FIXED,P1 normal
145285,ues build,CLOSED FIXED,P3 critical
145286,calisto release contain source code,RESOLVED WONTFIX,P3 major
145287,new style item library theme recreate,CLOSED FIXED,P2 major
145288,localization support,NEW,P3 normal with 3 votes
145289,improve xerces export package manditory attribute,CLOSED FIXED,P3 normal
145290,getstyles method exist modulehandle,NEW,P3 normal
145291,compounddirectedgraphlayout edge shoot side,RESOLVED FIXED,P2 normal
145292,select style right click list library,CLOSED INVALID,P3 normal
145293,configuration import add source control create bak log file,CLOSED FIXED,P2 major
145294,jump stacktrace,CLOSED FIXED,P3 normal
145295,php search execute include,CLOSED FIXED,P3 normal
145296,render attach report design file pdf,CLOSED FIXED,P2 major
145297,help content font small,RESOLVED DUPLICATE of bug 145540,P3 major
145298,show navigator option,CLOSED WORKSFORME,P3 normal
145299,call calcalculatepreferredsize fix hint,RESOLVED WORKSFORME,P3 normal
145300,web parameter dialog,CLOSED FIXED,P2 normal
145301,different master page one row cause inconsisitency html pdf,CLOSED FIXED,P3 normal
145302,drag chart click chart still exist system throw exception,CLOSED DUPLICATE of bug 145490,P3 normal
145303,parameter dialog show property change xml source,CLOSED FIXED,P3 normal
145304,different process way pagebreakbefore pagebreakafter,CLOSED FIXED,P3 normal
145305,syntax error right add,CLOSED FIXED,P3 normal
145306,tempfile create every time preview xml dataset,CLOSED DUPLICATE of bug 145098,P3 normal
145307,preivew preview result different pdf html,CLOSED DUPLICATE of bug 145455,P3 normal
145308,image birt report developer guide alt text,RESOLVED FIXED,P3 normal
145309,button disable first tab chart builder,CLOSED FIXED,P1 normal
145310,key occasionally stop work popup,ASSIGNED,P3 normal with 1 vote
145311,dialogsettings save add attribute tag,RESOLVED DUPLICATE of bug 104047,P3 minor
145312,create visual class composite extend superclass,NEW,P3 enhancement
145313,parameter value retrieve,CLOSED FIXED,P2 normal
145314,source lookup fail,RESOLVED WORKSFORME,P3 critical
145315,option launch deug navigetor view right click,CLOSED WORKSFORME,P3 normal
145316,hightlight work properly chart,CLOSED INVALID,P3 major
145317,code formatter insert extra blank line,CLOSED DUPLICATE of bug 303519,P5 normal with 2 votes
145318,unable,RESOLVED WORKSFORME,P3 normal
145319,nullpointerexception,VERIFIED FIXED,P3 major
145320,hbx toolbar link go correct spot,RESOLVED WORKSFORME,P3 normal
145321,resource events lose transaction roll back,VERIFIED FIXED,P2 major
145322,failure,RESOLVED FIXED,P3 normal
145323,failure,RESOLVED FIXED,P3 normal
145324,npe,RESOLVED FIXED,P3 normal
145325,deployment elements artifact properties java classpath base,CLOSED WORKSFORME,P3 normal
145326,touppercase incorrect selection,RESOLVED FIXED,P3 minor
145327,jmvti agent print usage message,CLOSED FIXED,P3 normal
145328,record exceed slow certain websites use sdk,CLOSED FIXED,P3 major
145329,unable locate source monster workspace,VERIFIED FIXED,P2 normal
145330,technical miss extension point,CLOSED FIXED,P3 normal
145331,edit jsp page,CLOSED WORKSFORME,P3 normal
145332,error trace log offend unit trace,NEW,P3 normal
145333,resolve much,VERIFIED FIXED,P3 normal
145334,tlds find dependant utility project,RESOLVED DUPLICATE of bug 183756,P3 minor with 1 vote
145335,delegatingmouseeventseditpolicy need translate location mouse event,RESOLVED FIXED,P3 normal
145336,create connections rectilinear rout respect initial anchor feedback,RESOLVED FIXED,P3 normal
145337,move element assignment expressions feature expression templates,RESOLVED FIXED,P3 normal
145338,text move edit display,RESOLVED FIXED,P3 normal
145339,help search produce result default locale,RESOLVED DUPLICATE of bug 124688,P3 normal
145340,compartment menu item rename compartments,NEW,P3 trivial
145341,edit domain advancedpropertysection workbench part adapt ieditingdomainprovider,RESOLVED FIXED,P2 major
145342,exceptions throw try delete elements pe,RESOLVED FIXED,P3 critical
145343,codepage problem birt error window,RESOLVED FIXED,P3 normal
145344,tw untranslated string new cascade parameter panel,CLOSED FIXED,P3 major
145345,extra buffer around connections source,NEW,P3 trivial
145346,error publish service interface,CLOSED INVALID,P3 major
145347,warn fedora compiler,RESOLVED FIXED,P3 normal
145348,web project update prompt attach,CLOSED FIXED,P1 major
145349,npe throw resizableeditpolicy drag drop,RESOLVED DUPLICATE of bug 140020,P3 normal
145350,jdi enhancements java,VERIFIED FIXED,P3 enhancement
145351,index miss typedef structs,RESOLVED FIXED,P3 normal
145352,dispose viewer editor cause npe,RESOLVED FIXED,P3 major
145353,hardcoded english string preferences ant editor,RESOLVED INVALID,P3 minor
145354,truncation,CLOSED DUPLICATE of bug 144749,P3 major
145355,wrong plugin version include plugin,CLOSED FIXED,P3 normal
145356,npe throw drag drop multiple time,RESOLVED WORKSFORME,P3 normal
145357,truncation,CLOSED FIXED,P3 minor
145358,save jpeg image higher dpi,NEW,P3 normal with 3 votes
145359,chkpii errors gmf,RESOLVED FIXED,P3 normal
145360,acc class need split button role,RESOLVED WONTFIX,P3 normal
145361,binary compatibility problems new feature base class,VERIFIED FIXED,P3 enhancement
145362,jdi test suite need update test,VERIFIED FIXED,P3 normal
145363,layout invoke drag drop operation,RESOLVED FIXED,P3 critical
145364,java perspective resize unexpected use,NEW,P3 normal
145365,mbs user doc update,RESOLVED FIXED,P3 normal
145366,inconsistent placement welcome items,RESOLVED WORKSFORME,P3 normal
145367,fail open binary member leave cache inconsistent,VERIFIED FIXED,P3 normal
145368,ruby irb launch eclipse external tool,RESOLVED INVALID,P3 normal
145369,birt installtion work linux,RESOLVED FIXED,P2 major
145370,new swt virtual table tree,RESOLVED FIXED,P3 normal
145371,export context menu item enable result view exporters register provider,CLOSED FIXED,P3 normal
145372,jsps cant handle folder name dot,CLOSED DUPLICATE of bug 153482,P3 normal
145373,add ability specify table joincolumn,CLOSED FIXED,P3 enhancement
145374,delete connections delete persistently,RESOLVED FIXED,P3 normal
145375,update log parser isv documentation reflect current feature enable,CLOSED FIXED,P1 major
145376,archive export customization need,NEW,P3 enhancement
145377,property file persistence must fold case resource name,CLOSED FIXED,P3 normal
145378,appication lose ide stable build,VERIFIED FIXED,P3 normal
145379,example installer wizard open specific file create project,VERIFIED FIXED,P3 enhancement
145380,example installer wizard hang delete action cancel,VERIFIED FIXED,P3 normal
145381,hardcoded string label,CLOSED FIXED,P3 normal
145382,hardcoded string label,CLOSED INVALID,P3 major
145383,hardcoded string label,CLOSED FIXED,P3 major
145384,externalize string translate,RESOLVED FIXED,P3 major
145385,error message log file,RESOLVED INVALID,P3 normal
145386,terminate launch kill spash screen process,RESOLVED WORKSFORME,P3 normal
145387,cdt parser report syntax error valid initializer,RESOLVED FIXED,P3 normal
145388,,CLOSED WORKSFORME,P2 major with 1 vote
145389,cdt parser problems assembly code,RESOLVED FIXED,P3 minor
145390,wse allow https scenarios work properly,CLOSED WORKSFORME,P1 major
145391,call generic method within nosuchmethoderror,RESOLVED FIXED,P3 normal
145392,dnd op fail illegalargumentexception,CLOSED FIXED,P2 normal
145393,add organize open type uis,RESOLVED WORKSFORME,P3 enhancement
145394,profile server shortcut use serverprofilers value,CLOSED FIXED,P3 critical
145395,spell error duplicate security role error message,CLOSED FIXED,P2 normal
145396,showin launchview work anymore,VERIFIED FIXED,P3 normal
145397,invalid stackmap attribute,VERIFIED FIXED,P3 normal
145398,alternate php exe preselected automatically change,CLOSED FIXED,P3 normal
145399,project utility jar specify ear level get copy root directory war,CLOSED WORKSFORME,P3 critical
145400,npe display extend data elements,CLOSED FIXED,P2 normal
145401,change filter tab probe insertion configuration update global filter set,CLOSED FIXED,P1 major
145402,export log set work destination directory doesnot exist,CLOSED FIXED,P1 normal
145403,build properties cause crash,RESOLVED DUPLICATE of bug 112579,P3 critical
145404,minor update rac documentation,CLOSED FIXED,P3 normal
145405,designer recognize custom emitter,RESOLVED DUPLICATE of bug 146517,P2 normal
145406,check move content package one plugin another,CLOSED FIXED,P2 major
145407,user input bean config page ignore,CLOSED FIXED,P1 critical
145408,package rename refactor throw exception,RESOLVED INVALID,P3 major
145409,generate conflict import statements,RESOLVED WORKSFORME,P3 normal
145410,help prefences english,RESOLVED INVALID,P3 major
145411,remove view honour commit perform,VERIFIED FIXED,P3 normal
145412,add readme item log import problem iseries,CLOSED FIXED,P1 normal
145413,fix wsdl model uml emf artifacts,CLOSED FIXED,P3 normal
145414,birt propogate jdbc exception report generation task,RESOLVED FIXED,P1 major
145415,full indexer produce huge pdom file,VERIFIED FIXED,P3 normal
145416,rule help format,CLOSED INVALID,P3 normal
145417,syntax error organize import class nest aspect,RESOLVED WONTFIX,P3 normal
145418,stackoverflowerror refactoring replace interface supertype possible,RESOLVED WORKSFORME,P3 normal
145419,need better statistics index,RESOLVED FIXED,P3 normal
145420,compiler error indeterminate type variable resolution,RESOLVED DUPLICATE of bug 144879,P3 major
145421,provide schema xml test,CLOSED WONTFIX,P3 normal
145422,import export method plugins,CLOSED WONTFIX,P3 critical
145423,attribute need add tomcat define connector port url path contain dbcs,NEW,P3 enhancement with 1 vote
145424,delay load package,CLOSED FIXED,P3 normal
145425,gef update site appear twice dialog,RESOLVED DUPLICATE of bug 146163,P3 normal
145426,monitor cannot route correct port mulitple port service,CLOSED FIXED,P3 normal
145427,encode detection web service platform need work,CLOSED WONTFIX,P3 normal
145428,pull map file get right version equinox,VERIFIED INVALID,P3 normal
145429,english string preferences menu,CLOSED INVALID,P3 major
145430,clock preferences,RESOLVED WONTFIX,P3 normal
145431,incorrect sort dropdown list,VERIFIED FIXED,P3 normal
145432,improve word page one web wizards,CLOSED FIXED,P3 minor
145433,generate jsp doesnt handle datatype getter,CLOSED FIXED,P2 major
145434,open menu miss meta nod,CLOSED FIXED,P2 major
145435,display need synchronization asyncexec dispose,RESOLVED DUPLICATE of bug 45294,P3 normal with 1 vote
145436,crash cdt,RESOLVED DUPLICATE of bug 162598,P3 normal
145437,add monitor lifecycle support mylar monitor,RESOLVED FIXED,P3 normal
145438,break incremental build trigger incremental build project,RESOLVED FIXED,P3 normal
145439,huge memory leak diagrameditor,RESOLVED DUPLICATE of bug 142803,P3 major
145440,various new ac task docs need minor update,CLOSED WONTFIX,P1 normal
145441,action cancel button two line instead one,NEW,P3 normal
145442,line number miss advise,RESOLVED FIXED,P3 normal
145443,import clean folders,CLOSED FIXED,P2 major
145444,java profiler automate test failures windows ipf,CLOSED INVALID,P1 critical
145445,scroll insanely slow upgrade,RESOLVED FIXED,P3 critical
145446,project selection dialog truncate message appear,CLOSED WONTFIX,P3 normal
