id,title,status,importance
382269,validate consistency,ASSIGNED,P3 enhancement
382270,complete ocl facade class,NEW,P3 normal
382271,support key join unique limit scope,NEW,P3 enhancement with 1 vote
382272,model element deletion slow crossreferenceadapter initialize,CLOSED FIXED,P3 normal
382273,rdfconsumerstore use api remove jena,CLOSED FIXED,P3 normal
382274,create remote branch push new topic branch,CLOSED DUPLICATE of bug 360266,P3 normal
382275,welcome screen artifacts create new workspace,CLOSED DUPLICATE of bug 377085,P3 normal
382276,xcasepart longer extend jvmidentifiableelement,CLOSED FIXED,P3 normal
382277,xswitchexpression use contain jvmformalparameter,VERIFIED FIXED,P3 normal
382278,provide example installers,CLOSED FIXED,P3 enhancement
382279,infinite loop legacy lttng,CLOSED FIXED,P3 normal
382280,remove dependency rununit rununitbase,CLOSED FIXED,P3 enhancement
382281,contribute oslc workshop lyo,CLOSED FIXED,P3 enhancement
382282,java code proposal give table attribute specify name attribute,NEW,P3 normal
382283,ensure papyrus integration test,NEW,P3 normal
382284,document xtext extensibility,NEW,P3 normal
382285,table name reserve keyword write orm properly ui,RESOLVED INVALID,P3 normal
382286,test repository return empty page,CLOSED FIXED,P3 critical
382287,user name display profile,CLOSED INVALID,P3 normal
382288,dnd one editor another cause focus change,RESOLVED INVALID,P3 normal
382289,problems may need,RESOLVED FIXED,P3 major
382290,file open old editor even file rename,RESOLVED INVALID,P3 normal
382291,perf test less machine dependent,RESOLVED FIXED,P3 normal
382292,etfw tab tool select,CLOSED FIXED,P3 normal
382293,failures discover debug lineinfo,RESOLVED FIXED,P3 normal
382294,tooloption extension point etfw,CLOSED FIXED,P3 enhancement
382295,problem unsaved dialog,RESOLVED WORKSFORME,P3 normal
382296,add expression make subclass compatible superclass,RESOLVED FIXED,P3 normal
382297,consider respin respin ecf respin,RESOLVED DUPLICATE of bug 382206,P3 normal
382298,filter switch dialog cannot filter,CLOSED WORKSFORME,P3 normal
382299,failures,RESOLVED WORKSFORME,P3 normal
382300,tomcat bundle import package,NEW,P3 normal
382301,miss style,RESOLVED FIXED,P3 normal
382302,tooltip help appear fast,RESOLVED FIXED,P3 normal
382303,operations page optimize,RESOLVED FIXED,P3 normal
382304,mail list public,RESOLVED FIXED,P3 normal
382305,eclipse crash try open javadoc window,RESOLVED WORKSFORME,P3 critical
382306,chunk response deliver client,CLOSED DUPLICATE of bug 382487,P3 major
382307,improve exception simplelifecycle support,RESOLVED FIXED,P3 enhancement
382308,jpql entitymanager typedquery createquery getresultlist sqlexception,NEW,P2 normal with 7 votes
382309,cobalt rm prematurely report launch completion,NEW,P3 normal
382310,jetty server leak file descriptors usefilemappedbuffer true,CLOSED WORKSFORME,P3 major
382311,dialogs notify possible ways character usage,RESOLVED FIXED,P3 normal
382312,unresponsive dropdown combo widget aix linux,RESOLVED NOT_ECLIPSE,P3 normal
382313,emf validation custom task,RESOLVED FIXED,P3 normal
382314,export package add extension test,RESOLVED FIXED,P3 normal
382315,cannot create iclassfile memento,NEW,P1 normal
382316,cannot create iclassfile binaryreadonlyfile,NEW,P3 normal
382317,form editor hook global select delete action,NEW,P3 normal
382318,vdddd,RESOLVED INVALID,P3 normal
382319,enable java generator set language eunit test project compile errors find generate java source,CLOSED FIXED,P3 normal
382320,remove version dependencies,CLOSED FIXED,P3 normal
382321,add behavior problems view external location markers,NEW,P3 normal
382322,change sortkey jdt target milestone,VERIFIED FIXED,P3 normal
382323,project deletion eclipse clean execute test command line,CLOSED DUPLICATE of bug 343754,P3 major
382324,need version number eclipse package file,CLOSED FIXED,P2 normal
382325,papyrus provide tool migrate properties view,RESOLVED FIXED,P3 normal
382326,update build target eclipse juno release,RESOLVED FIXED,P3 normal
382327,flat file input stream close charset empty,RESOLVED FIXED,P3 normal
382328,modularize ecp reuse containers editors,CLOSED FIXED,P3 enhancement
382329,use single databinding context control,CLOSED FIXED,P3 enhancement
382330,equinox console plugin prevent virgo kernel startup smoke test,CLOSED FIXED,P3 normal
382331,label refresh change datatype presentation configuration dialog,RESOLVED FIXED,P1 normal
382332,connection sourceport property editor show invalid port options,RESOLVED FIXED,P3 normal
382333,diagram corruption use copy onefile feature,RESOLVED FIXED,P3 normal
382334,action popup menu model element throw exceptions,RESOLVED FIXED,P3 normal
382335,java heap space run test,RESOLVED FIXED,P3 major
382336,jpql regression hermes entity type expression relationship field,RESOLVED FIXED,P3 normal
382337,rms demo break,RESOLVED DUPLICATE of bug 378062,P3 normal
382338,gw bundle import version,CLOSED FIXED,P3 normal
382339,hide empty compartments,NEW,P3 enhancement
382340,add selection default action sit page,RESOLVED FIXED,P3 normal
382341,pleas add,RESOLVED FIXED,P3 normal
382342,make get start documentation helpful,VERIFIED FIXED,P2 enhancement
382343,jetty xml support map break,RESOLVED FIXED,P3 normal
382344,ready tycho build,RESOLVED FIXED,P3 major
382345,compiler complain unimplemented method default implementation exist,RESOLVED FIXED,P3 enhancement
382346,handle,CLOSED FIXED,P3 enhancement
382347,compiler accept incorrect default method inheritance,RESOLVED FIXED,P3 enhancement
382348,minor version increase next release,CLOSED INVALID,P3 normal
382349,debug seem regress last moment juno,CLOSED INVALID,P3 normal
382350,unable invoke inherit default method via syntax,RESOLVED FIXED,P3 enhancement
382351,memory settings plugin development load,RESOLVED WORKSFORME,P3 critical
382352,problem authenticate remote,RESOLVED WONTFIX,P3 normal
382353,implementation property modifiers accept default,RESOLVED FIXED,P3 enhancement
382354,compiler silent conflict modifier,RESOLVED FIXED,P3 enhancement
382355,compiler accept erroneous default method,RESOLVED FIXED,P3 enhancement
382356,cannot log use signin button,RESOLVED FIXED,P1 blocker
382357,need decide brand,RESOLVED WONTFIX,P3 normal
382358,ccombo work properly popudialog,RESOLVED INVALID,P3 normal with 1 vote
382359,compatibility helios,CLOSED FIXED,P2 normal
382360,need remove extraneous file,RESOLVED FIXED,P3 critical
382361,concurrentmodificationexception nio selectormanager stop jetty,CLOSED WONTFIX,P3 normal
382362,need remove extraneous file,RESOLVED FIXED,P3 critical
382363,eef honor,CLOSED WONTFIX,P3 normal
382364,extraneous project file development dir,RESOLVED FIXED,P3 normal
382365,ecp runnable context,CLOSED FIXED,P3 enhancement
382366,need remove extraneous file,RESOLVED FIXED,P3 normal
382367,need remove extraneous file,RESOLVED FIXED,P3 blocker
382368,type definitions need update conversion operation take return nullable,CLOSED FIXED,P3 normal
382369,problem discover register service implement package,RESOLVED WONTFIX,P3 normal
382370,try block template produce part binder failure npe,CLOSED FIXED,P3 normal
382371,image resolution honor pdf export,CLOSED NOT_ECLIPSE,P3 normal
382372,comment delete add annotation via jpa detail,NEW,P3 normal
382373,value presentation configurations save,RESOLVED FIXED,P3 major
382374,synchronization look fishy,RESOLVED FIXED,P3 normal
382375,dispatch method type inferrer give unexpected result,CLOSED FIXED,P3 normal
382376,honor column span,NEW,P3 normal
382377,correct license file,CLOSED FIXED,P3 normal
382378,implement hence mention class use,NEW,P3 normal
382379,npe wcc source file,CLOSED FIXED,P3 major
382380,make semantic highlight configuration easier,CLOSED FIXED,P3 normal
382381,hello world sample file empty,VERIFIED FIXED,P3 normal
382382,write access,RESOLVED FIXED,P3 normal
382383,enable registration new epackages runtime dynamicemf,CLOSED FIXED,P3 normal
382384,use cairo instead gdk deprecate methods tooltip method,RESOLVED FIXED,P3 normal
382385,login prompt show though user already log,CLOSED WORKSFORME,P3 normal
382386,initial setup install button install plugins,CLOSED FIXED,P3 minor
382387,sound,RESOLVED FIXED,P3 normal
382388,schema generate xmlelementref miss,RESOLVED FIXED,P3 normal with 1 vote
382389,miss perclause superclass message mislead,NEW,P3 normal
382390,confuse selection refocus specification editor,RESOLVED FIXED,P2 major
382391,make dynamic,RESOLVED FIXED,P3 normal
382392,internal error occur,CLOSED FIXED,P3 minor
382393,refactor common result display mergeresultdialog cherrypickhandler,NEW,P3 enhancement
382394,call method console message load file,RESOLVED FIXED,P3 normal
382395,run line disable breakpoint work,CLOSED FIXED,P3 normal
382396,inconsistency plugin property case file plugin,RESOLVED WONTFIX,P3 normal
382397,update website availability,CLOSED FIXED,P3 normal
382398,move ezeinitialize constructor,RESOLVED FIXED,P1 enhancement
382399,force push prompt many time,RESOLVED FIXED,P3 normal
382400,need directory move linux tool technology,RESOLVED FIXED,P3 normal
382401,seem take longer editor,RESOLVED WORKSFORME,P3 normal
382402,make dynamic,RESOLVED FIXED,P3 normal
382403,cannot use ssh connect slave,CLOSED FIXED,P3 major
382404,illegalstateexception servicecontext commandline build,CLOSED FIXED,P3 normal
382405,differences file ecl file,CLOSED FIXED,P3 minor
382406,annotation default create correctly file save,CLOSED FIXED,P3 major
382407,make function dynamic,RESOLVED FIXED,P3 normal
382408,annotations cause compiler error,CLOSED INVALID,P3 major
382409,update plugin version,RESOLVED FIXED,P3 normal
382410,query hint cause uncommitted data load share,RESOLVED FIXED,P2 blocker
382411,cache annotations annotationshelper avoid repeat reflection call,REOPENED,P3 enhancement
382412,problems rui browser preference choices,CLOSED FIXED,P3 normal
382413,move emfstore example plugins core feature releng,CLOSED FIXED,P3 normal
382414,problem describe reference opposite,CLOSED FIXED,P3 normal
382415,abstracttaskeditorpart escape partname,RESOLVED FIXED,P3 trivial
382416,cycledetectionstack improvements,RESOLVED FIXED,P3 enhancement
382417,eclipse cgit patch usable,NEW,P3 normal
382418,dbws typeresolutiontestsuite fail due miss database table,RESOLVED FIXED,P3 normal
382419,login username field spellcheck enable,RESOLVED FIXED,P3 normal
382420,use cause extra double quote add,RESOLVED FIXED,P3 normal
382421,epf work linux environments,CLOSED FIXED,P3 major
382422,add builtin compiler settings lsp provider mingw toolchain,RESOLVED FIXED,P3 normal
382423,add builtin compiler settings lsp provider cygwin toolchain,CLOSED FIXED,P3 normal
382424,update download page,RESOLVED FIXED,P3 normal
382425,able parse remote file,NEW,P3 enhancement
382426,ui elements provide label,RESOLVED FIXED,P3 normal
382427,mechanism inject line compare strategies merge structure viewers,RESOLVED FIXED,P3 enhancement with 2 votes
382428,change navigator root fire selection change,RESOLVED FIXED,P3 normal
382429,improve display eunit result,CLOSED FIXED,P3 enhancement
382430,wizard exist model elements show model,RESOLVED DUPLICATE of bug 402525,P3 normal
382431,inconsistent layout storage layout persistence,CLOSED FIXED,P3 normal
382432,support eglars debugger,CLOSED FIXED,P3 enhancement
382433,change conversions bytes string,CLOSED FIXED,P3 enhancement
382434,change conversions bytes string,CLOSED FIXED,P3 enhancement
382435,problems generic return type itds,RESOLVED FIXED,P3 normal
382436,remove unused common block variables requirements removal strict,NEW,P3 normal
382437,move subprogram module check conflict bind,NEW,P3 normal
382438,nullpointerexception close statistics view,CLOSED FIXED,P3 normal
382439,null pointer exception,RESOLVED FIXED,P3 normal
382440,introduce compound protocols,CLOSED FIXED,P3 enhancement
382441,new nod add via src overview tend place vertically,NEW,P3 minor
382442,architecture bend point dependency connections duplicate open editor,CLOSED INVALID,P3 normal
382443,new vs auto vertical layout location,NEW,P3 trivial
382444,double click palette add item diagram,CLOSED WONTFIX,P3 enhancement
382445,site editor dirty state lag,RESOLVED FIXED,P3 normal
382446,reload configuration lead lose build status,NEW,P3 major
382447,able activate connection label editor connection label define,CLOSED FIXED,P3 normal
382448,incorrect validation marker node create connection,CLOSED FIXED,P3 normal
382449,support el,CLOSED FIXED,P3 enhancement
382450,expose maven repository link resource variable,CLOSED WONTFIX,P3 enhancement
382451,connection update endpoint make invalid,CLOSED FIXED,P3 normal
382452,node label editor cover validation marker,CLOSED FIXED,P3 normal
382453,annotation cause problems xml resources invalid schemas,CLOSED FIXED,P3 normal
382454,parse php function generate syntax error,CLOSED WORKSFORME,P3 normal
382455,eclipse hang update maven dependecies,CLOSED WORKSFORME,P3 major
382456,add fold support egl readonly editor vertical ruler,CLOSED FIXED,P3 enhancement
382457,lock artifact work,CLOSED FIXED,P3 major
382458,improve epp resource consumption servers,NEW,P3 normal
382459,,CLOSED DUPLICATE of bug 365867,P3 normal
382460,compile error use escape keyword dispatch method,RESOLVED WORKSFORME,P3 normal with 1 vote
382461,enable finer grain quickfixes,CLOSED FIXED,P3 enhancement
382462,possible launch binaries debug without enable binary parsers,RESOLVED FIXED,P3 normal
382463,filenotfoudexception genmodel convert xcore ecore,CLOSED WONTFIX,P3 normal
382464,swt password input text fail several character,CLOSED WORKSFORME,P3 critical
382465,jubula extendability provide additional binary bundle,REOPENED,P3 major
382466,direct navigation work firefox,RESOLVED WORKSFORME,P3 normal
382467,dependency papyrus svn optional,CLOSED FIXED,P3 normal
382468,update faq new repository structure,RESOLVED FIXED,P3 normal
382469,ambiguous method invocation,VERIFIED DUPLICATE of bug 383780,P3 normal
382470,ready tycho build,RESOLVED FIXED,P3 major
382471,paho java client mavenization,RESOLVED FIXED,P1 blocker
382472,codan break detect comment,NEW,P3 normal
382473,rui handlers cannot open,CLOSED FIXED,P3 critical
382474,format javascript contain html tag literal break,RESOLVED FIXED,P3 major
382475,npe edit diagram connection label linux,CLOSED FIXED,P3 major
382476,replace show commit file history,RESOLVED FIXED,P3 enhancement with 1 vote
382477,cannot install update site,RESOLVED INVALID,P3 normal
382478,css pad work properly right align columns,RESOLVED WORKSFORME,P3 minor
382479,ldt feature installable,CLOSED WONTFIX,P4 major
382480,ready tycho build,RESOLVED FIXED,P3 major
382481,pagination issue datafield content long,CLOSED DUPLICATE of bug 323222,P3 major
382482,allow osgi versions release,NEW,P2 enhancement with 3 votes
382483,ready tycho build,RESOLVED FIXED,P3 major
382484,clean implementation property view,RESOLVED FIXED,P3 major
382485,node project explorer collapse whenever project refresh,RESOLVED FIXED,P4 minor
382486,problematic tycho,CLOSED DUPLICATE of bug 381192,P3 major
382487,let servlet decide chunk process content,CLOSED WORKSFORME,P3 major
382488,trail coma end property name,RESOLVED FIXED,P3 normal
382489,unnamed git repository,CLOSED FIXED,P3 minor
382490,instal jnlp slave windows service fail,VERIFIED FIXED,P1 major
382491,set attribute primitive type fail configure datasource,CLOSED DUPLICATE of bug 383194,P3 normal
382492,abstract explorer like,RESOLVED FIXED,P3 normal
382493,remove code duplicate string,RESOLVED FIXED,P3 normal
382494,scroll mouse wheel support inside generate page,CLOSED FIXED,P3 normal
382495,string externalizer load preview file take lot,RESOLVED WONTFIX,P3 normal
382496,eclipse hang cdt debugger,RESOLVED FIXED,P3 critical
382497,always return empty array,RESOLVED WONTFIX,P3 normal
382498,dbws fail due change marshal behavior null binary field,RESOLVED FIXED,P3 normal
382499,groupboxbuttonbar inherit background color groupbox,CLOSED FIXED,P3 normal
382500,test unix database security realm throw error,NEW,P3 normal
382501,tool bridge feature miss categories update site,RESOLVED FIXED,P3 normal
382502,class find generate application,RESOLVED FIXED,P3 trivial
382503,use result nullpointerexception,RESOLVED FIXED,P2 blocker
382504,conversion wizard synchronize project file filter options,CLOSED FIXED,P3 normal
382505,incorrect group slave,RESOLVED FIXED,P3 normal
382506,node label default fonts hard read oses,CLOSED FIXED,P3 normal
382507,http preview restart cause restart,NEW,P3 normal
382508,bracket hover caret place use,NEW,P3 normal
382509,make aspectj dynamic minor syntax,NEW,P3 enhancement
382510,dojomobile checkbox widget comment,CLOSED FIXED,P3 normal
382511,add annotation actorclass,CLOSED FIXED,P3 enhancement
382512,support library group manage builder,NEW,P3 enhancement
382513,git status breadcrumbs work,RESOLVED FIXED,P3 normal
382514,workspacejob get block run validations,RESOLVED FIXED,P3 normal
382515,create common plugins junit test,CLOSED FIXED,P3 normal
382516,performance optimization model element deletion,CLOSED FIXED,P3 enhancement
382517,login user name display,CLOSED INVALID,P3 normal
382518,need relate link repository git log,RESOLVED FIXED,P3 normal
382519,extract theme separate plugin,CLOSED FIXED,P3 normal
382520,basic type generate illegalstateexception,CLOSED INVALID,P2 blocker
382521,gemini web miss file,CLOSED FIXED,P3 normal
382522,cannot login start initial setup upgrade unix database security use,NEW,P3 critical
382523,gemini jpa miss file,RESOLVED FIXED,P3 normal
382524,tag juno release,RESOLVED FIXED,P3 enhancement
382525,possible string,RESOLVED INVALID,P3 normal
382526,third party libraries via must correspond cq specific version,RESOLVED FIXED,P3 normal
382527,checkboxtableviewer setcheckedelements fail check items,NEW,P3 major
382528,performance regressions,RESOLVED FIXED,P3 normal
382529,concurrentmodificationexception control flow view,CLOSED FIXED,P3 normal
382530,infinite loop package name prepended type name,RESOLVED FIXED,P3 normal
382531,exception occur try invoke operation build storedfunction ref cursor return type,CLOSED WORKSFORME,P3 normal
382532,warn report errors actual errors compile,RESOLVED FIXED,P3 normal
382533,windows navigation maximize active view editor slow,CLOSED DUPLICATE of bug 357939,P3 normal
382534,go back git log page fail load,CLOSED DUPLICATE of bug 382130,P3 normal
382535,let importednamespaceawarelocalscopeprovider use idefaultresourcedescriptionstrategy,NEW,P3 enhancement
382536,create unit test scpfileservice,NEW,P3 normal
382537,throw illegalstateexception instead illegalargumentexception,CLOSED FIXED,P2 blocker
382538,delete folder root cause favorites,RESOLVED FIXED,P3 normal
382539,navigator need build id footer,RESOLVED FIXED,P3 normal
382540,every tree expand navigator reset viewport select item,RESOLVED FIXED,P3 normal
382541,return number object,CLOSED FIXED,P3 enhancement
382542,sometimes move node move context button,CLOSED FIXED,P3 trivial
382543,add xor operator booleans,CLOSED FIXED,P3 enhancement
382544,fix conversions bytes number,CLOSED FIXED,P3 normal
382545,use,CLOSED FIXED,P3 enhancement
382546,improve detection nullvalueexceptions,CLOSED FIXED,P3 enhancement
382547,fix conversions string,CLOSED FIXED,P3 normal
382548,fix typo,CLOSED FIXED,P3 trivial
382549,return attribute,CLOSED FIXED,P2 blocker
382550,gcli compatible,RESOLVED FIXED,P3 normal
382551,eclipselink installer download include,RESOLVED FIXED,P3 critical
382552,virtual server nebula,RESOLVED WORKSFORME,P3 normal
382553,adopt jgit final,RESOLVED FIXED,P3 normal
382554,egit block eclipse call main thread,RESOLVED FIXED,P3 normal
382555,regression work standalone index,CLOSED FIXED,P3 major
382556,migrate download content,RESOLVED FIXED,P3 normal
382557,change default bug assignee,CLOSED FIXED,P3 normal
382558,add way set markup language task,RESOLVED INVALID,P3 normal
382559,remove incubation egg everywhere,RESOLVED FIXED,P3 normal
382560,,RESOLVED FIXED,P3 normal
382561,update list test distros,RESOLVED FIXED,P3 normal
382562,update lttng wiki page,CLOSED FIXED,P3 normal
382563,fix web page,CLOSED FIXED,P3 normal
382564,remove redirect web page,RESOLVED FIXED,P3 normal
382565,fix web page,RESOLVED FIXED,P3 normal
382566,update cvs instructions,CLOSED WONTFIX,P3 normal
382567,fix add screenshot website,CLOSED FIXED,P3 normal
382568,remove unnecessary link page,RESOLVED FIXED,P3 normal
382569,gerrit trigger stop vote,CLOSED DUPLICATE of bug 380986,P3 normal
382570,clarify internal package name policy,CLOSED FIXED,P3 normal
382571,update mention policykit,RESOLVED FIXED,P3 normal
382572,add ibm copyright bottom systemtap user guide,RESOLVED FIXED,P3 normal
382573,rename reference,RESOLVED FIXED,P3 normal
382574,internal error occur help system need property set lucene present,RESOLVED FIXED,P2 normal
382575,update releng page new,CLOSED WONTFIX,P3 normal
382576,update versions,CLOSED FIXED,P3 normal
382577,content assist fail reveal select element scroll,CLOSED DUPLICATE of bug 390699,P3 normal with 3 votes
382578,,CLOSED INVALID,P3 normal
382579,move linux tool technology tool project,RESOLVED FIXED,P3 normal
382580,unable receive system properties,CLOSED DUPLICATE of bug 189486,P3 normal
382581,jsdt infer incorrect type flow analysis override local variable leak type information across method,NEW,P3 normal
382582,executable build one target trigger build libraries compatible target,ASSIGNED,P3 minor
382583,update eclipsesource link,RESOLVED FIXED,P3 normal
382584,plugin allow buddies,RESOLVED FIXED,P3 minor
382585,respect mavenarchiveconfiguration,CLOSED INVALID,P3 normal
382586,empty implementation one file upload function file service,NEW,P3 normal
382587,decimal division lose decimal precision,NEW,P3 normal
382588,folder miss release candidate build,RESOLVED FIXED,P3 normal
382589,investigate directory end macosx install,NEW,P3 normal
382590,must also work subclass element,VERIFIED FIXED,P3 normal with 3 votes
382591,export plugin development preferences,RESOLVED WORKSFORME,P3 enhancement
382592,add test plugins releng uml compare,CLOSED FIXED,P3 enhancement
382593,linewrap presentation handle focus correctly,RESOLVED FIXED,P3 normal
382594,egl search shadow search result right,CLOSED FIXED,P3 normal
382595,wrong behaviour sql prepare statement datasource define function,CLOSED FIXED,P2 normal
382596,one miss juno,RESOLVED FIXED,P3 normal with 1 vote
382597,egl search invocationtargetexception,CLOSED FIXED,P3 major
382598,incorrectly generate bundle dependent another bundle,RESOLVED INVALID,P3 normal
382599,icons take implementations,NEW,P3 normal with 1 vote
382600,war product embed servletbridge export war osgi launch,NEW,P3 normal
382601,cannot install birt via software via new,NEW,P3 major
382602,manage war product,NEW,P3 normal
382603,swtbot work swt dnd,CLOSED DUPLICATE of bug 285271,P3 normal
382604,clone slideout disappear clone do,CLOSED DUPLICATE of bug 389083,P3 normal
382605,npe dnd property nestedclass operation owner package,RESOLVED FIXED,P3 normal
382606,constructor use javadoc get resolve secondary,VERIFIED FIXED,P3 normal
382607,update mantis discovery list mylyn,RESOLVED FIXED,P3 enhancement
382608,egl search search wrong function,CLOSED DUPLICATE of bug 381528,P3 normal
382609,move egf emft emf,CLOSED FIXED,P3 normal
382610,display stereotype mask nest classifier label,CLOSED FIXED,P3 enhancement
382611,add egf category model forum,RESOLVED FIXED,P3 normal
382612,update foglyn mylyn,RESOLVED FIXED,P3 enhancement
382613,race condition ui callbacks,RESOLVED FIXED,P2 major
382614,provide action validate custom templates respect abandon,ASSIGNED,P3 normal
382615,upgrade hudson subversion plugin work format,RESOLVED FIXED,P3 minor
382616,enable emf generator retain javadoc tag,RESOLVED WORKSFORME,P3 enhancement
382617,variable set decimal literal fail due vary decimal position,CLOSED FIXED,P3 normal
382618,econtentadapters efficient,RESOLVED FIXED,P3 normal
382619,apply patch report change error lead whitespace crop,CLOSED DUPLICATE of bug 123787,P3 normal
382620,editor dirty even save,CLOSED FIXED,P3 normal
382621,provide way providers customize cross reference,CLOSED WONTFIX,P5 enhancement
382622,reference view cause npes,CLOSED FIXED,P3 normal
382623,javascriptobectexception null smallfloat smallint conversion,CLOSED FIXED,P3 normal
382624,throw illegalstateexception object obtain correlation,CLOSED FIXED,P2 blocker
382625,set,CLOSED DUPLICATE of bug 479126,P3 normal with 7 votes
382626,make dynamic,RESOLVED FIXED,P3 normal
382627,atl preference page contribute feature preference page update manager,CLOSED FIXED,P3 normal
382628,include oslc blog post tag planet eclipse,RESOLVED FIXED,P3 normal
382629,upgrade simple instance result error,VERIFIED FIXED,P3 critical
382630,cannot use configuration,VERIFIED FIXED,P3 critical
382631,classcastexception add string value multivaluededitor,CLOSED WONTFIX,P3 normal
382632,javascript throw typecastexception conversion string single digit month date,CLOSED FIXED,P3 normal
382633,eclipselink jpa test use asm build directory instead classpath,RESOLVED FIXED,P3 normal
382634,move ezeinitialize constructor,RESOLVED FIXED,P3 enhancement
382635,reset password work selfhosted site,RESOLVED FIXED,P3 normal
382636,update wizards new type add,CLOSED FIXED,P1 enhancement
382637,exception throw attempt create generator model,VERIFIED FIXED,P2 normal
382638,rename,NEW,P3 normal
