id,title,status,importance
57367,unable instantiate editor,RESOLVED DUPLICATE of bug 57130,P3 critical
57368,generate junit test test run,VERIFIED DUPLICATE of bug 56749,P3 minor
57369,able wizard description,VERIFIED DUPLICATE of bug 33241,P3 normal
57370,cannot change pullup pushdown refactoring type mouse,RESOLVED WORKSFORME,P4 normal
57371,link resource list sort ignore case,VERIFIED FIXED,P5 enhancement
57372,cvs integrate antelopetasks,RESOLVED INVALID,P3 normal
57373,workaround task tag default,RESOLVED WONTFIX,P3 enhancement
57374,dialogs message sync,RESOLVED FIXED,P3 normal
57375,match bracket highlight anymore,RESOLVED FIXED,P3 normal
57376,enable delay splash screen closure,RESOLVED INVALID,P3 enhancement
57377,draw horizontally scroll table incorrect,RESOLVED DUPLICATE of bug 42416,P3 normal
57378,navigate go resource available text editor,RESOLVED INVALID,P5 normal
57379,partition scanner handle cdata section,VERIFIED FIXED,P3 normal
57380,excess area table,RESOLVED FIXED,P3 normal
57381,build show outline,CLOSED INVALID,P3 major
57382,group tiff image show blank,CLOSED DUPLICATE of bug 545032,P3 normal with 13 votes
57383,print panel show properly change size,CLOSED FIXED,P3 minor
57384,main window active iwindowlisteners never receive windowactivated,RESOLVED FIXED,P3 normal
57385,receive notification new text file,VERIFIED WORKSFORME,P3 normal
57386,log create dbcs project,CLOSED DUPLICATE of bug 57431,P3 normal
57387,unable complete install,RESOLVED INVALID,P3 normal
57388,implementation wrong eclipse,RESOLVED WONTFIX,P3 normal
57389,add support execute test component behaviors,CLOSED FIXED,P3 enhancement
57390,import directly work,RESOLVED WORKSFORME,P3 normal
57391,preferences lose,RESOLVED WORKSFORME,P3 normal
57392,set default button work,RESOLVED WONTFIX,P3 normal
57393,recorder use eclipse standard icon directory structure,CLOSED FIXED,P3 minor
57394,exceptions startup,RESOLVED WORKSFORME,P3 major
57395,backspace texteditors double backspace,RESOLVED FIXED,P1 normal
57396,hose cvs like every year daylight save,RESOLVED INVALID,P3 normal
57397,unable save unit,RESOLVED FIXED,P3 normal
57398,error create nest control,RESOLVED WORKSFORME,P3 normal
57399,infopops wizard page fail control,RESOLVED WORKSFORME,P4 enhancement
57400,ask resources add ignore directories,CLOSED DUPLICATE of bug 36483,P3 normal
57401,panel work,RESOLVED DUPLICATE of bug 56375,P3 normal
57402,problem drop button linux motif,RESOLVED WORKSFORME,P3 normal
57403,problem drop button linux motif,RESOLVED DUPLICATE of bug 57402,P3 normal
57404,column head task view corrupt miss,CLOSED FIXED,P3 minor
57405,delete bookmark menu show mouse release bookmark,CLOSED FIXED,P3 normal
57406,cdt sluggish eventually run memory,RESOLVED WORKSFORME,P3 normal
57407,input show chinese,RESOLVED DUPLICATE of bug 56915,P3 normal
57408,press anything input,RESOLVED FIXED,P2 major
57409,cdt make ui plugin still use old startup extension format,RESOLVED FIXED,P3 normal with 1 vote
57410,new location break,RESOLVED FIXED,P3 critical
57411,site still disable select configuration window,RESOLVED FIXED,P3 normal
57412,keyboard key respond,RESOLVED WONTFIX,P1 major
57413,cannot rename internal bean ps,CLOSED FIXED,P3 normal
57414,open java search,VERIFIED FIXED,P3 normal
57415,hang deadlock mulitple cvs operations,RESOLVED DUPLICATE of bug 48859,P3 normal
57416,disappear perspectives toolbar,RESOLVED FIXED,P3 normal
57417,difference older methods,RESOLVED WORKSFORME,P3 normal
57418,java class file display java editor,RESOLVED DUPLICATE of bug 56915,P3 normal
57419,search expression via menu,CLOSED WORKSFORME,P3 normal
57420,change fonts,CLOSED WORKSFORME,P3 major
57421,cursor shape leave square bracket java,CLOSED INVALID,P3 normal
57422,content assist typedef struct yield field,RESOLVED INVALID,P3 normal
57423,formoutlinepage respond model change source mode,RESOLVED FIXED,P3 normal
57424,uijob violate document contract,RESOLVED INVALID,P3 normal
57425,treeviewer implement ifontprovider,CLOSED FIXED,P3 critical
57426,clip items set tree item use bold font,RESOLVED FIXED,P1 normal
57427,nullpointerexception close editor external palette,RESOLVED DUPLICATE of bug 50022,P3 normal
57428,problems copy string diffrent selection,RESOLVED WORKSFORME,P3 normal
57429,input dbcs workspace selection dialog,NEW,P3 normal
57430,exception print,RESOLVED FIXED,P3 normal
57431,bogus extention tab view plugin editor,CLOSED DUPLICATE of bug 57174,P3 major
57432,npe create declare message,NEW,P5 enhancement
57433,extract method even several local assignments,RESOLVED WONTFIX,P3 enhancement
57434,instruction pointer disapears,RESOLVED FIXED,P3 normal
57435,need api test help support available,RESOLVED WORKSFORME,P3 normal
57436,java fail run class produce ajc,RESOLVED FIXED,P2 normal
57437,fonts issue,CLOSED FIXED,P3 normal
57438,quick fix select text omit,RESOLVED WONTFIX,P5 enhancement
57439,key work,CLOSED WONTFIX,P3 normal
57440,workspace chooser detail history list,RESOLVED WONTFIX,P3 normal
57441,add fail,RESOLVED FIXED,P3 normal
57442,string work dbcs name class,CLOSED FIXED,P3 normal
57443,message err log panel new project dbcs,CLOSED DUPLICATE of bug 57386,P3 major
57444,null pointer exception save datagraph null root object,VERIFIED FIXED,P3 normal
57445,lack descriptions documentation,RESOLVED FIXED,P3 normal
57446,workbench freeze build open type dialog,RESOLVED FIXED,P2 normal
57447,memory leak perfmon,CLOSED FIXED,P3 major
57448,unclear group key,VERIFIED FIXED,P3 normal
57449,global source code locations,RESOLVED WONTFIX,P3 enhancement
57450,editor report error source error,RESOLVED WORKSFORME,P3 normal
57451,need javadoc,RESOLVED FIXED,P3 minor
57452,unexpected error due entries file sync,RESOLVED FIXED,P3 normal
57453,new icons,RESOLVED FIXED,P3 normal
57454,preference save shutdown,CLOSED FIXED,P3 normal
57455,aggregate plugin search index,RESOLVED FIXED,P1 enhancement
57456,new wizard show items enable actiivties default,CLOSED FIXED,P2 normal
57457,show,CLOSED FIXED,P3 normal
57458,vm crash,RESOLVED WORKSFORME,P3 major
57459,add option print highlight current line,RESOLVED DUPLICATE of bug 14954,P3 enhancement
57460,code add feature,ASSIGNED,P5 enhancement
57461,setframeandensurevisible addselection,CLOSED FIXED,P3 normal
57462,revise security emf cbe event,CLOSED FIXED,P3 normal
57463,npe abstractinformationcontrol,RESOLVED WORKSFORME,P3 normal
57464,constructors,RESOLVED FIXED,P3 enhancement
57465,eclipse platform provide variable temp bind local temporary file space,RESOLVED WONTFIX,P3 enhancement
57466,runtime workbenches store temporary relative product,VERIFIED WONTFIX,P3 normal
57467,race condition cause invalid stack frame,VERIFIED FIXED,P3 normal
57468,show date comment next text compare,VERIFIED FIXED,P3 enhancement
57469,view collapse disable would result space view,RESOLVED FIXED,P3 normal
57470,disbaled message action log intreactions view,CLOSED FIXED,P3 normal
57471,upto daily crash go java perspective,RESOLVED FIXED,P3 critical
57472,cannot create editor file extension stable,RESOLVED INVALID,P2 critical
57473,see file use open editor drop,RESOLVED FIXED,P3 normal
57474,specify exception method cause problem,VERIFIED FIXED,P3 normal
57475,subtle heap dump issue need resolve,CLOSED FIXED,P3 normal
57476,eclipse terminate vm crash windows xp,RESOLVED DUPLICATE of bug 56390,P3 major with 2 votes
57477,investigate support dom api,NEW,P3 enhancement with 11 votes
57478,selection change dialog,RESOLVED INVALID,P4 normal
57479,method eclassifier,RESOLVED WONTFIX,P3 enhancement
57480,presentation allow italicize title,ASSIGNED,P5 enhancement
57481,fast view need show result bolding,RESOLVED WONTFIX,P3 enhancement
57482,allow toolchain default options set per configuration,RESOLVED FIXED,P3 enhancement
57483,help leak dispose browsers,RESOLVED INVALID,P3 normal
57484,user job top priority,VERIFIED FIXED,P2 major
57485,illegalarguementexception gotosource action,CLOSED FIXED,P1 critical
57486,problems class change shape,CLOSED DUPLICATE of bug 58349,P3 critical
57487,contribute properties logasyncmessagereturn message,CLOSED FIXED,P3 normal
57488,non automatic selection open type list,RESOLVED WORKSFORME,P4 normal
57489,small option,RESOLVED WONTFIX,P3 enhancement
57490,save size perspectives,ASSIGNED,P5 normal
57491,must handle bad participants,RESOLVED FIXED,P3 normal
57492,classcastexception togglebreakpointadapter,RESOLVED WORKSFORME,P3 normal
57493,update cbe javadoc window title better reflect name spec,CLOSED FIXED,P3 normal
57494,add cbe factory template schema package,CLOSED FIXED,P3 normal
57495,code formatter performance problems,RESOLVED DUPLICATE of bug 72319,P3 normal
57496,dynamic variables display preference page,CLOSED WONTFIX,P3 normal
57497,cannot save file,RESOLVED FIXED,P3 normal
57498,code completion work new class wizard resource perspective,RESOLVED FIXED,P3 normal
57499,code formatter performance problems,RESOLVED DUPLICATE of bug 57495,P3 normal
57500,sometimes portion text show text label size,CLOSED WONTFIX,P3 normal
57501,concurrentmodificationexception parttabfolder,RESOLVED WORKSFORME,P3 normal
57502,open log view work log view yet open,CLOSED INVALID,P3 normal
57503,registry view contain redundant properties pane,RESOLVED WORKSFORME,P3 normal
57504,action mark open debug view,RESOLVED DUPLICATE of bug 51084,P3 normal
57505,need sure workbenchjobs cannot schedule workbench shutdown,RESOLVED WONTFIX,P2 enhancement
57506,press tab key create junk editor,RESOLVED FIXED,P3 normal
57507,releng,RESOLVED WORKSFORME,P3 normal
57508,ant format bug,RESOLVED INVALID,P3 normal
57509,ant enhancement,RESOLVED DUPLICATE of bug 55356,P3 normal
57510,cannot move projet another folder,RESOLVED WONTFIX,P3 normal
57511,javadoc warn markers show editors,RESOLVED WORKSFORME,P3 normal
57512,resizetracker gettargeteditpart may return null,RESOLVED FIXED,P3 normal
57513,treat new method reference,VERIFIED FIXED,P2 normal
57514,url test complete successfully use agent,CLOSED FIXED,P3 critical
57515,java search participant launch configs,VERIFIED FIXED,P3 enhancement
57516,set method entry breakpoint stack frame,RESOLVED WONTFIX,P3 enhancement
57517,eval popup initially small,VERIFIED FIXED,P3 enhancement
57518,difficult get ast imethod,RESOLVED WONTFIX,P3 enhancement
57519,console bold title new output available,VERIFIED FIXED,P3 enhancement
57520,,RESOLVED FIXED,P3 trivial
57521,method code coverage profile type filterable,CLOSED FIXED,P3 normal
57522,method access properties charstart charend ijavaclasspreparebreakpoint,RESOLVED INVALID,P3 normal
57523,profile type select later unchecked,CLOSED FIXED,P3 critical
57524,password amnesia switch workspaces,RESOLVED DUPLICATE of bug 58072,P2 normal
57525,keybinding cut work,RESOLVED FIXED,P3 normal
57526,cmodelelementstest need test mode well,RESOLVED FIXED,P3 normal
57527,default filter include,CLOSED FIXED,P3 normal
57528,getbundlegroups return duplicate,RESOLVED FIXED,P3 major
57529,wizard error,RESOLVED DUPLICATE of bug 55249,P3 major
57530,disable field focus dialog,RESOLVED INVALID,P3 normal
57531,close view activate previous previous view,RESOLVED WORKSFORME,P3 normal
57532,illegalstateexception dispose theme manager,CLOSED FIXED,P3 normal
57533,illegalstateexception run restartable job shutdown,RESOLVED DUPLICATE of bug 57505,P3 normal
57534,aspectj editor open mac os x,RESOLVED FIXED,P3 normal
57535,console continue output encounter,RESOLVED WORKSFORME,P3 normal
57536,provide way columns problems view,RESOLVED INVALID,P3 enhancement with 3 votes
57537,full build start ui,RESOLVED FIXED,P2 major
57538,quickbar trigger,RESOLVED WONTFIX,P3 normal
57539,close editor focus last editor,RESOLVED FIXED,P3 normal
57540,function work editor view activity search scope,CLOSED DUPLICATE of bug 56817,P3 major
57541,source format problem,RESOLVED WONTFIX,P3 normal
57542,save recent workspaces,RESOLVED INVALID,P3 major
57543,need handle tag better,VERIFIED FIXED,P3 normal
57544,opensnippetwizardaction find,RESOLVED WORKSFORME,P3 normal
57545,check,RESOLVED WONTFIX,P3 normal
57546,npe,RESOLVED FIXED,P3 normal
57547,console view come top linux,RESOLVED WORKSFORME,P2 normal
57548,result invalid sort,RESOLVED DUPLICATE of bug 92782,P3 minor
57549,keyboard navigation tab pane,RESOLVED INVALID,P3 normal
57550,registry update export usable,RESOLVED INVALID,P3 critical
57551,visual press key graph viewer impact source,CLOSED DUPLICATE of bug 59543,P3 major
57552,jar packager keyboard navigation fail go back,RESOLVED DUPLICATE of bug 48849,P3 minor
57553,illegalargumentexception use replace local history,RESOLVED WORKSFORME,P3 normal
57554,button panel enable button,CLOSED FIXED,P3 minor
57555,copy paste dbcs data eclipse java editor writer show,RESOLVED DUPLICATE of bug 41772,P3 normal
57556,encode file open encode,CLOSED DUPLICATE of bug 145754,P4 enhancement
57557,export deployable fragment dbcs folder fail,RESOLVED WORKSFORME,P2 major
57558,run project workbench,RESOLVED WORKSFORME,P3 normal
57559,cannot display korean glyphs linux,CLOSED WONTFIX,P2 major
57560,folders represent package package explorer,RESOLVED INVALID,P3 normal
57561,error dialog display openning,CLOSED DUPLICATE of bug 57693,P3 normal
57562,window resize work properly,CLOSED FIXED,P1 normal
57563,smarter codeassist suggestions,RESOLVED WONTFIX,P3 enhancement
57564,workspace launcher remember recently use workspace,RESOLVED DUPLICATE of bug 57440,P3 normal
57565,eclipse cvs synchronize,RESOLVED DUPLICATE of bug 57452,P3 critical
57566,add fail junit view,RESOLVED FIXED,P3 enhancement
57567,nullpointerexception start recorder window close,CLOSED FIXED,P3 normal
57568,location label test nav view,CLOSED FIXED,P3 minor
57569,search pattern fail,VERIFIED FIXED,P2 normal
57570,preference change font failure view,RESOLVED DUPLICATE of bug 411794,P3 normal
57571,remove dead code gla,CLOSED FIXED,P3 normal
57572,manifest translate translatable,RESOLVED FIXED,P3 normal
57573,animationstart slow,RESOLVED INVALID,P2 normal
57574,markers table synchonrization job take much ui thread time,RESOLVED INVALID,P3 normal
57575,refresh marker view job take much time,RESOLVED INVALID,P3 normal
57576,progress view update take long,RESOLVED INVALID,P2 normal
57577,update decorations take long ui thread,RESOLVED INVALID,P2 normal
57578,new project new class feature work,RESOLVED FIXED,P3 normal
57579,run background animate progress indicator,VERIFIED FIXED,P3 normal
57580,add code watch expression editor,REOPENED,P3 enhancement with 18 votes
57581,provide way customize color,CLOSED WONTFIX,P3 enhancement
57582,instrument ui block,RESOLVED WONTFIX,P3 normal
57583,check code file transfer functionality hyades data collection,CLOSED FIXED,P3 normal
57584,interaction aspectj jdt,RESOLVED FIXED,P3 normal
57585,memory optimization javamodelcache,VERIFIED FIXED,P3 minor
57586,markers view title turn bold often,VERIFIED FIXED,P2 normal
57587,ui unresponsive second select work set,RESOLVED WORKSFORME,P4 normal
57588,remove process launch remove associate console,VERIFIED FIXED,P3 normal
57589,hp build break,CLOSED FIXED,P3 normal
57590,segfault function,RESOLVED DUPLICATE of bug 38305,P3 normal
57591,profile data filter attach,CLOSED FIXED,P3 normal
57592,separator file would better term,VERIFIED WONTFIX,P3 enhancement
57593,method limit,VERIFIED FIXED,P3 critical
57594,operationcancelledexception pde container initialization lead thousand problems,RESOLVED FIXED,P3 blocker
57595,generate hours process result,RESOLVED WONTFIX,P5 normal
57596,rectangle animation need able use multiple composites,RESOLVED WORKSFORME,P4 enhancement
57597,tabs flash gain lose focus,NEW,P3 normal
57598,remove scrapbook toolbar button,VERIFIED FIXED,P3 normal
57599,eclipse periodically dups part workspace outside workspace,RESOLVED FIXED,P3 normal
57600,new user progress dialog need check need close,VERIFIED FIXED,P2 major
57601,new history dropdown must limit number menu items,RESOLVED FIXED,P3 normal
57602,full command input support console,NEW,P3 enhancement with 2 votes
57603,datapool window menu bar entries basic editor,CLOSED WORKSFORME,P1 enhancement
57604,cannot open update manager longer,RESOLVED INVALID,P3 major
57605,datapool horizontal scroll bar disappear resize grid long equivalence class,CLOSED WORKSFORME,P3 minor
57606,datapool delete variable resize class column cause grid line,CLOSED FIXED,P3 minor
57607,datapool column boundary resize largest cell content consideration column,CLOSED WONTFIX,P3 trivial
57608,datapool edit record drag highlight invoke automatic horizontal,CLOSED FIXED,P3 minor
57609,user name conflict,RESOLVED WORKSFORME,P3 normal
57610,datapool editor menus need customizable,CLOSED FIXED,P2 enhancement
57611,datapool,CLOSED FIXED,P2 normal
57612,datapool editor need support search,CLOSED FIXED,P1 enhancement
57613,datapool edit begin double click,CLOSED WORKSFORME,P4 minor
57614,customcommand binarycustomcommand overlap,CLOSED WONTFIX,P3 normal
57615,datapool methods variablechanged equivalenceclasschanged listener pass along old,CLOSED FIXED,P2 normal
57616,way set,VERIFIED FIXED,P3 normal
57617,npe,RESOLVED DUPLICATE of bug 44578,P3 normal
57618,global miss accelerator,RESOLVED DUPLICATE of bug 44354,P3 normal
57619,display problem view toolbar display bottom view,RESOLVED WORKSFORME,P3 normal
57620,open editor windows dynamically change association correspond file name change,CLOSED FIXED,P3 normal
57621,selectively export plugin class load,RESOLVED FIXED,P3 normal
57622,classcastexception use nls tool,VERIFIED FIXED,P3 critical
57623,new search save disable,RESOLVED FIXED,P3 normal
57624,error load profile file applet launch invalid character trace,CLOSED FIXED,P3 normal
57625,dot line style visial appearance dash,RESOLVED WORKSFORME,P3 normal
57626,close synch resources close tree,NEW,P3 normal
57627,click content assist window new class wizard,RESOLVED FIXED,P1 normal
57628,connection option use compare two revisions,RESOLVED INVALID,P2 normal
57629,hierarchy view show many type,RESOLVED FIXED,P3 normal
57630,open adapter file gla editor cause message formatter element,CLOSED INVALID,P3 normal
57631,nullpointerexception,VERIFIED WORKSFORME,P1 major
57632,run profile never send command,CLOSED FIXED,P3 normal
57633,editor switcher small,RESOLVED FIXED,P3 normal
57634,pde import plugins default location,RESOLVED FIXED,P3 normal
57635,java editor longer work external source,RESOLVED FIXED,P3 critical
57636,nullpointerexception,CLOSED FIXED,P3 critical
57637,turn remove terminate launch default,VERIFIED FIXED,P3 enhancement
57638,null pointer exception link component configuration,CLOSED DUPLICATE of bug 57640,P2 critical
57639,turn remove terminate launch default,RESOLVED DUPLICATE of bug 57637,P3 enhancement
57640,gla browse button unique id field component detail pane cause exception,CLOSED FIXED,P3 normal
57641,unable delete link file package,RESOLVED DUPLICATE of bug 50158,P2 enhancement
57642,debug test failures due miss selection,VERIFIED FIXED,P2 major
57643,preference terminate process,RESOLVED FIXED,P3 enhancement
57644,smap strata sourcefile attribute use locate source,VERIFIED FIXED,P3 normal
57645,resources disappear team synchronize perspective,RESOLVED DUPLICATE of bug 57093,P3 minor
57646,build menu project enable,RESOLVED WORKSFORME,P3 normal
57647,errant shell behaviour tooltiptext set control,RESOLVED FIXED,P3 normal
57648,take minutes start web application,RESOLVED FIXED,P3 critical with 1 vote
57649,title synchronize view wrap,RESOLVED WORKSFORME,P2 normal
57650,import access log show log record,CLOSED FIXED,P3 blocker
57651,errors launch dump exception stack,CLOSED FIXED,P3 normal
57652,eclipse crash load fops structure,RESOLVED FIXED,P3 major
57653,revalidate new uris create exist validate,VERIFIED FIXED,P3 enhancement
57654,implement cache mechanism uri reduce repetative string parse cost,VERIFIED FIXED,P3 enhancement
57655,terminate process never go away console,RESOLVED DUPLICATE of bug 57588,P3 major
57656,stop work,RESOLVED FIXED,P2 critical with 1 vote
57657,gtk performance,CLOSED DUPLICATE of bug 37683,P3 critical
57658,npe mouse event handler,RESOLVED DUPLICATE of bug 58042,P3 normal
57659,view acitvated toolbar button press,VERIFIED FIXED,P3 normal
57660,binarycontainer still show binaries folder remove,RESOLVED FIXED,P3 normal
57661,nls property file must use encode,RESOLVED FIXED,P3 normal
57662,tablecursor traverse method signature match parent,RESOLVED WONTFIX,P3 normal
57663,need precise validation exceptions,CLOSED FIXED,P3 normal
57664,command stop work,VERIFIED WORKSFORME,P4 normal
57665,icons miss,CLOSED FIXED,P3 normal
57666,duplicate manifest cause gack,RESOLVED FIXED,P3 normal
57667,provide way customize console name,RESOLVED DUPLICATE of bug 42138,P3 enhancement
57668,clearcase plugin work anymore,RESOLVED DUPLICATE of bug 50631,P3 normal
57669,simplify improve default factory registration,VERIFIED FIXED,P3 normal
57670,preference writer use safefileoutputstream,RESOLVED FIXED,P3 normal
57671,scroll keybinding,RESOLVED INVALID,P3 normal
57672,scroll diagram viewport,RESOLVED FIXED,P3 normal
57673,add task bookmark pde source page ruler,CLOSED DUPLICATE of bug 29398,P3 normal
57674,nullpointerexception trace ui plugin,CLOSED FIXED,P3 critical
57675,match outer scope,RESOLVED DUPLICATE of bug 50631,P3 major
57676,filter apply log interactions log view,CLOSED FIXED,P3 normal
57677,selective patch path improvements,VERIFIED FIXED,P3 enhancement
57678,log interactions view show correlations select node,CLOSED FIXED,P3 normal
57679,inconsistent terminology log interactions diagram,CLOSED FIXED,P3 normal
57680,externalize string dialog huge,VERIFIED FIXED,P3 normal
57681,addition tracemodenone change default agent behavior,CLOSED FIXED,P3 normal
57682,invalid option value,CLOSED FIXED,P3 normal
57683,mouse gesture like debug perspective,CLOSED WONTFIX,P3 enhancement
57684,profile ui set,CLOSED FIXED,P1 critical
57685,extension point profile send command agent,CLOSED FIXED,P2 normal
57686,nullpointerexception activate sample xml schema editor,VERIFIED FIXED,P3 normal
57687,emf cbe throw,CLOSED FIXED,P3 normal
57688,tableviewer framwork support new swt table capabilities,VERIFIED FIXED,P4 enhancement with 1 vote
57689,arrayindexoutofboundsexception create new class,VERIFIED FIXED,P3 normal
57690,alltypescaching may still run workbench close,RESOLVED WORKSFORME,P3 normal
57691,export dbcs java project jar dbcs data show,CLOSED DUPLICATE of bug 21454,P3 normal
57692,behaviour incorrect,VERIFIED FIXED,P3 normal
57693,swt error pop click outline view,CLOSED FIXED,P3 major
57694,cvs synchronization include non select file,RESOLVED DUPLICATE of bug 56426,P3 normal
57695,multi language support,RESOLVED DUPLICATE of bug 56915,P3 normal
57696,console appear run,RESOLVED WORKSFORME,P3 normal
57697,ok button disable factory method first charactor lower,CLOSED FIXED,P3 major
57698,nothing happen click intro new,CLOSED FIXED,P3 normal
57699,button truncation sample dialog intro,RESOLVED FIXED,P3 minor
57700,progress feedback sync,RESOLVED FIXED,P3 critical
57701,checkbox workspace launcher window work,RESOLVED DUPLICATE of bug 55537,P3 normal
57702,shorten cvs update job,RESOLVED FIXED,P2 normal
57703,extension file,CLOSED FIXED,P3 major
57704,popup go,RESOLVED DUPLICATE of bug 55537,P3 normal
57705,add tab navigation java editor,ASSIGNED,P3 enhancement
57706,expect override indicator override anonymous class,RESOLVED FIXED,P3 normal
57707,xml schema file fail,CLOSED FIXED,P3 major
57708,hang load class,RESOLVED FIXED,P3 normal
57709,npe open,RESOLVED FIXED,P3 normal
57710,able make layout sticky,RESOLVED FIXED,P3 normal
57711,render visual part graph viewer create visual,CLOSED INVALID,P3 major
57712,task problems view selection provider,VERIFIED WORKSFORME,P3 enhancement
57713,suspicious entries log patch,RESOLVED DUPLICATE of bug 59653,P3 major
57714,queue disambiguate,RESOLVED FIXED,P3 normal
57715,work one editor tab folder,CLOSED FIXED,P3 normal
57716,npe compile selectionparser source,RESOLVED FIXED,P3 normal
57717,empty sync view restart,RESOLVED FIXED,P3 normal
57718,npe startup,RESOLVED FIXED,P3 major
57719,illegalstateexception markers view,RESOLVED DUPLICATE of bug 57505,P3 normal
57720,arrayindexoutofboundsexception code assist,RESOLVED FIXED,P2 normal
57721,copy resource share project different one destroy cvs information,RESOLVED WORKSFORME,P3 normal
57722,exception intro startup,RESOLVED FIXED,P3 blocker
57723,styledtext bug change color bold text,RESOLVED FIXED,P3 normal
57724,support work set,VERIFIED FIXED,P3 enhancement
57725,rename project update work set,RESOLVED DUPLICATE of bug 15938,P3 minor
57726,cvs root undocumented,RESOLVED INVALID,P3 normal
57727,swap position original current version item compare,RESOLVED WONTFIX,P4 enhancement with 1 vote
57728,perspective bar chop linux,RESOLVED DUPLICATE of bug 56254,P3 normal
57729,highlight inconsistency,RESOLVED WONTFIX,P3 normal
57730,report option miss test navigator,CLOSED WORKSFORME,P3 normal
57731,synchronisation execution test navigator browser work,CLOSED INVALID,P3 normal
57732,relative build classpath lead outside eclipse workspace,VERIFIED FIXED,P3 enhancement
57733,help create patch feature,RESOLVED FIXED,P3 normal
57734,contribute sign update,NEW,P4 normal
57735,include assert tag private breakpoint set,VERIFIED FIXED,P3 normal
57736,provide mean immediately show action set new plugin,RESOLVED WONTFIX,P3 enhancement
