id,title,status,importance
372601,syntax error,RESOLVED FIXED,P3 normal
372602,warn message log regard security communication cookies,CLOSED INVALID,P3 critical
372604,actorclass generate,CLOSED FIXED,P3 normal
372605,remove prefix key bind,VERIFIED FIXED,P3 normal
372606,add rename detection merge,REOPENED,P3 enhancement with 9 votes
372607,tree,RESOLVED FIXED,P3 enhancement with 1 vote
372608,npe vulnerability platformresourceurihandlerimpl,CLOSED FIXED,P3 normal
372609,show markers navigator file problems,CLOSED DUPLICATE of bug 368176,P3 enhancement
372610,scout model value update miss lose focus event,CLOSED FIXED,P2 normal
372611,press esc close messagebox mac os,CLOSED WONTFIX,P3 normal
372612,toggle checkbox state space,RESOLVED INVALID,P3 normal
372613,breakpoint filter handle inner class,VERIFIED FIXED,P3 normal
372614,welcome occupy full screen window without perspectives,VERIFIED FIXED,P3 normal
372615,move name match strategy content assist cdt core ctd ui,NEW,P3 normal
372616,,RESOLVED WONTFIX,P3 normal
372617,data properly escape,RESOLVED FIXED,P3 normal
372618,xsd design view need back button,NEW,P3 enhancement
372619,test failures official build,VERIFIED FIXED,P3 normal
372620,unexpected unfold anonymous type,ASSIGNED,P3 normal
372621,cannot start eclipse power failure,CLOSED DUPLICATE of bug 370374,P3 blocker
372622,drag directories external program file system,RESOLVED FIXED,P3 normal
372623,javadoc warn official build,VERIFIED FIXED,P3 normal
372624,,RESOLVED WONTFIX,P3 normal
372625,process fail job,CLOSED FIXED,P3 blocker
372626,aggregate,CLOSED FIXED,P2 enhancement
372627,new blog url,RESOLVED FIXED,P3 normal
372628,gitgerritfilter client support configurable map create scm location,RESOLVED FIXED,P3 normal
372629,chooser languageissue,CLOSED FIXED,P3 normal
372630,launch process end,RESOLVED FIXED,P3 normal
372631,improve view filter selection,RESOLVED FIXED,P3 enhancement
372632,improve view content selection,RESOLVED FIXED,P3 enhancement
372633,slow use indigo update site,RESOLVED FIXED,P3 major
372634,visual requirements management consumer,CLOSED WONTFIX,P3 enhancement
372635,editable row mouse key,CLOSED FIXED,P3 normal
372636,enable reference products modules,RESOLVED FIXED,P3 enhancement with 1 vote
372637,push commit authorize committer committer field,CLOSED DUPLICATE of bug 369043,P3 major
372638,trait template add php templates,CLOSED FIXED,P1 enhancement
372639,remove tag remove cache refresh tag,NEW,P3 normal
372640,build greenpages empty maven cache,CLOSED FIXED,P3 normal
372641,cannot execute binary file run,RESOLVED FIXED,P3 normal
372642,different string field behaviour swt swing,CLOSED FIXED,P3 normal
372643,unable download latest,CLOSED FIXED,P3 critical
372644,create customizable tooltips treeviewer use customizablelabelprovider,CLOSED FIXED,P2 enhancement
372645,support rdf reification,CLOSED FIXED,P3 enhancement
372646,icon whitespace miss,CLOSED WORKSFORME,P3 normal
372647,menu items show run memory analyzer rcp base,RESOLVED FIXED,P3 normal
372648,go keybinding clobber location browser action,RESOLVED FIXED,P3 normal
372649,provide ability obtain content type upload file,RESOLVED FIXED,P3 enhancement
372650,support prototype scoped bean,CLOSED WONTFIX,P3 enhancement
372651,dijit select box style overload,RESOLVED FIXED,P3 normal
372652,scalable keybinding strategy editor page command,RESOLVED WONTFIX,P3 normal
372653,incorrect mouse coordinate silverlight mac,RESOLVED WORKSFORME,P3 normal
372654,xulrunner crash js invoke,RESOLVED FIXED,P3 normal
372655,serial connector pick system rxtx library instal,RESOLVED INVALID,P3 normal
372656,defaultfilelocatorhelper work protocol felix,CLOSED MOVED,P3 normal
372657,feature name source bundle,CLOSED WONTFIX,P3 normal
372658,badlocationexception errors open project,RESOLVED WORKSFORME,P3 normal
372659,write test path result requesturi space rather,CLOSED FIXED,P3 minor
372660,upper case file name sort front lower case,CLOSED FIXED,P3 normal
372661,content assist api include selection,RESOLVED WONTFIX,P3 normal
372662,problem resolve correct proposal,RESOLVED FIXED,P3 normal
372663,npe taskeditoroutlinepage,RESOLVED FIXED,P3 normal
372664,login work transactional edit domain,CLOSED FIXED,P3 major
372665,remove use mozoutline,RESOLVED FIXED,P3 normal
372666,longer work view swap around,RESOLVED FIXED,P3 major
372667,create copy patch clipboard even though file select,VERIFIED FIXED,P3 major
372668,update blog address,RESOLVED FIXED,P3 normal
372669,impossible add icefaces facet eclipse,RESOLVED NOT_ECLIPSE,P3 normal
372670,remove prefix key bind,VERIFIED FIXED,P3 trivial
372671,open office emitter error,VERIFIED FIXED,P3 normal
372672,inconsistent timestamp use instance within unit,NEW,P3 normal with 4 votes
372673,linux tool build fail,RESOLVED FIXED,P3 normal
372674,enhancement preserve state remote monitor view,RESOLVED FIXED,P3 normal
372675,change public,RESOLVED FIXED,P3 normal
372676,sequencer allow specify cycle period use unit years months,RESOLVED FIXED,P3 enhancement
372677,json support mappings,RESOLVED FIXED,P2 normal
372678,embed examples need update new loginservice requirement,RESOLVED FIXED,P3 normal
372679,cause lock congestion,ASSIGNED,P3 critical
372680,contributions review tool need update consideration contributions,RESOLVED WONTFIX,P3 normal
372681,avoid declaration redundant local variables,CLOSED FIXED,P3 enhancement
372682,segfault dynamic loader use small stack size,CLOSED INVALID,P3 minor
372683,always separate java output folder java source folder,RESOLVED FIXED,P1 normal
372684,contributions use longer one action delegate instance per view instance,VERIFIED FIXED,P3 normal
372685,treeitems incorrect horizontal position,RESOLVED FIXED,P1 normal
372686,update status ui freeze,CLOSED FIXED,P3 major
372687,return empty list class methods,VERIFIED FIXED,P3 normal
372688,instal service fail,CLOSED DUPLICATE of bug 368548,P3 normal
372689,order work,NEW,P2 major with 12 votes
372690,primitive internal typerefs show help,RESOLVED WONTFIX,P3 trivial
372691,make work amd module loader,CLOSED FIXED,P3 enhancement
372692,tcf agent generate truncate process stdout,RESOLVED FIXED,P3 major
372693,incremental find work find slide open,RESOLVED FIXED,P3 normal
372694,adjust parser generator tool,VERIFIED FIXED,P3 normal
372695,content assist try invoke setter function define,CLOSED FIXED,P3 normal
372696,clear marketplace client error flag work,RESOLVED FIXED,P3 normal
372697,feasibility flexible content assist jdt,CLOSED FIXED,P3 enhancement
372698,return json errors post request,ASSIGNED,P3 enhancement
372699,invisible shell become active shell constellations,RESOLVED FIXED,P3 normal
372700,provide map support parameters,CLOSED FIXED,P3 normal
372701,change url miss message detail push result push gerrit,RESOLVED FIXED,P3 normal
372702,share fragment bundle,NEW,P3 normal
372703,return range,CLOSED FIXED,P3 enhancement
372704,please install maven,RESOLVED FIXED,P3 normal
372705,publish new noteworthy mylyn,RESOLVED FIXED,P3 enhancement
372706,optimize compile code x null null x,NEW,P3 enhancement
372707,rapunittest notifyclient longer work,CLOSED WONTFIX,P3 normal
372708,completion proposal suggest always provide suggestions,NEW,P3 normal
372709,find reference workspace unreliable,VERIFIED DUPLICATE of bug 469320,P3 normal
372710,dialog warn change remote host identification miss host name,ASSIGNED,P3 major
372711,call apply function break,CLOSED FIXED,P3 normal
372712,wrong type check,CLOSED FIXED,P3 normal
372713,eclipse crash confirm dialog,CLOSED DUPLICATE of bug 357619,P3 critical
372714,,CLOSED DUPLICATE of bug 372317,P3 enhancement
372715,support override dynamic,CLOSED WONTFIX,P3 enhancement
372716,reduce size generate js file release,CLOSED FIXED,P3 enhancement
372717,target list go,RESOLVED FIXED,P3 normal
372718,need refresh get border widgets handler miss build path,CLOSED DUPLICATE of bug 372936,P3 normal
372719,icon need,CLOSED FIXED,P3 enhancement
372720,windowbuilder editor create,CLOSED WORKSFORME,P3 major
372721,clone gerrit setup eclipse git repo become harder recently,NEW,P3 normal
372722,codan checker create software metrics,NEW,P3 enhancement with 1 vote
372723,feature request problems view,NEW,P3 enhancement
372724,search function traverse linkitems,RESOLVED FIXED,P3 normal
372725,handle change task data directory,RESOLVED FIXED,P3 enhancement
372726,scm bundle importer must reset page set selection,RESOLVED FIXED,P3 major
372727,single line,RESOLVED FIXED,P3 normal
372728,configurationdialog fail initialize separator,RESOLVED FIXED,P3 major
372729,javadoc warn official build,VERIFIED FIXED,P3 normal
372730,parameters tab properties view custom task blank,RESOLVED FIXED,P3 normal
372731,quickfixes unsatisfied link constructors,NEW,P3 enhancement
372732,rewrite catalog view,CLOSED FIXED,P2 normal
372733,properties custom task get display properties view,CLOSED FIXED,P3 normal
372734,rationalize multiple icon descriptions model,NEW,P3 normal
372735,locatorservice fail parse peer attribute,RESOLVED FIXED,P3 normal
372736,webservice generate option completely basic profile compliant,RESOLVED FIXED,P3 normal
372737,java source pattern ignore maven conversion,CLOSED INVALID,P3 normal
372738,need share cbi platform build prototype package,CLOSED FIXED,P2 major
372739,hide feature category view,RESOLVED FIXED,P3 enhancement
372740,parse error xquery script syntax,NEW,P3 normal
372741,remove,RESOLVED FIXED,P3 normal
372742,replace usage,RESOLVED FIXED,P3 normal
372743,tag git repos,RESOLVED FIXED,P3 normal
372744,problem index hxx file,RESOLVED WORKSFORME,P3 normal
372745,major refactoring group framework,CLOSED FIXED,P3 enhancement
372746,xmlanycollectionmapping remove namespaces soon,RESOLVED FIXED,P3 normal
372747,samplecommands plugin reference miss icons,RESOLVED FIXED,P3 normal
372748,use instead,RESOLVED FIXED,P3 normal
372749,instal samplecommandsplugin result double chevrons favorites,RESOLVED FIXED,P3 normal
372750,dbws databasetypebuilder handle mix case type name,RESOLVED FIXED,P3 normal
372751,transport error clone repo via ssh,RESOLVED FIXED,P3 normal
372752,indigo uml fail juno run standalone,RESOLVED WONTFIX,P3 critical
372753,save flush command stack,CLOSED FIXED,P3 enhancement
372754,profile page label attribute undefined,RESOLVED FIXED,P3 normal
372755,hudson confuse node name label name cause git poll trigger build repeatedly,VERIFIED WORKSFORME,P3 normal
372756,review comment file get corrupt prevent open review kill eclipse,RESOLVED WONTFIX,P3 major
372757,manhattanconnection support bendpoints,ASSIGNED,P4 enhancement
372758,allow use spacebar activate button,RESOLVED FIXED,P3 normal
372759,cleanup save file cause much code lose,RESOLVED WORKSFORME,P3 critical
372760,segment offset flexible,RESOLVED FIXED,P3 normal
372761,update rest bind page wizard,NEW,P3 enhancement
372762,hide line number ruler screen readers,RESOLVED FIXED,P3 normal
372763,remove debug oauth framework consumer store,CLOSED FIXED,P3 normal
372764,import source bundle work,NEW,P3 normal
372765,provide accessible way discover current line,RESOLVED FIXED,P3 normal
372766,npe classpathdependencyutil classpath container return null entries,RESOLVED FIXED,P3 normal
372767,git repos visible list,RESOLVED FIXED,P3 normal
372768,adjust preference ui line bug,RESOLVED FIXED,P3 normal
372769,remove unnecessary methods icompileroptions,CLOSED FIXED,P3 normal
372770,feature import discrete population transportation events stem,ASSIGNED,P3 enhancement
372771,support constructor args jvmenumliterals,NEW,P3 normal
372772,jdk include product export,CLOSED DUPLICATE of bug 325368,P3 normal
372773,mouse events sync,RESOLVED FIXED,P3 normal
372774,oauth make sure rdf consumer store thread safe,CLOSED FIXED,P3 major
372775,introduce annotation,CLOSED FIXED,P3 enhancement
372776,block definition incorrect papyrus copy paste support lead diagram,RESOLVED INVALID,P3 major
372777,internal block incorrect papyrus copy paste support lead diagram,RESOLVED INVALID,P3 major
372778,git directory epp project,RESOLVED FIXED,P3 normal
372779,remove svn compatible clients,RESOLVED FIXED,P3 normal
372780,aggregate content target platform instead resolve project dependencies,ASSIGNED,P3 normal
372781,include javahl connector early simulatenous release build,RESOLVED FIXED,P3 normal
372782,feature request decoration project package explorer,NEW,P3 enhancement
372783,compare action work complex structure,NEW,P3 enhancement
372784,problem add nebula update site target platform,CLOSED INVALID,P3 normal
372785,confine dependency binary runtime bundle,VERIFIED FIXED,P3 normal
372786,npe work otdt source bundle,VERIFIED FIXED,P3 normal
372787,json binary data mappings,RESOLVED FIXED,P3 normal
372788,let artifact repository create artifactdescriptor instance,RESOLVED FIXED,P3 enhancement
372789,file import git project git work,RESOLVED FIXED,P3 normal
372790,winicofileformat cannot handle icons,RESOLVED FIXED,P3 normal
372791,qualifier version number,RESOLVED FIXED,P3 normal
372792,status cbi build eclipse platform,RESOLVED FIXED,P3 major
372793,please add support compute columns script data set,NEW,P3 enhancement with 1 vote
372794,cbi build platform native swt code,CLOSED FIXED,P2 major
372795,refactor common code class,RESOLVED FIXED,P3 enhancement
372796,pluginimportoperation delete project content disk default location,RESOLVED FIXED,P3 major
372797,create examples plugin visualizer,RESOLVED FIXED,P3 normal
372798,mwe bean compatibility,NEW,P3 enhancement
372799,viewpart cannot adapt isaveablepart longer must implement,VERIFIED FIXED,P3 normal
372800,push new ui refresh,RESOLVED FIXED,P3 normal
372801,join wrap inconsistent break rule,CLOSED DUPLICATE of bug 303519,P3 normal with 1 vote
372802,ergonomic feedback,RESOLVED FIXED,P3 normal
372803,extension element search show wrong match count,RESOLVED FIXED,P3 normal
372804,image tag lead space generate incorrect filename,RESOLVED FIXED,P3 normal
372805,sit feature break,CLOSED INVALID,P3 critical
372806,command line accept relative paths xml config file,RESOLVED FIXED,P3 normal
372807,delete folder corrupt,RESOLVED FIXED,P3 normal with 6 votes
372808,link guide break firefox,RESOLVED FIXED,P3 normal
372809,bugzilla mess portal change,RESOLVED FIXED,P3 critical
372810,cannot open peer eclipse,RESOLVED FIXED,P3 normal
372811,relative href paths generate windows incorrect path separator,RESOLVED FIXED,P3 normal
372812,annotate eattribute whose type eenum modelgenannotator take much time,RESOLVED FIXED,P3 major
372813,cannot add java annotation whose full qualify name contain one dot,CLOSED INVALID,P3 normal
372814,function inside global object appear outline,NEW,P3 normal
372815,parser fail recognize label,CLOSED DUPLICATE of bug 321775,P3 major
372816,provide adapt mechanism sapphirepart,CLOSED FIXED,P3 enhancement
372817,spellig mistake dshv,NEW,P3 normal
372818,test failures ui bug,RESOLVED FIXED,P3 trivial
372819,could consume web service eclipse blue,RESOLVED NOT_ECLIPSE,P3 critical
372820,make assistscope accessible internalcompletioncontext,NEW,P3 normal
372821,implement project liveliness,RESOLVED WONTFIX,P3 normal
372822,cannot import move svn revisions problem,NEW,P3 major with 1 vote
372823,significant differences map file master,RESOLVED INVALID,P3 normal
372824,emf instead juno release train,CLOSED DUPLICATE of bug 329935,P3 normal
372825,grid column incorrect since introduction,RESOLVED FIXED,P3 normal
372826,change css class fire event update application style,RESOLVED WONTFIX,P3 normal
372827,wrong warn import never use,NEW,P3 minor
372828,multireferenceeditor still use compatible infinite tree,RESOLVED FIXED,P3 major
372829,problems input various character sign,CLOSED MOVED,P2 critical
372830,problem several keyboard input,CLOSED WONTFIX,P2 critical
372831,suggestions improvement buckminster svn output,NEW,P3 trivial with 1 vote
372832,checkable table toggable,CLOSED FIXED,P3 normal
372833,release greenpages,CLOSED FIXED,P3 enhancement
372834,handle incorrectly show file change,RESOLVED FIXED,P3 normal with 1 vote
372835,selectionlength report lead immediate crash,RESOLVED FIXED,P1 normal
372836,widget keystrokes order,CLOSED FIXED,P3 normal
372837,nullpointerexception open gerrit search page,RESOLVED FIXED,P3 normal
372838,illegalargumentexception open gerrit editor,RESOLVED FIXED,P3 major
372839,error build,RESOLVED FIXED,P3 normal
372840,add quick fix add miss default switch statement,RESOLVED FIXED,P3 enhancement
372841,syntax highlight options available,RESOLVED WORKSFORME,P3 major
372842,error report egit sparse,RESOLVED INVALID,P3 major
372843,post max rydahl andersen,RESOLVED FIXED,P3 normal
372844,test failures,VERIFIED FIXED,P3 major
372845,problem latest nightly update site,RESOLVED FIXED,P3 critical
372846,make password complexity requirements logical,RESOLVED FIXED,P3 major
372847,generate source add classpath import time,CLOSED DUPLICATE of bug 353244,P3 normal
372848,time issue,RESOLVED FIXED,P3 normal
372849,manually add file associations work restart,NEW,P3 minor
372850,revise documentation ocl,CLOSED FIXED,P3 normal
372851,wont start,RESOLVED WORKSFORME,P3 critical
372852,filter work launch configurations without associate project,CLOSED FIXED,P3 normal
372853,error opaque behavior without body,RESOLVED FIXED,P3 critical
372854,delete eclipsecon forum,RESOLVED FIXED,P3 normal
372855,add blog ed willink,RESOLVED INVALID,P3 normal
372856,release virgo,CLOSED FIXED,P3 enhancement
372857,change remote java application java attach application,RESOLVED WONTFIX,P3 enhancement
372858,exception first post request prevent application restart,RESOLVED FIXED,P1 normal
372859,use standard undo icon revert commit icon,RESOLVED FIXED,P3 trivial
372860,ask save need dialog show twice esc,CLOSED FIXED,P3 normal
372861,dependency reduction chart framework,CLOSED WONTFIX,P3 enhancement
372862,cvs cache contain precise information,VERIFIED FIXED,P3 enhancement
372863,include fix start cdt move,RESOLVED FIXED,P3 normal
372864,xtend switch return null type mismatch incompatible implicit return type,CLOSED FIXED,P3 normal
372865,facetset selection dialog,CLOSED FIXED,P2 enhancement
372866,mac slave access resources,RESOLVED FIXED,P3 normal
372867,ant start modern test failure,RESOLVED INVALID,P3 normal
372868,change category hide task task list focus work week select,RESOLVED DUPLICATE of bug 332070,P3 normal
372869,eruntime hold epackages heap memory data store close,RESOLVED FIXED,P3 normal
372870,set enable enable action windows,NEW,P3 normal
372871,hudson job gerrit trigger,RESOLVED FIXED,P3 normal
372872,disconnectoperation,CLOSED DUPLICATE of bug 403385,P3 normal
372873,duplicate entries customize perspective dialog,RESOLVED FIXED,P3 normal
372874,add,RESOLVED FIXED,P3 normal
372875,keystroke menu work menu invisible,CLOSED WORKSFORME,P3 normal
372876,dynamic entity generation table,VERIFIED FIXED,P3 enhancement
372877,gerrit run test change,RESOLVED FIXED,P3 normal
372878,gerrit run test change,RESOLVED FIXED,P3 normal
372879,new dynamic entity wizard,RESOLVED FIXED,P3 enhancement
372880,hudson windows slave need internet options set bypass proxy localhost eclipse address,RESOLVED FIXED,P3 normal
372881,please add support replace data set report designer,NEW,P3 enhancement with 1 vote
372882,stash mess index,RESOLVED FIXED,P3 normal
372883,command remove select stash,RESOLVED FIXED,P3 enhancement
372884,message stash show git stash list,RESOLVED FIXED,P3 normal
372885,save database password use eclipse secure storage,CLOSED DUPLICATE of bug 378971,P3 enhancement
372886,maximize undecorated frame work circumstances,CLOSED FIXED,P3 normal
372887,wikitext standalone build depend docs site,RESOLVED FIXED,P3 normal
372888,need actively prune eclipse download cache folder,CLOSED FIXED,P3 enhancement
372889,click tree work display texts,CLOSED FIXED,P3 enhancement
372890,bundlecontext longer valid,CLOSED FIXED,P3 normal
372891,feature etc etc,CLOSED FIXED,P3 normal
372892,git stag view miss head,RESOLVED FIXED,P3 enhancement
372893,rationalize server name,RESOLVED FIXED,P3 normal
372894,support use expression criteria api,RESOLVED FIXED,P3 enhancement
372895,confuse ever one warn log file,NEW,P3 minor with 1 vote
372896,favicon git page,RESOLVED WONTFIX,P3 normal
372897,favorite quickfix xml edit go eclipse,CLOSED WORKSFORME,P3 major
372898,make select line,RESOLVED FIXED,P3 normal
372899,change need ceditor order implement remote code fold remote c editor ptp,RESOLVED FIXED,P3 normal
372900,integration test execution fail central hudson,RESOLVED FIXED,P3 normal
372901,exception code recommenders,CLOSED WORKSFORME,P3 normal
372902,replace job table view nattable,RESOLVED WONTFIX,P3 normal
372903,set label attribute generate source feature,RESOLVED DUPLICATE of bug 374349,P3 normal
372904,jpa support collection collection mappings,NEW,P3 enhancement
372905,use gtk instead,RESOLVED FIXED,P3 normal
372906,use,RESOLVED FIXED,P3 normal
372907,use java se compilation,RESOLVED FIXED,P3 enhancement
372908,change default severity warn ok,CLOSED FIXED,P3 normal
372909,message verbiage instanceof erasure,VERIFIED FIXED,P3 trivial
372910,publish,CLOSED FIXED,P3 enhancement
372911,despite job build get delete,RESOLVED WONTFIX,P3 normal
372912,new fortran line scanner,CLOSED FIXED,P1 enhancement
372913,support service sapphire part,CLOSED FIXED,P3 enhancement
372914,implement service extension,RESOLVED FIXED,P3 enhancement
372915,xml editor replace much xml forward slash use overwrite select text,CLOSED DUPLICATE of bug 277052,P3 normal
372916,add device catalog,CLOSED FIXED,P3 enhancement
372917,support xxx keywords comment automatically create task,RESOLVED FIXED,P3 normal
372918,welcomefilefilter activate valid content,RESOLVED FIXED,P3 normal
372919,perf fail gracefully path,RESOLVED FIXED,P3 normal
372920,null pointer exception rename project,RESOLVED WORKSFORME,P3 normal
372921,bogus exceptions fork repositories,RESOLVED FIXED,P1 blocker
372922,global search replace say,RESOLVED FIXED,P3 normal
372923,infinite loop use cdo resources,RESOLVED FIXED,P3 critical
372924,update version number,RESOLVED FIXED,P3 normal
372925,npe attach checkbox list property editor,CLOSED FIXED,P3 normal
372926,gerrit code review email link break,VERIFIED FIXED,P3 normal
372927,windowbuilder unusual repository,CLOSED FIXED,P3 normal
372928,optional bundle resolve properly,RESOLVED WORKSFORME,P3 normal
372929,add isystempartlistener compiler plugin could use ca ide tool,NEW,P3 enhancement
372930,pop select menu entry list observe mode,CLOSED WONTFIX,P2 normal
372931,improve support dynamically compute,CLOSED INVALID,P3 enhancement
372932,quick fix create function delegate parameter always available,RESOLVED FIXED,P3 normal
372933,inconsistent help documentation parameter,RESOLVED FIXED,P3 trivial
372934,support dynamic trace,VERIFIED FIXED,P3 normal
372935,httpclient cannot make ssl request select mode,CLOSED WORKSFORME,P3 normal
372936,unsupportedoperationexception throw regenerate fix build path problem rui project,NEW,P3 normal
372937,javascript function work properly february timestamps,VERIFIED FIXED,P3 normal
372938,orphanedsessiontest fail mongosessionmanager,CLOSED INVALID,P3 normal
372939,nullpointerexception,RESOLVED WORKSFORME,P3 major with 1 vote
372940,locatorservice linux able get remote peer,RESOLVED FIXED,P3 normal
372941,focus get lose debug,REOPENED,P3 normal with 11 votes
372942,instal latest fail,VERIFIED FIXED,P3 major
372943,cannot maximize share area tab area split,NEW,P3 normal with 4 votes
372944,unreachable code errors cause build fail,CLOSED DUPLICATE of bug 372319,P3 critical
372945,export eclipse rap war osgi bundle external,RESOLVED WONTFIX,P3 normal
372946,deadlock session restart,RESOLVED FIXED,P1 normal
372947,derive transient volatile,NEW,P5 normal
372948,current change lose try refactor name constructor parameter,RESOLVED WORKSFORME,P3 major
372949,reduce dependencies epub update target file,CLOSED FIXED,P3 trivial
372950,proposals certain expression,CLOSED FIXED,P3 normal
372951,deadlock java update,CLOSED WONTFIX,P3 critical
372952,eclipse crash lose work,RESOLVED WORKSFORME,P3 critical with 1 vote
372953,removedropsupport miss,NEW,P3 trivial
372954,test failures,CLOSED DUPLICATE of bug 372918,P3 normal
372955,custom keyboard shortcuts work egit command,NEW,P3 normal
372956,compositeimagedescriptor throw npe decoration,VERIFIED FIXED,P3 critical with 1 vote
372957,filter unmapped stack elements strata,NEW,P3 enhancement
372958,provide object id generator,RESOLVED WONTFIX,P3 enhancement
372959,history view track compare editor compare two,NEW,P3 normal
372960,sometimes return wrong phase,RESOLVED FIXED,P1 normal
372961,basic term translate wrong,CLOSED FIXED,P3 normal
372962,nullpointerexception,CLOSED DUPLICATE of bug 368018,P3 normal
372963,since pingservice create clientnotifications fetch without user activity,CLOSED FIXED,P3 normal
372964,image get fail,CLOSED INVALID,P3 enhancement
372965,java return type method miss,CLOSED NOT_ECLIPSE,P3 normal
372966,xtend organize import may raise import collide import,CLOSED FIXED,P3 minor
372967,action consider model providers,CLOSED DUPLICATE of bug 354474,P3 normal
372968,provide support csh tcsh shell,RESOLVED FIXED,P3 normal
372969,test fail windows,NEW,P3 normal
372970,start end ganttevents calculate incorrectly overlap higher zoom level,RESOLVED FIXED,P3 normal
372971,setup integration test,RESOLVED FIXED,P3 enhancement
