id,title,status,importance
375161,deadlock lock class conjunction uisafeacquire,NEW,P3 critical
375162,undo paste may lead uncorrect diagram,RESOLVED INVALID,P3 normal
375163,git poll,RESOLVED FIXED,P3 normal
375164,nullpointerexception profile property section stereotype establish composite association,CLOSED FIXED,P3 normal
375165,usability issue,RESOLVED FIXED,P3 enhancement with 1 vote
375166,complete job report jobmanager complete listeners return,CLOSED DUPLICATE of bug 325356,P3 normal
375167,introduce operationbehavior support extensible ocl standard library,NEW,P3 normal
375168,update javahl connector version,RESOLVED FIXED,P3 normal
375169,bugzilla adopt,CLOSED FIXED,P3 enhancement
375170,cheatsheet tutorials ask feedback,NEW,P3 enhancement
375171,possible performance issue open context menu pagewithnodes,CLOSED FIXED,P3 normal
375172,parse eclipse console,CLOSED INVALID,P3 normal
375173,problem visual plugin,RESOLVED WONTFIX,P3 normal
375174,build fail resolve optional bundle,RESOLVED INVALID,P3 normal
375175,minor improvements di debug,RESOLVED FIXED,P3 normal
375176,canonicalmodelprocessor raise nullpointerexception entity contain inner interface,RESOLVED FIXED,P3 minor
375177,releng tool install fail maybe,RESOLVED WORKSFORME,P3 normal
375178,uncontrolling package remove duplicate application profile child control package,CLOSED FIXED,P3 normal
375179,option show annotation,RESOLVED FIXED,P3 normal
375180,error javadoc,RESOLVED FIXED,P3 trivial
375181,upgrade mylyn workbench unexpected parameter type,RESOLVED FIXED,P3 minor
375182,maven plugin throw classnotfoundexception,CLOSED FIXED,P3 normal
375183,object paste,NEW,P3 enhancement
375184,check contextpath encode fix need,CLOSED FIXED,P3 normal
375185,bundlecontext could tomcat config phase,CLOSED FIXED,P3 normal
375186,exist,CLOSED WORKSFORME,P3 minor
375187,process leak file descriptors fastlane,RESOLVED WORKSFORME,P3 normal
375188,refactor association figure edit part common,CLOSED FIXED,P3 normal
375189,open associate gprof view,RESOLVED FIXED,P3 normal
375190,tree expansion icons present children,RESOLVED FIXED,P3 normal
375191,upgrade,RESOLVED FIXED,P3 normal
375192,table oddities,CLOSED FIXED,P3 normal
375193,chart filter work outer datasets anymore,RESOLVED WORKSFORME,P3 blocker
375194,move part cast exception,CLOSED DUPLICATE of bug 349867,P3 normal
375195,package name completion work file character,CLOSED FIXED,P3 normal
375196,tcf svn since days,RESOLVED FIXED,P3 normal
375197,mail list list contain invalid entries,RESOLVED FIXED,P3 normal
375198,xtend editor freeze minutes,CLOSED WORKSFORME,P3 critical
375199,unexpected api errors mylyn baseline,NEW,P3 normal
375200,provide minimal feature chart runtime functionality,RESOLVED WORKSFORME,P3 normal
375201,pcntl show content assist,CLOSED FIXED,P3 normal
375202,make editor insert space,CLOSED DUPLICATE of bug 23406,P3 normal
375203,provide junits test launch cancellations,NEW,P3 enhancement
375204,anomaly properties udpate rule id button become unavailable,RESOLVED FIXED,P3 normal
375205,document validation properties contributions,RESOLVED FIXED,P3 enhancement
375206,voiceover read certain checkbox label preferences,NEW,P3 normal
375207,update event breakpoint action use new,NEW,P3 normal
375208,incoming run,RESOLVED FIXED,P3 normal
375209,voiceover read certain expandable table label preferences,NEW,P3 normal
375210,deadlock texlipse text reconciler,CLOSED DUPLICATE of bug 319098,P3 normal
375211,train ef staff use git,RESOLVED FIXED,P3 normal
375212,add batch methods access attribute state system,CLOSED FIXED,P3 normal
375213,incorrect dead code report simple loop,NEW,P3 normal
375214,must handeled save control manner,RESOLVED FIXED,P3 critical
375215,advance property editor cope whitespaces qualify name,RESOLVED DUPLICATE of bug 332702,P3 normal
375216,jaxb schema generation fail class default package,VERIFIED FIXED,P3 normal
375217,node label place node mode scroll diagram,CLOSED FIXED,P3 normal
375218,remove intel code common code,RESOLVED FIXED,P3 normal
375219,css value sometimes seem take effect,RESOLVED FIXED,P3 normal
375220,lazy selection change,REOPENED,P3 normal
375221,menu show context menus,VERIFIED FIXED,P3 normal
375222,standard path disappear reopen project,NEW,P3 enhancement
375223,theme load local resources,VERIFIED FIXED,P3 normal
375224,block recursive attempt part dispose creation,RESOLVED FIXED,P3 normal
375225,gemini blueprint run spring framework,CLOSED FIXED,P3 major
375226,code index properly change active configuration,RESOLVED FIXED,P3 normal
375227,tracepoints cannot set disassembly view,RESOLVED FIXED,P3 normal
375228,rename change active configuration affect indexer reopen,NEW,P3 normal
375229,ant task contain duplicate code due flaw rename,CLOSED FIXED,P3 normal
375230,xbase expressions side effect,CLOSED FIXED,P3 major
375231,pror allow installation plugins,RESOLVED FIXED,P2 normal
375232,improve spectype specification,RESOLVED FIXED,P3 normal
375233,cannot select ctabitems,RESOLVED FIXED,P3 normal
375234,better create new reqif file,RESOLVED FIXED,P3 normal
375235,restart tomcat server hang wtp,NEW,P3 major
375236,space filename show main reqif editor,CLOSED FIXED,P3 normal
375237,rename reqif file propagate editor,ASSIGNED,P3 minor
375238,better handle link creation,RESOLVED FIXED,P3 enhancement
375239,allow hide information property view,RESOLVED FIXED,P2 normal
375240,capture first character start edit speceditor,CLOSED FIXED,P3 normal
375241,scrollbars sometimes miss,RESOLVED FIXED,P3 normal
375242,error modifiying border layout column,ASSIGNED,P3 normal
375243,button show incoming link,RESOLVED FIXED,P3 normal
375244,show raw xhtml,CLOSED WONTFIX,P2 major
375245,remove unnecessary entries context menus,CLOSED FIXED,P1 normal
375246,set custom widget,RESOLVED FIXED,P2 normal
375247,create collection tip show startup,NEW,P4 enhancement with 1 vote
375248,aioobe inside twr finally block,RESOLVED FIXED,P3 major
375249,eclipse throw read valid zip error completely healthy jar file build path,REOPENED,P3 major with 5 votes
375250,eclipse compatibility tutorial,RESOLVED FIXED,P3 normal
375251,design view createbuttonsforbuttonbar method present design jface dialog,ASSIGNED,P3 normal
375252,generate allow include mutable field,RESOLVED WONTFIX,P3 enhancement
375253,add support spy across multiple windows,RESOLVED FIXED,P3 normal
375254,developer friendly url namespace,CLOSED DUPLICATE of bug 343264,P3 critical
375255,semantics templates,CLOSED DUPLICATE of bug 491245,P3 normal
375256,use word instead tracepoints,RESOLVED FIXED,P3 normal
375257,stackoverflow exception use,NEW,P3 normal
375258,eclipse respond click android,RESOLVED NOT_ECLIPSE,P3 critical
375259,manual device installation work,NEW,P3 critical
375260,suggest plural name containment,CLOSED FIXED,P3 enhancement
375261,check java type name create class part addons,RESOLVED FIXED,P3 normal
375262,fix css extension point,VERIFIED FIXED,P3 normal
375263,formatter different new line behavior annotation place modifiers,NEW,P3 enhancement
375264,contact theme toolbars menus grow execution,VERIFIED FIXED,P3 normal
375265,user able add save,CLOSED NOT_ECLIPSE,P3 normal
375266,good interactive console view available eclipse,RESOLVED DUPLICATE of bug 76936,P3 normal
375267,work table tableeditors,RESOLVED INVALID,P3 normal
375268,support fix columns tree,RESOLVED FIXED,P3 enhancement
375269,menus items fragment multiply restart persistence,VERIFIED FIXED,P3 critical
375270,rule issue use external lexer,CLOSED WORKSFORME,P3 minor
375271,deprecation warn helpful,RESOLVED FIXED,P3 normal
375272,editor crash sometimes comment templates use,CLOSED FIXED,P3 normal
375273,allow instance specification deployment diagram,NEW,P3 enhancement with 1 vote
375274,error dialog try use template expressions annotation value,CLOSED FIXED,P3 normal
375275,wrong cast executetransitionchain,CLOSED INVALID,P3 major
375276,server cannot assign user name,RESOLVED FIXED,P3 normal
375277,gerrit header render issue,RESOLVED FIXED,P3 normal
375278,consider support jar,CLOSED MOVED,P3 enhancement
375279,enable gerrit gemini dbaccess,RESOLVED FIXED,P3 normal
375280,add support cssengine stylesheets document root,VERIFIED FIXED,P3 normal
375281,ruihandler cannot render ie,CLOSED FIXED,P3 normal
375282,add support,RESOLVED FIXED,P3 normal
375283,proposal flag,CLOSED WORKSFORME,P3 enhancement
375284,application template tree tablepage add standard outline,CLOSED FIXED,P3 enhancement
375285,google map customize widget cannot render,CLOSED FIXED,P3 normal
375286,extract external type java class result js gen,CLOSED FIXED,P3 normal
375287,include nightly build,RESOLVED FIXED,P3 normal
375288,npe activity diagram structure activity node,CLOSED FIXED,P3 normal
375289,unable create comment activity group,CLOSED FIXED,P3 normal
375290,build script avoid eof construct,NEW,P4 enhancement
375291,deployment descriptors name find,CLOSED FIXED,P3 normal
375292,provide marketplace client classic download,RESOLVED FIXED,P3 enhancement
375293,npe open console view start application,CLOSED DUPLICATE of bug 453151,P3 normal
375294,jboss sybase database issue,RESOLVED FIXED,P3 normal
375295,field methods terminalview private protect,RESOLVED WONTFIX,P3 normal
375296,redirect properties view main editor,RESOLVED FIXED,P3 minor
375297,serialconnector overwrite settings,RESOLVED FIXED,P3 minor
375298,convert rap bundle contain javascript,RESOLVED FIXED,P3 enhancement
375299,create action palett set element wrong container model explorer view,CLOSED FIXED,P3 critical
375300,machine label transition pollute state machine diagram,CLOSED FIXED,P3 major
375301,ui lock prevent linux desktop receive events,RESOLVED WORKSFORME,P3 critical with 1 vote
375302,number column name preview arrayindexoutofboundsexception,CLOSED DUPLICATE of bug 321104,P3 normal
375303,navigation history backward scroll outline tree selection,CLOSED FIXED,P3 normal
375304,null instal bundle contain ds components,RESOLVED WORKSFORME,P3 normal
375305,longer allow access toolbar,RESOLVED INVALID,P3 normal
375306,juno rc rcp could map,CLOSED WORKSFORME,P3 normal
375307,method override,CLOSED FIXED,P3 normal
375308,cbi platform build fail openjdk ssl error,RESOLVED FIXED,P3 enhancement
375309,problem library chart object rptdesign,VERIFIED WORKSFORME,P3 blocker
375310,label customization properly manage multiselection,NEW,P3 normal
375311,move mootools jquery new admin console,CLOSED FIXED,P3 enhancement
375312,apply jquery change header import,CLOSED FIXED,P3 enhancement
375313,jquery change overview page,CLOSED FIXED,P3 enhancement
375314,jquery update overview page test,CLOSED FIXED,P3 enhancement
375315,jquery change configuration page,CLOSED FIXED,P3 enhancement
375316,jquery change configuration page test,CLOSED FIXED,P3 enhancement
375317,jquery change dump page,CLOSED FIXED,P3 enhancement
375318,jquery change dump page test,CLOSED FIXED,P3 enhancement
375319,jquery change artifacts page,CLOSED FIXED,P3 enhancement
375320,jquery change artifacts page test,CLOSED FIXED,P3 enhancement
375321,jquery change osgi state page,CLOSED FIXED,P3 enhancement
375322,jquery change osgi state page test,CLOSED FIXED,P3 enhancement
375323,npe uml profile,RESOLVED FIXED,P3 major
375324,compartment propagate selection elements type work,NEW,P3 normal
375325,multiple iiconproviderservices find one use,CLOSED FIXED,P3 normal
375326,assignment statement produce stack map exception,RESOLVED FIXED,P3 normal
375327,invalid argument exception due wrong topindex,RESOLVED FIXED,P3 major
375328,project workspace fail connect repository,NEW,P3 normal
375329,remove use,CLOSED FIXED,P3 minor
375330,edit reference open combobox many items,CLOSED FIXED,P3 normal
375331,copy paste command shall available diagram,RESOLVED FIXED,P3 normal
375332,return non form page,NEW,P3 normal
375333,open diagram action miss jpa content node,RESOLVED FIXED,P3 normal
375334,rework metamodelclipboard functionality,ASSIGNED,P3 normal
375335,communication path miss,CLOSED FIXED,P3 normal
375336,wrong icon flow property,CLOSED INVALID,P3 normal
375337,xtext wizard create project exist ecore model accept xcore file,CLOSED FIXED,P3 enhancement with 1 vote
375338,null pointer exception add exist review group,RESOLVED FIXED,P3 normal
375339,preferences handle review navigator close,RESOLVED FIXED,P3 normal
375340,unexpected behavior use arrow key move elements,NEW,P3 normal
375341,code optimizations,NEW,P3 enhancement
375342,eclipse recognize file binary filename contain dot,RESOLVED DUPLICATE of bug 364027,P3 normal
375343,testtask,CLOSED INVALID,P3 normal
375344,use junit view,NEW,P3 enhancement
375345,call sapphire part could take second,CLOSED INVALID,P3 normal
375346,contribute custom abbreviate xml writer lyo,CLOSED FIXED,P3 enhancement
375347,add support prefer custom abbreviate xml writer,CLOSED WONTFIX,P3 enhancement
375348,product version check pom version,NEW,P3 minor
375349,replace usability problems,RESOLVED FIXED,P3 normal
375350,potential security issue invoke build gerrit,CLOSED FIXED,P3 critical
375351,copy stack action debug view return wrong label,VERIFIED FIXED,P3 normal
375352,work simple lifecycle,RESOLVED FIXED,P3 normal
375353,fontdialog crash simplelifecycle select color,RESOLVED FIXED,P3 normal
375354,toolbar button tool tip read screen reader,NEW,P3 normal
375355,xml valid job build git,RESOLVED FIXED,P3 normal
375356,exception session timeout simplelifecycle,RESOLVED FIXED,P2 normal
375357,,CLOSED FIXED,P3 normal
375358,make examples compatible mode,NEW,P3 enhancement
375359,targetnamespace miss save model,NEW,P3 normal
375360,notify notifications thread,RESOLVED FIXED,P3 normal
375361,backport one duplicate filter name filter,RESOLVED FIXED,P3 normal
375362,many xml test fail arguments list wrong type,CLOSED FIXED,P3 major
375363,update user guide include information task list filter,RESOLVED FIXED,P3 normal
375364,javadoc implementation consistent utility method,ASSIGNED,P3 normal
375365,race condition download jar jsp tlds find,RESOLVED FIXED,P3 normal
375366,ecj ignore unusedparameterincludedoccommentreference unless enablejavadoc option set,VERIFIED FIXED,P3 normal
375367,try view gui class design get parse,CLOSED INVALID,P3 major
375368,start stop,CLOSED FIXED,P3 trivial
375369,rcp update break build,NEW,P3 major
375370,problem run,CLOSED INVALID,P3 critical
375371,load give npe,CLOSED FIXED,P3 normal
375372,include connector next mylyn release,RESOLVED FIXED,P3 enhancement
375373,automatically add reference java project classpath update egl project build path,CLOSED FIXED,P3 enhancement
375374,unable restore delete directory,NEW,P3 enhancement with 1 vote
375375,compile error modelutils,CLOSED DUPLICATE of bug 375269,P3 critical
375376,rui tech sample get error,CLOSED WORKSFORME,P3 normal
375377,private member outer class try access method inner class,RESOLVED INVALID,P3 normal
375378,test case browser focus lose elements colapsed delete textfilter,CLOSED WONTFIX,P3 normal
375379,feature want open test case browser window multiple time,CLOSED FIXED,P3 minor
375380,wrong translation properties view title russian language,RESOLVED WONTFIX,P3 normal
375381,code format hang second eclipse,RESOLVED WORKSFORME,P3 normal
375382,sdk feature wrong package,CLOSED FIXED,P3 normal
375383,black rectangle push dialog,NEW,P3 normal
375384,git repositories view push seem affect project explorer,NEW,P3 normal
375385,cannot set shell full screen linux,CLOSED WORKSFORME,P3 critical with 1 vote
375386,pde cannot resolve dependencies,REOPENED,P3 normal
375387,cdourihandler support connection aware uri,CLOSED FIXED,P3 normal
375388,cell editor iimage,CLOSED FIXED,P2 enhancement
375389,toggle comment work phtml file,CLOSED FIXED,P2 normal
375390,npe move diagram model view explorer,RESOLVED WORKSFORME,P3 normal
375391,composite repository,RESOLVED FIXED,P1 normal
375392,repository exist,CLOSED FIXED,P3 normal
375393,popup context menu disapears reopen part,VERIFIED FIXED,P3 major with 11 votes
375394,incorrect type check parameterized type,VERIFIED FIXED,P3 normal
375395,validate action genmodel editor,RESOLVED WONTFIX,P3 enhancement
375396,ability remove untracked file,CLOSED DUPLICATE of bug 354437,P3 enhancement
375397,rcpapp rich client sheet break rcp update,CLOSED DUPLICATE of bug 375369,P3 enhancement
375398,document dump exclusion configuration parameters,NEW,P3 enhancement
375399,eclipse resolve variables,CLOSED DUPLICATE of bug 218898,P3 normal
375400,file open instance eclipse help content open,RESOLVED WORKSFORME,P3 normal
375401,minimize hide toolbars,CLOSED WORKSFORME,P3 normal
375402,npe,RESOLVED WORKSFORME,P3 major
375403,insert common prefix automatically,CLOSED FIXED,P3 enhancement
375404,,NEW,P2 normal
375405,table inside expandbar generate mouse events properly,CLOSED WORKSFORME,P3 normal
375406,validation honor xml catalog,NEW,P3 normal
375407,create products mdt subprojects,RESOLVED FIXED,P3 normal
375408,editor dependency,RESOLVED FIXED,P3 normal
375409,add miss javadoc compile options batch compiler,VERIFIED FIXED,P3 normal
375410,conversion possible loss data,RESOLVED FIXED,P3 trivial
375411,start juno javaee,CLOSED WORKSFORME,P3 blocker
375412,pad make proper layouting difficult,RESOLVED FIXED,P3 normal
375413,objectexpression notation result javascript generation errors,CLOSED DUPLICATE of bug 366861,P3 major
375414,objectexpression notation result java generation java syntax errors,CLOSED DUPLICATE of bug 366860,P3 major
375415,npes jaxb validation,VERIFIED FIXED,P3 normal
375416,egl file mark javascript generation error message,CLOSED FIXED,P3 normal
375417,highlight special function feature,CLOSED FIXED,P3 enhancement
375418,incorrect java generate simple testcase,CLOSED WORKSFORME,P3 normal
375419,npe formal review attempt update exit decision,RESOLVED FIXED,P3 normal
375420,new hudson,CLOSED FIXED,P3 normal
375421,visual artifacts xml editor android,RESOLVED NOT_ECLIPSE,P3 major with 3 votes
375422,create calloperation target pin reference,CLOSED FIXED,P3 normal
375423,backport enhancement preserve state remote monitor view,RESOLVED FIXED,P3 enhancement
375424,fix debug function print state undefined,RESOLVED FIXED,P3 normal
375425,jface viewer new geomap,RESOLVED FIXED,P3 enhancement
375426,jgit clone submodules recursively,VERIFIED FIXED,P3 normal
375427,spechierarchy drop onto nothing happen,CLOSED FIXED,P3 normal
375428,miss http proxy set cause web crawler fail,CLOSED FIXED,P3 normal
375429,orca silent certain expandable tree,CLOSED WORKSFORME,P3 normal with 1 vote
375430,link dali forum dali website,RESOLVED FIXED,P3 normal
375431,name templates cause exception create project windows,CLOSED INVALID,P3 normal
375432,find user dialogue display properly solaris,NEW,P5 normal
375433,provide java hook eclipse filesystem fallback case native support,RESOLVED FIXED,P3 normal
375434,orca sometimes read cycle list content,NEW,P3 normal
375435,breakpoints firebug eclipse,RESOLVED FIXED,P3 normal
375436,instal eclipse xsl developer use common navigator base link editor open xsd throw partinitexception,NEW,P3 normal
375437,npe save resources,RESOLVED FIXED,P3 normal
375438,indication show disable participant property view assign anomaly,NEW,P4 minor
375439,unfocused state respect theme,CLOSED INVALID,P3 normal
375440,wrap support eefdetailspage,NEW,P3 major
375441,surface number delete row sql delete,NEW,P3 enhancement
375442,impossible resize diagram,RESOLVED FIXED,P3 normal
375443,autrun doesnt close output prevent automate test environments continue testprocess,CLOSED FIXED,P3 normal
375444,invaliduriexception control resources autoreleaselock option disable,REOPENED,P3 major
375445,exception select close review meet information,RESOLVED FIXED,P3 normal
375446,miss default namespace declaration difference depend upon process order,RESOLVED FIXED,P3 major
375447,implement vaccination code polio,CLOSED FIXED,P3 enhancement
375448,allow gerrit cdt,CLOSED FIXED,P3 normal
375449,java need update eclipse compliance,RESOLVED FIXED,P3 major
375450,hide complete review hide active complete review,RESOLVED FIXED,P3 normal
375451,code warn mqtt java client unused import incomplete definitions,CLOSED FIXED,P3 minor
375452,escape regexp populate field,RESOLVED FIXED,P3 minor
375453,disable participant select enter participant dialogue,RESOLVED FIXED,P3 normal
375454,emdash endash support confluence,RESOLVED FIXED,P3 normal
375455,arrayindexoutofboundsexception tcftargettab,RESOLVED FIXED,P3 normal
375456,build error old version,RESOLVED FIXED,P3 minor
375457,null pointer exception file group file insert preferences,RESOLVED FIXED,P3 normal
375458,jaxb class generation schema validate project every java file generate,RESOLVED FIXED,P3 normal
375459,state system break unit test,CLOSED FIXED,P3 minor
375460,auth loop due xlc environment supplier force log,RESOLVED FIXED,P3 normal
375461,add eclipse blog fee planet eclipse,RESOLVED FIXED,P3 normal
375462,disable elements dialog ask work,RESOLVED FIXED,P3 normal
375463,execute readallquery additional join expression objecttypemapping,RESOLVED FIXED,P3 normal
375464,expose type dependency dependencygraph,NEW,P3 enhancement
375465,url update centre contain value,NEW,P3 enhancement
375466,build page show node build run,NEW,P3 enhancement
375467,open eclipse open persistence editor display,VERIFIED FIXED,P3 normal
375468,focus rectangle partially obscure checkboxes link,RESOLVED FIXED,P3 normal
375469,hudson security provide read mode,ASSIGNED,P3 enhancement
375470,request new bugzilla inbox paho project,RESOLVED FIXED,P3 normal
375471,toolbar actionset action notification work,VERIFIED FIXED,P3 normal
375472,content assist api cleanup,RESOLVED FIXED,P3 normal
375473,preserve information abstractresource,CLOSED FIXED,P3 enhancement
375474,logrotation extension point,NEW,P3 enhancement
375475,group administration user interface,RESOLVED FIXED,P3 enhancement
375476,assign get populate creation global anomaly,RESOLVED FIXED,P3 normal
375477,dozens throw dialogs,NEW,P3 normal
375478,link mylyn docs bug find bug incorrect target milestone,RESOLVED FIXED,P3 normal
375479,dialogue modifier expend outside screen,RESOLVED FIXED,P3 normal
375480,change warn severity message deployment assembly page entry cannot find,RESOLVED FIXED,P3 normal
375481,fix solvers correctly handle continuous time,RESOLVED FIXED,P3 normal
375482,improve capability markup viewers,RESOLVED WONTFIX,P3 enhancement
375483,fix import compiler level errors,CLOSED FIXED,P3 normal
375484,breakpoint print call stack,CLOSED DUPLICATE of bug 71020,P3 enhancement
375485,stub,NEW,P3 normal
375486,eclipse build overly sensitive,NEW,P3 enhancement
375487,key columns use defferent icon highlight outline view record,NEW,P3 enhancement
375488,wizard new c lock next force quit need kill,RESOLVED NOT_ECLIPSE,P3 critical
375489,construct new mechanism get rid invalid content assist,NEW,P3 enhancement
375490,npe command line,RESOLVED FIXED,P3 normal
375491,eclipse hang occasionally os x right click,CLOSED DUPLICATE of bug 344818,P3 normal
375492,egl timestamp generate egl record column whose type timestamp null,CLOSED FIXED,P3 normal
375493,test connection button disable specify connection information blank,NEW,P3 normal
375494,client ui preferences iuserpreferencestorageservice use preferences interface,CLOSED FIXED,P3 normal
375495,webdeployableartifactutil turn file webresource link file remote server,NEW,P3 normal
375496,sqljndidatasource support operation,CLOSED DUPLICATE of bug 363498,P3 normal
375497,graphiti provide wizard create initial editor,CLOSED FIXED,P3 enhancement
375498,basic optional annotation model take account,RESOLVED FIXED,P3 normal
375499,nod contain structuredactivityregion lose pin move region,CLOSED FIXED,P3 normal
375500,formatter align field columns work properly,VERIFIED WORKSFORME,P3 normal
375501,dojo grid sample input click enter script error,NEW,P3 normal
375502,delete spechierarchy delete description copy,CLOSED FIXED,P3 minor
375503,git poll hang,VERIFIED FIXED,P3 normal
375504,cause classpath exceptions,RESOLVED FIXED,P3 normal
375505,abstractservicetunnel handle version mismatch twice,CLOSED FIXED,P3 normal
375506,interruptible activity region lose interrupt edge,CLOSED FIXED,P3 normal
375507,delete server dirty server editor,REOPENED,P3 normal
375508,creation readstructuralfeatureaction activit group impossible,CLOSED FIXED,P3 normal
375509,stall stream stall stream session control frame,RESOLVED FIXED,P3 normal
375510,version number generator still show egl compiler properties,CLOSED FIXED,P3 normal
375511,wrong icon show task bar workspace selection dialog show,RESOLVED WORKSFORME,P3 normal
375512,error display click button,CLOSED FIXED,P3 major
375513,parent map repository options gray error message,RESOLVED FIXED,P3 major
375514,cce try open commit editor,RESOLVED FIXED,P3 critical
375515,delete bookmark folder structure throw nullpointerexception,CLOSED FIXED,P3 major
375516,dirty state update,CLOSED FIXED,P2 normal
375517,npe elements different metamodels,NEW,P5 normal
375518,anomaly state transition mismatch preparation phase,CLOSED INVALID,P3 normal
375519,drag drop work first time newly open reif document,RESOLVED FIXED,P3 normal
375520,items intially always render even unfocused,RESOLVED FIXED,P2 normal
375521,expose public api,RESOLVED WORKSFORME,P3 enhancement
375522,scrolltoselection property event,CLOSED FIXED,P3 normal
375523,text select accept multiple value,CLOSED MOVED,P3 major
