id,title,status,importance
492330,remove,CLOSED FIXED,P3 enhancement
492331,react remove,RESOLVED FIXED,P3 normal
492332,change way artifact store artifact metadata,RESOLVED FIXED,P3 enhancement
492333,eclipselink jpa source miss,NEW,P3 enhancement with 1 vote
492334,,CLOSED DUPLICATE of bug 491153,P3 blocker
492335,select metadata component,RESOLVED NOT_ECLIPSE,P3 major
492336,show history open file,RESOLVED FIXED,P3 normal
492337,deprecation report fail input,VERIFIED FIXED,P3 blocker
492338,ui freeze second without stacktrace,NEW,P3 normal
492339,fncjknjk,NEW,P3 normal
492340,buckminster materialize maven,NEW,P3 blocker
492341,wrong implication diffs resource attachment change,RESOLVED FIXED,P3 normal
492342,support rename object ekeys sirius integration xtext,NEW,P3 enhancement
492343,job appear blacklist github access,CLOSED DUPLICATE of bug 492412,P3 major
492344,break repo version,NEW,P3 normal
492345,publish maven central repository,RESOLVED FIXED,P3 normal
492346,accept,NEW,P3 normal
492347,click empty area text lead position character top document,RESOLVED FIXED,P3 normal
492348,drag selection beyond last line select complete last line,RESOLVED FIXED,P3 normal
492349,startup trigger task always perform restart file empty,VERIFIED FIXED,P3 enhancement
492350,wrong order groupid artifactid add exclude dependency hierarchy page,RESOLVED FIXED,P3 normal
492351,drag drop always use text drop ignore droplistener,NEW,P3 normal
492352,provide test template help gendoc validation,NEW,P3 enhancement
492353,model element shall select edit model explorer directly creation,CLOSED DUPLICATE of bug 476629,P3 normal
492354,disable button gray,RESOLVED NOT_ECLIPSE,P3 normal
492355,change keyword mechanism use event broker,CLOSED FIXED,P3 normal
492356,model element shall select edit model explorer directly creation,CLOSED FIXED,P3 normal
492357,localsourcefile reload remember new data load filesystem,RESOLVED FIXED,P3 normal
492358,return null call without set start commit,NEW,P3 normal
492359,neon possible create diagram type umlrt viewpoint active,CLOSED FIXED,P3 normal
492360,creation new repositories capella req vp,RESOLVED FIXED,P3 normal
492361,support project multiple output locations,RESOLVED WORKSFORME,P3 normal
492362,error call help direct edit active,RESOLVED FIXED,P3 normal
492363,rename refactoring work properly field record,CLOSED FIXED,P3 normal
492364,xmlmarshaller produce namespaces properly,NEW,P3 major
492365,wrong null pointer variable abc may null location logical,NEW,P3 normal
492366,provide one templates organize requirements relate information,CLOSED FIXED,P3 normal
492367,must depend ant orbit,RESOLVED FIXED,P3 normal
492368,incongruity port creation,CLOSED FIXED,P2 normal
492369,remove branch,RESOLVED FIXED,P3 normal
492370,mode bits execute set correctly application package build linux,NEW,P3 minor
492371,issue affect ubuntu,RESOLVED FIXED,P3 normal with 1 vote
492372,move rome,RESOLVED WONTFIX,P3 normal
492373,improve task tag recognition,CLOSED FIXED,P3 minor
492374,cannot edit uri remote manually,RESOLVED FIXED,P3 normal
492375,define target platform improve build performances,RESOLVED FIXED,P3 enhancement
492376,quick outline white white,RESOLVED WONTFIX,P5 major
492377,pbody normalizer fail eliminate type constraints,CLOSED FIXED,P3 normal
492378,allow link contributions open help page,RESOLVED FIXED,P3 normal
492379,welcome screen empty bad size ubuntu unless instal,CLOSED DUPLICATE of bug 498829,P3 normal
492380,miss sourceanchor targetanchor upon edge creation circumstances,RESOLVED FIXED,P3 major
492381,standalone generation fail trigger use,CLOSED INVALID,P3 normal
492382,load bare minimum plugins tern project file,RESOLVED FIXED,P3 normal
492383,make use resource delete event,RESOLVED FIXED,P3 normal
492384,work interface field,VERIFIED INVALID,P3 normal
492385,rename application break install osx,CLOSED DUPLICATE of bug 485476,P3 normal
492386,replace flag log internal error,NEW,P3 normal
492387,platform ui icon clean,RESOLVED FIXED,P3 normal
492388,test hang,NEW,P3 normal
492389,input part still propose parteditorsashcontainer,RESOLVED FIXED,P3 normal
492390,add keyword handler script,CLOSED FIXED,P3 normal
492391,icon fix,RESOLVED WORKSFORME,P3 normal
492392,icon issue neon,VERIFIED FIXED,P3 normal
492393,neon stack overflow,CLOSED INVALID,P3 normal
492394,error see log,CLOSED DUPLICATE of bug 476469,P3 critical
492395,dot model cause deadlock dotexecutableutils,RESOLVED FIXED,P3 major
492396,add keyword handler editor save action,CLOSED FIXED,P3 normal
492397,unhelpful message repo,CLOSED WONTFIX,P3 normal
492398,neon products definitions,RESOLVED FIXED,P3 normal
492399,handle peg revision difftwo diffstatustwo,RESOLVED FIXED,P3 normal
492400,remove deprecate code relate peg revisions handle,RESOLVED FIXED,P3 normal
492401,autosave preference page must render bold,VERIFIED FIXED,P3 normal
492402,locateresourceurlinhistoryoperation use code one use connectors,RESOLVED FIXED,P3 normal
492403,mylyn build job fail java,RESOLVED FIXED,P3 normal
492404,vm analysis generate numberformatexception thread,RESOLVED FIXED,P3 normal
492405,add lambda method argument insert mismatch parentheses,CLOSED DUPLICATE of bug 477615,P3 normal
492406,add content assist quickfix create lambdas,CLOSED DUPLICATE of bug 443091,P3 normal
492407,npes appliedstereotypecommenteditpolicy,RESOLVED FIXED,P2 normal
492408,numerous npes undo port creation capsule structure diagram,CLOSED FIXED,P2 normal
492409,first type character lose method take second,NEW,P3 normal
492410,improve performance server refresh,RESOLVED FIXED,P3 normal
492411,content assist lambda expression add unnecessary semicolon,CLOSED DUPLICATE of bug 458321,P3 normal
492412,connection problems external source,CLOSED FIXED,P3 blocker with 1 vote
492413,conflict extension parsers expansion model,NEW,P3 normal
492414,element type registration message log,CLOSED FIXED,P3 normal
492415,oomph update neon definition,RESOLVED FIXED,P3 trivial
492416,lambda expressions jandex support,CLOSED FIXED,P3 normal
492417,select java code style formatter profile use default,RESOLVED FIXED,P3 normal
492418,welcome page render properly,CLOSED DUPLICATE of bug 490116,P3 normal
492419,gendoc menu icon big,REOPENED,P3 normal
492420,refactor connection wizard,CLOSED WONTFIX,P3 normal
492421,change description,CLOSED FIXED,P3 normal
492422,compile warn official build,VERIFIED FIXED,P3 normal
492423,new stop condition evolutionary algorithm,RESOLVED FIXED,P3 normal
492424,simple type proposals function return ca,CLOSED FIXED,P3 normal
492425,bidi base text direction enforcement problem editor selection panel,RESOLVED FIXED,P3 normal
492426,insufficient robustness,RESOLVED FIXED,P3 normal
492427,string page,RESOLVED INVALID,P3 normal
492428,stall ci,RESOLVED WORKSFORME,P3 critical
492429,site login support path mpc favorites,RESOLVED FIXED,P1 major
492430,inconsistent proxies,NEW,P3 normal
492431,syntax issue documentation,CLOSED FIXED,P3 minor
492432,inconsistent assigment handle,CLOSED WONTFIX,P3 normal
492433,ui scale much wayland,REOPENED,P3 normal with 5 votes
492434,npe,VERIFIED FIXED,P3 normal
492435,define problem,RESOLVED FIXED,P3 normal
492436,search service,NEW,P3 enhancement
492437,optimize dse transformation statements different exploration strategies use case,CLOSED FIXED,P3 normal
492438,autosave happen menu open,VERIFIED FIXED,P3 normal
492439,view execute code current inside jsp,VERIFIED FIXED,P3 normal with 1 vote
492440,npe compare php file team synchronize view,CLOSED FIXED,P3 normal
492441,code support anchor reify resources,NEW,P3 enhancement
492442,debug feature enhancement,NEW,P3 enhancement
492443,jpa entities table wizard create fk class,NEW,P3 normal
492444,extensions instal via ite work external,CLOSED FIXED,P3 major
492445,marketplace entry detect correct version eclipse ide,VERIFIED FIXED,P3 normal
492446,clear change report,NEW,P3 normal
492447,temporary add disc space,RESOLVED FIXED,P3 normal
492448,reduce build time trim package build,ASSIGNED,P4 normal
492449,prepare eclipse configurators offline,CLOSED WONTFIX,P3 normal
492450,aioobe,VERIFIED FIXED,P3 critical
492451,use papyrus log,CLOSED INVALID,P3 normal
492452,category limit message,RESOLVED FIXED,P3 normal
492453,dbg session corrupt one thread hit dynamic printfs time,NEW,P3 normal
492454,add support implicit ui,NEW,P3 enhancement with 1 vote
492455,allow disable automatic news poll,RESOLVED FIXED,P3 normal
492456,respect language,VERIFIED FIXED,P3 normal
492457,push button misplace invisible use,CLOSED INVALID,P3 normal
492458,structure port incorrectly place four corner case include graphical glitches incorrect location behavior adornment,CLOSED FIXED,P3 normal
492459,scroll bar disappear column freeze small window,CLOSED WONTFIX,P3 normal
492460,controlflowviewtest others sometimes fail open,NEW,P3 normal
492461,consolepatternmatcher cause large delay large input improvements,NEW,P3 normal
492462,build fail artifacts retrieve,CLOSED DUPLICATE of bug 492412,P3 normal
492463,improve local cache strategy,NEW,P3 normal
492464,need build permissions retrigger build equinox,RESOLVED FIXED,P3 normal
492465,indentation constructors fail initializers multiline initializers,NEW,P3 normal
492466,improve initial work continue parallel,NEW,P3 enhancement
492467,use dash name copy delete unused platforms,RESOLVED FIXED,P3 normal
492468,move project team git repository java,RESOLVED FIXED,P3 normal
492469,json validator ignore duplicate key,RESOLVED FIXED,P3 normal
492470,js code completions available inside string literals,RESOLVED FIXED,P3 normal
492471,unicode characther cause serialization fail,CLOSED WONTFIX,P3 normal
492472,cbi common build infrastructure work without external internet access,NEW,P3 normal
492473,report error default method,NEW,P3 normal
492474,arrayindexoutofboundsexception,VERIFIED DUPLICATE of bug 492450,P3 normal
492475,error load sdk,NEW,P3 normal
492476,generic editor support workspace file,CLOSED FIXED,P1 normal
492477,stack overflow right click close project,NEW,P3 normal
492478,launch still available close delete project,RESOLVED FIXED,P3 normal
492479,restore default work relaunch preference,VERIFIED FIXED,P3 normal
492480,cannot import team team package,RESOLVED FIXED,P3 normal
492481,update esrecurse version,RESOLVED FIXED,P3 normal
492482,undo relate failure stereotype connectors model,RESOLVED FIXED,P1 blocker
492483,null errors enter credentials cloud foundry entry url,RESOLVED FIXED,P3 normal
492484,inconsistent syntax error report,RESOLVED FIXED,P3 normal
492485,externalize user readable string,RESOLVED FIXED,P3 normal
492486,remove include path remove entries,CLOSED DUPLICATE of bug 493070,P3 normal with 1 vote
492487,reply dialog display comment file publish,RESOLVED FIXED,P3 normal
492488,add change notifications new index,RESOLVED FIXED,P3 normal
492489,organize include throw exception angle bracket use headers project extern headers,RESOLVED FIXED,P3 normal
492490,need additional eventdata artifact creation,RESOLVED FIXED,P2 normal
492491,iwyu hyperlink include pragmas preference page move,RESOLVED FIXED,P3 normal
492492,add auth method idockerconnection,RESOLVED FIXED,P3 normal
492493,need help permissions build machine,RESOLVED FIXED,P3 minor
492494,npe,RESOLVED FIXED,P3 normal
492495,skip change management localsourcefileinput reload,RESOLVED FIXED,P3 normal
492496,work styledtextarea,RESOLVED FIXED,P3 normal
492497,nullpointerexception,CLOSED DUPLICATE of bug 492847,P3 normal
492499,documentation nattableconfiguration miss specific axis configuration,ASSIGNED,P3 enhancement
492500,require attribute error decorator,RESOLVED FIXED,P3 trivial
492501,readable serialization huge xml blog preferencetask value resourcecreationtask content,NEW,P3 enhancement
492502,react new maven central mirror,RESOLVED FIXED,P3 normal
492503,fix progress monitor indexbasedhierarchybuilder,VERIFIED FIXED,P3 normal
492504,minor cleanup new index,RESOLVED FIXED,P3 normal
492505,eclipse respect generatedsourcesdirectory index generate code,CLOSED WONTFIX,P3 minor
492506,new index throw cce binarytypefactory,RESOLVED FIXED,P3 normal
492507,string display correctly editor ie browser,RESOLVED WORKSFORME,P3 normal
492508,arrayindexoutofboundsexception,UNCONFIRMED,P3 normal
492509,end text cut export display fine app,NEW,P3 normal
492510,potentially load complete cdo repo,UNCONFIRMED,P3 normal
492511,gvt bidi rtl type support orion editor ie browser,RESOLVED FIXED,P3 normal
492512,incorrect port location four corner case cause issue,CLOSED FIXED,P3 normal
492513,mpc api support exact query tag,RESOLVED FIXED,P3 enhancement
492514,gvt bidi text overlap line number editor firefox,CLOSED WONTFIX,P3 normal
492515,info template mirror,RESOLVED INVALID,P3 normal
492516,canonical refresh do might lead illegealstateexceptions,NEW,P3 normal
492517,export image work,CLOSED FIXED,P3 normal
492518,search implementors report lambda expressions match intersection type involve,NEW,P3 normal
492519,upgrade openmdm work group website feedback,CLOSED FIXED,P2 normal
492520,hint tip template mirror,CLOSED DUPLICATE of bug 466528,P3 normal
492521,flag handle correctly,NEW,P3 major with 1 vote
492522,delete model comment link work delete,RESOLVED FIXED,P3 normal
492523,bad type signature runtimevisibleannotations,NEW,P3 normal
492524,association name editable,CLOSED WORKSFORME,P3 normal
492525,tracecompass seem work large trace file,CLOSED WORKSFORME,P3 normal
492526,miss package set ignore error,VERIFIED FIXED,P3 normal
492527,arrayindexoutofbounds clone git repository,RESOLVED WORKSFORME,P3 normal
492528,run runidea task intellij idea,NEW,P3 normal
492529,dtableelementsynchronizer remove table metamodel,CLOSED FIXED,P3 normal
492530,emfforms setup base resolve necessary plugins,CLOSED FIXED,P3 normal
492531,architecture framework viewpoint switch,RESOLVED DUPLICATE of bug 510451,P3 normal
492532,wrong dependency version junit,RESOLVED FIXED,P3 normal
492533,web app preview reflect change browser preview,RESOLVED INVALID,P3 enhancement
492534,new file folders display compare compatible connector use,RESOLVED FIXED,P3 normal with 2 votes
492535,wrong change direction compare compatible connectors,RESOLVED FIXED,P3 normal
492536,incoming addition deletion statuses reverse compare compatible connector use,RESOLVED FIXED,P3 normal
492537,merge importer bundle main ui bundle,CLOSED WORKSFORME,P3 enhancement
492538,remove unnecessary editor control,CLOSED FIXED,P3 normal
492539,move parent child package result exception,NEW,P3 normal
492540,omr mark feature birt report,NEW,P3 critical
492541,menu draw large empty section,RESOLVED FIXED,P3 normal
492542,drain cpu usage,RESOLVED INVALID,P3 enhancement
492543,eclipse switch application console gdb console step debugger,NEW,P3 minor
492544,adt plugin render,RESOLVED NOT_ECLIPSE,P3 enhancement
492545,project new catalog eclipse installer,RESOLVED FIXED,P3 normal
492546,unable render image post script,NEW,P3 blocker
492547,refresh content dashboard review change,RESOLVED FIXED,P3 normal
492548,improve example use make,RESOLVED FIXED,P3 normal
492549,build pick latest push code,RESOLVED INVALID,P3 normal
492550,add information instructions code quote correctly,RESOLVED INVALID,P3 normal
492551,test suit dnf linux test machine,RESOLVED DUPLICATE of bug 492580,P3 major
492552,preferences allow disable launch keep target selector enable,NEW,P3 minor
492553,warn os use,NEW,P3 normal
492554,automatically add,NEW,P3 normal
492555,problems hide label,UNCONFIRMED,P3 normal
492556,check project filechooser ignore value,NEW,P3 normal
492557,content edit template bidi locale inconsistent english ui,RESOLVED NOT_ECLIPSE,P3 normal
492558,new default location field clear,REOPENED,P3 normal
492559,,RESOLVED FIXED,P3 normal
492560,table offset right selection different stereotype elements,CLOSED FIXED,P3 normal
492561,dual license,RESOLVED FIXED,P3 normal
492562,trademark approval require,RESOLVED FIXED,P3 normal
492563,context welcome page mirror bidi,CLOSED INVALID,P3 normal
492564,exception getaftercreaterelationshipcommand profile package,CLOSED FIXED,P3 major
492565,many test run build,CLOSED FIXED,P3 critical
492566,change launchshortcut support cfg file selection,CLOSED FIXED,P3 enhancement
492567,fail step due,RESOLVED FIXED,P3 normal
492568,git stag drag file unstaged stag area often drag file,CLOSED DUPLICATE of bug 491309,P3 critical
492569,sometimes fail,RESOLVED FIXED,P3 minor
492570,date,RESOLVED FIXED,P3 normal
492571,nattable provide method override easily richtexteditor,CLOSED FIXED,P3 enhancement
492572,inputcompletion drop save search result extend past container,RESOLVED FIXED,P3 normal
492573,fail promote artifacts,RESOLVED FIXED,P3 normal
492574,investigate automate update file,NEW,P3 enhancement
492575,allow access build infrastructure,CLOSED FIXED,P3 normal
492576,page link access end,VERIFIED FIXED,P3 trivial
492577,display release versions,RESOLVED FIXED,P3 normal
492578,create snippet new variable button visible,NEW,P3 normal
492579,code recommenders cannot download model repository,CLOSED DUPLICATE of bug 483354,P3 normal
492580,deltapack create,RESOLVED FIXED,P1 major
492581,close detach window shut eclipse workbench,CLOSED FIXED,P3 major
492582,compare performance file,RESOLVED FIXED,P3 normal
492583,installation early access release possible eclipse,RESOLVED WORKSFORME,P3 normal
492584,compare create accelerator comment,RESOLVED INVALID,P3 normal
492585,recent versions show blank pie chart eclipse mat,CLOSED INVALID,P3 normal
492586,call resource empty string throw exception,RESOLVED FIXED,P3 normal
492587,autosave break incremental find,VERIFIED FIXED,P3 normal
492588,polish aka quick access search menu,VERIFIED FIXED,P3 normal
492589,update copyright reflect contributors,RESOLVED FIXED,P3 normal
492590,open cdt editor menu disappear neon,CLOSED FIXED,P3 normal
492591,give erroneous comparison always yield warn return,RESOLVED DUPLICATE of bug 331651,P3 normal
492592,rule need greedy really work fastpartitioner,RESOLVED FIXED,P3 normal
492593,facilitate move one marker next,RESOLVED FIXED,P3 enhancement
492594,improve presentation active patchset,RESOLVED FIXED,P3 normal
492595,disable edition detail section history tab,RESOLVED FIXED,P3 normal
492596,add accelerators keybindings,RESOLVED FIXED,P3 normal
492597,,CLOSED FIXED,P3 normal
492598,jardesc warn resources miss,ASSIGNED,P3 normal with 5 votes
492599,simplify process perform simple change,NEW,P3 enhancement
492601,delta pack,VERIFIED FIXED,P3 normal
492602,rational link display model edit view,CLOSED WONTFIX,P3 major
492603,expand tree search result list open file,RESOLVED FIXED,P3 normal
492604,delete rational link,CLOSED DUPLICATE of bug 492522,P3 major
492605,error message,RESOLVED FIXED,P3 major
492606,add line width preview brace parentheses tabs,RESOLVED DUPLICATE of bug 462940,P3 normal
492607,inner container parent container open diagram use sirius,CLOSED FIXED,P3 normal with 1 vote
492608,add relations requirement nod impossible use properties view,CLOSED WONTFIX,P3 trivial with 1 vote
492609,unable delete module fail correctly deploy,RESOLVED FIXED,P3 normal
492610,show draft comment another color stand,RESOLVED FIXED,P3 enhancement
492611,mismatch root element value display elements model,RESOLVED DUPLICATE of bug 492891,P3 minor
492612,whitespace rule generate json config,RESOLVED FIXED,P3 normal
492613,properties vague name value,CLOSED WONTFIX,P3 enhancement
492614,edit button id field provide editor,RESOLVED FIXED,P3 normal
492615,inconsistency properties view,RESOLVED FIXED,P3 normal
492616,provide help,CLOSED INVALID,P3 enhancement
492617,change default value display attribute operations,CLOSED FIXED,P3 enhancement
492618,launcher create share memory segment restart fail segment remove,RESOLVED WORKSFORME,P3 normal
492619,accessibility issue,NEW,P3 major
492620,zoom text content shortcut work simplify chinese locale,NEW,P3 normal
492621,error handle parentheses bidi,RESOLVED NOT_ECLIPSE,P3 normal
492622,version build workspace make infinite loop,NEW,P3 major
492623,support horizontal rule,RESOLVED FIXED,P3 enhancement
492624,wrong build path resources folder contain subfolder,CLOSED INVALID,P3 normal
492625,declare neon,RESOLVED FIXED,P3 normal
492626,gvt fail find string cursor location incremental find function,RESOLVED WORKSFORME,P3 normal
492627,rightclick modify caret,RESOLVED FIXED,P3 normal
492628,commit message display correctly git outgo ie browser,CLOSED WONTFIX,P3 normal
492629,create maintenance branch mar stream,CLOSED FIXED,P3 enhancement
492630,cell scroll view selection,CLOSED INVALID,P3 normal
492631,modify source code pass build analyzer test linux distributions,CLOSED FIXED,P3 normal
492632,fxkeylookup invalid,RESOLVED FIXED,P3 blocker
492633,caret movement fail windows line end,RESOLVED FIXED,P3 normal
492634,dcells keep line delete edition,CLOSED FIXED,P3 normal
492635,dependencies contain file name different case package,RESOLVED WONTFIX,P3 normal
492636,ensure port capsule capsule part cannot resize,CLOSED DUPLICATE of bug 494903,P3 normal
492637,command available shell page,CLOSED WONTFIX,P3 normal
492638,report unsigned content automatically,RESOLVED WORKSFORME,P3 enhancement
492639,allow trigger editor action programmatically,RESOLVED FIXED,P3 normal
492640,ioexception,NEW,P3 normal
492641,compare model git commit view,CLOSED FIXED,P3 normal
492642,width calculation need use tabadvance define,RESOLVED FIXED,P3 normal
492643,error execute external split character define,CLOSED FIXED,P3 normal
492644,add buildship documentation eclipse help,CLOSED MOVED,P3 enhancement
492645,compile error reference event method,VERIFIED FIXED,P3 major
492646,filenotfoundexception,CLOSED FIXED,P3 minor
492647,dark background make difficult spot red,NEW,P3 normal
492648,generate environment parent pom,CLOSED WONTFIX,P3 normal
492649,miss diagram icons new project wizard,CLOSED FIXED,P3 minor
492650,remove java dev relate plugins core,RESOLVED FIXED,P3 normal
492651,allbrowsertests fail,RESOLVED FIXED,P3 normal
492652,capsulepart show property icon diagram next name capsule part,CLOSED FIXED,P3 trivial
492653,test bug tracker,NEW,P3 critical
492654,absolute paths everywhere,CLOSED NOT_ECLIPSE,P3 normal
492655,leak invalidationlistener textnode,RESOLVED FIXED,P3 normal
492656,recognize rename project chcking,CLOSED DUPLICATE of bug 479609,P3 major
492657,autotools builder show id instead string,NEW,P3 normal
492658,byte constantly create desktop,NEW,P3 normal
492659,impossible update concern list viewpoint,CLOSED FIXED,P3 normal
492660,new model wizard usability default template profile template handle error,UNCONFIRMED,P3 normal
492661,miss package import,VERIFIED FIXED,P3 normal
492662,unchecked action grey,CLOSED DUPLICATE of bug 493138,P3 minor
492663,get nullpointerexception unregister ui bind,CLOSED FIXED,P3 normal
492664,need delete add pojo data preview,NEW,P3 normal
492665,contentview calculate charwidth,RESOLVED FIXED,P3 normal
492666,detach windows appear model spy,NEW,P3 normal
492667,odd git error log,RESOLVED FIXED,P3 normal
492668,gerrit account update change email eclipse account,RESOLVED FIXED,P3 normal
492669,bundle fully unpack area define use,NEW,P3 normal
492670,remove repo platform build,RESOLVED DUPLICATE of bug 492412,P3 normal
492671,frequent lag apparently due npe javasearchscope,NEW,P3 normal
492672,add support,CLOSED FIXED,P3 enhancement
492673,egit commit,NEW,P3 enhancement
492674,history show select multiple specific branch,CLOSED DUPLICATE of bug 381520,P3 normal
492675,remove repositories,RESOLVED FIXED,P3 normal
492676,get rid pattern match code,RESOLVED FIXED,P3 normal
492677,null check roles team,ASSIGNED,P3 normal
492678,add git config repository settings clone,RESOLVED WONTFIX,P3 enhancement
492679,trigger contentproposal contentpopup open lead exception,RESOLVED FIXED,P3 normal
492680,doubleclick table row effect,CLOSED WORKSFORME,P3 major
492681,wizard filter search descriptions,VERIFIED FIXED,P3 enhancement
492682,support concepts ts,NEW,P3 enhancement with 3 votes
492683,data bind support incompatible neon,RESOLVED FIXED,P3 critical
492684,xtext compatibility,RESOLVED FIXED,P3 critical
492685,add support primitive string transformations,RESOLVED FIXED,P3 normal
492686,get rid pattern use invisiblecharsupport,RESOLVED FIXED,P3 normal
492687,npe callout,RESOLVED WORKSFORME,P3 normal
492688,read relative file,RESOLVED FIXED,P3 normal
492689,concurrentmodificationexception activepagetracker,RESOLVED FIXED,P3 normal
492690,welcome page throw diagram load ui thread,RESOLVED FIXED,P3 normal
492691,confusion,VERIFIED FIXED,P3 normal
492692,cancel drag drop ear onto cloud server already push app,RESOLVED FIXED,P3 normal
492693,accessibility issue host take detection,RESOLVED FIXED,P3 normal
492694,password cannot contain space character configuration file,RESOLVED FIXED,P3 normal
492695,dialogs often wrong size,RESOLVED FIXED,P3 normal
492696,username character u umlaut display incorrectly,CLOSED DUPLICATE of bug 463700,P3 normal
492697,user able change representation actor typesymboldefinition stereotype,RESOLVED FIXED,P3 enhancement
492698,make serialportconnectionblock newserialportconnectionwizardpage package private,RESOLVED FIXED,P3 normal
492699,cache result longest line calculation change content modify,RESOLVED FIXED,P3 normal
492700,caret vanish arrow key keep press,RESOLVED FIXED,P3 normal
