1156,"Cause ""No proxy for"" list to be comma separated after exanded"
2019-06-11T00:33:04Z,discuss,"Currently it is a space sepparated list, which causes issues when using
proxy exceptions."
2019-06-11T00:33:04Z,discuss,See https://youtrack.jetbrains.com/issue/IDEA-215943 for more details.
2019-08-14T19:52:15Z,commit,git: restore binary compatibility with plugins,github.com/JetBrains/intellij-community/pull/1156/commits/43cf7a7a07ca5ef39a156f678951de27f9ec293d
2019-08-14T20:16:11Z,commit,IDEA-220681 diff: fix incorrect status label,github.com/JetBrains/intellij-community/pull/1156/commits/72a28fa0cfc37cf4fa8a2b10bea3398427220034
2019-08-14T21:29:53Z,commit,EA-208871 - IAE: StringUtil.$$$reportNull$$$,github.com/JetBrains/intellij-community/pull/1156/commits/00424c3921896cabe0cc36822e3538942ffcfdf3
2019-08-14T22:00:03Z,commit,cleanup,github.com/JetBrains/intellij-community/pull/1156/commits/0034ec722b0cfa6fb30c9deec8b68ac9168b5d24
2019-08-14T22:07:21Z,commit,don't show thumbnails images action in the project view,github.com/JetBrains/intellij-community/pull/1156/commits/9b3f62b042dc1d922a8e86923dc0f89555a2729f
2019-08-14T22:30:58Z,commit,go to action should show the only one `Open...` action,github.com/JetBrains/intellij-community/pull/1156/commits/ea20241265f9fb956c5a99b1023765aa0e941979
2019-08-02T06:08:35Z,commit,IDEA-CR-51071: FUS: add annotation to mark methods that create or mod¡­,github.com/JetBrains/intellij-community/pull/1156/commits/a3e28862c7e780cb467bd4edab57b74ad6fbce2f
2019-08-14T08:14:55Z,commit,UnmodifiableHashMap: optimized getOrDefault; do not allocate array in¡­,github.com/JetBrains/intellij-community/pull/1156/commits/c64e93f30dea9f79d7da5f18d20994874a798a95
2019-08-14T08:15:56Z,commit,PsiSubstitutorImpl: use optimized UnmodifiableHashMap#getOrDefault to¡­,github.com/JetBrains/intellij-community/pull/1156/commits/9bd5cca6fc67d3f4addfac698e98737a536fceac
2019-08-14T08:16:24Z,commit,InferenceVariablesOrder: minor improvements,github.com/JetBrains/intellij-community/pull/1156/commits/6d817caf3c560a6ac3fa2727dd3c23b73a686236
2019-08-14T10:36:23Z,commit,InferenceVariablesOrder: fast-path in resolveOrder when the resulting¡­,github.com/JetBrains/intellij-community/pull/1156/commits/55cba447f6abd253acbfa4a0d336ebfc215a5bb4
2019-08-14T10:41:58Z,commit,LightAdvHighlightingPerformanceTest#testVarArgPoly: increased count f¡­,github.com/JetBrains/intellij-community/pull/1156/commits/59d7dc78269976997b8b6c609392f258daeb8cb9
2019-08-15T02:41:42Z,commit,InferenceVariablesOrder#resolveOrderFast fixed comparison,github.com/JetBrains/intellij-community/pull/1156/commits/819ce48c13b2ac4956978e4166df2559d578ab94
2019-08-15T02:42:12Z,commit,PsiUtil#equalOnEquivalentClasses: fast-path for equal substitutors an¡­,github.com/JetBrains/intellij-community/pull/1156/commits/925efc9808fba998a96cd562cb1e46b5804bfda2
2019-08-15T04:16:59Z,commit,PsiUtil#typeParametersIterable: less allocations for common case (do ¡­,github.com/JetBrains/intellij-community/pull/1156/commits/1c4352b7406f67e31539b175c0cb6094378490a0
2019-08-15T04:19:30Z,commit,ContainerUtil: fixed some raw type warnings,github.com/JetBrains/intellij-community/pull/1156/commits/b8f38f866a8cef64c4e594ad9664d2e63002a9b3
2019-08-15T04:20:06Z,commit,TypeConversionUtil#isAssignable: fast-path for j.l.Object,github.com/JetBrains/intellij-community/pull/1156/commits/968102292625197be46559d202354c4da683b438
2019-08-15T04:57:32Z,commit,testVarArgPoly moved to InferencePerformanceTest (IDEA-CR-51398),github.com/JetBrains/intellij-community/pull/1156/commits/435e196cb15f64a45a681373b3e9e325466762cc
2019-08-15T06:14:49Z,commit,build scripts: correct javadoc,github.com/JetBrains/intellij-community/pull/1156/commits/fa775c3df9e5fa8af0c435bcbf71b67252b49f02
2019-08-15T06:25:25Z,commit,tests: clear ParserDefinition stored in Language's user data when reg¡­,github.com/JetBrains/intellij-community/pull/1156/commits/ac13e0910d8c6abd1052ba358045f4c89ab639ea
2019-08-15T06:35:42Z,commit,JvmSymbolNameCompletionContributor: support nested classes (IDEA-CR-5¡­,github.com/JetBrains/intellij-community/pull/1156/commits/9f7932ca631bb6dfa67e9167e95c7f808d809bad
2019-08-15T06:53:18Z,commit,tests: clear ParserDefinition stored in Language's user data when Par¡­,github.com/JetBrains/intellij-community/pull/1156/commits/9ffb12fe4d058bf42423307d19c9ab8d54ded4ab
2019-08-15T06:53:38Z,commit,CommitCompletionContributor: use prefix matcher if wasn't invoked exp¡­,github.com/JetBrains/intellij-community/pull/1156/commits/dd0dcc8d79e3fd4920e35fbfae68738f679cf70c
2019-08-15T08:10:36Z,commit,don't show thumbnails images action in the project view,github.com/JetBrains/intellij-community/pull/1156/commits/4a343e57580b9668c1e7e37cfae9d3a1d73f2662
2019-08-15T08:49:08Z,commit,build scripts: take bootstrap version of JPS modules from Maven repos¡­,github.com/JetBrains/intellij-community/pull/1156/commits/444af5308cd3c00de27c87aa693d3a48bc211c72
2019-08-15T08:50:21Z,commit,NullableProblems.html: updated according to review,github.com/JetBrains/intellij-community/pull/1156/commits/509dc1f968b305d722c4c0a1547af52938b98e00
2019-08-15T08:52:19Z,commit,"faster AbstractXmlBlock.canWrapTagEnd, without xi:include resolve",github.com/JetBrains/intellij-community/pull/1156/commits/8ac49ee1f9f8a2232cb4c5fcbf475f5ec007f3ae
2019-08-14T09:45:01Z,commit,IDEA-CR-51440: remove invalid icon reference and update presentation ¡­,github.com/JetBrains/intellij-community/pull/1156/commits/d73aeadc4fe23a7d18f3579025c089608c3a9c97
2019-08-15T09:38:33Z,commit,[devkit] kotlin test data -> test-resources to properly categorize in¡­,github.com/JetBrains/intellij-community/pull/1156/commits/aa9385876efb2761d5ee5346bf9755b54598973b
2019-08-15T09:48:03Z,commit,JavaAutoModuleNameIndex should accepts dirs,github.com/JetBrains/intellij-community/pull/1156/commits/124e5eb2429c6b77a0b718cf9624ff672a5a3155
2019-08-15T09:50:21Z,commit,plugin.xml id index: fixes for IDEA-CR-51428,github.com/JetBrains/intellij-community/pull/1156/commits/113e424d96466f2188ae1e9d55ff7b0917b719fb
2019-08-11T07:38:43Z,commit,Define git config gc.auto for the repository according to team-wide s¡­,github.com/JetBrains/intellij-community/pull/1156/commits/e44eec3c4cade892a281fbc07e314d1f11f0e44b
2019-08-15T09:38:41Z,commit,[gradle] fixed subscription leak,github.com/JetBrains/intellij-community/pull/1156/commits/be82e3a2a77c8cafb978a5648284922be23e41af
2019-08-15T10:10:18Z,commit,EA-210352 - NPE: SimpleDiffModel.clear,github.com/JetBrains/intellij-community/pull/1156/commits/78740e11e9a5583453e5dc443e118a1edbdbf51c
2019-08-15T10:29:27Z,commit,"IDEA-220729 ""Open"" project link doesn't work on Welcome screen",github.com/JetBrains/intellij-community/pull/1156/commits/1074b87afd76910f18a12444e057dde558582b55
2019-08-15T10:40:20Z,commit,PY-37012 Revert accidentally removed import,github.com/JetBrains/intellij-community/pull/1156/commits/9ba53b33b308d273d5dd47c25e371a4c46711c62
2019-08-15T10:56:35Z,commit,[uast] java: fix jump expressions stack overflow,github.com/JetBrains/intellij-community/pull/1156/commits/aec0dc453d858a3bcfc2587ee31b9c497c4eeb57
2019-08-14T11:53:59Z,commit,vcs-ignore: call project file index under read action,github.com/JetBrains/intellij-community/pull/1156/commits/5f336b576e499fa0bd6a575fc6d6026205a3a9a8
2019-08-15T10:56:02Z,commit,git: fix flaky test: assert only error notification,github.com/JetBrains/intellij-community/pull/1156/commits/e178bdaa05aa89ee888844cdbbaa3a94989c0fe3
2019-08-15T10:59:34Z,commit,vcs-ignore: avoid clear unprocessed files without processing it first,github.com/JetBrains/intellij-community/pull/1156/commits/209f9539ccd8f6c4e010409a4d236b78db5a9d4d
2019-08-15T12:03:46Z,commit,Borderless: Cannot easily distinguish two Rider windows with differen¡­,github.com/JetBrains/intellij-community/pull/1156/commits/c7b3da6e99d23b2296a2565574720fd3bfc5c9e8
2019-08-07T11:03:35Z,commit,vcs-ignore: fix flaky test: add waiter to ensure update of ignored fi¡­,github.com/JetBrains/intellij-community/pull/1156/commits/954404e18aaedfc075513ce6c13aff46955cfef9
2019-08-15T12:12:47Z,commit,IDEA-211157 File and Code Templates shows incorrect include header fo¡­,github.com/JetBrains/intellij-community/pull/1156/commits/6befbcda7798087a0eb46ec7abae646c5f19bad6
2019-08-15T12:26:30Z,commit,"FUS-473 Extract dynamic values from event id for intention, live temp¡­",github.com/JetBrains/intellij-community/pull/1156/commits/fb212c56944a8f5d6d592a2e91a8a5d4ece4e481
2019-08-15T12:30:18Z,commit,new Editor Tabs UI: editor tabs should have left/right borders (#IDEA¡­,github.com/JetBrains/intellij-community/pull/1156/commits/43ca630186b70289244f8efda10e3afd2e7f33c7
2019-08-15T12:39:02Z,commit,platform: fix nullability of parameter in handleInitComponentError,github.com/JetBrains/intellij-community/pull/1156/commits/c19711505dbee440f2e5ea9b56dcf43594d40a39
2019-08-15T11:37:20Z,commit,extract painting session object in EditorPainter,github.com/JetBrains/intellij-community/pull/1156/commits/4dcbd54d174161e5cefed0d077c5c76bb05b376d
2019-08-15T12:58:27Z,commit,[devkit] DOM: split ExtensionDomExtender vs ExtensionDomExtender,github.com/JetBrains/intellij-community/pull/1156/commits/2a82d13d52ddcc7f9ac06e620905702a7d47c999
2019-08-15T13:05:11Z,commit,customizable values creation,github.com/JetBrains/intellij-community/pull/1156/commits/5b73c9097f6196bb88543526d98857a2922d0ed1
2019-08-15T13:21:41Z,commit,[devkit] ExtensionsDomExtender: cleanup,github.com/JetBrains/intellij-community/pull/1156/commits/2deb0244c6882a6ef0ddb9629d83dc6d4013c8f4
2019-08-15T13:31:45Z,commit,IDEA-216525 Freezes in CustomHeader - fallback if jna is not available,github.com/JetBrains/intellij-community/pull/1156/commits/2a2cb77fdfd00aed5cb5a861df2f4e0104e6d986
2019-08-15T13:42:11Z,commit,IDEA-216360 Code vision selection background overrides editor margin,github.com/JetBrains/intellij-community/pull/1156/commits/69cc7d9c212387d1928b097d326aa92c0af216a7
2019-07-31T14:58:39Z,commit,[diff] Allow plugins to customize editor title in diff,github.com/JetBrains/intellij-community/pull/1156/commits/d1136bb24719cd7e15550402a4544888cafae6da
2019-07-31T15:00:17Z,commit,[diff-impl] Save given request context in SimpleDiffRequest,github.com/JetBrains/intellij-community/pull/1156/commits/9462d1f3fcae1ea3c50b2c6f218fbff5fea05c93
2019-08-01T17:39:33Z,commit,[diff-impl] Introduce ProxySimpleDiffRequest which is used to keep re¡­,github.com/JetBrains/intellij-community/pull/1156/commits/664f90b67e5fa0b080c8c5fccb18b448db1bf8be
2019-08-15T11:20:35Z,commit,ResolveScopeManager:,github.com/JetBrains/intellij-community/pull/1156/commits/203ba6dabab52435a2bc7c03d397c17d4a2250e9
2019-08-15T12:39:19Z,commit,JavaDoc,github.com/JetBrains/intellij-community/pull/1156/commits/1131960d02ecf52e5c33b6297847f9425736a824
2019-08-15T14:04:19Z,commit,build scripts cleanup: get rid of unnecessary reflection,github.com/JetBrains/intellij-community/pull/1156/commits/a228e54cb2750b7da8601c30447c3b01df418906
2019-08-15T14:36:21Z,commit,xml formatter: avoid expanding xi:include in more places,github.com/JetBrains/intellij-community/pull/1156/commits/830803f659a37db4b67333d6507a66d625a14e8c
2019-08-15T14:39:12Z,commit,preload keymap manager and ui settings,github.com/JetBrains/intellij-community/pull/1156/commits/138e4e49f865a3fd50b20434cb5995f68f3462bb
2019-08-15T14:39:29Z,commit,cleanup,github.com/JetBrains/intellij-community/pull/1156/commits/2f7f7ae1758ad31fe7e61bb5b888f49f1b90419f
2019-08-15T14:46:22Z,commit,junit: check for junit classes available in scope before proceeding w¡­,github.com/JetBrains/intellij-community/pull/1156/commits/54eb66996d25de13051024ebcfe585f246f7260e
2019-08-15T14:53:50Z,commit,scheduleAdjustLineIndent() API method,github.com/JetBrains/intellij-community/pull/1156/commits/da448e5889a56c073c49e535279d37a6c6d105dd
2019-08-15T15:00:25Z,commit,don't spawn a new thread for update checker,github.com/JetBrains/intellij-community/pull/1156/commits/d800eb92e55222bd99e8f3a68af28d2ea9331c04
2019-08-15T11:20:46Z,commit,git-tests: fix toString which was using incorrect file type class to ¡­,github.com/JetBrains/intellij-community/pull/1156/commits/01a894d78c5838129872c12f1b47f02835f65dcf
2019-08-15T13:45:08Z,commit,temporary workaround for JBR-1721 Cant open project on macOS 10.15,github.com/JetBrains/intellij-community/pull/1156/commits/18a5fe8175a8547f9e72ee8138d5067fe0698d9b
2019-08-15T14:15:20Z,commit,cleanup,github.com/JetBrains/intellij-community/pull/1156/commits/77d77d9b9604e75227df8dd1ffd7d8178c4a0579
2019-08-15T14:17:28Z,commit,notnull,github.com/JetBrains/intellij-community/pull/1156/commits/d6a0b66b2000e6a2d2945a60a125911b1b382540
2019-08-15T14:21:00Z,commit,"simplify code (since now there's no node splitting anymore), get rid ¡­",github.com/JetBrains/intellij-community/pull/1156/commits/d480f812ad079b5d1c8849803d95abbffb1cebb1
2019-08-15T14:47:16Z,commit,[devkit] ExtensionDomExtender: cleanup,github.com/JetBrains/intellij-community/pull/1156/commits/5215aaff6d341bf2cfb78c3790b0db7d2851d459
2019-08-15T15:00:06Z,commit,vcs tests: dump debug log if tearDown() fails with an exception.,github.com/JetBrains/intellij-community/pull/1156/commits/aa079d640c2210f6eb115387a100963f523f7e2c
2019-08-15T15:03:10Z,commit,FUS-473 Extract dynamic values from event id for surround with,github.com/JetBrains/intellij-community/pull/1156/commits/6d2a8e208e5c427b3c7b66404d7ce834d1aa3867
2019-08-15T15:21:05Z,commit,fix typo,github.com/JetBrains/intellij-community/pull/1156/commits/b1e5644ca3edcf42e0fdd5fa1abe777b64a9cea1
2019-08-15T15:57:29Z,commit,[devkit] cleanup EP field annotation code,github.com/JetBrains/intellij-community/pull/1156/commits/a4ceedebd5982a8c419af6f78b106e79f3f8e414
2019-08-15T14:50:25Z,commit,vcs: cleanup: RunVcsCloneDialogAction.kt -> GetFromVersionControlActi¡­,github.com/JetBrains/intellij-community/pull/1156/commits/6d839e236dad3d5cc514569325ab2f0e80cf6a3d
2019-08-15T15:04:39Z,commit,vcs: use correct text for clone actions in different places,github.com/JetBrains/intellij-community/pull/1156/commits/a144bef814d966c3853514fc4ea5db8a68010059
2019-08-15T16:15:00Z,commit,"CodeInsightUtil: tolerate classes with null names, whoever returns th¡­",github.com/JetBrains/intellij-community/pull/1156/commits/9f94c65616746f6bc09a2ab3b4ce34ec889eb387
2019-08-15T16:20:21Z,commit,[devkit] ExtensionDomExtender: skip EP static fields immediately,github.com/JetBrains/intellij-community/pull/1156/commits/3e64217de4bfb5c7604b01acb17d15737e312869
2019-08-15T16:25:14Z,commit,make smart keys configurables searchable,github.com/JetBrains/intellij-community/pull/1156/commits/35fba7c13dfe0fe8ecf9459f22fd478d876d1f22
2019-08-15T16:37:45Z,commit,Fall back to project settings if current computation is unfinished (l¡­,github.com/JetBrains/intellij-community/pull/1156/commits/f475ae92d54c6f51b1d4913240e9b5a81bbfc2ac
2019-08-15T17:39:30Z,commit,Notify on EDT in synchronous mode too (failing test fix),github.com/JetBrains/intellij-community/pull/1156/commits/7d2018c336ab23a638beb17558f69035822bc068
2019-07-23T14:37:23Z,commit,Don't mark `continue` in `finally` block as an error in Python 3.8+ (¡­,github.com/JetBrains/intellij-community/pull/1156/commits/d50b3ad7ea97b13e5e5f389ac450fd06404ebe79
2019-07-25T17:05:47Z,commit,Complete `continue` in `finally` block in Python 3.8+ (PY-36003),github.com/JetBrains/intellij-community/pull/1156/commits/bf2f4468b2a652917c9a18bf598dee6969c75afb
2019-08-15T16:00:38Z,commit,Move highlighting `continue` under `finally` to compatibility inspect¡­,github.com/JetBrains/intellij-community/pull/1156/commits/34ae8b9265a0746d4c757a54253453a75d2c1ef0
2019-08-15T18:38:06Z,commit,fix paths in OrderEnumeratorTest.addModuleRoots,github.com/JetBrains/intellij-community/pull/1156/commits/6cc03fd2ab7e0dbf0608f3e29db64a036b54453a
2019-08-15T13:35:46Z,commit,avoid getting file specific codestyle settings when not necessary (ID¡­,github.com/JetBrains/intellij-community/pull/1156/commits/ec1b89f89d96d85852f637249fce957c328a36ca
2019-08-15T18:57:04Z,commit,reset cache correctly for cell renderers,github.com/JetBrains/intellij-community/pull/1156/commits/3d843f49c05c2a85648ce5497d974a3659e7f4d0
2019-08-15T20:17:13Z,commit,"temp disable a test to help TC a bit,",github.com/JetBrains/intellij-community/pull/1156/commits/aecea82a4da66338de616574a45fd5beea498a0b
2019-08-15T20:32:28Z,commit,revert,github.com/JetBrains/intellij-community/pull/1156/commits/ed8f6613998a5c3599b5bf4eebfa08ee9cf7cf01
2019-08-15T20:52:06Z,commit,IDEA-153291 IDE opens on a last known location when external monitor ¡­,github.com/JetBrains/intellij-community/pull/1156/commits/1c279e90c99aa46564a88ecaddb4b09db84bcd13
2019-08-16T07:16:44Z,commit,remove empty method,github.com/JetBrains/intellij-community/pull/1156/commits/766ca3e5ca3b5501bc61139b737ef9a3ef14ecbe
2019-08-16T08:11:31Z,commit,don't fire file-type changed events on TextMateServiceImpl initializa¡­,github.com/JetBrains/intellij-community/pull/1156/commits/2ff0d321a761a506aba153541f2cb3b2007f7c0b
2019-08-16T08:13:01Z,commit,IDEA-216893 Quick documentation is shown even without moving the mouse,github.com/JetBrains/intellij-community/pull/1156/commits/ac30a302e7687f9626eebe9a743338cf542b4452
2019-08-15T16:22:38Z,commit,IDEA-220779 add recent commit messages into the commit message input ¡­,github.com/JetBrains/intellij-community/pull/1156/commits/7e94e50f3eeed58a56cbb8da9fc7fe7828ff909f
2019-08-16T09:02:06Z,commit,IDEA-219849 - added ProgressManager.checkCanceled(),github.com/JetBrains/intellij-community/pull/1156/commits/1774421c3e7d42432b67d80d87f08cc0a26f5ffe
2019-08-16T09:39:13Z,commit,"[devkit] Provide ""Plugin Descriptor Files"" default search scope (enab¡­",github.com/JetBrains/intellij-community/pull/1156/commits/0f6419650e946a57894321aeb05670cbed4a3a0c
2019-08-16T09:41:42Z,commit,[platform] non-destructive fast SafeFileOutputStream (IDEA-152607/IDE¡­,github.com/JetBrains/intellij-community/pull/1156/commits/36eb661e15ac5605e295ed41900b9fcb46af683e
2019-08-15T16:40:06Z,commit,IDEA-215196 fix runner tabs border when left toolbar isn't visible,github.com/JetBrains/intellij-community/pull/1156/commits/f1da0a162ce33992109330a46fcfe6939d45bc4a
2019-08-15T17:35:41Z,commit,Update Recent Changes Popup layout,github.com/JetBrains/intellij-community/pull/1156/commits/47cf56d27c41d27d8dc82529ecf6e1539259bb3c
2019-08-15T18:31:49Z,commit,IDEA-215194 bring back separator between toolbar and console in run tabs,github.com/JetBrains/intellij-community/pull/1156/commits/6bda2d72f52b97dc1fb1cca077013ca74310ab20
2019-08-16T10:03:39Z,commit,"[devkit] ""Plugin Descriptor Files"" default search scope - remove regi¡­",github.com/JetBrains/intellij-community/pull/1156/commits/eee0b38fccce6ba843cb92f6cc5eda26060336e5
2019-08-16T10:39:59Z,commit,"base state <cinit>: let's use a class loader, which belongs to the cl¡­",github.com/JetBrains/intellij-community/pull/1156/commits/15bc02e14a1fdc571ce5c6d8b1b5df8eca445fa4
2019-08-16T10:44:47Z,commit,"don't load services with current thread's class loader, specify it ex¡­",github.com/JetBrains/intellij-community/pull/1156/commits/d37c9a972874a5eea4aa747c567fba90a555bf86
2019-08-16T11:08:14Z,commit,IJI-186 build ultimate modules for private maven repo publication,github.com/JetBrains/intellij-community/pull/1156/commits/970e75d9e421bd8ed0d6b2f72f6a5421fcbcf011
2019-08-16T11:14:18Z,commit,Updating versions of project dependencies: jdkBuild->11_0_4b419.1,github.com/JetBrains/intellij-community/pull/1156/commits/0ceb1a7af23f2abe786c4633e0e48935fc7bb466
2019-08-16T11:21:53Z,commit,process extensions from xincluded plugin xmls with modules but no id,github.com/JetBrains/intellij-community/pull/1156/commits/8fef03d491de40a821656b6d9dd098f854359f61
2019-08-15T15:55:02Z,commit,EA-207093 - IAE: SliceUtil.$$$reportNull$$$,github.com/JetBrains/intellij-community/pull/1156/commits/99b4bbb8edbcf4b382a4d3e8e2237ccb8705bd96
2019-08-15T16:11:43Z,commit,EA-207358 - NPE: FindUsagesManager.lambda$null$,github.com/JetBrains/intellij-community/pull/1156/commits/43c572cbaab96e90bf12e597d0c3f23923393b85
2019-08-15T16:15:29Z,commit,EA-207504 - IPE: VfsEventGenerationHelper.lambda$isUnderSomeProjectRoot$,github.com/JetBrains/intellij-community/pull/1156/commits/d3db7e6476eb93c64ed2cd8941014ac53b61afe1
2019-08-15T16:15:43Z,commit,EA-210048 - assert: LazyParseableElement.ensureParsed,github.com/JetBrains/intellij-community/pull/1156/commits/4cc4d7dc84ac134ff95ada08534279c9ca6f9f41
2019-08-16T11:24:18Z,commit,IDEA-220692 fixing code review suggestions from Nik,github.com/JetBrains/intellij-community/pull/1156/commits/cfc076c57838f141e9451b5313f4b4dd28a1721e
2019-08-16T11:40:27Z,commit,EA-210457 - IAE: PsiDocumentManager.$$$reportNull$$$: project is miss¡­,github.com/JetBrains/intellij-community/pull/1156/commits/48fb1aef4aca0816b65154433842f12fdac6dc0f
2019-08-16T12:10:26Z,commit,cleanup: simplify code since the VirtualFile.getId() is positive: rep¡­,github.com/JetBrains/intellij-community/pull/1156/commits/c2b58ffbbf09cbfc9ee66f8a8c63293f0f332055
2019-08-16T12:27:56Z,commit,git: Compare Branches should filter the log view by respective git root,github.com/JetBrains/intellij-community/pull/1156/commits/cbe4fa7e40eac630d54f6e74882928326e0b553d
2019-08-16T12:28:52Z,commit,IJI-186 preview -> publication rename; publication of all artifacts s¡­,github.com/JetBrains/intellij-community/pull/1156/commits/c2afcaf396b3646a2bad5dbcc3aeb32311fc66df
2019-08-16T12:32:53Z,commit,"IDEA-220692 fixing code review suggestions from Nik, take 2",github.com/JetBrains/intellij-community/pull/1156/commits/467bc4111b764704b2616f1e969a5493d00cb6df
2019-08-16T12:32:59Z,commit,"Fix HiDPI case for ""Dump Screen Configuration"" internal action",github.com/JetBrains/intellij-community/pull/1156/commits/bbb437aee242aa7a19e6dea2701e565671a7741a
2019-08-16T12:41:22Z,commit,IDEA-216967 Folded values of properties from resource bundles are not¡­,github.com/JetBrains/intellij-community/pull/1156/commits/fe46f1bc06ba49c1a5ee8326e1b7ea7ef7ef328c
2019-08-16T12:50:21Z,commit,IJI-186 remove Bintray-specific suffix,github.com/JetBrains/intellij-community/pull/1156/commits/cb671a2f1fff1ed860cc7e478dffa64805de953a
2019-08-08T08:43:23Z,commit,IDEA-CR-51224: PY-37204 Remove accidentally added code from `pydev_co¡­,github.com/JetBrains/intellij-community/pull/1156/commits/06eb532762d1d2e7eb4631290b6ec5d3e128f627
2019-08-13T13:26:57Z,commit,[vcs] IDEA-211406: Move changes parsing to background,github.com/JetBrains/intellij-community/pull/1156/commits/6bb81883bed2729cac276920f19501c9bc60454f
2019-08-13T14:24:27Z,commit,IDEA-CR-51461: PY-37150 Check if frame is None,github.com/JetBrains/intellij-community/pull/1156/commits/dca39399b5d6a40f4832a21d92cde9e4a5703757
2019-08-13T17:17:39Z,commit,[vcs] ShowAllAffectedGenericAction should be performed only from old ¡­,github.com/JetBrains/intellij-community/pull/1156/commits/8801c32a5df09aa24b407e0ffae0e5d35d550920
2019-08-16T08:37:35Z,commit,IDEA-CR-51461: PY-37150 Rebuild windows and mac binaries,github.com/JetBrains/intellij-community/pull/1156/commits/0a758ef8120d700f13c4d3bb50f944aa2e326866
2019-08-16T12:49:18Z,commit,[devkit] use DescriptorUtil.getIdeaPlugin(),github.com/JetBrains/intellij-community/pull/1156/commits/05d5149ceb8b8133a5b77ea1df884ad73683eb5b
2019-08-16T13:26:16Z,commit,[devkit] DescriptorUtil: getIdeaPluginFileElement vs getIdeaPlugin,github.com/JetBrains/intellij-community/pull/1156/commits/42c685898d2279b736b329595387d2e49e03dc24
2019-08-16T13:33:04Z,commit,[devkit] DescriptorUtil#getPluginId() -> PluginRunConfiguration,github.com/JetBrains/intellij-community/pull/1156/commits/73a874182d6fc9901ea5768696aa9c59ec47eb0b
2019-08-16T13:53:56Z,commit,[devkit] use constants from PluginManagerCore,github.com/JetBrains/intellij-community/pull/1156/commits/0fc286db94438ba45d6c035a985c8ddd2045b7d0
2019-08-16T14:09:10Z,commit,"move text message to VcsBundle, restore removed attribution",github.com/JetBrains/intellij-community/pull/1156/commits/6330ecf2c74c006712e417f27a7828e450a7c09b
2019-08-16T14:42:13Z,commit,"IDEA-220848 Disable ""WARNING: An illegal reflective access operation ¡­",github.com/JetBrains/intellij-community/pull/1156/commits/b065e1983b87575ead24f979ca894d26731b2c91
2019-08-06T16:56:56Z,commit,vcs-ignore: extract possible heavy operation from lock to avoid EDT f¡­,github.com/JetBrains/intellij-community/pull/1156/commits/0fd845c94aecebd47e3b28eac557a0326739b3bd
2019-08-07T12:23:12Z,commit,"vcs-ignore: optimize isUnder in ignore holders (IDEA-217647, IDEA-219¡­",github.com/JetBrains/intellij-community/pull/1156/commits/5a955161d8196c802cc039f7baf48795bd42b6da
2019-08-08T14:49:56Z,commit,vcs-ignore: optimize ignore holders partial rescans by checking unver¡­,github.com/JetBrains/intellij-community/pull/1156/commits/7023e63880698055f48d1802427a543f34c6f479
2019-08-15T15:17:22Z,commit,cleanup: remove unused snappy JAR file,github.com/JetBrains/intellij-community/pull/1156/commits/b2969db9177bad62fec5a9e8e30bed75a260f81a
2019-08-16T15:15:06Z,commit,make sure creating file pointers for FS root doesn't crash,github.com/JetBrains/intellij-community/pull/1156/commits/aef37b8c9b6198b36fe3708869a8748c8cad8760
2019-08-16T15:18:33Z,commit,"assert argument to findRoot is actual root path, not some random dire¡­",github.com/JetBrains/intellij-community/pull/1156/commits/c5db68cde4539be38fc309a9c38aa97d166d162a
2019-08-16T15:28:58Z,commit,fix flaky tests: wait until tree is build,github.com/JetBrains/intellij-community/pull/1156/commits/090855044b4b575c8513dbcc696498593f1d3d8b
2019-08-16T15:42:13Z,commit,Cancel the editorconfig processing future on PCE,github.com/JetBrains/intellij-community/pull/1156/commits/ccedd26f7c77e4152b716f286340d84df66d5ea3
