293,JavaDoc showAndGet function
2015-08-12T13:15:17Z,discuss,"Add JavaDoc for Quick documentation
(I know that's not a big pull request, but I found the not commented method when I needed it so I wrote it)."
2015-08-13T11:54:47Z,discuss,"Have you submitted a contributor license agreement? If not, please download the PDF from http://www.jetbrains.org/display/IJOS/Contributor+Agreement and then print it out, sign (mention you github account name there), scan and email to contribute@jetbrains.com"
2015-08-13T14:13:36Z,discuss,I've sent the license just now.
2015-08-15T12:38:03Z,discuss,"Merged manually with some additions, thanks!"
2015-08-12T13:14:25Z,commit,JavaDoc showAndGet function,github.com/JetBrains/intellij-community/pull/293/commits/ea80ca8dcfa790cec0bcc6be1cfd16d7ea5e2f48
