82,SSH agent support for git and svn integrations
2013-06-25T17:13:46Z,discuss,"This version allows SSH agent-based authentication to be used for authenticating to SVN or git, as discussed in the ticket http://youtrack.jetbrains.com/issue/IDEA-52034"
2013-06-25T17:16:27Z,discuss,"A contributor agreement has been submitted by Doug Grey, VP of Engineering at at Indeed.com (which owns copyright to this change)."
2013-12-26T14:09:02Z,discuss,Sorry for delay with this pull request.
2013-12-26T14:09:02Z,discuss,"@charles-dyfis-net I see that SvnKit 1.7.10 introduced SSH agent support added via JSCH library. Was it your patch accepted by SvnKit team or it is somewhat different?
Currently there are no reasons (besides additional testing) not to update SvnKit shipped with IDEA to 1.7.11, so we'd prefer an official build to the patched version."
2013-12-26T14:09:02Z,discuss,Could you please check if the patch works fine if SvnKit 1.7.11 is used?
2013-12-26T15:44:24Z,discuss,"Yes, this patch works with upstream SVNKit 1.7.11."
2013-12-26T15:54:50Z,discuss,"@charles-dyfis-net
Thanks! Could you please recreate the pull request without patching svnkit?"
2013-12-26T16:09:03Z,discuss,Per request.
2013-12-26T16:09:03Z,discuss,"That said, there's still a pretty nontrivial set of conflicts trying to merge this into current master -- one of the perils of leaving something unmerged for quite this long."
2013-12-26T16:09:03Z,discuss,I might try to rebase. Would master be the appropriate target?
2013-12-26T16:14:25Z,discuss,Yep. Please rebase against current master.
2013-12-26T18:07:18Z,discuss,"Done. I'm including the upgrade to SVNKit 1.7.11 (released version) as a separate changeset -- so y'all can cherry-pick the piece that doesn't contain it if the upgrade has been done separately. As the patch can't be built without an appropriate SVNKit, not including one at all doesn't make much sense."
2013-12-26T19:26:18Z,discuss,Bleh -- this PR is still using 129 as target. Closing and recreating.
2013-12-26T19:28:09Z,discuss,Reopened as #140
2013-12-19T16:03:54Z,commit,restore WebBrowserUrlProvider API,github.com/JetBrains/intellij-community/pull/82/commits/d4d4ad54db8a386fe8fd787deaef8ba8bb5ca077
2013-12-19T16:09:06Z,commit,"polish ""Difference using ""Open in browser"" vs browser icon"" fix ¡ª we ¡­",github.com/JetBrains/intellij-community/pull/82/commits/bcebafd0b1e87ef57c3cd752560994bef90e1a46
2013-12-19T16:16:33Z,commit,IDEA-118429 (IDEA incorrectly suggests to remove unboxing),github.com/JetBrains/intellij-community/pull/82/commits/c45066584665b9485d005e6821e08af066f2548f
2013-12-19T14:05:43Z,commit,ui: correct icon for facet editor panel,github.com/JetBrains/intellij-community/pull/82/commits/4eb09a2f3a3ec19bf10c5604b44687a9ee3df96c
2013-12-19T16:15:24Z,commit,platform: incompatible KTerm option stripped,github.com/JetBrains/intellij-community/pull/82/commits/285876768890fa1413bc2709b30984e7381361d7
2013-12-19T16:26:12Z,commit,Cleanup (duplicate),github.com/JetBrains/intellij-community/pull/82/commits/d2e8aa1934c0ebed4cbed3507cb75e6190cc4317
2013-12-19T17:32:22Z,commit,add missed src jar,github.com/JetBrains/intellij-community/pull/82/commits/f34a02493fa5cebd9b5fc5a8857d5997c013ba06
2013-12-19T17:38:00Z,commit,Cleanup (PTY runner decoupled from GeneralCommandLine),github.com/JetBrains/intellij-community/pull/82/commits/1da12c620597edd27ff5089343e094205600bc2a
2013-12-19T11:42:57Z,commit,more precise quick fix name (IDEA-118416),github.com/JetBrains/intellij-community/pull/82/commits/fda75954dd1dce6f98b91bf96b56fdb2dc3647f5
2013-12-19T12:00:54Z,commit,IDEA-118420 Better wording for quickfix to 'Declaration can have fina¡­,github.com/JetBrains/intellij-community/pull/82/commits/ab1bebff33b7311d48b44c2a0e47f0c13521bf20
2013-12-19T16:13:06Z,commit,add assert: respect initializer in ForStatement,github.com/JetBrains/intellij-community/pull/82/commits/7c4a448e292bec457f7553cfa2b5ed310a8d9309
2013-12-19T16:34:27Z,commit,junit: reject to start when no tests were found in package,github.com/JetBrains/intellij-community/pull/82/commits/fa52498116208c0bec2688b16d13fe9df7e7a460
2013-12-19T17:04:22Z,commit,run manager: do not override shared status from default configuration¡­,github.com/JetBrains/intellij-community/pull/82/commits/d35fc051decbaf42a056c1bc72b729e582cb8b87
2013-12-19T17:38:00Z,commit,IDEA-118496 disable boolean param inspection for library overriders,github.com/JetBrains/intellij-community/pull/82/commits/58e433ad7bc50e9f65be46bae0d2df3378ea0b99
2013-12-20T08:33:07Z,commit,spy-js plugin initial commit,github.com/JetBrains/intellij-community/pull/82/commits/530c80088fb2d46fc229f1efb8cec464ff9468d5
2013-12-19T12:08:31Z,commit,IDEA-118371 Partial find occurences disappear with 'group by ...' button,github.com/JetBrains/intellij-community/pull/82/commits/53fe9df2533f8f45c6b5dd569ddbbf7e087e7519
2013-12-19T13:12:20Z,commit,notnull,github.com/JetBrains/intellij-community/pull/82/commits/520219514ceea9fc92deb289574c5bf94c6cd2f9
2013-12-19T13:13:09Z,commit,optimisation: do not load document to check for isReadOnly,github.com/JetBrains/intellij-community/pull/82/commits/11dad8cb724bb528182740e2fe44f020a7854fbc
2013-12-19T13:58:06Z,commit,cleanup,github.com/JetBrains/intellij-community/pull/82/commits/aa678f58088d01a9654087ea3b5df485f1404240
2013-12-19T15:07:07Z,commit,notnull,github.com/JetBrains/intellij-community/pull/82/commits/c0a94d5a9a8b91ccaa0d2b6451c743cd81492bd2
2013-12-19T15:08:50Z,commit,cleanup,github.com/JetBrains/intellij-community/pull/82/commits/c52f140d18da19165ebff07de44a1461846eb163
2013-12-20T09:52:57Z,commit,IDEA-118096 Documentation popup not usable because of Jetbrains annot¡­,github.com/JetBrains/intellij-community/pull/82/commits/32133c0ad1c71ecd68b2a9b961912ff30bdc20a9
2013-12-20T10:59:21Z,commit,"Show ""Split mode"" action for sliding toolwindows.",github.com/JetBrains/intellij-community/pull/82/commits/e03fa18deb9d4f3fcc30215bbce61a0b6d6c9d3b
2013-12-19T18:38:14Z,commit,Do not populate custom live template lookup with 'Edit live template,github.com/JetBrains/intellij-community/pull/82/commits/e647f6fe107f7b8d4eb8a2b713a7c9e5c827dd90
2013-12-19T18:39:51Z,commit,Postfix: rename 'Edit postfix templates settings' action,github.com/JetBrains/intellij-community/pull/82/commits/a71af7f7e114aab93b5e3d3a3004f0923121a7c3
2013-12-19T18:56:28Z,commit,Emmet: show 'Edit emmet settings' for emmet lookup item,github.com/JetBrains/intellij-community/pull/82/commits/1684f09c3758544a3806fc259925a3c4cc93075a
2013-12-20T11:05:14Z,commit,Copyright: commit document after comment updating,github.com/JetBrains/intellij-community/pull/82/commits/0f2e2a53a442d883f07e66d1c6c02a6900cb67f2
2013-12-12T09:49:31Z,commit,revert: IDEA-117864 optimize reference search scope,github.com/JetBrains/intellij-community/pull/82/commits/dc77905ac2584b34c7d9c6964f8847a5d2cedc3b
2013-12-16T08:52:51Z,commit,simplify type inference for unary expressions,github.com/JetBrains/intellij-community/pull/82/commits/b9531f2428533b89db5d3fa07e62e9c37fd17857
2013-12-16T11:32:27Z,commit,save applicability in GroovyResolveResult,github.com/JetBrains/intellij-community/pull/82/commits/e48edcd68c6f11ac759bab992e07a4d3317cc4aa
2013-12-20T07:12:03Z,commit,Groovy: operator resolving & type inference,github.com/JetBrains/intellij-community/pull/82/commits/7c2363d66c23d29282d09ce0d424d263a0e8b891
2013-12-20T09:52:56Z,commit,Groovy: assignment type inference,github.com/JetBrains/intellij-community/pull/82/commits/2ecd26f735c1dd819149449332b68d8d43c58b4b
2013-12-20T11:17:46Z,commit,don't fall into recursion while resolving annotation name,github.com/JetBrains/intellij-community/pull/82/commits/aa52dce5bce20f5827c17eb19691bb09351717bd
2013-12-20T08:25:50Z,commit,free RootIndex memory on project dispose,github.com/JetBrains/intellij-community/pull/82/commits/b3a6dbb1b62d9ca888bd1f42e73aec1e1062d597
2013-12-20T08:43:29Z,commit,uncomment DirectoryIndexTest assertions,github.com/JetBrains/intellij-community/pull/82/commits/5c514055ddab72a478e738351ddffd8ebb6f75a4
2013-12-20T11:40:51Z,commit,some cases to avoid Document.getText where CharSequence is enough,github.com/JetBrains/intellij-community/pull/82/commits/93977b511b77b9deee5f553c46e4bd962602b665
2013-12-20T11:47:39Z,commit,save RootIndex memory,github.com/JetBrains/intellij-community/pull/82/commits/0f2dda440c63a5047752650e91c003a80a8a870f
2013-12-20T11:51:09Z,commit,NotificationGroup constructor shouldn't require an initialized Applic¡­,github.com/JetBrains/intellij-community/pull/82/commits/4e60af8a433d719e0648d4f05c80ac3142408c5b
2013-12-20T12:10:53Z,commit,use folder icon for groups in Menus and Toolbars configurable,github.com/JetBrains/intellij-community/pull/82/commits/f310feeef8d5f5167f462ac6f536098aa451aeff
2013-12-20T12:14:42Z,commit,IDEA-118552 Generated ANT scripts do not honour cross-compile settings,github.com/JetBrains/intellij-community/pull/82/commits/8d996fa4c79942d0582137fc8edf1a11d775cb0b
2013-12-20T12:15:16Z,commit,cosmetics,github.com/JetBrains/intellij-community/pull/82/commits/767d1aba6a5d58d43f1fa69046619f96abc2cfff
2013-12-20T08:20:42Z,commit,allow autocompletion in dumb mode if provider is dumb aware,github.com/JetBrains/intellij-community/pull/82/commits/90d256cf2803506f62e53c880d1ded476f06bc43
2013-12-20T12:46:02Z,commit,can be final: ensure non final for base of anonymous class (IDEA-118493),github.com/JetBrains/intellij-community/pull/82/commits/fb53d06dfd941ce3e394b742e64f3921b24e93c1
2013-12-20T13:08:50Z,commit,Switched back to char-based triple quotes detection for docstring ele¡­,github.com/JetBrains/intellij-community/pull/82/commits/242a5e3ee03a8d52ab4a0db5537f37bcd108cbc2
2013-12-20T13:21:27Z,commit,check context for nullability,github.com/JetBrains/intellij-community/pull/82/commits/d3be23f7ce49700522d5a354d2689816a807deca
2013-12-20T13:37:52Z,commit,BackgroundTaskQueue.waitForTasksToFinish API,github.com/JetBrains/intellij-community/pull/82/commits/be071832ee0192b05f2bed4dbe0f61750b76e3e5
2013-12-20T13:38:53Z,commit,BackgroundTaskQueue doesn't postpone onSuccess/onCancel until next aw¡­,github.com/JetBrains/intellij-community/pull/82/commits/628ff783002a49f323f6e812ff9b75944d9bee36
2013-12-20T14:04:13Z,commit,lazy sem contributor loading,github.com/JetBrains/intellij-community/pull/82/commits/1feb27b7bcce9d9073a61751e4946245eb23e708
2013-12-20T14:05:20Z,commit,constant-time ModuleManager.getModuleByFilePath,github.com/JetBrains/intellij-community/pull/82/commits/0380bcfb47639502814e063e3b69059d3de583d0
2013-12-20T14:28:14Z,commit,Gradle: GrShiftExpressionImpl usage removed,github.com/JetBrains/intellij-community/pull/82/commits/fd3bc7f4930515de2db02cad12a1cf37b62a898c
2013-12-20T14:50:01Z,commit,VersionComparatorUtil.comparePriorities() simplified,github.com/JetBrains/intellij-community/pull/82/commits/d4f5e53432e70aa3fe533cc84a3e35af569e0a2f
2013-12-20T14:35:42Z,commit,Multiply revision node presentation in HgLog for only one revision fi¡­,github.com/JetBrains/intellij-community/pull/82/commits/4e16c4174b1ed8b3d2a4d33d0a829fb6c5efef40
2013-12-20T14:54:48Z,commit,Parents revision hash template changed to long.,github.com/JetBrains/intellij-community/pull/82/commits/32ab1db7693a73a5cae7e714bf647a99c40db6a9
2013-12-20T15:02:11Z,commit,Show unnamed branch heads without bookmarks and not current revision ¡­,github.com/JetBrains/intellij-community/pull/82/commits/77792a3770b517417469613b976a908db6d9bc87
2013-12-20T15:12:28Z,commit,fixed problem mentioned in CR-IC-3742,github.com/JetBrains/intellij-community/pull/82/commits/7e9eaf963bc09c26bb7358d99254297191ec2b7a
2013-12-18T09:47:43Z,commit,[log] Supply correct commit object to getCommitData in DetailsPanel,github.com/JetBrains/intellij-community/pull/82/commits/9a92cb95ea404280f30fa422de0b3c71bc6d7fac
2013-12-20T13:00:05Z,commit,[log] Flush & Close persistent enumerator on dispose(),github.com/JetBrains/intellij-community/pull/82/commits/2beff60bed9f55f004decfec005e0ef500f735df
2013-12-20T14:06:42Z,commit,[git] Wrap the VcsException not to loose the cause,github.com/JetBrains/intellij-community/pull/82/commits/23583d3a74c095c9551f9800eb9fce408af7968c
2013-12-20T15:22:10Z,commit,[log] Fix identifying root of Node,github.com/JetBrains/intellij-community/pull/82/commits/cb5ee8641f42b078ef9310172f88c0232bd67558
2013-12-20T15:23:05Z,commit,[log] Take END_COMMIT_NODE as well as COMMIT_NODE,github.com/JetBrains/intellij-community/pull/82/commits/34ab25e2273911e105184def6d2d77ae28304646
2013-12-20T15:25:45Z,commit,cache cls navigation elements that are not so cheap to calculate each¡­,github.com/JetBrains/intellij-community/pull/82/commits/054ec7e0586ee5269e22b1f730e2b0754446328a
2013-12-20T15:40:07Z,commit,"IDEA-104706 Remove currently active file from ""Recent Files"" popup",github.com/JetBrains/intellij-community/pull/82/commits/317be6ec958d0fa73ec7ea75daa59a70f009fc2e
2013-12-20T15:40:09Z,commit,assertion added to check that 'registerOutputDirectory' isn't called ¡­,github.com/JetBrains/intellij-community/pull/82/commits/2f2154b59302bdd7a3e9333e7022ae278f48a1a2
2013-12-20T15:42:53Z,commit,don't show active file in recent files section,github.com/JetBrains/intellij-community/pull/82/commits/3aac7abcd1295caf6b616e86c00a0cafa3ec2862
2013-12-20T16:09:40Z,commit,% sign is useless while indexing,github.com/JetBrains/intellij-community/pull/82/commits/181d69ee838e2a8b27924a2445d8e0307baf0e56
2013-12-20T16:11:22Z,commit,use ctrl(meta) + shift + K shortcut for push,github.com/JetBrains/intellij-community/pull/82/commits/2c708399fcff5278e049c0bd1262648b4c7e0eb3
2013-12-20T16:13:19Z,commit,use ctrl(meta) + shift + K shortcut for push,github.com/JetBrains/intellij-community/pull/82/commits/718d70f59b43f0d90e50f584091430edf6797d10
2013-12-20T16:19:31Z,commit,"Do not throw on quick-fix creation, just return null",github.com/JetBrains/intellij-community/pull/82/commits/b83ecae0bdea002263c09f1190c81017cd61a122
2013-12-20T17:24:20Z,commit,free the memory used to build RootIndex,github.com/JetBrains/intellij-community/pull/82/commits/ec01e468b1940a674e618fdc1b4c2dd3b162beaa
2013-12-20T17:24:50Z,commit,avoid creating string garbage when searching for external annotations,github.com/JetBrains/intellij-community/pull/82/commits/2c458f1f5c203c6e0cbdb0e21dacad00e186f27c
2013-12-20T17:25:17Z,commit,drop cls navigation element cache on the navigation element change,github.com/JetBrains/intellij-community/pull/82/commits/2acfe622469dea8fe09d435814c5785aadae5a3c
2013-12-20T18:26:56Z,commit,"+ ""trie""",github.com/JetBrains/intellij-community/pull/82/commits/669ae41ad09412e77421206cfcc6991d4f9dbfa5
2013-12-21T11:12:40Z,commit,cosmetics: revision hash template changed to long.,github.com/JetBrains/intellij-community/pull/82/commits/f1c78e193f7bd3c31c529ed24b54bc961eb8c031
2013-12-21T11:14:20Z,commit,"Style: unnecessary array with indicator output command removed, mySho¡­",github.com/JetBrains/intellij-community/pull/82/commits/71f457f8f135eaebd81d74691baee3eb0ee2fa8e
2013-12-21T12:14:58Z,commit,"OutputSuppressed option added for HgCommandExecutor, style changed, u¡­",github.com/JetBrains/intellij-community/pull/82/commits/4d55fdde0d0cdb67df877b506e9ebebed019723a
2013-12-21T13:04:33Z,commit,[log] simplify,github.com/JetBrains/intellij-community/pull/82/commits/12fd8d45add703f9f8504180dc117d1a913bb221
2013-12-20T13:27:07Z,commit,groovy 2.2.1,github.com/JetBrains/intellij-community/pull/82/commits/53ea37558d6acfd25c0f2c697e716b59835fd842
2013-12-21T17:44:25Z,commit,don't run groovy shell if there is no full Groovy lib in a module,github.com/JetBrains/intellij-community/pull/82/commits/0ac89c0d2ecafaa78d281fb266b01ecaab8493c1
2013-12-21T17:45:08Z,commit,get rid of GrBinaryExpressionImpl inheritors in code base,github.com/JetBrains/intellij-community/pull/82/commits/62dec2dbcba22af60246395872a1bcadd9d04d4a
2013-12-21T17:58:38Z,commit,disable 'new' postfix template for a while,github.com/JetBrains/intellij-community/pull/82/commits/87b06c1fb59d47db948793f30976c4aedd04f7fb
2013-12-21T18:18:58Z,commit,update gant according to groovy version,github.com/JetBrains/intellij-community/pull/82/commits/77bf85bda600d0faf4df40f15549616b360c834a
2013-12-21T19:36:36Z,commit,Merge remote-tracking branch 'origin/master',github.com/JetBrains/intellij-community/pull/82/commits/cf379f32ab82fc42e087b3f396e7d95f005d9452
2013-12-21T19:44:14Z,commit,revert groovy 2.2.1,github.com/JetBrains/intellij-community/pull/82/commits/dfbbfe289d18c70552c0fd3859eff2cc681c81d1
2013-12-21T20:14:17Z,commit,corrected gant,github.com/JetBrains/intellij-community/pull/82/commits/a8861db9c968040b714cc0b37b187635782757ee
2013-12-22T09:37:19Z,commit,dfa: don't grow stack infinitely on &= (IDEA-118522),github.com/JetBrains/intellij-community/pull/82/commits/1dd46651c97a59b7b373d3b27a659ef0f3544955
2013-12-23T08:34:07Z,commit,IDEA-117966 introduce variable from unresolved reference,github.com/JetBrains/intellij-community/pull/82/commits/5b8d6b2497173f36d2d070937603dd4555c124ea
2013-12-23T08:58:28Z,commit,IDEA-118138 don't highlight closures using unassigned vars,github.com/JetBrains/intellij-community/pull/82/commits/ec97f825f7158c2eb1dce6dcd36e96aced0ff143
2013-12-23T09:50:59Z,commit,correct dependency type for gant,github.com/JetBrains/intellij-community/pull/82/commits/4cfd00159853dad00a86ff3225f065b95610e72a
2013-12-23T10:05:03Z,commit,EA-52726 (assert: ComponentManagerImpl.getComponent),github.com/JetBrains/intellij-community/pull/82/commits/5a86a94ba17dfa851a40417b5c5afe6560fd0b11
2013-12-20T12:35:32Z,commit,EA-52137,github.com/JetBrains/intellij-community/pull/82/commits/bb63a9b4aa64783b6c760b3ce695364983ba2a87
2013-12-20T14:32:31Z,commit,cleanup,github.com/JetBrains/intellij-community/pull/82/commits/016ee36d1752dd37bc5520d3984e419d9d84f4e5
2013-12-23T10:23:28Z,commit,cleanup,github.com/JetBrains/intellij-community/pull/82/commits/8ff12a43153ac60c2bc428bb51a655637a13ac6a
2013-12-23T10:24:54Z,commit,IDEA-97930,github.com/JetBrains/intellij-community/pull/82/commits/6d025c10cd0f2a8dfec1e2a685d0f8d21ca44138
2013-12-23T11:23:28Z,commit,EA-35422 - IOOBE: EditorImpl.offsetToLogicalLine (from debugger),github.com/JetBrains/intellij-community/pull/82/commits/c21cd02f53a93fee9c8f1e1b8363e8dfa36b7ef7
2013-12-23T11:31:13Z,commit,fixed IDEA-111701 Emacs: pressing Ctrl+k several times should add lin¡­,github.com/JetBrains/intellij-community/pull/82/commits/93b3fcc3707ab110df36c5d9423f0b06037d9574
2013-12-23T11:32:01Z,commit,Merge remote-tracking branch 'origin/master',github.com/JetBrains/intellij-community/pull/82/commits/b83d875e175e68e6e31b918c31cfbe9795dfe1b2
2013-12-23T11:41:21Z,commit,roll back spy-js,github.com/JetBrains/intellij-community/pull/82/commits/5c0518e821dc0998d516b727981f2768dcb74f03
2013-12-23T11:52:47Z,commit,Made builtins cache valid only if it has a valid reference to the bui¡­,github.com/JetBrains/intellij-community/pull/82/commits/3a3bbfff65d89ec6ec10fa588a798fd5fa5a4716
2013-12-23T11:55:18Z,commit,IDEA-86907 Fold/unfold for the last node is incorrect,github.com/JetBrains/intellij-community/pull/82/commits/8086000a6ee1d7940f35b6bb72f8595da981a1b5
2013-12-23T12:11:02Z,commit,re-applied darcula changes correctly,github.com/JetBrains/intellij-community/pull/82/commits/183e4169e70e3167a0aa5fd472defbaab5bf5cd0
2013-12-23T12:14:25Z,commit,Added error message for missing python-skeletons diagnostics (PY-10411),github.com/JetBrains/intellij-community/pull/82/commits/9e8ef9207c6232c1ef573e511025828e21176517
2013-12-23T12:39:36Z,commit,IDEA-118588 (Concatenation with empty string fails to fix an expression),github.com/JetBrains/intellij-community/pull/82/commits/01753c7677518db84c94d606fc1722aa2b85e89f
2013-12-23T12:10:08Z,commit,ensure public inner inside interface (IDEA-118564),github.com/JetBrains/intellij-community/pull/82/commits/3d7a8fb300d5bdc15359fb3f8c19701de34a8de0
2013-12-23T12:15:14Z,commit,untie static methods in interface hierarchy (IDEA-118577),github.com/JetBrains/intellij-community/pull/82/commits/6565df2babc6206fac57a0efb120b28cb8aa35a3
2013-12-23T12:31:07Z,commit,rename: do not show collisions for static methods rename in interface¡­,github.com/JetBrains/intellij-community/pull/82/commits/6eaeefa2aa6bbbaa005ea88bec4519295e4647a6
2013-12-23T13:12:24Z,commit,plugin advertiser: do not suggest to update from ultimate to ultimate¡­,github.com/JetBrains/intellij-community/pull/82/commits/461cd32ee4f7e523530fe6e68e5c059e2135a887
2013-12-23T13:47:19Z,commit,lower the dfa inspection time limit in analyze mode (IDEA-118567),github.com/JetBrains/intellij-community/pull/82/commits/99aaa2c27838994b937d4b9dcbf913570871e052
2013-12-23T13:50:19Z,commit,Introduced Bitness and JdkVersionInfo combining version and bitness,github.com/JetBrains/intellij-community/pull/82/commits/9d07fd69b41f2b2985e77515d82cfc3a0ba77c3e
2013-12-23T13:58:05Z,commit,Merge branch 'python-fixes',github.com/JetBrains/intellij-community/pull/82/commits/5735d5c46945bfbddc2426697872191b60fa0086
2013-12-20T16:08:59Z,commit,IDEA-118569 Add quick doc for live template lookup items,github.com/JetBrains/intellij-community/pull/82/commits/107e9ae4422949500cd465d34f40505149ea7f80
2013-12-20T16:23:34Z,commit,Extend block support API,github.com/JetBrains/intellij-community/pull/82/commits/60a5c6086f929dd3c6557d025eccec9144270ea7
2013-12-23T13:45:27Z,commit,ListTemplateAction should provide custom live templates,github.com/JetBrains/intellij-community/pull/82/commits/544d21fd9a8b7a08fc52453363694481c2f1597e
2013-12-23T14:20:13Z,commit,"IDEA-118419 Keep caret on the screen while changing font size, IDEA-1¡­",github.com/JetBrains/intellij-community/pull/82/commits/f6a4f207f067b7ae74eacc6c162ee091d97f64e5
2013-12-23T14:38:02Z,commit,EA-52292 fix (PHP template inside HTML comment case),github.com/JetBrains/intellij-community/pull/82/commits/41ccbd29470b505a469a0a8029ebf4da292e3169
2013-12-23T14:54:40Z,commit,use getElement instead of getParent,github.com/JetBrains/intellij-community/pull/82/commits/43b7c906fd72b5dbf53982d6dace9529815803b1
2013-12-23T15:31:36Z,commit,added copyright,github.com/JetBrains/intellij-community/pull/82/commits/59d1d4c3695238abb9f6b19349ec5bff6b8f9095
2013-12-23T15:36:31Z,commit,IDEA-118487 IDEA should suggest downloading missing plug-ins for unre¡­,github.com/JetBrains/intellij-community/pull/82/commits/0a5485ba2e83457903878d6d16574cc68ac4cc26
2013-12-23T15:43:41Z,commit,fix performance problem on 'new Object() {}' test code,github.com/JetBrains/intellij-community/pull/82/commits/3d634e499acbc06ef7e2c0a8b8452f2731e548c6
2013-12-23T12:07:22Z,commit,clean up literal type inference,github.com/JetBrains/intellij-community/pull/82/commits/89e472e454a14673209686704b0f6582d8bcb82e
2013-12-23T15:15:58Z,commit,Groovy: reassigned vars without closures,github.com/JetBrains/intellij-community/pull/82/commits/e90c6785e9902484c4c8cb8da6f287e4d0c0fd47
2013-12-23T13:09:57Z,commit,java: extra whitespace in class decompiler trimmed,github.com/JetBrains/intellij-community/pull/82/commits/6d85c557b24cf750ca95c5bb7159597b5a78d31f
2013-12-23T15:35:45Z,commit,java: incorrect parsing of bounds in class files fixed,github.com/JetBrains/intellij-community/pull/82/commits/f45f27fd20a2f27e90b07d98d3eee18dd86b9c1b
2013-12-23T15:35:58Z,commit,Cleanup (formatting),github.com/JetBrains/intellij-community/pull/82/commits/1e147d8455fe9993770806fd92c6b5d9918a13e3
2013-12-23T16:27:23Z,commit,static super methods: java 8 interfaces,github.com/JetBrains/intellij-community/pull/82/commits/7e3d1abb52935a7d5f54bfb80c4d96cafa46759e
2013-12-23T16:30:11Z,commit,Merge remote-tracking branch 'origin/master',github.com/JetBrains/intellij-community/pull/82/commits/668b0c15850b1a7f30d33a38faa0cdfe378709dd
2013-12-23T12:17:37Z,commit,"overrides, prefer to use our utils methods",github.com/JetBrains/intellij-community/pull/82/commits/558b4bac4bd8050236c6cd75d0345674f9dcac3c
2013-12-23T16:53:36Z,commit,WEB-10367 JavaScript Debugging in Firefox hangs PhpStorm,github.com/JetBrains/intellij-community/pull/82/commits/1a0c297d426849da3b1b11185ef777617b0b8d67
2013-12-23T16:56:47Z,commit,Add debug info to investigate blink test.,github.com/JetBrains/intellij-community/pull/82/commits/d25214ab584442e3ec067ad2b34b07276ab863e5
2013-12-23T18:06:18Z,commit,"IDEA-118601 New Module: Maven: click on ""Create from archetype"" rever¡­",github.com/JetBrains/intellij-community/pull/82/commits/d94c9a19edd8fca16112b3dbf7f93ca5a4571056
2013-12-23T18:53:13Z,commit,WEB-10360 Javascript debugger with non unique file names,github.com/JetBrains/intellij-community/pull/82/commits/6bd22b407483d7702c5a35d787057263c2ccf560
2013-12-23T19:36:12Z,commit,"fix and clarify ""Cyclic class dependency"" inspection warning",github.com/JetBrains/intellij-community/pull/82/commits/68b7ce46db80a6d18b51de0f3250b3572a7b3773
2013-12-23T20:31:37Z,commit,Bug fix: check not-null,github.com/JetBrains/intellij-community/pull/82/commits/6b54183c9cbacf912b4d0036425a26f77d164183
2013-12-23T20:59:54Z,commit,Fix live templates tests,github.com/JetBrains/intellij-community/pull/82/commits/9edbf08ea2db9f303624e43d6c922f0b2fa58900
2013-12-23T22:04:17Z,commit,move test to correct location,github.com/JetBrains/intellij-community/pull/82/commits/878641fc5108f4803cd487874951646172ddcfd3
2013-12-23T22:46:57Z,commit,IDEA-118495 (Cyclic package dependency inspection is unusable.),github.com/JetBrains/intellij-community/pull/82/commits/e23693cb2e18a57c239004dd7e254c59d9425df1
2013-12-24T06:41:24Z,commit,IDEA-118419 Keep caret on the screen while changing font size,github.com/JetBrains/intellij-community/pull/82/commits/00dda2f26588e8db19c087009e4cbf8d011be4b0
2013-12-24T06:41:42Z,commit,new project wizard in work,github.com/JetBrains/intellij-community/pull/82/commits/41308247ee8636f6e212cca747e488ecfff6d5c2
2013-12-24T06:52:28Z,commit,description font,github.com/JetBrains/intellij-community/pull/82/commits/c3ca08be471cb2fbbae11d5a0060beb2da166266
